"body","subreddit","category"
"2025 Ford Mustang GTD's Official Monroney Shows $327,960 Price Options","Mustang",""
"bolts right up? I’ve heard lot guys say gt cat backs bolt v6s easy, roush catback gt dudes selling 400$ brand new like 2.5k guys know fact bolt 2017 v7?","Mustang",""
"bought Speed Engineering Catless Headers. right thing buying oem header gaskets? copped Speed engineering longtubes buddy works Ford decided get Header Gaskets car. OEM ones better ones come headers? return oem ones.","Mustang",""
"Need help identifying year this. gf’s grandparents car weren’t completely sure year. two pictures right now. information helps.","Mustang",""
"Need help identifying. gf’s grandparents car we’re completely sure year. two pictures right now. information helps.","Mustang",""
"5th Gen 2005-2009 Mustang S197's 20 years old. Mine still looks good, opinion.","Mustang",""
"Fresh Pics ""Old Yellow"", Pre-Production 05 Ford Mustang","Mustang",""
"Philadelphia Skyline girl favorite purchase 💕💕🤣","Mustang",""
"Even shopping wife fun Mustang","Mustang",""
"1967 GTA Fastback Mustang Wanted share 1967 GTA Fastback. matter day goes, there’s tough ones lately, always puts smile face. jump go cruising things look lot better.","Mustang",""
"Found Twin","Mustang",""
"Lack race red s650 GTs What's boring colors? Every single s650 grey, silver slate dark blue color. trying find new one race red 6 speed almost impossible. ordering chance?","Mustang",""
"Salvageable? Project car? 2000 Mustang v6... buddy sell $200... Runs drives, looks like shit. son turned 14 think could possibly good project work next 2 years get game. Maybe throw big boy motor line... worth saving?","Mustang",""
"love red","Mustang",""
"get Mustang Dark Horse Mercedes cle53? always really loved mustangs thinking getting gonna first american car dont know price mustang gt premium dark horse worth u get get mercedes amg cle53 roughly abt price bit more.","Mustang",""
"overpaying? 2002 Saleen clone I’ve got 2002 mustang gt appears Saleen clone. 85k miles. Looks pretty clean. I’m buying $8k. I’ve owned real Saleen kind like idea cheaper car don’t worry about. getting hosed?","Mustang",""
"mustang badge 5.0","Mustang",""
"Price 2024-P Mustang guys pay OTD s650 gt manual, pp1 Curious see, hear going sticker Thanks","Mustang",""
"can't decide two mustangs originally looking performance package 2 found two performance package 1s, 6spd manuals recaro seats wanted anyways.","Mustang",""
"worth $11,500? lister 12.5 ive asked firm came 11.5. still think salavage title roush stage 1 quite high. alone thinking this? 69k miles. says works body shop replaced damage strut damaged. Attached damage pictures well. Roush stage 1 looks like gt body kit? correct?","Mustang",""
"worth $11,500? lister 12.5 ive asked firm came 11.5. still think salavage title roush stage 1 quite high. alone thinking this? 69k miles. says works body shop replaced damage strut damaged. Attached damage pictures well. Roush stage 1 looks like gt body kit? correct?","Mustang",""
"Need help vacuum routing supercharged gen2 s550. 2017 gen2 coyote. Paxton supercharger 1320 junkie ported boss intake. Going run filter right inlet supercharger charge tube. also upr vented catch cans that’s taken care off. far rest vacuum lines, 3 ports boss intake. 1 run purge valve correct? run brake booster check valve prevent boost pressure booster? guess planned using 3rd port bov. making sure would correct beforehand. Thanks advance.","Mustang",""
"Old Man Gets First Mustang retiring teaching turning 60 August little present me. I’m getting red leather seats installed later month. coworkers drooled yesterday morning. going play safe get another Camry, 180 bought instead. much fun drive!","Mustang",""
"GTD Sound things awesome person.","Mustang",""
"Thought made cool edit FBO nitrous 3V, @schrodinger_yta1 IG","Mustang",""
"Revology Car Review | 1967 Mustang GTA Meteor Grey Metallic car [\#270]( Revology 1967 Mustang GTA Meteor Grey black Nappa leather interior, black GT stripes 17x9.5 Torq Thrust wheels. simple yet chic looking GTA fast reliable, also comes significant new technological development, could get OEM. something custom, restomod hot rod builder Earth offers—and now, Revology Cars making part every car build. video, Tom talk is, it.","Mustang",""
"Tri City Cars Coffee 6/8/2025 #mustanggt500 #mustang #carsandcoffee #carcrashes buff out?","Mustang",""
"new headlights changed entire look. waiting smoked fog lights parking lights. bad 2009.","Mustang",""
"Yup, definitely best wheels Callie.","Mustang",""
"“Drive mode available” fix? coming 24 dark horse switches mode normal could issue be?","Mustang",""
"Transmission slip, flare, shutter 2017 S550 mustang GT, Whipple full bolt ons. transmission done since got weeks ago. happens 3-4 give 50% throttle, really get shifts fine. insight might cause this? so, repairs look like. Thank you.","Mustang",""
"Bama Tunes Life need little help, recently got 2016 5.0 looking mess around BAMA flash tuner 07 4.0 Mustang. BAMA tunes life applicable 07 4.0 told need purchase tuned life file $160. already 87 93 tune files device wanted know applicable new car work old one. arent, way around this?","Mustang",""
"Gtd thing absolutely unreal person.","Mustang",""
"94 mustang gt im looking older mustang learn work cars something learn found 5k wondering good deal? said put 5k redid leather front seats put bullit wheels offered put nee tires said engine replaced odometer broke stuck 203000 miles started says almost never drives anymore. paint isnt good thats good thing gives oppurtunity learn paint.1994 mustang gt 5.0.","Mustang",""
"Tensioner bolt size 98 V6 Replacing tensioner 98 V6 bolt good needed extracted can't find information size dimensions bolt auto parts stores say it. can't find anything Google. anyone happen know dimensions even better link order one?","Mustang",""
"case y’all wondered MSRP GTD looks like","Mustang",""
"Worth it? Hey all! wasn’t looking getting mustang came across beaut thinking it. It’s 2016 ecoboost. It’s got fancy package ac seats good sound system. dream car kid mustang convertible top. originally going get either truck (ford ranger engine ecoboost) jeep. leaning mostly truck. eye candy caught me. Drove pretty smooth! Sexy looking imo. want 17.5k think could negotiate bit. 16.5k I’m thinking. Florida car almost 81k miles","Mustang",""
"think Mustang FX Package?","Mustang",""
"Would risky renting ford mustang despite never driven sports car before? Never driven mustang sports car. driving slow Honda fits 16 years mustang model hire safe much power, 2023/2024 base 4 cylinder one, California? I’ll driving totally normal like commuter car btw pacific coast highway..","Mustang",""
"Mustang dash board Hello! play get rid mustang dash board replace with... two iPads? looking getting new mustang kids grown gone get iPad dash board. inside scoop going get replaced? believe relatively new (post 2022?) sure next refresh happening. Thanks everyone!","Mustang",""
"lower stang 2005 v6 mustang convertible it’s stock. went marketplace find day guy sr performance springs American muscle lower car 1IN said he’d sell $80. know job don’t know it’s good idea. Also I’m sure I’d buy new shocks well","Mustang",""
"overheat often, does, always front car parts store Driving along, noticed AC blowing hot air, saw temperature gauge almost pinned. Pulled over, temperature 244 (F) OBD reader. Let cool off, replaced fuse radiator fan, drove mechanic without issues (with AC off). Hopefully find culprit! least already visit scheduled two days now, missing car much longer planned.","Mustang",""
"Got first Mustang Hey guys new here! know it’s ecoboost last car Tesla model 3 😗, need suggestions mods/parts install make louder budget $5000 cad 🥲 .","Mustang",""
"Coilovers? 2012 mustang gt I’m curious quality mid range coilovers are. Nothing crazy, want stiffer adjustable ride little drop. Ideal price 1700 max.","Mustang",""
"Weird sound coming engine side sound started today, car runs fine, oil temp normal weird sound, idea could be? 2015 V6 engine","Mustang",""
"may rustle jimmies","Mustang",""
"2025 Ecoboost electrical gremlins? Hello! driving 2025 Ecoboost nearly month. loving it!! However, noticed sometimes shut car exit, screen stays phone stays connected Android Auto. happened twice. Today recent time. backed garage, shut exited. ten minutes later go back garage screen still lit phone still connected could still slightly hear radio. unlock car hit start button turn accessories. couple weeks ago parked, turned off, exited vehicle window slide back place like always did. plugged dash cam via cigarette lighter matter what, dash cam stayed shut car exited. gave good 5 minutes gave plugged USB c outlet fine since. missing something quite understand new Mustang?","Mustang",""
"Almost Part Gang car finally got picked today making way west. Looking forward joining mustang gang !","Mustang",""
"Mustang AC Compressor question. anyone ordered non OEM compressor? know OEMs notorious failing, considering iv 2 fail already believe rumors, can’t justify spending $600+ another OEM compressor considering bad are, I’m curious anyone experience aftermarket ones.","Mustang",""
"Man love car!","Mustang",""
"Brushed finish/non-chrome badges anyone? Wondering anyone seen 5.0 fender pony grille badges? seem black chrome, would like something closer color finish wheels. tried am/cjpp Google got nothing. links greatly appreciated.","Mustang",""
"Appreciation Post thread & love seeing everyone post Mustangs, decided turn! Purchased 15' GT \~2 years ago 21st birthday one best decisions made. Got great deal low miles plans getting rid it.","Mustang",""
"2006 Mustang Gt Ticking Noise anyone know ticking sound might be? Sound comes passenger side rear engine. exhaust leaks anything like that. rythmic goes faster throttle. rod knock either. Car runs drives smooth cel.","Mustang",""
"Help mustang community upgrade mustang Hi, recently purchased 2018 mustang convertible, im love it, wanna upgrade parts change even better already is, example want change muffler sounds even better, also put stuff make faster enjoyable, guys could help giving ideas products appreciate it🙏🏻","Mustang",""
"rattling sound maybe piston slap? around 1,300 rpm sounds like piston slap weird it’s load also took oil cap revd still sound engine hear outside around rev park sound made listen closely please help","Mustang",""
"got brand new 2025 $48.5k cad cash. look?","Mustang",""
"New 5.0 bought new 2012 mustang gt premium 70k miles honestly drive home felt amazing can’t wait make truly car.","Mustang",""
"Steeda Q767 looks nicer new fox drop Saw online review think looks great,","Mustang",""
"much would pay this? guys think?","Mustang",""
"piece called noticed sell strut braces, installed one marketplace car oem one made plastic connects one strut towers, called buy decent one without getting brace","Mustang",""
"Poor Supercharged ‘06 GT poor baby dealing BS electrical problems past couple years. Alternator got cooked twice short period time, dad pinpointed janky ass Shaker1000 sound system. overhauled entire sound system, installed modern speakers, stereo subs back. also added lower gauge ground wire alternator. another year charging system failed again. Dad (a chrysler technician 40 years) says he’s touching thing anymore i’m 😂 luckily still free tow dealership airbag recall. I’m taking dealership buddy works at, said he’s gonna rousch tech inspect help 🤞 pray miss baby.","Mustang",""
"250K 2025 Shelby. Thoughts ? crazy","Mustang",""
"Ford air design spoiler gloss black paint seems bubbling peel off, exposing underneath paint. anyone else issue? suggestions?","Mustang",""
"Ac stuck defrost 2008 ford mustang 4.0 ac blows defroster. replaced climate control module change all. also can’t seem find vacuum line like people suggested. anyone clue next?","Mustang",""
"buy 2014 mustang GT? originally 14 GT sell back, I’m back market found 14 GT, track pack, brembo pack, premium trim 19k miles $28,000. guys think? Black paint btw","Mustang",""
"Video game car Anyone else someone recreate car since car x added s197? (I’m Xbox 1 dude can’t even make ts yet)","Mustang",""
"Mustang it’s natural habitat Guys please stay away anything mcloud… throwout bearings produce absolutely garbage first oem mcloud throwout bearing went thousand miles second one billet adjustable throwout bearing also went out… cause rear main seal luckily warranty got new one hoping would last nope see photo car commission BUY OEM SHIT FORD 🫶🏽","Mustang",""
"worried? Hi, 2013 3.7 Mustang, mileage 30.000 miles. started making weird “clunk” noises coming rear car. worried? it?","Mustang",""
"Indy 500's rain? Anyone got experience using indy 500 tires specifically rain got set good deal kinda worried perform wet","Mustang",""
"Anyone comprehensive list tools need valve covers 2010 GT? Hi all, looking change valve covers 2010 GT, wondering types things prepared, including stuff like RTV, dielectric grease, etc","Mustang",""
"Fixing 2026 Mustang FX package","Mustang",""
"anyone else think gas prices seem little low right now?","Mustang",""
"Brand New 25’ EB wanted share pics first car purchased own. beginning, grateful course it’s V8 think good start. originally wanted scat due financial situation decided it’s great idea wrong time went instead. Tell y’all think mods get right away? don’t plan investing much money car plan upgrade GT sooner later holds real power !","Mustang",""
"Extended Brake Line I’m building s550 (2017) drift car angle kit already installed. whatever reason kit didn’t come extended brake lines. Looking options can’t find online I’m gonna get custom ones. Brembo brake package also car.","Mustang",""
"It’s rules lol","Mustang",""
"Another Parking Buddy usually fan white Mustang, blacked wheels tint pairs well one!","Mustang",""
"H Pipe - included clamps good use/buy better pipe clamps? gonna add H pipe 2024 gt active exhaust wondering supplied pipe clamps good go buy/use something else that's better? Thx!","Mustang",""
"Miss SVT, anyone else? Quick YouTube video Motorweeks review 2003 Mustang Cobra","Mustang",""
"LMR Employee Appreciation Day = Bring Mustang Work Day annual company BBQ past week everyone drove Mustangs work. lineup!","Mustang",""
"Steeda Q767 review (German) can't read German, lead photo looked rugged... unpaywalled link friend Germany sent me.","Mustang",""
"Traction control working TCS isn’t working, dealership told replace entire panel electrical board well(PCB)","Mustang",""
"Built stand","Mustang",""
"looks good Follow Instagram TikTok see @dark_knight.s650","Mustang",""
"Potential mods recently purchased 09 s197 Mustang auction 32k miles. It’s 45th anniversary GT 4.6L 5 speed transmission. I’ve thinking modding car don’t know exactly do. I’m thinking coil overs lower car, possibly larger wheels, maybe supercharger/turbo? List mods already done: 24 psi fuel injectors, 5 speed hurst short throw shifter, cold air intake, pypes aftermarket exhaust, 373 rear end, tune. notes: know much horsepower makes due purchased auction. I’m planning sending letter previous owner find mods did. Please let know ideas stupid anything else do.","Mustang",""
"95 cobra power doesn’t sound like starter engaging 95 cobra ran great yesterday tried starting turn key doesn’t crank, it’s like battery isn’t connected correctly doesn’t make clicking noise lose power. doesn’t sound like starter even trying kick it’s making noise.","Mustang",""
"Rear brake replacement oem fit pp1 wheels Can’t seem find oem rear brake kit 2021 ford mustang premium performance pack 1. need new rear calipers caliper mounts. Brake bomber acid rusted something never coated don’t really want anything buy new set swap out. Anyone know look?","Mustang",""
"Black silver winter wheels? Hi new s650 OEM carbonized grey wheels. need buy another set wheels mount winter tires wonder - Would recommend lighter (eg. polished /chrome) darker tone (like glossy black)? I’m leaning towards glossy black may see lot online. carbonized grey wheels good job right middle : mate glossy, dark light either. Pretty good wheels TBH. - go glossy black wonder wether use black wheels summer winter tires ? thoughts ?","Mustang",""
"One year daily optional daily car Philippines Im loving day badboy.","Mustang",""
"want spacers, may low want better stance rear, would best bet? 15mm? roll out? maybe 20","Mustang",""
"Side mirror blind spot logo puddle light Hello 2017 GT fastback, doesn’t mirrors logo puddle light blind spot system, wanted those, would possible find electronics swap keep mirro shell don’t want repaint, here? Thanks advance","Mustang",""
"Ecoboost Mustang got featured Apple's WWDC event 2025 EBM got featured Apple's WWDC event today. showing new carplay software. Honestly, happy mustang got lime light. But, could easily gotten GT well.","Mustang",""
"Thoughts 2026 FX pkg","Mustang",""
"Need help video hello, I’m making YouTube video trying find loudest V8 car research studies led Mustang 5.0 Mustang 50 loudest VA earth not, is?","Mustang",""
"tf fix tf fix also tips keep car clean would greatly appreciated, live close highway mostly commute highway gets many bug marks soon clean","Mustang",""
"Undercarriage Look Like This? black stuff rust sort fluid film?","Mustang",""
"2014 mustang gt😎 Completely bone stock Lmk think 🙂‍↕️","Mustang",""
"First Mustang know it’s 4.0 love room upgrades","Mustang",""
"4.6 Moment","Mustang",""
"newest purchase","Mustang",""
"Rpm dropping low pressing clutch Hey guys, I’ve got weird issue manual 08 GT/CS (~155,000km / ~96,300 miles). Whenever I’m coming stop go press clutch pedal, rpm’s drop 500 I’m full stop, rpm’s jump normal ~750 rpm. that, rough idle anything. happen AC on. Also recently noticed low speed cooling fan come wondering anything it. pointers it’s common problem may missed, please comment","Mustang",""
"H-Pipe sure ... got H-Pipe, Roush AM, installed couple weeks ago muffler/smog shop. owner told clamp come headers/cat back (I'm guessing that's end/start, much knowledge exhaust flow) weld axle back section. said ""it's better, gonna happier."" said ""sounds good."" Since then, obnoxiously loud, wanted, love it! However, day fired Mach 1 remotely walking back normal self, seemed like deep idle tone shut off? way home, feel like obnoxious before. Could something wrong? would get dash notification something malfunctioned like active exhaust? maybe leak weld? IIJM??","Mustang",""
"Good deal? **$34k asking (not otd)** **2017 Premium 6spd 24.75k mi.. pp1, recaros, shaker** sticker (sus?) **other options like nav whatnot** nice, got see traded interested think price (34k tax) much, **thinking $33k OTD good end at** feels like *a lot* market Opinions appreciated! Thanks Royal","Mustang",""
"2015 PP1 6 speed part red oval? last mustang GT automatic I’m led believe it’s something clutch.","Mustang",""
"4Runner 1 Mustang 0 Pt. 2 surprisingly insurance totaled car last Tuesday stating estimate repair 33K+. gave settlement Wednesday asked bump up, Friday received requested amount. Created injury claim proactively check nagging pains insurance called Friday present first, second obligatory low settlement. link original post","Mustang",""
"Fox-body Mustang Transformer technically exists","Mustang",""
"Need help finding exhaust. 06 4.0 V6, looking muffler something make sound little beefier, links advice would appreciated.","Mustang",""
"Gt500 style winglets Got gt500 style winglets fit RTR chin splitter","Mustang",""
"Family gifted 2013 mustang 240k miles it. Original engine transmission. first?","Mustang",""
"blacked 5.0 badges tacky? saw comments recent thread anything except stock silver 5.0 badge factory tacky. wanted see general consensus community groups blacked 5.0 gender badges category up-badging putting badges look like up-badging. personally love good blacked 5.0 badge, everyone taste","Mustang",""
"New club! recommendations keeping car best condition?","Mustang",""
"2010 Mustang V6 key ignition nothing happens I’ll put key ignition nothing lights dash, attempt crank, let move shifter Neutral. I’ve tried keys result. guesses could Tow Dealership. key fob let unlock/lock doors I’ve already unhooked battery 10 minutes reconnected luck.","Mustang",""
"makes part front car?","Mustang",""
"awhile since follow rules","Mustang",""
"Market Head Unit Recommendations Hi team, recommendations market head unit 2017 Mustang GT Convertible?","Mustang",""
"Side mirrors logo puddle lights blind spot system Hello 2017 GT fastback dont come factory side mirror logo puddle lights blind spot, im trying find genuine ford mirror two things luck, also would need wiring programming needed blind spot system? help appreciated.","Mustang",""
"walked clean looking Foxbody errands. Spotted Lynden, Washington. gonna get hate controversial hot take personally think Foxbody Mustangs look great even though American Honda Civic. know love much, looks nice drive even though fairly unreliable.","Mustang",""
"reward cleaning box stuff. Came across little Mustang Hot Wheels. fun share.","Mustang",""
"backfiring pops using paddle shifters harmful car? let friend drive car showing make pop decelerating . wondering harmful car i’m new that’s asking. may dumb question might’ve worded wrong i’m sure yall understand i’m referring to.","Mustang",""
"H Pipe Question Hey everyone, 2018 GT premium active exhaust. Recently put Roush H pipe decelerating there’s like raspy air sound. checked leaks even used muffler sealer permatex based forums I’ve read. sounds like it’s coming tail pipes seeing it’s normal. Thanks!","Mustang",""
"Thinking 😊","Mustang",""
"Mustang 1966 289Ci Ford Mustang V8 4.7L - 200 HP. Manual Gearbox 3 speed. Come Canada.","Mustang",""
"Billy boat exhaust bolts v6 right?","Mustang",""
"200 miles radar seems failed already past Saturday got error, previous drive rain, wonder radar got wet failed. Currently car detect another car front blind spot markers working either. idea? take dealership maybe tomorrow, tried disconnecting battery, wondering could help all.","Mustang",""
"Back Mustang. 2020 GTCS foolishly traded couple years ago, thinking needed wheel drive snows twice year. regretted since. weekend I’m back Mustang, time 2024 GT.","Mustang",""
"Changing S550 Cabin Air Filter? I’ve heard it’s fun….. car weeks, even though plans change regardless needing not, finally decided I’d today. I’ve done ecoboost, fun (not even close). figured since I’ve done before, little easier time hopefully. pulled glove box, opened covering hides air filter box, sure enough, filter hanging filter housing halfway out. tried looking plastic door requires convenient t25 torx bit, couldn’t find anywhere. I’m guessing gave trying put back realizing fun is. bring back dealership get replacement part since can’t seem find anywhere online, frankly, really fix (even though want part I’d rather knowing done right time). said, I’ve wondering people’s stories fun it’s trying replace cabin air filter.","Mustang",""
"beautiful GT 500 🤦🏾‍♂️🤦🏾‍♂️","Mustang",""
"Need help 2006 ford mustang lot work reason can’t get key fob work works press hood I’ve gotten new key fobs changed battery’s can’t find anything key fob antenna could fuse NEED HELP!!","Mustang",""
"Unlock car? mean open trunk Apparently common problem newest model. Everything unlocks door opens trunk. can’t even open passenger door except inside. Ford service car 2-4 days week almost month trying fix wait till hear another potential fix.","Mustang",""
"barn","Mustang",""
"Hitch recommendations: 2014 GT California Special recently picked 2014 GT/CS looking hitch install use bike rack. anyone similar model found one? Curt rack says fit special edition models like CS.","Mustang",""
"car squeaking? 06 mustang drive rear car squeaks kind near tire. front tire also squeaks turn. could causing noises?","Mustang",""
"Fair price 2022 Gt Premium PP1? wondering would good price 2022 Mustang GT Premium? 10 speed, 401A, PP1, Magneride, Active Exhaust, security package. Dealer listed 40k wondering could negotiated","Mustang",""
"Hydroplaned ended ditch interstate Got car year half ago. problems that's expected 19 year old car. hit two deer time driving it, replace numerous parts, including radiator headlights. this. raining hydroplaned, going ditch absolutely fucking wrecking car. sure totaled screwed regardless. Enjoying life rn 👍","Mustang",""
"Uh, good MPG? reference, 2017 GT350R. warm, spends fair amount time 4,000 RPM.","Mustang",""
"First Mustang 3 months. don’t think ever get car isn’t Mustang.","Mustang",""
"advice this? 2002 mustang v6 t5 tranny made mistake getting cheap clutch cable broke wanting know throwout bearing out. anyone experience cars could help would really like know looking","Mustang",""
"Uncle + nephews Good see unspoken parking rule still alive","Mustang",""
"Dynavin 9 D9-MST2005 looking getting Dynavin 9 D9-MST2005 2007. anybody information works shaker subs info sound quality","Mustang",""
"Last Breed? 2021 Ford Mustang Shelby GT500 Future Classic Making","Mustang",""
"think mustang possessed, advice Anyone knows here? time passed failure stop, every time starts car happen","Mustang",""
"Ecoboost issue Hello everyone, someone posted video, sent message owner, didn’t respond. However, anyone know cause this? electrical issue vacuum leak?","Mustang",""
