"body","subreddit","category"
"Honda accord 2014 hybrid brake changing Hi everyone need change Brake caliper rear (both) Brake rotor disks pads front back Date car: 13 May 2014 Honda Accord 2014 hybrid. 1.5k-2k budget. don’t know anything cars family mechanic labor parts. want really nice brakes price performance anyone recommend parts need buy from. need exact part numbers genuinely don’t know anything car. took dealership quoted 4k can’t afford right seems high","CarHelp",""
"Codes P0421 & P0431 (2005 Porsche Cayenne 3.2L V6) Check engine light wont leave life. Anyone else issues codes insight. Already replaced oxygen sensors. seeing signs exhaust leak. (Although probably check throughly time jack car up) Used catalytic converter cleaner well. signs bad smell coming exhaust black smoke etc. Gas cap seems tighten fine. Also might look replacing spark plugs? mechanically inclined im 24 learning go insight helps. Hopefully bad Cat","CarHelp",""
"Wires hanging Toyota Avalon 2003 noticed today tube/hanging wires 1 1/2 2 feet back front car. it? don’t drive much older car need fix this?","CarHelp",""
"2012 Mazda 3 Itouring clue could problem Ive checked everything could think of, ideas?","CarHelp",""
"Engine failure-Ford Focus mk2 FL, 2009, 1.6 TDCI 66kw/90HP Hi everyone. Focus mk2 FL 1.6 tdci 66kw/90HP (HHDA). tested emissions high revs something seemed crack, black smoke came exhaust engine stalled. repairman tried start it, engine seemed spin without timing belt. lot work wait 3 weeks. removed belt intact cut teeth. Even without damaged belt, cams shafts turn?Any idea could happened?","CarHelp",""
"2009 Buick Lucerne issues Hey hyd guys, recently bought 2009 Buick Lucerne I’m minor issues I’m main biggest issue annoying ass noise Either first start car awhile car starts running, sort creaking noise, even car isn’t moving, sounds like it’s around ac near engine car, malfunction indicator light show second, went away fast Besides think I’m genuinely love car, thankfully guy owned filled fluids me, I’ll likely get taken get looked next 3 days do, guys advice?","CarHelp",""
"2009 Ford Escape concerns Hey guys, recently bought 2009 ford escape $3,500 car lot near house. dirty outside, took car wash windshield 3 windows(non driver) still dirty. We’ve used Windex another brand window cleaner still looks same. Also, found suv actually 2005, 2009. I’m wondering contact guy bought see give money back try return full refund? I’ve seen newer cars going price.","CarHelp",""
"2002 Toyato Corolla Hatchback Hello, I’m good cars. little idea. Basically happened car left sitting week two. owner started car driving ten minutes, heater on, going around round car stalled. even idled, makes loud noise, like motor stopping starting AC turned on. Could issue AC compressor alternator? advice would helpful.","CarHelp",""
"screw close sidewall repair? 2007 Acura MDX Slow leak, rear drivers side. Apologies pic bad, take another better lighting/angle needed lol. Thanks!","CarHelp",""
"Nissian Sentra 2016 Head Light Question left low beam recently failed. vehicle's SL trim equipped LED low beams. watching YouTube videos, thought would easy replace LED. However, realized trim level different headlight assemblies: Halogen LED. understanding, watched halogen bulb replacements, vehicle's LED low beam permanent housing, meaning need new LH housing. current thoughts purchase halogen housing LH RH eBay swap current LED housing. However, I’m nervous connections two housings may different. anyone know? would work theory?","CarHelp",""
"2023 Toyota corolla cross hybrid A-pillar won’t go back boyfriend tried install dash cam removed pillar hide wires impossible put back without one edges sticking out, way fix this?","CarHelp",""
"2017 Buick encore acceleration sound? Yeah, noticed windows finally sound almost exactly like mixing cup dice press gas. don’t know anything cars I’m asking help anyone would happen even guesses could be? It’s definitely new sound I’m assuming that’s good.","CarHelp",""
"Can’t figure tire size! (2005 Honda Civic) bought 14x5 1/2 rims put car, far smaller current wheels (16x7) tires (205/50R16). size tires need compensate?","CarHelp",""
"Question tick 2013 Mercedes-Benz gl-class GL 450 4MATIC Sport Utility 4D cant put videos please upvote ill send video","CarHelp",""
"2022 Nissan Sentra: looking advice fixing scratches (in wax? paint?) point winter, something made foam/rubber left hood car became tacky/stuck. Tasked son remove it; used soft sponge (not heavy dury scrubber), dish soap, _very_ hot water. Unfortunately, left scratches. know damage paint - know washed cars elbow grease without damaging paint - extremely hot water messed wax? Looking advice repair it.","CarHelp",""
"2006 Hyundai Sonata engine cut morning way work pull stop light 10 minutes 20 minute commute stop engine goes quite. quiet silent longer feel vibrations. take foot break; nothing, tap gas; nothing. turn car wait beat turn back on. It’s fine since then, anyone idea could happened?","CarHelp",""
"2005 Buick Rendezvous Bluetooth Radio System anybody know anywhere way add bluetooth Rendezvous without completely reworking radio system? don’t want spend load money it, want better setup janky speaker attached hook car.","CarHelp",""
"Anyone know sound is? 2012 vw Jetta","CarHelp",""
"Bonnet prop stuck bonnet, Volkswagen Beetle 2012 don’t even know ive managed it, bonnet prop slammed bonnet slammed top it. It’s completely stuck don’t know fix it. driving test 48 hours mechanic fit this. anyone know do🥲","CarHelp",""
"2004 chevy trailblazer LS issue dad's work car 2004 chevy trailblazer LS issue morning key getting stuck ignition state power even though battery fully charged checked fuse boxes fuses fine replaced ignition switch cylinder change, even using manual override shifter anyone ideas suggestions would great dont know could wrong (and im best cars)","CarHelp",""
"2006 Ford Transit Minibus Please help: Noticed engine rattling increased rpm engine misfiring, increased fuel consumption white smoke exiting exhaust, engine begun taking two tries start. Figured culprit dirty fuel injectors, bought Redex diesel fuel injector cleaner. Put appropriate amount fuel tank instructed, start vehicle splutters; stalls; rpm needle won’t sit still idling throttle completely dead—no revs. Gigantic plumes white smoke coming exhaust *was* running bit, though I’ve read posts users said perfectly normal concern. Oil levels adequate. engine lights on. Redex added half tank diesel. Diesel definitely reaching injectors. suggestions?","CarHelp",""
"2001/Toyota/Corolla don’t money fresh box transmission car literally drive reverse. Anybody know fix need replacement exact car?","CarHelp",""
"2002 honda crv im sorry much information vic, big car guy im trying fix issues sell leave, stationed middle east rn bought island beater, 2002 honda crv dosent thong fancy buttons lock un lock car unlock/lock doors locking drivers door inside out. sunroof iffy work open gets locked closing, can't unlock back passenger door driver door manually can't roll passenger window driver side windows, roll reach passenger door. anyone help issue urgent think help provide whatever info need. Much appreciated","CarHelp",""
"going car? noise? Jeep Compass 2016","CarHelp",""
"2020 Subaru Impreza Hello, accidentally broke boyfriends side mirror 2020 Subaru Impreza. ordered new mirror thought cover. bottom piece missing idea called order one. attached photo. anyone help I’d forever grateful. ordered mirror cover “Subaruwarehousedirect.com”. Thank you.","CarHelp",""
"2017 Lexus Rx350. leaking fluid? Someone hit parked car, leaving damage body. two hours later, noticed fluid leak ground suspension area wet. could causing this? safe drive car mechanic? situation?","CarHelp",""
"2015 Citroen C4 Picasso People Carrier turn Aircon off?","CarHelp",""
"2003 Mercedes ml350 ignition turning Battery fine, won’t turn brake peddle stuck little confused help greatly appreciated","CarHelp",""
"Differential leaking? 2021 Ford F-150 think pinion seal want know yalls opinion.","CarHelp",""
"2015 Chrysler town country (touring?) mystery oil leak. town country seems leaking oil. checked transmission fluid oil level (hot cold) moment seems levels okay. wife drives says yesterday saw trail oil small puddle front end pulled spot work. attached pictures reference. oil top transmission housing. transmission fluid return lines slightly wiggly, oil outsides them. quite bit looks like freshly leaked oil front side oil pan, haven’t looked before, don’t know long it’s there.","CarHelp",""
"2012 Nissan Altima, sounds looks like motor shaking? 2012 Nissan Altima recently started sounding like motor shaking alot. looking doesnt look like usual vibrations etc. drives fine scared continue drive without getting fixed first spark plugs changed couple weeks ago old ones oil them. motor mounts recently changed well.","CarHelp",""
"Could blown head gasket? 2014 Chevy Cruze start 2014 Chevy Cruze check engine light on. lot things going wrong car last two months. right now, oil change grandpop noticed oil around engine cover. proper tools take bolts look it. believes knows says seal needs fixed. oil change topped antifreeze off. driving back house, turned car heard gurgling. opened hood coolant. got antifreeze refilled. Sometimes start car loud rumbling noise rpm starts 1 & 2 dies 0 along noise. sign white smoke overheating. Could blown gasket possibly something else?","CarHelp",""
"Window switch issue 2003 toyota tundra v8 passenger door window regulator motor wasn’t working replaced it, able lower rise, checking testing wire everything checked out, except raising window sends 2 positive signals, replace switch issue still isn’t fixed I’m really sure problem could be, 2003 toyota tundra, help would appreciated","CarHelp",""
"2008 Mitsubishi Nativa fuel smell bad fuel economy Hey guys, need help diagnosing issue 2008 Mitsubishi Nativa. Every time open fuel cap, even short drive, get strong hissing sound like tank lot pressure. I’m also getting really bad fuel economy, around 6 km per liter, often smell fuel around car. Here’s I’ve done far: tested purge valve (K5T48086). It’s clicking apply 12 volts, suspect might stuck closed. checked charcoal canister. blow ports. There’s resistance full blockage. One lines going purge valve canister feels highly pressurized, one leaving isn’t. fuel cap still original one. clicks shut properly, I’m sure pressure relief working. There’s check engine light car runs fine otherwise, I’m using lot fuel tank builds lot pressure. Right now, I’m thinking either purge valve stuck closed fuel cap isn’t venting properly. replace anything else, wanted see anyone experienced something similar advice.","CarHelp",""
"2019 Ford Ranger odd feeling driving low gears reverse Hey all, bought 2019 ford ranger year ago, test ride felt fine smoke cig smell imagine comes every ford ranger! 6 months truck started feeling odd driving lower gears even reverse, it’s feeling could compare manual transmission clutch kinda slipping out. truck slight lurch almost sounds like it’s going stall me. It’s 10 speed auto trans happens gears 1-4 reverse occasionally, RPMs stay constant lights indicators going off. course took back dealership let know what’s course they’re help charged run computer diagnostics came back nothing. keep well maintained frequent oil air filter changes, someone even suggested spark plugs may causing kind misfire replaced still nothing. hoping someone may suggestion could maybe even dealt themselves, know model year common issues drive train. Still 100k power train warranty would like able something now! try attach video hit road today idk would convey well. help much appreciated let know u give details!","CarHelp",""
"Nissan note 2011, sanyo nva-200a radio broken replacement suggestions available Hamilton NZ Hey really need advice, days ago, radio broke, started static beeping turned down, changed music static random intervals, volume controls stopped working stuck max volume switched music CD static,I tried turning power button wasn’t working, screen completely blank wasn’t sure settings navigating (it’s black years didn’t really use it, music still worked) button controls also Japanese; pulled car point attempted “open” (its attached top cars CD DVD inserts, folds/ slides looks like tray allow access) took several tries opened could remove CD, music static stopped radio got stuck open/ closed position (the bottom part radio hasn’t returned it’s normal position) point I’ve given trying get repaired since it’ll probably cost replacement, I’m sure system get since cars time I’ve seen type radio, I’m looking reasonably priced suggestions get Hamilton New Zealand (preferably place installation). {sorry formatting I’m phone} TL/DR: replacement radio sanyo nva-200a purchased Hamilton New Zealand reasonable price preferably installer.","CarHelp",""
"2011 Nissan Rogue making noise braking brake, makes noise similar clunk, extreme. also sometimes makes noise transition braking accelerating forward. Really hoping isn’t huge issue, mechanics month ago would really unfortunate develop new issue quickly. thoughts appreciated!","CarHelp",""
"Choosing new truck 2008 Toyota tundra v6 2003 Toyota tundra v8 SR5 context 2003 v8 285k miles noticeable issues. 2008 v6 150k miles far I’m aware good condition well far yall know would best option 2 far reliability. would nothing daily driver","CarHelp",""
"2010 Subaru forester weather stripping question front windshield replace November 2024. Recently top part come groove vibrates roof caused scratches it. need fixed urgently? appointment June 11th fix hold masking tape need drive take tape doesn’t melt heat. sides weather stripping able pealed back well I’m wondering even put sealant hold down.","CarHelp",""
"Nissan/rogue/2019 body shop advice (stupidly) bumped mom’s car wall want repair it. don’t want go insurance don’t want insurance go since fault. went two different body shops one quoted 2.8k (AutoNation) quoted 2k. say could inside damage, really doesn’t look like anything aesthetic damage. talked guy fixes bumpers quoted 700. want know I’m getting scammed, cautious actually pay 2k+? guys think? appreciate input.","CarHelp",""
"trying buy first car. 2013 hyundai accent sedan; it’s sitting year. issues could have? worth it? basically title. dad’s gf’s daughter selling previous car 3000. dad says pitch 500. also says may need new tires, tune new driver’s side door handle isn’t bad. basically, go it? don’t want buy issue pops month later.","CarHelp",""
"Mazda 6 2010 anyone know is?","CarHelp",""
"2011 Chrysler 200 starting Disclaimer. work IT. fix computers software development. Cars far realm knowledge. deeply apologize errors descriptions aren’t technically accurate something nature. Hopefully least get laugh it. anyway. past year almost I’ve trying get car running again. officially stopped starting all, pulled random parking lot driving (45mph turned left sitting stoplight), almost like engine revving kinda lurching bit again. Additionally, AC started going full blast stopping starting again. radio turning on. Literally every single light dash stared flashing. parked, turned car off, get towed back house (thank god AAA). replaced battery alternator (the alternator replacement one worst experiences life ngl). also replaced little fuses. replaced larger fuses (the 30s 40s). still nothing aside turning lights kinda thing. There’s sound like it’s trying start all. looked instructions replacing starter looks like absolutely terrible experience. anyone ideas could causing this, would beyond helpful. Sorry sound like absolute idiot. Cars certainly thing.","CarHelp",""
"2001 toyota corolla LE car clean title, 184000 miles it, front right door damage, scratched surface. wonder much ask sell (not trying sell im wondering future)","CarHelp",""
"2019 toyota corrolla LE part important? Found trunk getting tires replaced. it? see using google lens air deflector sort. car explode anything without ?","CarHelp",""
"2013 ford fusion replace tires asap?","CarHelp",""
"2014 Seat Ibiza part identification request Seat Ibiza 2014 model, noise made engine block particularly slow speeds, think it’s parts knocking around, help part is, clarification two pipes (rubber) gear teeth looking things (also rubber) retreat cavity towards driver bay","CarHelp",""
"Cassette tape stuck 1986 dodge 600 Hello! got car cassette tape stuck tape deck. doesn’t play, eject button broken/stuck. came stuck car. tried using pliers pull out, stuck pretty badly. wondering something learn shoukd even look start so. isn’t option, I’d like know need take get worked instead, thank help!","CarHelp",""
"Passanger Rear end chattering hitting pothole 2008 mazda 3 gs Rear end chattering hitting pothole drive 2008 mazda 3 gs, hitting pothole rear end started rapidly chattering? checked car & didnt see anything & even checked tires & saw nothing, know isnt exhaust noise mainly cominh rear passanger side & exhaust driver side explanation this?","CarHelp",""
"2018 Chevy Equinox - new engine cost way high! 2018 Chevy Equinox (2.0-liter Turbocharged Four-Cylinder:) \~ 75,000 miles. vehicle broke late last year. leaking coolant quickly. could even see coolant going. order get safe place, add water every 50 - 60 miles. leaking....to somewhere. appear leaking within cabin. informed water leaking one engine chambers within one spark plugs. Therefore, engine shot need replacement. quoted $15,000 replacement. owe less 10k worth save vehicle. questions are.....how hell happen? $15k much? replaced engine <$2000 small car. car several years started see issues last year. bought used 4 years ago drive 10k miles year. could engine get water it? possible something damaged bought it? never accident anything.","CarHelp",""
"2017 Subaru Impreza Hello! Please let know anyone suggestions thoughts issue. moving days ago moved car way truck. left hatch open fill car 2 hours maybe 3. that. Loaded truck got back car move new house. Car wouldn’t start didn’t even click turn over. tried jump got nothing. gauges lit looked though started still click. tried pop start rolling first gear couldn’t get it. parked side road moved without car. changed key fob battery brought new starter relay fuse today changed battery dead longer got gauges light up. tried jump it. gauges came back life still clicking turn over. possible battery dead jump? lack click, starter shot? ideas suggestions try?","CarHelp",""
"1989 chevy c1500 head gasket know it’s kind hard see, i’m wondering think little white liquid spots dip stick indicative blown head gasket. thanks advance","CarHelp",""
"2009, Ford Fiesta ~ Tyre question Hello, looking order new tyres vehicle. went check tyres vehicle, noticed different door sticker. ones currently Vehicle 205/50zR16 87w 195/45 R16 recommendation door sticker one go with, get whats already on.","CarHelp",""
"2014 buick verano , plug? Font front left side wheel","CarHelp",""
"1996 Acura TL’s blowers turn cannot change climate control settings. turned car randomly turned blowers high. cannot turn off, change temp, turn defrost, etc. Anybody idea could be? drive 1996 Acura TL","CarHelp",""
"2008 Subaru Outback Idle dying neutral recently, manual car issues start well driving put car neutral RPMs drop car sometimes dies sometimes drops 200 RPMs. Would love idea ideas fix this!","CarHelp",""
"steering wheel shake lot highway? 1999 Dodge Stratus 4DR context, drive lot highway, going least 110-120km (I'm Calgary, Stoney Trail). recently got whole suspension fixed, still needing new tires motor mounts fixed. seen online get tires balanced rotors replaced, want make sure. ideas? ~154000km btw.","CarHelp",""
"Peugeot 3009 2019 Engine Light on. Hello, Wondering anyone help this. driving around engine light came on. Shortly Ad Blue light came on. Would engine light come ad blue low go top up, need go garage?","CarHelp",""
"2015 Mazda CX5, weird burning smell driving hill past couple years, getting weird, rubber burning smell whenever drive hill extended periods. hot days, long drives, uphill. quite strong too. can't pin point exactly coming seems somewhere near front car. ideas?","CarHelp",""
"2003 Chevy Silverado know temu actual things legit work???","CarHelp",""
"Mitsubishi Magna 1995 front tyre going flat tyre fine 1995 Magna, front left tyre keeps deflating driving, one. seems fine sitting. Tyre changed thing happened, tyre taken tyre place, checked multiple times said tyre fine damage leaks. could possibly issue? idea I’m hoping somebody good guess, tia.","CarHelp",""
"2002 Ford F150 starter motor engaging flywheel Hello yall, last night trying leave friends place, truck wouldn’t start. could hear starter motor whirring wouldn’t engage flywheel turn engine over. bunch research, sounds like need replace starter motor (correct i’m wrong). Since truck stuck friends house, i’d like get started one time bring back house work easier. found video guy getting faulty starter motor turn engine hitting hammer/metal pipe. yall think would work specific issue? thing could try get started?","CarHelp",""
"Mazda cx5 2018 I’m drive tx mo noticed tire here. It’s 3.5 years old I’m questioning get replaced going. advice?","CarHelp",""
"2014 Kia Rio drive temperature gauge engine fluctuate. drive 45 mph fine. However go 45 long go up. stay seconds go back normal. says engine overheating seconds goes down. know causing this. think is?","CarHelp",""
"Ongoing Idle Issues 2001 Volvo S80 (2.4L Petrol) title says, I’ve persistent issues 2001 Volvo S80 (2.4L petrol engine). problem happens engine fully warmed up. come stop—like traffic light—the idle drops 1000 RPM becomes rough, car stall. However, never actually stalled. warning lights dash normal driving. let car idle it’s acting up, check engine light eventually comes on. error code P0300 – Random/Multiple Cylinder Misfire Detected. Interestingly, turn engine let cool down, issue disappears while, car runs normally again. far, I’ve replaced spark plugs—no change. also cleaned throttle body—still improvement. I’m starting suspect throttle body (Italian-made Magneti Marelli) might culprit simply worn out. I’ve already ordered new one, I’ll see makes difference. anyone similar experience knows issue, I’d really appreciate advice suggestions!","CarHelp",""
"Alternator problem? VW Polo Cross 2008 driving 20km/h suddenly weird noise passenger side engine bay came. first thought might stone something break pad, stopped look. car stopped jumped back red battery light on. tried start car wouldn’t. (It trying to, engine didn’t. Dk explain) guy knows little cars tested battery fine, belt fine start motor spinning. also OBD scanner codes came could help. see online might alternator. ideas?","CarHelp",""
"brake pad needs change?? 2003 honda accord brake pad pic rear tires 2003 honda accord. started notice metal grinding noise thought could brake pad tried get quote changing brake pad damn expensive cannot afford right wanted help know brake pad change necessary not.","CarHelp",""
"2018 Honda Civic, section front wheels falling Hello, wondering section car called quick fix complicated fix. Thanks advance","CarHelp",""
"2004 mustang dash lights bought 04 mustang guy said dash lights suddenly went out. assumed fuse fuse isn’t blown. Later, stated messing aftermarket stereo, one wires made contact cigarette lighter plug sparked, causing lights go out. lights vehicle work it’s dimmer switch. Hoping didn’t short something out. ideas? Thanks advance.","CarHelp",""
"Mazda 2 2009 bought beauty, need change breaks, bought ready, missing torq specs front calipers wheel cylinder. found car manual. know many nm need torq to? Thanks!","CarHelp",""
"2016 Kia Optima EX AC trouble Hello! trying figure problem AC. change temperature air, turn defrost, use dual climate control. AC won’t turn off, can’t change speed. far replaced blower motor, resistor, climate control module luck. anyone give advice I’d really appreciate it.","CarHelp",""
"VW Golf Plus - 1.6 - 2005 - Headlight bulb blown, replaced bulb, still working. Hi, driver side headlight bulb blown, went change it, contacts gone brown - blown too? unit. ""HEADLAMP BULB HOLDER NUMBERED 69946350"" [ Swapped unit around, work passenger side. bought ""new"" one swapped it, work side either. fuse could blown? assume fuse, affect lights? Thank you!","CarHelp",""
"Toyota Avalon 2013 XLE Premium New Bumper? hi l'm wanting get help. 23 f trying figure do. Someone hit bumper yesterday hit run completely messed bumpe. never received already hanging thread (my dad's fault) want see even possible save point. want see do. Thank 😊🤍","CarHelp",""
"2005 Volkswagen Passat making annoying beeping noise every 2 minutes anyone know is? switched car key battery case stop like 2 weeks already back driving crazy [example](","CarHelp",""
"Alternator 2001 Prado tx 1kzte 2001 tx Prado 1kzte, Recently replaced alternator 80 oex one repco, match fit said right one website, second oex one thought first one got faulty got warranty replaced. doesn’t want charge 12.6 even alternator terminal, blown fuses, perfect continuity every cable, replaced plug going alternator tried 2 different batteries fine 80 series, honestly idea else could advice would greatly appreciated","CarHelp",""
