"body","subreddit","category"
"RAV4 purchase timing year/new? Hi- Strongly leaning towards buying RAV4 plug SE, thoughts 2025 vs. years old? Years avoid go used? Also buy January flexibility, worth waiting end year financing deals? people recently gotten RAV4 less ~9% APR Toyota listing. Last question, Costco members never used car buying program - worth case? Thanks advance thoughts!","Toyota",""
"Dealership put 0w16 Grand Highlander Hybrid Max Today realized dealer used 0W-16 oil change July 2024. manual calls 0W-20 Hybrid MAX engine. non-spec oil used 8,500 files next oil change June year. manual mention allowed substitutions. concerned long term (100K+ miles) reliability engine, especially turbocharger, know newer engines tighter tolerances oil correct operating temperature viscosity important making sure metal metal contact dissipating heat load (turbo). emailed dealer, called me, took in. changed oil visual inspection send lab. taking in, captured ounces mailed Blackstone Labs analysis.I also submitted complaint Toyota Brand engagement online. never done sure long take respond expect dealer take care it. dealer offered 100K mile extended warranty, said would transferable sold it. told service manager happy solution 40k additional miles feel like much issue may present later engine's life. Also regarding non-transfer-ability, feel obligated disclose buyer potential issue. seems like offering inadequate make whole, especially believe there's issue choose sell it. [Invoice 0W-16 oil](","Toyota",""
"12V battery charging start stop system malfunction changing battery changed battery car wouldn’t start. get notification driving hour. Although I’m planning going dealer bad sign, need tow","Toyota",""
"New 2012 Tacoma 1 owner, 65k miles!","Toyota",""
"Buying Toyota Camry 2014 202K gave visit local dealership selling 2014 Toyota Camry 10K 202k mileage it. guys think worth it?","Toyota",""
"Factory extended warranty Hello, partner got 2023 corolla 37k miles. interested purchasing extended warranty. However, third party. drive mazda able get extended factory warranty 50% cheaper dealerships. wonder toyota anything similar? Thank you.","Toyota",""
"Hey, Toyota, guys please track stolen truck me. provide police report numbers such. possible safety connect, please give data may contain 3rd party apps installed truck's console? entitled data anyway - app broken. Hey, Toyota, guys please track stolen truck me. provide police report numbers such. know, life threatened pursuing vehicle, possess data would easily reveal location, almost got wacked local gang (crime ring) making posts local crime watch Facebook group looking truck. possible safety connect, please give data may contain 3rd party apps installed truck's console? didnt one installed, find hard believe person currently possession vehicle also. entitled data anyway, app broken error ismpreventing receiving data legally entitled to. broken? app recognize address valid, ive tried different variations physical address well PO box, nothing works. Google maps find address though, wont let request data based this. Ive hell looking vehicle, received multiple death threats got stabbed arm. deserve answers.","Toyota",""
"1997 Camry V6LE EVAP Repair 1997 Camry V6LE, 148k miles. Engine light came on. Phoenix, Arizona. Took local mechanic. throwing P0446 error code. Guy says car needs new EVAP circuit, foot hose, new charcoal canister. Quoted $1000 USD plus $180 diagnostic. fair reasonable cost repair? really expensive? Also: couple birthdays old lady. know anything working cars. tools. can't DIY this. really need advice. Please?","Toyota",""
"Oil Leak 2grfe engine Hello. oil leak 2grfe engine. leaking around bottom VVTI oil line. Changed gasket multiple times still leaks. sound like timing cover chain leak? attached photos. look like lot oil? drip onto ground pool little hole picture attached. car 20 series Vellfire/Alphard","Toyota",""
"2021 Highlander Transmission Highlander making whining noise shaking changing gears. 196,000miles right (I know high, uber driver) anyway fix without changing whole transmission. mechanic quoted 8000$ transmission change cannot afford it. need car run 1.5 years paid off.","Toyota",""
"2000 tundra steering dead zone got 2000 tundra 111k it. lifted along bigger tires wheels. extremely large dead zone. turn around 8 inches left right get movement tires. idea could cause this? know lift good front end parts already installed got it. help appreciated.","Toyota",""
"Car gurus- P1497 & C1201 Codes + Pilot Learn Stuck 'Wait' - 2010 RAV4 2.2 D-CAT anyone help error codes 2010 Toyota RAV4 2.2L D-CAT diesel? P1497 (Intake Air Temperature Sensor Circuit High) C1280 (Engine Control System Malfunction) - 4x4 system C1201 (Engine/EV Control System Malfunction) - ABS system dashboard shows “Check Engine System” “Check 4x4 System”. also can’t complete pilot quantity learn it’s stuck “Wait” pilot quantity state fitted four new injectors. advice fixing codes, issue means/is get rid code fix particular car please?","Toyota",""
"Flow Shut-off Valve Coolant Leak? got paper mail saying primary coverage possible flow shut-off valve coolant leak. check engine light turned said ""Engine Coolant Pump Performance/Shut Off"". issue said cover? Also take care Toyota pay diagnostic anything primary coverage right? Thank advance.","Toyota",""
"rust protection offered hybrid corolla (canada) getting new car dealers told rust-protect cars. live west coast. asked salesperson type rust protection told First Canadian Protection Plan (which dont understand lol) water based rust protection 5 year warrenty. anyone information well worked far hybrid corolla hybrid toyota models? useless product get remove something else let apply it? instead 999$ doc fees charge lower rate include rust protection.","Toyota",""
"car looks crazy good","Toyota",""
"toyota this? saw fb marketplace, claims SR5 ive never seen SR5 like this! convertible look unique specific truck?","Toyota",""
"2nd Gen Tacoma VS 1st Gen Tundra currently drive lowered Mazda, wanting complete 180 get truck. really gotten outdoor activities like mountian biking, hiking, camping etc well get huge dumps snow winter. want occasionally mild offroading road trips, also use full time daily driver. truck modified little bit above. leads mentioned trucks. haul often concern, larger 6'1, 200lbs. test drove 2010 tacoma loved drove, however, 1st gen tundra seem much bigger much affordable near me. comments suggestions would great!","Toyota",""
"chuckled this, Acura RSX headlights email Toyota parts. like really? use photo headlights Toyota model?","Toyota",""
"Coolant drain fill simple drain fill coolant car, pink Toyota long life diluted coolant. bought two gallons replaced it. kinda short dealership closed ran walmart bought Prestone 50/50 Asian vehicles, color topped half quart. reading online never mix coolants, wondering I’m screwed? need whole new flush refill Toyota coolant only? planning touching next 50,000 miles…","Toyota",""
"Two First Gen Toyota Prius Simply pic two First Gen Prius (2001) rarely see them.. especially around Eastern Europe.","Toyota",""
"return parts bought toyota part website? week ago bought two brake kit camry longer needed. went toyota part website bought return link form fill out. find return policy description faq page. bought website asked zipcode select nearest dealer. figured might sell parts dealer dealer sent parts me. Like 3rd party. asked dealer return told go “TPCO website” assuming stands toyota part . Com whatever. long azz back forth discussion manager dealer customer service toyota part website. manager told submit return form behalf last week far havent heard anything. Another detail purchased part, guest. create account website. could reason ? Im lost.","Toyota",""
"Toyota Yaris Cross 2025 question question speed limit feature. matter time day night is, go passed school, school zone kicks dash shows you’re going limit. asked Toyota sales person said system doesn’t know time day is, reads speed sign… surely can’t true.","Toyota",""
"2010 RAV4 2.2L Diesel - Pilot Learn Stuck ""Wait"", Get ""Ready""? need help anyone who's done pilot quantity learn Toyota D-CAT. way final step 2010 RAV4 2.2L diesel completely stuck. fitted complete new set 4 injectors. managed get new codes programmed successfully—I see stored ECU. absolutely **have to** pilot quantity learn. start test, says **“Pilot Quantity State: Wait”** forever. never changes ""Ready"". conditions (like coolant temp) okay. test start this. Even pilot quantity state (cat) says ready **. drive car , fitting injectors, drove almost fine 20 minutes, get past 2000 rpm driving also engine light check 4.4 system dashboard message codes: * **P1497** (Intake Air Temperature Sensor 1 Circuit High) * **C1280** (Engine control system malfunction) * **C1201** (Engine/EV control system malfunction) **Please, tell directly:** 1. **What get past ""Wait"" state?** make say ""Ready"" run test? needs looked at, changed etc need. 2. **What possible cause** stuck ""Wait"" forever? know waiting perfect conditions, exactly? 3. **Can skip pilot quantity learn?** reason car press gas feels lacking power bit also tried rev 3000rpm get move form wait start pilot quantity learn success. sure someone seen exact screen knows trick fix need get around this. Please tell check. says wait","Toyota",""
"2024 Prados DPF issues? Im thinking buying 2024 Prado 2.8 diesel engine. Unfortunately, driving style mostly short, city drive rare highway driving involved. know DPFs used clog unless moderate frequent highway driving. still concern 2024 models Toyota manage refine system longer serious concern?","Toyota",""
"Possible self update 2022 landcruiser prado way self update infotainment Australia go dealer waste money? Theres gotta workaround cant find anything online. Thabks","Toyota",""
"2023 Toyota Yaris Replacement Wiper blades I’m looking help female friend Mexico (that’s nervous going auto parts shop) determine appropriate replacement wiper blades would be. can’t recall car technically sedan hatchback options known would ideal. I’ve googled around found drivers manual can’t find anything consistent. best find appears 24” front driver blades 16” front passenger blades thank advance help much appreciated!","Toyota",""
"original 1996 RAV4 coolest SUV ever made, much better newer RAV4s. going say it. 1996 RAV4 SUVs, whole, peaked. certainly unique, time SUVs truck-based. still remains interesting, time car-based SUVs (or crossover CUVs) become generic, lifted hatchback grocery getters. RAV4 met fate matured, years. get first generation best attributes truck-based SUV best attributes small economy car. Like SUV, looks rugged funky, plenty ground clearance, tough traction supported locking differential permanent 4WD system, plenty practicality haul. like small car akin Corolla, great fuel efficiency time, nimble handling easy maneuverability, comfortable ride comparable price tag boot. also two-door, squeeze even tighter parking spot.","Toyota",""
"Buying 2012 Camry tomorrow. Extended warranty nah? Houston, car 68k miles it, two owners, one rental car company. extended warranty add 5k total price car extend financing term year, covers nearly everything. question is, cars reliable expect relatively trouble-free years, drop extra change every month warranty. Thoughts?","Toyota",""
"Mandatary Post-collision safety inspections seatbelt SRS (safety restraint systems) Toyota? Hey fellow Toyota owners, car recently got rear-ended recently car's insurace admits faulty agrees pay repair. problem bodyshop chose said Toyota requires safety inspections seatbelt SRS (safety restraint systems) collision. However, request denied insurance company (they Ok'ed items). wondering encountered similar issue indeed required procedures. information/reference highly appreciated. Thanks!!! \-- Alex PS: live Californa.","Toyota",""
"1993 pickup 76k original miles.","Toyota",""
"Remote start - missing features recently purchased new RAV4 Limited hybrid technology & weather packages. loving remote start feature- however option customize climate settings? partner 2025 Corolla LE features available her. missing something? attached photo options I’m given app.","Toyota",""
"AC help Hi guys, bought Toyota vitz, Japanese version Toyota yaris hatchback 2010, air conditioning works fine 10 20 minutes stops cooling, anyone tips know change sensor? press button air conditioner runs another 20 30 minutes, guess compressor damaged","Toyota",""
"2021 Toyota Venza XLE Headlight issues. 2021 Toyota Venza XLE unable unfold power side mirrors, failing move power seat presets, issues back camera showing grid lines. also issues right (passenger side) headlight noticed condensation it. removed bumper noticed small crack headlight housing removed headlight. removed headlight electrical issues resolved themselves. got water allowed dry weekend. Sealed hole silicone put headlight back in. issue running headlight turn parking light, low beams, high beams. However turn turn signal fine. find weird since parking light turn signal run LED strip. I’ve checked fuses relays, even tried swapping right left relays. would like try plugging left headlight right headlight cable see works normally. unsure that’s good/safe idea would appreciate input anyone knowledgeable I. Also would good idea take headlight assembly apart see find issues it?","Toyota",""
"Paid pocket oil pan gasket repair, realized Toyota warranty covered it. way get reimbursed? Hi everyone, 2022 Toyota Corolla SE 26,700 km it. Recently noticed oil leaking underneath, independent shop diagnosed oil pan gasket leak. replaced gasket also oil change. total came CAD $428 (around $262 labour, $74 parts, plus tax). afterwards realized car still well within 3-year / 60,000 km factory warranty, type oil leak covered warranty dealer. questions: chance Toyota reimburse repair contact dealer Toyota Canada? start dealer service department directly Toyota Canada customer service? anyone successfully gotten goodwill reimbursement similar situation? invoice shop pictures leak. sure I’m luck since repair wasn’t performed dealer. Thanks advance advice!","Toyota",""
"2019 Highlander Hybrid Platinum? 52+k miles. Dealership asking $35971. I’ve read plenty people saying might well get new car…but sort like idea getting reliable used car, know toyotas last forever! Recent experiences= dealerships don’t want negotiate price come significant amount. demand high? price difference (compared 2024 highlander hybrid xle, get one) pretty big us— shell 45+k used car? also trying end car annoying problems (like 2023). KBB/internet search tell dealership’s price quite high. Haven’t tried negotiate dealership one don’t know it’s worth it. WWRD?","Toyota",""
"Corolla Engine Maintenance I’m getting Engine Maintenance Required engine lights off. usually shows morning turn long rest. also shows turn AC. fix issue? visit shop?","Toyota",""
"better, Yaris Hi CVT (the fully equipped ) Corolla Base ? Hello, need opinion would better. would first brand-new car dealership; previous cars always pre-owned Corollas. Honestly, love Toyota would like stay brand. dilemma want buy new car now, don’t plan selling several years—at least 7. I’m sure would better: fully equipped Yaris, monthly payments wouldn’t heavy me, base Corolla, payments would tighter. could still afford them, would leave restricted compared Yaris, gives bit financial freedom. Thinking long-term, think would better option?","Toyota",""
"Last remaining chariot Gods","Toyota",""
"Extended warranties local dealer see side? 2024 Land Cruiser 16K miles year. little stuff warranty, thinking ahead buy extended warranty. buy Platinum warranty now, would change service experience all? local dealer/service manager see extended warranty pull VIN? matter accept mediocre service?","Toyota",""
"Toyota (Australia) dash cam installs/how drain battery Hi im purchasing hybrid car Toyota (Australia) front dash cam install. (Blackvue Gold Pro front rear) occurred may use alot battery let continuous record. anyone know Toyota hard-wired install includes power management/ cut drain battery. Anyone experience, ensure battery drain? use parking mode? never dashcam new.. Thank you.","Toyota",""
"2014 Rav4 Hi all! bought used 2014 rav 4 December 2023. experiencing shudder, told wheel bearings, unofficially. around 20 mph major hesitation, presume transmission slip starting. questions -is repairable outside replacement whole transmission? mention decide trade in? like get 2017 rav4 keep payment same. Thanks advance advice!","Toyota",""
"getting scammed? 10k autocare plan go Oakland Toyota maintenance. However, “check engine light” came today. went told would $250 diagnostic engine wasn’t covered plan. newer car problems sounds like crazy number check whats wrong. standard getting scammed?","Toyota",""
"2013 Rav4 Limited (147k miles) $12000? considering 2013 Rav4 Limited 147k miles $11,500 Ira Toyota. dealership costs everything end close $12000-13000. test drive scheduled, condition good CarFax report comes clean, good deal? max budget everything 15k seen local auto shops sell similar $9-10k.","Toyota",""
"Toyota's Infotainment software update website working Hi! trying update friend's corolla Cross infotainment system try fix android auto/apple carplay disconnection issues, damn website work, matter try ""Go"" button anything. already tried different computers browsers, change","Toyota",""
"Question use help engine stay smooth? parents vehicles worth buy use forget it?","Toyota",""
"Hey cowl part called? life find outer shell, it’s 2020 Camry hybrid xle. impacts term someone knows part number that’s even better. dealer keeps forgetting get back us 🙄","Toyota",""
"Obviously price gouging going overpriced. @ Yarris standard model - new car sales. “If ask price know it’s expensive can’t afford it”. - wise saying. Toyota Australia slippery price gouging don’t even advertise purchase prices new cars partnerships/dealerships Australia. Wanted Yarris obviously expensive don’t want show asking price fear scaring away customers. shall buy i20 know exactly much Hyundai’s dealerships want it. Fk Toyota price gouging partnerships Australian dealerships.","Toyota",""
"Vin help! Hi guys! isn’t aloud, please let know. recently bought 2021 Toyota Corolla LE Carvana little two months ago. downloaded Toyota app hoping connect car better look focus ins outs car. trying enter vin manually app, tried scanning says vehicle found. Would something would contact Toyota let know bought car another dealer rather Toyota dealer? able use app since didn’t get car Toyota. anyone knows do, please let know! willing call didn’t know would get anywhere that. Thank advance! 😊","Toyota",""
"safer? 4runner, tundra, tacoma Ram? Hello! getting first car soon torn get! always loved trucks (ram particular) 4runner! However, know Toyota quite reliable perhaps tacoma tundra might lil cheaper used 4runner. still leaning towards 4runner also high resale value understand love looks. Safety also big priority me. anyone know safer? (e.g. getting collision) one safety features? anyone owned 4runner one others mentioned? thoughts them? suggestions/input much appreciated! Thank you!!!","Toyota",""
"Door Seal Defect Hey guys, literally brought car home Toyota dealership 60+ miles away since ones it. I’m driving freeway noticed whistling noise coming driver door. get home open door realize door seal damaged called morning (they closed got home) asked messed seal damaged somehow. taken aback fuck would brand new car spent stupid amount time money on. Anyways, called Toyota dealership told situation they’re willing check $150 possible replace seal. original dealership wanting drive back 60+ miles “check out” doesn’t promise anything. I’m sure I’m supposed do. Here’s video damage. look like manufacturing defect?","Toyota",""
"2010 Toyota Camry Rear Speakers Stopped Working 2010 Toyota Camry SE (2.5L) JBL audio system installed. vehicle still original stereo system installed. rear speakers stopped working ago. door speakers front speakers still work. wondering anyone advice diagnose issue fix it? Thanks.","Toyota",""
"Looking buying ex-rental 4Runner - what’s cheapest ODB2 code reader scan airbag deployment? 2024 4Runner looks fantastic cheaper price bc it’s former rental. Worried potential accidents since can’t see rental company’s service history Car Fax.","Toyota",""
"lot dashboard warning lights toyota chr 2018 21/8, got car serviced didnt move much today could wash it. wash almost every warning light red (abs, tcs, EPB...). could problem be? Could problem safety. dont know much cars could really help ideaAlso, workshop close car needed tomorrow trip.","Toyota",""
"2AZ-FE rebuild cost Houston area finally needing fix 2AZ-FE daughters '12 Scion xB. Since 60,000 miles started using qt every 2500 miles so, slowly gone up. oil change today (105,000 miles), checked nothing dipstick, drained 2 quarts oil. said topped 1000 miles ago full, means went 2 quarts 1000 miles. Never enough use extended warranty even bring in, well past that, me. already tried ""fixes' people post, running 5w-30 10w-30 synthetic oil since 30,000 miles (and synthetic oil since bought new 2012 5,000 mile oil changes). Anyone know reputable shop West Houston/Katy area knows repair fair cost? shop use things ability, never done repair, would prefer shop done before. know local dealer has, dealer cost huge turnoff.","Toyota",""
"Land Cruiser Black Plastic Bumpers one thinks there’s much black plastic exterior Land Cruiser? think Toyota USA give us option body color bumpers fenders. example Australia shows Land Cruiser body color parts.","Toyota",""
"2026 rav4 xle premium images? seen limited, woodland, gsr. anyone images/pictures 2026 Rav4 XLE. specially loaded version XLE think called ""premium""?","Toyota",""
"2009 Scion xD still poor rear suspension changing struts Hi folks. picked Scion 2 years ago slowly replacing parts it. 3 months ago replaced rear shock absorbers cuz getting unusual wear inside rear tires, etc. Things seemed good notice rear suspension still sucks. going replace coils read typically dont ""go bad"" unless theyre physically busted. hoping keep car another 2 years [college student] unsure theres rear suspension parts looking instead. Everything see online says coils shock absorbers rear. Thoughts/ comments/ concerns appreciated!","Toyota",""
"Protectant matte black plastic trim? bought wife new LE Corolla Cross ton textured matte plastic trim. recommendations experience good product use it? plan keeping long time want proactive keeping looking nice.","Toyota",""
"go ? found Celica ST162 1987 basically perfect shape. 5k - 6k bucks feel like let go. rich, saved enough money around October like ask seller keep then. can't go see person can't try either side country. family member lives 10 minutes away, knows stuff comes cars trust that. make move try convince seller wait bit save money ? wait enough buy another car corresponds criterias ?","Toyota",""
"Total Price 25 Corolla? Hi all, getting 2014 camry serviced walked lot. base 2025 corollas spec sheets listing $25k msrp. would generally total price (approx price tax, tag, title, dealer fees) wanted buy one these? They’re gorgeous I’m interested, want know think. Thank you!","Toyota",""
"Toyota Wigo G CVT vs Road Humps Toyota Wigo G CVT, feel drive road humps? planning buy soon.","Toyota",""
"2012 Toyota Hilux 31k miles","Toyota",""
"4 wheel drive button Toyota Fortuner? Purchased South Africa","Toyota",""
"2025 Camry XSE vs 2025 Corolla LE (Both Hybrid + AWD)","Toyota",""
"2008 Toyota Yaris - Thinking picking one tomorrow. Thoughts needed. Hey all, joined group going go inspect potentially drive away 2008 Toyota Yaris Hatch tomorrow. Going use beater/daily/train station car. advertisement full logbooks real issue paint fade bonnet roof read elsewhere normal. Might try make look little better buffing it. question car 190,000 km (118,000 miles). Never owner car many miles seeing others thought? reasonable mileage car? getting $5k Australian dollar (About $3k USD) worried breaks would reasonably cheap fix nice last year 2 trouble free.","Toyota",""
"bad timing chain sound like Ive hood friends 2019 Toyota Corolla sound car startup sounds like bad timing belt, high pitch squeeling apperently 2019 Toyota Corolla doesnt timing belt??","Toyota",""
"Grand Highlander Hybrid LE. Really simple question. want 2 wheel drive base model Grand Highlander hybrid. primarily price, want 4wd, want glass roof, **must** totally cloth seats. Anyone know actually even built? Seemingly exist anywhere all, even though Toyotas website. note, anyone know dealers sell MSRP add buncha crap?","Toyota",""
"2010 Toyota Venza Radio Hey 2010 Toyota Venza radio acquired storage unit full parts. unable test it. sell for? anyone interested this? ship worldwide. Thanks.","Toyota",""
