"body","subreddit","category"
"ECU tuning, start? Hello. cars overall car modification couple years currently work maintenance engineer. learned alot still want grow learn, thats want get ecu tuning im love overall motorsport/car scene. many tutorials/hints internet (especially mother language - alot douchebags five hints cuz scared someone would take job, lol) want ask start? tools need (ofc budget mess cars). 3 cars (1 diesel 2 turbo petrols) work learn. im owner bmw programming simple diagnosing. graduated electronic school helps. Im willing pay help","ECU_Tuning",""
"24 F-150 3.5 Tuning?","ECU_Tuning",""
"🚗💻 Launched: Virtual ECU Tuning Simulator Use Right Browser (No Download Needed!) Hey everyone — launched project I’ve working fellow car enthusiasts, tuners, DIY builders want learn tuning without risking blowing actual engine. It’s called Tuning Simulator Pro — browser-based ECU tuning simulator lets you: • Adjust cam timing, fuel maps, AFR & boost • Sim test virtual dyno runs • Learn smart feedback • Safely experiment tuning logic without touching real engine downloading software. ✅ installs ✅ account required test ✅ Great learning tuning fundamentals prepping next build 🔗 Try here: Would love feedback — you’re building/tuning sims, I’m open collabs feature suggestions too.","ECU_Tuning",""
"Help Mpps 18 & SIM4LE (MB W203 M111) Hello, used Mpps18 read (copy original data) write new .bin reached 100% fine showed : Conditions correct. car's radiator fan went full speed ignition now. decided revert back original thing happened, conditions correct. ignition (car start) still write using mpps ""error"" Anyone knows fix this? daily wanted remove rpm limiter + crackles, got car.","ECU_Tuning",""
"Help received KESSV2 gift realized original. causes reading problem car, saw videos saying update it. already done help it?","ECU_Tuning",""
"Modification edc16c9 glow plugs Hi, need modify via control unit temperature glow plugs turn start-up phase. moment, 25 degrees coolant, turn on, making engine start slower smoke. would like make possible activate temperature coolant. Could anyone guide changing parameters ecm titanium case could change post file","ECU_Tuning",""
"tune looking [Tables target AFR, fuel trim MAP, Average AFR achieved, Mode AFR achieved count data went averaging.]( Here's AFR data last ride bike. 160km data, average speed 64km/h, twisty open road. Mild pace. 2002 VFR800 full system exhaust, K&N air filter modified velocity stacks. Rapid bike racing piggyback fuel ignition adjustments data logging. Data logged 0.5s interval. data filtered used analysis. AFR data rounded nearest 0.2 make ""mode"" function excel effective. shift filter, omits data revs dropped 200. important filter data quickshifter. quickshifter cuts fuel AFR goes fully lean shift, would mess data. filtering that's done ""Average"" results. Mode data type mostly refer tuning. shows frequently occuring AFR value data set. use additional filters. filter data throttle position moved 5% enrichment happens opening throttle. also filter unstable AFR data, standard deviation four consecutive AFR values threshold data used mode function. Target AFR 13 high throttle 13.6 cruise area. bike feels like shit running 14's. right see fuel trims Rapid bike. trims result many thousands kilometers riding data logging, filtering analysis trough excel, graphs diagrams. bike feels great now. [Example histogram AFR data one particular cell fuel trim table]( [Snippet data showing graphed GPS speed, logged RPM, TPS AFR](","ECU_Tuning",""
"daily drive Fueltech car? Looking tips make ft450 Mazda6 daily driver status? converted auto manual weekend odds ends tie anyone daily drive car standalone? Id love hear took guys get","ECU_Tuning",""
"Ssd file e70 needed Hello. Could someone share e70 ssd file ncs expert? Thank you! Ssd file must 8hp45 FA","ECU_Tuning",""
"need help kessv2! bought kessv2 5.017 ktag. wanted use kessv2. comes cd. problem dont cd player laptop, downloades like 10 different versions ksuite oline. everytime download driver try open k-suite, error occours saying ""connection established"". downgraded win11 10, thought problem. still problem comes. download driver without internet connection turned driver signatur windows defender. still. kessv2 detected. ? recommended software ksuite2.47 wich acces time.i tried nearly every version ksuite. figured cant version im using. people work. ktag kess masterversion chinese ordered ebay.","ECU_Tuning",""
"Stage 1","ECU_Tuning",""
"Stage 1 Looking tuned file Stage 1 Ford Focus 1.6 TDCi EDC16C3 SW: 1037381440 Need file compatible KESS V2 (OBD write). Thanks advance! used Kess v2 read ECU, according internet, ECU model read well Kess. Anyway, anyone interested Stage 1, send reading see OK. Decide price private","ECU_Tuning",""
"Ford focus 1.6 90hp Hey guys! stock 2006 Ford Focus 1.6 TDCi (90 HP) I’m thinking tuning first time. car 250.000km + haven’t done mods yet, I’m considering doing: - Stage 2 remap - EGR DPF delete - Straight pipe exhaust - Cone/K&N air filter - Bigger intercooler - Upgraded clutch needed question is: safe go straight stock Stage 2 engine? stock turbo internals handle it, start Stage 1 first? Also, recommendations reliable parts welcome. Thanks lot! 🙏","ECU_Tuning",""
"Need help/guidance. m104.992 turbocharging. looking narrow ECU options least couple would work best/have support engine. First time build, diving right in. Thanks advance 🙏🏽.","ECU_Tuning",""
"mad go wrong e90 guy replaced ecu got running right (see description) Every since hes got running lights coms dsc/abs module. also limited around 4k rpm speedo doesnt work milage counter isnt going all. switch back old ecu (different map) (car doesnt run) exact lights show problem occurs, indicates mapper car problem despite car running absolutely fine lights before. dont know much cares ive torn whole car apart checking every single fuse it. Hes suggesting take apart ecu protection box thing see wires ect loose dont feel comfortable that. garage normally take car repairs suggesting replace abs module see helps…. feeling nothing car map/wrong ecu maybe really dont know. Could anyone please share insight spend £900 new abs module fitted 🤦‍♂️ Thanks advance 2011 e90 lci 320d bmw","ECU_Tuning",""
".bin to.tun kessv2 Hello, sent .bin file tuner, sent back file .tun format. don’t know use file Kess V2 Ksuite 2.80. Could please let know proceed? Thank advance help.","ECU_Tuning",""
"OM654.920 TUNING Hi, thinking tuning 194 hp diesel om654 C300 de 2019 electric motor. want know example E300d engine 245 hp ecu tuned. getting stage 1 upgrade 194 hp, mean safely tune 245 like stock e300d stage 1 what? Tuners askes completed maps give x amount torque hp seem like similar offers, like plug play them. help would appreciated","ECU_Tuning",""
"Selling Dimsport MyGenius? Hi everyone, hope right place question. bought VFlash (rebranded Dimsport MyGenius) + Tune VelocityAP, unfortunately issue engine shortly purchase sold car. reset device help VelocityAP. linked master-VIN anymore. would like sell device know steps taken prior selling similar? market value? happy someone use get bucks back","ECU_Tuning",""
"start? Hi guys, Im currently turd BMW X5 E70 30d N57D30A engine. done timing chains oil pump refresh couple months egr cooler valve went. wondering could map car either clone k-tag kess v2? - one would better would best send file get made? TIA","ECU_Tuning",""
"Dyno Results E10 curious actual power differences ethanol free gasoline vs E10 gasoline. car, day, dyno, changes tune. speculation. Dyno sheets gtfo.","ECU_Tuning",""
"VW Crafter 2.5 TDI – CECA CEBB Full ECU Kit Swap (No Turbo) Advice?","ECU_Tuning",""
"TunerStudio Settings Help [Mine]( [R3vLimit]( [My Ignition Settings]( found thread r3vlimit engine can't find window settings guessing firmware ecu? using rusEFI believe use megasquirt. engine crank sensor cam, told run crank since better use it? first picture mine, cam inputs make sense ones r3vlimit (second picture)? also find tables/graphs dwells, work way? guessing dwells important. Thread basing on: [","ECU_Tuning",""
"Discontinued, but…","ECU_Tuning",""
"Help starting car","ECU_Tuning",""
"recommendations power box scanmatik 3? buy?","ECU_Tuning",""
"hope lol hope allowed & try best explain! boyfriend toyota matrix 2003 xrs & tried wiring aem fic 6 car bought ebay (the guy sold said compatible truck) anyway running week & rewired back stock. rewire different wiring today fic wires didnt copper thinks thats work. checked pretty much fuses, bought brand new battery (his old battery less year old) tried jump starting, charging, pretty much everything. thinks wiring problem im sure. would guys opinions be? im sorry allowed / savy enough lol, feel sorry car means everything & messed fixable? thank you🥲","ECU_Tuning",""
"new upcoming youtube channel well established company - Rgt performance sure helps anyone here, came across mobile tuning company called **RGT Performance** figured I’d share anyone London area looking get car remapped. offer: * ✅ ECU remaps £225 * ✅ Stage 1 Stage 3 tuning * ✅ Pops & bangs, anti-lag, DSG tuning, launch control * ✅ Mobile service — come home workplace * ✅ DPF, EGR, AdBlue solutions site [rgtperformanceltd.co.uk]( thier new youyube [ affiliated — stumbled across looking tuning options thought looked like good setup, especially you’re London area. videos soon","ECU_Tuning",""
"Gotta measure rations! behind ahead. Bet ya'll havent measuring imprtant thing....rations!!!","ECU_Tuning",""
"F1 dash bypass recently tuned bike popcorn tune, put resistor plug air sensor gose into. wonding anyway make hook switch? Bc plug sensor pop downshifting would like toggle incase cop that's all. Lol","ECU_Tuning",""
"MSV80 ECU (328i N52B30) – Need Help Identifying Unknown Tune BIN File **Hey guys, quick update situation regarding MSV80 DME 2007 328i E90 (N52B30 engine).** [ Good news – managed recover bricked ECU using KTAG bench mode. However, tried reflash 328->330i mafless file BimmerLabs again, still got error — even recovery. now, I’ve flashed binary found forum get car running again. don’t know what’s inside BIN, don’t proper `.a2l` `.xdf` file read verify maps. I’m still learning stuff. anyone help identify what’s current tune? * car stock: 231 HP N52B30 * 3-stage intake manifold 330i * Cone air filter installed * Planning delete 2 4 catalytic converters soon, mounting new exhaust manifold. anyone knowledge tools analyze binary, send file via DM upload somewhere review. love know: * safe tune? * really 330i-style map? * Anything else know driving it? I’d really appreciate help, especially someone walk point right direction. Thanks advance! Edit: Thie file: [","ECU_Tuning",""
"Guten Tag,Leute wo kann man ecm titanium (crack) unterladen?","ECU_Tuning",""
"flashing tune car go gear loading tune car go gear, loaded base tune car issue.","ECU_Tuning",""
"new tuning. Hey im new tuning general, bought laptop, watched sum videos YT, still trying get layout approach it. mainly tune specific mods, feel like people broad subject dont start ground up. tips, anything?","ECU_Tuning",""
"97 Camry 5SFE turbo Microsquirt. Can't rev past ~5000 rpm reliably Microsquirt V3 running 5SFE 565cc injectors. using stock 2 coils dual outputs, 36-2 VR sensor crank, single tooth VR sensor cam. Right 10k resistor shunt, 10k inline +/- crank VR sensor (all 1/4 watt resistors sitting around). seems matter do, can't get reliably rev past \~5000-5200. spike initially \~6100, fall kinda stumble/hold \~5000. rev limiter set 6350. included msq, composite log, tooth log revving, mlg log shows RPM hanging. see anything wrong tooth/composite logs total loss issue could be. possible related VR inputs? Since basically copied msextra forum post, mention using non-stock discrete wiring cam/crank sensors. twisted wire cam VR, shielded ""security wire"" crank VR. [","ECU_Tuning",""
"Ford 1.0 Ecoboost Bosch MED17.0.1 Cloosed loop removal track car needs remain open loop. possible find coolant temp threshold set higher car ever get remain open loop? option zero lambda controls/sensors completely? done jap ecu-flash track cars previously never done MED17.0.1","ECU_Tuning",""
"Tune adjustment Hey everyone k24 swapped s2000 AEM infinity 506 I’m need assistance. car tuned runs fine it’s 2 years finally got ac system setup. turn ac idle drops starts surge causing compressor kick off. anyone help step step adjusting idle id grateful experience tuning need one little piece advice","ECU_Tuning",""
"New tuning Hi, new tuning topic want get stage 1 ECU. drive Audi A4 2.0TDI 2011. Via VCDS get numbers SW: 03L 906 022 NN HW: 03L 906 019 AL ECU. Internet says got EDC17CP20. Would say possible tune Kess V2 clone would recommend something else?","ECU_Tuning",""
"Best book ECU Hello everyone! third-year electrical engineering student currently internship car company. really interested learning ECUs (Engine Control Units) bus system. looking book recommendations explain topics detail — ideally something beginner-friendly also goes practical technical aspects. Whether diagnostics, repair, communication protocols, love hear resources helped most. Thanks advance!","ECU_Tuning",""
"Fueltech NZ here’s deal, im south America ill moving NZ soon, one dreams building cars im even able see live. part love country would love install fueltech ECUs them, dont know tune wanted know there’s tuners work","ECU_Tuning",""
"Can't get stable idle Hi trying get stable idle days get seem get it. 1993 na8 Mazda Miata. (Na8 came NZ aus 1993) tune always makes idle high 1800 rpm rev 600 1200 sometimes stall. Anyone problem know solution fix it. Thanks.","ECU_Tuning",""
"Tuning 2015 Ford Taurus I’m wondering properly tune ecu 2015 Ford Taurus SE naturally aspirated v6. anything I’m looking getting rid speed limiter currently (limited 110 mph). little (not much) research something could stumbled onto SCT X4 programmer tool. Would work cause google says yes Amazon says no, would need keep handy case something happens tuning it? else would need buy?","ECU_Tuning",""
"Stage 1 + pops Hello reading ecu original bin file looking someone stage 1 + pops Sport mode , audi a4 2.0 tfsi MED17.1 THX","ECU_Tuning",""
"e38 tach output Hello! Curious anyone experience tach output e38 ecm. swapped 2013 Camaro LS3/TR6060 1986 Jaguar XJ6. running tach output pin 48 x1 connector resistor pickup signal. get signal dash, reads high. default high low resolution set 6, reading approximately 2x been. read 6 4 cylinder 3 8 cylinder changed 3 approximately 4x be, maybe went wrong direction? Screenshot attached, guidance appreciated!","ECU_Tuning",""
"Doubt recently bought Kess KTAG. KTAG worked PERFECTLY. Kess gives initialization error generic ID error. help problem? run Kess several cars go.","ECU_Tuning",""
"Need help EDC17C10 DPF Hello eveyrone, brought Peugeot Expert (1.6HDI 2014)for dpf removal mechanical everything went ok, need turn dpf ECU EDC17C10. would like learn myself, least able dump ECU maybe someone could help turning dpf, find exactly device need etc, read ""KTAG"" ""KESS"" still cannot find great ressources :(","ECU_Tuning",""
"New winOLS 2016 ford focus st 2.0t USD Cobb intake 3 inch pipe mishimoto fmic step 2 plug want get homebrew tuning find winOLS I’m trying modify Cobb ots 0 2 stratified tune honest don’t know I’m looking I’m watching HP Academy he’s working much older Ecu visuals I’m seeing seeing far someone teach","ECU_Tuning",""
"P2261 Code CTS Turbo BOV Stage 1 MK8 GTI","ECU_Tuning",""
"EMS5150 ECU Cloning Hi ECU son's R52 Mini One Cabriolet, Jan 2008. need clone ECU earth fault. donor ECU exact matching numbers. KTAG clone want use create backup. car listed KTAG, Kess V2. read various things online cannot Kess, people saying pulled data chip KTAG successfully. come definitive help. main controller c167cs-lm (Siemens) see googling FlasHit9 used program chip? also BDM100 programmer. possible tools have, need Kess clone, something else?","ECU_Tuning",""
"recognize map WinOLS??? struggling recognize maps days. I’ve watched tons tutorials YouTube even paid HP Academy courses, ever pull screenshot predefined map (how find first place?) say, “This ignition/requested torque/lambda/whatever map” (without explaining actually know). go certain address say, “This one looks promising,” even though like ten regions look exactly same. Next, drag random rows claim, “This looks like X axis” (again, tell?). define it, that’s it. None videos actually teach methodology identifying maps scratch really matters. rely already-defined screenshots, experience, intuition. Here's question: methodology defining maps actually exist? really experience intuition developed reverse engineering data? so, guess buying predefined map quicker way, especially newer vehicles?","ECU_Tuning",""
"Volvo S60 T8 Recharge (2023) performance options Hey guys, I’m hoping buy used lower mileage ‘23 s60 t8 recharge. I’m love car wouldn’t mind trying get extra 50+ horsepower. One options find piggy back system Heico. one seemed try see, don’t blame wanting ruin newer car piggy back system. would cool hear anyone experiences heico. really tuning options car? think would cool see creep little 500hp. Bigger turbos perhaps? aftermarket places would mess hybrid system? Surely polestar tune isn’t option! Also heico website mention piggy back system s60 polestar edition imagine would also work t8 recharge year? Thanks advance!","ECU_Tuning",""
"H&S MiniMaxx V1 Unlock Codes","ECU_Tuning",""
"H&S MiniMaxx V1 Unlock Codes","ECU_Tuning",""
"put E10 91 vehicle tuned 100% 91?? 2016 Silverado 1500 L83, cammed, deleted supercharged. “Built friend me”. question put E10 it’s tuned 100%? It’s really problem town live there’s two 100% gas stations. app use doesn’t say whether 100% not. matter??","ECU_Tuning",""
"anyone know file service JDM performance cars? customer JDM V7 WRX, havent done anything file services Euro based....","ECU_Tuning",""
"need information MED17.1 audi a4 hello want know original bin file MED17.1 8K5907115F SW Ver 0008 come 2MB 4MB size, recently tried write 2MB file someone sent DTC p0420 , writing done successfully via Openport2.0 pcmflash always fault code back p0420","ECU_Tuning",""
"Help, begginer Hi, looking standalone ecu start learning tuning car. would best/most affordable ecu buy? programs look good forums/YouTube rs could watch learn? M42B18 e36 318is","ECU_Tuning",""
"Mappack EDC15c2 3 plugs Hello everyone, desperately looking mappack EDC15C2 206 2.0 HDI 90 hp calculator. searched hard found nothing matching, rail maps wrong etc... original mapping helps would like stage 2 car necessary modifications mappack next step!","ECU_Tuning",""
"Straight across primary wastegate duty cycle tapered? What’s rationale straight across board primary wastegate duty cycle turbo car versus tapered one? friend getting car tuned tuner number straight across board 40% versus tapered percentage. tuners this?","ECU_Tuning",""
"someone please explain difference damos file copy here? new lurk want eventually try tune 8hp car. NOWHERE near stage even attempting thing, gathering information. also checked current tune locked win OLS, original pre tune can't really anything becuase know hex value =s what.","ECU_Tuning",""
"Help mk7 golf mods","ECU_Tuning",""
"way add flex fuel truck without spend $200 credits? hp tuners 1999 gmc sierra 1500 truck norris cam, tbss intake, l59 flex fuel injectors, 102mm throttle body, long tube catless headers. upgraded Efans bought credits operating system allows work since 411 ecu efans 2002 operating system. realized need different operating system flex fuel added. way without spend extra $200 credits?","ECU_Tuning",""
"🔧 Need Help Recovering ECU Mercedes CLS63 AMG (2013) Stage 1 Tune – Remote Support Possible Hey everyone, pay assistance whoever help 💯 I’m reaching I’m serious issue ECU 2013 Mercedes-Benz CLS63 AMG (M157) I’m hoping someone experience—or knows someone reputable—who help remotely. Stage 1 tune (with slightly aggressive pops/bangs), car suddenly stopped starting flashing process. Based happened, believe may caused voltage spike mid-write, since car already electrical load stabilizer barely holding up. What’s done far: ECU still communicates accepts flashes — it’s totally bricked. We’ve flashed original file via OBD bench — still start. Tried multiple stock files (Dimsport, PCM), even tested IMMO flash EEPROM — change. full bench backup made Trasdata, original tune initially flashed using New Genius. Another tuner suggested may hit write counter limit, could explain it’s writable longer boots car. currently have: Tactrix OpenPort 2.0 Stable internet connection Willingness follow instructions set remote session (TeamViewer / AnyDesk) ❓What I’m Looking For: Someone experience recovering M157 ECUs Ideally reliable independent tuner who’s handled write-limit recovery similar Remote tuning/recovery help (I'm U.S.) leads, personal recommendations, help would greatly appreciated. I’m trying avoid shipping ECU country unless it’s absolutely last resort. Thanks advance!","ECU_Tuning",""
"need someone make Xdf File - pay. Please Help, Bin file car wondering someone make me/would XDF file tunerpro. Oldskull tuners said bothered making one verge giving up. anyone says ""use winols."" Thanks offer skillset program yet, willing front 1000s dollars tune one car. car Bmw N53, MSD81 Ecu, identified IHF0S_ . Bin file send too. Thanks advance, pretty much last hope.","ECU_Tuning",""
"AFR sensing range WRX Cobb e85 flex fuel kit installed . notice WOT AFR ratio stays locked exactly value, something like 11.03 thereabouts. Question experts, correct assume AFR richer sensors range allows measure? so, seem like normal max rich limit? And… sensor indeed range, mean ECU open loop WOT?","ECU_Tuning",""
"Need info cheap widebands Hi, long story short: - got 03 Chevy Silverado messed long tube small mods. - want get tuned - closest tuner available 8-ish hours drive - got access HP Tuner MPVI3, viewing lot source understand safe tuning lately im well mechanical inclined. - pretty sure need wideband proper tuning/be safe problem: budget. Sure could buy AEM x series wideband good done 350$+ maple syrup dollar get one live... ... looking cheap wideband/AEM ripoff across amazon/ebay. word them? know claim bad lightning/very hard see gauge. Sure new flashy gauge mu truck would nice mostly need accurate AFR reading VCM Scanner. accuracy? Good enough big no? Im trying dyno tune 750 hp Vette 150 shot nitrous. Im trying make Ol'Cateye run good enough set longtubes/custom equal length exhaust learn tuning so.","ECU_Tuning",""
"Looking detailed info OBD2 ECU programming/tuning – start?""","ECU_Tuning",""
"Looking detailed info OBD2 ECU programming/tuning – start?"" Hello Reddit! really interested learning OBD2 diagnostics ECU programming/tuning cars. bit new advanced aspects this, looking comprehensive resources advice. Specifically, trying understand: * OBD2: best ways interpret raw OBD2 data? specific advanced tools software (beyond simple code readers) recommend deeper diagnostics data logging? truly understand different PIDs (Parameter IDs) mean practical sense? * ECU Programming/Tuning: curious process remapping ECUs. fundamental concepts need grasp attempting anything?","ECU_Tuning",""
"Anyone lead winOLS? stated, looking winOLS 1 click installer free","ECU_Tuning",""
"Duramax LMM Efi live toggle fuel pump Flashscan v2","ECU_Tuning",""
"Civic Si boosting tuning 2006 Civic Si want add supercharger it. I’m going DIY install don’t know local tuners. know I’ll need Hondata set California I’ll probably get off-road version well. Hondata ads make seem like it’s plug play. need know spend thousands dollars avoid turning engine anchor? know I’ll probably need wide band kit monitor air fuel ratio, smog guy ignore vacuum cleaner bolted intake. I’m looking blower able push engine 400 hp. goals unrealistic DIY get decent tune? Thank you.","ECU_Tuning",""
"New Injectors tuner didn’t change injector offset battery voltage. necessary?","ECU_Tuning",""
"Bike tuning? anyone know good resources related motorcycle tuning flashing? flashed old bike paid software paid custom flash. Anyone experience point right direction far software resources check . Thanks 🙏🏻","ECU_Tuning",""
"sub called ECU_Flashing, tuning literally see posts with; car X. (clone) tool need? That's called flashing, tuning. 90% chance end bricked ECU. Even succeed; big chance engine ticking timebomb know log adjust tune get car running right. Pay experienced tuner job properly.","ECU_Tuning",""
"Ai Tunes across FYP YouTube page, seen lot people ""ChatGPT tunes"" trucks cars. notable one Spotto ([ used AI tune win 2-step competition. moderately safe thing do, something really risky that's glorified creators?","ECU_Tuning",""
"Flashing AC Delco e87 Opel Astra J 1.7cdti Hi hardware use Flash ac delco e87 ecu take bench obd? also generate checksum ? kess v2 clone worried Flash.","ECU_Tuning",""
