"Nobara special grade sorcerer ideas buffs Nobara make stronger, story able apply buffs. \- Cursed energy trait: Spiked cursed energy, like nails. \- Cursed energy connection: entity cursed energy consents, able mark cursed energy making physical contact, ""leave remote"" remain connected it. use keep track someone, activate resonance. \- Resonance: use like if portion target, driving nail explode energy spiked pattern inside target, also use give cursed energy ally, exploding energy, allowing seep body. \- Cursed technique reversal, resonance: detonate reverse cursed technique remotely, severely injure curses, heal allies. \- Maximum technique, hairpin: activating hairpin hitting hammer requirement, makes technique stronger via binding vow, cursed energy detonates extremely quickly crazy range, pierce target extremely far away. technique fast piercing blood. \- Domain Expansion, hairpin resonance: Hairpin sure hit giant nail body, nail exist spawns skin, detonate. Resonance detonate spikes within body. Unlike Hairpin, resonance damage soul. \- ""Short Range Resonance"": able activate resonance without nail hammer, long cursed energy connected targets. forms cursed energy shapes almost like porcupines quills, around body, thin visible. one gets within 2 feet her, cursed energy touching theirs, activate resonance point contact, half strong normal resonance. able made binding vow unable use unless first left mark target via physical contact. mark require consent, cannot activate actual resonance using it, allows ""short range resonance"". use defend close quarters combat, keep enemy spaced far enough able use longer range abilities, hairpin. kit, cursed energy quantity control top grade 1 sorcerer like Choso, Kusakabe, Todo, strongest character fight 1v1 come top? beating terms value teammate team fight?","Jujutsufolk","anime"
"Everyone photo VS Hashirama Auge read description - genjutsu - eighth gate, seventh shisui Susano form shown OVA, Kakashi Kakashi 1 MS WA","NarutoPowerscaling","anime"
"Thoughts Mobile Suit Gundam 00 seasons movie Awakening Trailblazer. one pretty good. think anywhere close best installment franchise far, nowhere close worst either, opinion. perfectly middle road compared Gundam installments seen far, that's meant insult. Considering worst series consists near trash like Superior Defender Gundam Force, best original Mobile Suit Gundam debatably first season Mobile Suit Gundam Seed, installments, especially ones go long, straight terrible, series middle road still makes pretty entertaining. series takes place yet another new timeline, called Anno Domini timeline, AD timeline. guessed it, seasons plus movie series anime take place timeline, although light novels manga expand timeline. anyways, like usual, technical stuff improved here, especially animation, art, fight scenes. That's especially case movie. makes sense though movie, mention one came 2010, 15 years ago. getting recent Gundam now, relatively speaking anyways. even two seasons anime somewhat recent comparison older installments, aired 2007-2009. Like best Gundam series, anime themes includes war, also minor themes like love friendship, intertwined anti war themes. times execution themes could get slightly cheesy, enough completely ruin series me. first half show bit slow, although never boring. second half show got super engrossing, towards end show even tragic, lot people would probably expect Gundam anime. think movie unnecessary, still bad.","Gundam","anime"
"guys wondering whatever happened kaiju killing missile blow zetton first kaiju meat want know guys think","Ultraman","anime"
"many seen Gojo animation I’ve played game since release seen gojo summon once. I’m curious see many also seen/not seen it.","PhantomParadeJK","anime"
"anyone know anime? anime girls house burning live male coworker maybe guys house burned maybe werent even coworkers end falling love, memory hazy cus long since watched it, ive searching ever since","anime","anime"
"romance anime Bocchi Rock? like type anime romance, even light. Even there's least love interest, fine. one anime?","anime","anime"
"Urgent need help find anime that's lost internet So, kid dad bought dvd film. brother would watch religiously, literally almost daily, really loved it. Even so, around 12 years since watched can't remember crucial details. details remember young boy, small spheres different colors would float around air. Later move faced enemy white hair, thin surface water. reflects sky identically. enemy dies, theres shit ton blood main charachter crying. Thats literally remember. Im pretty sure french, could french-dubbed. Regardless remember popular, remember discussing scenes friends school aswell extended family. trying find movie ages, dad threw dvds one day remember movie, brother either. Neither childhood friends extended family. irking years KNOW exists, maybe every month go deep dive trying find havent luck 5 years. information limitied, theres way someone help one would blessing.","anime","anime"
"watch Dragon Ball Z Dragon Ball Z Kai first? never watched dragon ball Z before, friend told Dragon Ball Z Kai better newer, better animation story, one do?","anime","anime"
"recommend great anime? Hi like anime can't find anime watch one episode. like FMA brotherhood, code geass, violet evergarden, attack Titan season one three, first half death note. like thing inappropriate content like magi. protagonist behaviour anime. Note: currently watching cowboy bebop frieren. Note: also like anime solo leveling like web comic.","anime","anime"
"action/shounen anime Watch based ones watched ones watched: • ⁠Fire force • ⁠Attack titan • ⁠Solo leveling • ⁠Fate series • ⁠Shangri La frontier • ⁠Wistoria • ⁠Demon slayer • ⁠Jujutsu kaisen • ⁠Kaiju n8 • ⁠Hunter x Hunter • ⁠Sword art online • ⁠Hells paradise • ⁠Chainsaw man • ⁠OPM • ⁠Jojo • ⁠Akame ga kill • ⁠Bleach TYBW know mixed genres basically want anime good animation, fights original powers designs. dont care much plotits ok good, must. Maybe missed i’ll reply say watched one recommendations. Also, dont like action/isekai/ harem type anime like arifureta danmachi, prefer semi modern From 2005 onwards, less.","anime","anime"
"Help find anime's name anime short girl blue hair playing dating sim game? console guy came took tease know name forgot save clip saw","anime","anime"
"Retro-Cast Rewatch Future Boy Conan - Episode 16 Episode Index <- Episode 15 | Episode 17 -> Streaming exclusively RetroCrush Episode 16: HUT Dubbed Subbed Databases: MAL  Anilist  ANN  Databases: MAL | Anilist | ANN | aniDB Today's Questions: 1. Favorite animation sequence episode? 2. Favorite character interaction? See tomorrow Episode 17!","anime","anime"
"Need help finding name older anime Mc uses gears sword made gears fight fight partners pairs 2 alternate plane rember show realistic city backgrounds think 2 seasons","anime","anime"
"go next? Hey everyone, Im somewhat new anime watched classics growing like Akira, Ninja Scroll, Ghost Shell loved them. years ago came across Dorohedoro absolutely loved it. Chainsaw Man came along checking things since. loved far extremely short except AOT like Ninja Scroll series, Jujutsu Kaisen, One Punch man, Berserk, DanDaDan. Looking similar suggestions go next? Im aware Bleach, Full Metal, Samurai Champloo one would suggest first? hidden gems would recommend? tend enjoy darker stuff monsters, curses, demons things straight weird... Appreciate it!!","anime","anime"
"New anime newbie girlfriend Hi! made deal girlfriend: watch favorite Barbie movieswish good luck, she’ll watch one anime me. need help choosing one anime could get hooked make want watch more. She’s Disney princess type — really anything super action-packed war-themed — I’d still like least bit classic anime-style fighting. definitely cute, preferably slice life, since tend bit slow","anime","anime"
"Isekai romance harem Looking isekai romance, without harem. subplot like decent amount. Familiar zero bad cuz end 1 girl kinda felt sleezy? raeliana ended duke's mansion rlly loved.","anime","anime"
"need help finding anime used watch animes like 7-10 years old pretty watched animes like decade except mainstream ones like jjk naruto. can't remember much anime like 2 sisters involved not main characters tho highschool setting. one student council average student. average one blonde remembering correctly. student council sister used look upon think? sad backstory abused children. story also involved children's illustration story book chicken different others. literally details remember","anime","anime"
"Help finding Anime Hi y'all. new anime. started anime Netflix removed could finish it. believe plot disgraced demigod trying get full powers back trying get god status back. begrudgingly teams high school girl powers she turn monkey something. anyone know anime name? started watching Hero Academia. y'all suggestions animes watch. Thank y'all advance.","anime","anime"
"continue hunter hunter? I’m episode 33. first episodes hunter exam actually unique liked them, also really like gon killua. show seems slow. I’m middle fight arc going floors it’s boring. fight hisoka cloning guy interesting, damn drawn out… like holy moly. spend entire next episode hisoka explaining every little detail fight, slog get through. get better? love shounen anime, loved one punch man jutjusu kaisen hope hunter hunter cool fights seems drag lot.","anime","anime"
"Best anime coming soon? Jjk demon slayer blue lock solo leveling new DBs movie might even include invincible hottest thing coming","anime","anime"
"anyone recommend horror anime similar Dark Gathering? I’m really liking vibe Dark Gathering fun horror anime, especially like it’s got humour lightness well, it’s constant depressing nightmare. anyone recommend any? dark gorier better, wanted touch humour alongside that. Thanks much!","anime","anime"
"Low stakes “mundane” fantasy/scifi series? Looking shows set fantasy scifi world focus everyday parts it. Examples: * First episode Kaiju 8, it’s people clean aftermath * Planetes. focuses minutiae working space recommendations? Also non-anime recs","anime","anime"
"Recommendations funny & action-packed Love: one punch man, cowboy bebop, chainsaw man Indifferent: assassination classroom, flcl Dislike: Fullmetal alchemist, attack Titan interested slow dramas scarred life - thanks!","anime","anime"
"Shoushimin Series Season 2 • Shoshimin: become Ordinary Season 2 - Episode 7 discussion *Shoushimin Series Season 2*, episode 7 17 **Reminder:** Please discuss plot points yet seen skipped show. Failing follow rules may result ban. --- **Streams** * Crunchyroll **Show information** * MyAnimeList * AniList * AniDB * Anime-Planet * Official Website * **/r/Shoushimin** --- **All discussions** Episode|Link :-:|:-: 1|Link 2|Link 3|Link 4|Link 5|Link 6|Link 7|Link --- *This post created bot. Message mod team feedback comments.* *The original source code found GitHub","anime","anime"
"Recommendations anime haters boyfriend hates anime want put on. He’s really action comedy. Think MCU, Star Wars, sort thing. tried Attack Titan he wasn’t it, Mob Psycho 100 also no. somewhat liked Dororo, never finished it. One biggest turn offs ""weirdness"" anime. Things like fan service, creepy tropes, stuff definitely ... putting newcomers. get it, there's lot stuff veteran anime fans gotten used to. would recommend win over? Anything worked “anime hating” friends partners? I’m open suggestions!","anime","anime"
"anime remember younger watching anime guy lived house hid childhood friend?? people started showinf think emotional scene moves cant remember please help would nostalgic. ideas id love know!","anime","anime"
"Anyone know anime? saw someone talk anime pair soulmates hunt/kill gods? can’t find anywhere","anime","anime"
"Need Help really want get girlfriend 17 anime, seen earlier parts Hero Academia called anime whole cringe, wondering suggestions easy starter anime hopefully get it. understand people anime, simply hoping isnt case her. open genre suggestions.","anime","anime"
"good fantasy assasin anime? Hi, looking good fantasy assasin anime. one mc assasin class fights enemies head rather one actually uses stealth sneak attacks. Going direction thief also fine. Thanks advance","anime","anime"
"Trying remember old anime/cartoon animal kung fu masters — watched TV kid Hey folks, I’m trying identify anime cartoon used watch television child probably early 2000s. show followed main character journey learn different kung fu techniques. Along way, meets around 12 masters—each one specialized unique kung fu style secretly animal disguise. animals clearly remember include chicken, panda, turtle. tone adventurous martial arts theme throughout. think master taught new skill, may based zodiac animals something similar. definitely dubbed English or possibly Hindi watched India TV. can’t remember name exact plot details, concept learning kung fu animal masters really stuck me. sound familiar anyone? Would appreciate leads!","anime","anime"
"i’m trying find anime’s watch need stuff similarities to,fairy tail like watching long love also magic fighting things.","anime","anime"
"comedic / light hearted anime recs? Like title says. rule is, anime cant SA . Looking light hearted stuff puts people good mood :","anime","anime"
"y'all suggest anime based these? want watch something fun, like funny something fun watch. watched anime past 2 weeks found fun: Skip & Loafer Recovery MMO Junkie Monthly Girls Nozaki-kun Summertime Render Ranking Kings Sentai Daishikaku love story Yamada-kun Lv999","anime","anime"
"psychological anime recs? love psychological genre pretty hard find good animes like written sooo badly, good recommendations?","anime","anime"
"Looking Mystery Anime Hello, trying get anime, especially anime surrounding detectives something similar. watched Dinner Detective liked someone recommended Bungo Stray Dogs also enjoyed, anime similar vein appreciated. like comedy mainly tolerate drama horror themes, would prefer comedic elements.","anime","anime"
"watch? enjoy action anime, something good animation likable characters. can’t find anything really peaked interest idea watch, like female main characters aswell.. want good anime action great animation","anime","anime"
"anime totally forgot boy give food girl hungry give food girl likes boy, girl turns demon think, that's remember","anime","anime"
"Question anime/manga Maou yushaa romance manga? Confession,kiss etc?","anime","anime"
"Question Ragna Crimson tone series episode 3. Hi, finished chapter 3, found disappointing. basically Crimson's monologue, kept talking nonstop, end, there's famous part one dragons' accelerated monologue deliberately cut comedy. question whether series going like on, fights start right away? afraid touches comedy, considering bleak human landscape contrasts attempt humor. also concerned Crimson's constantly talking annoying character, minion, seems made water. third episode one-off series become darker serious?","anime","anime"
"Hello everyone, please help find anime! remember ghost boy or boy like Yōkai similar ghostor kinda Yōkai again sister. encountered woman could see unlike ppl asked help calming evil spirits local urban legends. woman even pretended school-girl blend crowd students find disturbing mystical stuff happening school help students it. Also, one villains woman cat ears sort pink hair, could also yellow cat powers habits. also cat spirit companion. ghost boy seemed love woman helps sister actually boy old ghost seemed wanted get back life probably get adult body¿¿.","anime","anime"
"Anime people lot trouble communicating others? trouble understanding people say act. recommendations specific issue?","anime","anime"
"watch mha fire force first? im really stuck bcz really wanna watch both, one hand mha classic another hand fire force seems cool fuck. need answer im gonna cry 💔💔💔also watch cyberpunk edgerunners peak","anime","anime"
"someone animes bunnygirls ? someone animes bunnygirls inside exept rascal dream bunnygirl senpai. dont care Ecchi want anime bunnygirls","anime","anime"
"Need help finding anime name saw edit anime caught interest, figure anime is. short, scene young boy, making hands cold ice pack holding young, girl's hands, maybe hands sensitive something? think might flashback romance anime, might check out, anyone could help?","anime","anime"
"Looking anime recommendations like rising impact finished anime rising impact hooked😭 wanna watch sports anime really focuses sports, like haikyuu, prince tennis, rising impact... Please recommend","anime","anime"
"best romantic comedy drama sloppas? far set genres seen: Toradora! Lovely Complex Love, Chuunibyo Delusions Pet Girl Sakurasou Tomo-chan Girl honestly love them. Basically, funny, little serious, cute. think Jun Maeda stuff serious funny enough qualify.","anime","anime"
"Need help finding anime name Hey, someone help finding name anime? ","anime","anime"
"watch movie anime first Rose Versailles? Saw trailer Netflix today, ngl looks hype EXACT cup tea!! absolutely LOVEEE historical romance, might first actual historical romance ANIME gonna watch. unfortunately saw lots reviews saying story rushed movie. place great importance plot romance, hearing kinda bummed out, reason touched anime hard bear old artstyle anime. So, watch movie first despite rushed plot, watch anime first good pacing story?","anime","anime"
"yall anime like seikon qwaser. watch seikon qwaser plot fan service, problem cancelled 2 seasons. shows fan service material decent plot?","anime","anime"
"Short bingeable anime recs 1 Jujutsu Kaisen 2 Beastars only S1 3 Assassination classroom 4 Attack Titan 5 Banana fish 6 Demon slayer 7 lie April 8 Chainsaw man 9 Dandadan 10 Death note 11 Devilman crybaby 12 Tokyo ghoul 13 Tokyo revengers only S1, read manga 14 Sk8 15 Spy x family only S1 16 Kakegurui 17 Classroom elite 18 Moriarty patriot 19 promised neverland 20 happy marriage only S1 21 Hell's paradise 22 Life ordinary guy reincarnated total fantasy knockout watched friend forced me, like it 23 Given 24 Haikyuu only S1 S2 25 Hormiya only S1 26 One punch man 27 Tomodachi game 28 Violet evergarden 29 Kiss him, 30 Windbreaker only S1 list animes watched. really want short ones recover slump era. Help please? Thanks advance!","anime","anime"
"Romance anime mc fmc get married recently watched romance animes watch guy told watch lie april said get married but... yeah looking romance anime mc fmc get married start middle series, maybe also children already watched clannad.","anime","anime"
"Need suggestion next watch. Hi folks! Currently watching - 100 Girlfriends really really really okay lost count! love you! nice fun watch. Looking something similar better. Like Shimoneta watched much genre romcom/harem/ecchi stuff suggestions welcome. Also, trying watch Shimoneta Crunchyroll seems India allow shows here. someone suggest accessed? watched Crunchyroll.","anime","anime"
"Name anime boy awakens good buildings fight evil buildings Trying find name old anime maybe 80s village boy gets universe equiv. Excalibur, help friends go around world awaken good buildings sealed fight evil buildings. One episode golden castle mini robots turn turrets, massive screwdriver/tower mini robot battles arena, another good bad buildings bros control seasons valley. Final big bad dark castle bat like features whilst good boss typical main Gundam colored Pegasus helmeted design","anime","anime"
"First Anime - Death note recommendation? probably asked lot times excuse ignorance. really interested starting Anime unsure start. start Death Note, something modern?","anime","anime"
"Look disturbing anime. > I’m trying remember anime really disturbing standalone-style episode. focused group girls captured bandits sold nightly sex workers nobles. scene putting makeup prepare night. One girl mutilated face I think avoid chosen, remember scissors involved. Another girl may tried commit suicide. saved end. Afterward, think rescued girls ended working MC store business. remember anything else driving nuts. ideas?","anime","anime"
"NANA: episode 3, maybe reading much Endo suddenly jump idea going Tokyo found Juno Kyosuke going? interest art something Junko? Sorry! sounds like Junko's really loyal doubt sort stuff would happen, maybe plot hole found odd made choice quick.","anime","anime"
"Help! Got thing stuck head, sure anime picture book scene So, vaguely remember scene someone drawing picture book. One person fighting enemies front back, swapping weapons enemy brother fighting enemies back front meet middle. remember middle pages black, character drew holding hands. Something like 'its choice, fight reunite' type stuff. think Naruto? life cannot remember bugging me. I'm sure also actual book, would helpful anime cannot remembered Help Please <3","anime","anime"
"Trying find anime watched around 2016 sure anime came time earlier, may also wrong year. remember fantasy/adventure setting. MC harassed 2 characters unidentified while. really villains harassing villain adjacent. MC first encounters enters village/town fountain. kind antagonistic relationship throughout village. 2 harassers revealed turn childhood friends. believe revealed MC forced forget due trauma. also think turns dead returned ghosts MC forgot them. unfortunately recall main story anime, side story arc. believe show movie.","anime","anime"
"Pls help find anime So... anime really old, like art style. remember much plot , main guy crimson red hair liked girl. think dual personality turned phantom night. girl liked , fell phantom sm. phantom like really tall blue hair","anime","anime"
"Anime opening song stuck head can't remember anything besides ""dooba doo doo"" think might say right maybe. girl voice","anime","anime"
"good band mostly music related anime? watched btr, gbc, started bit k-on rock lady's modesty good stuff?","anime","anime"
"I’m anime slump. help. hi everyone , i’m currently anime slump wondering recommendations get love back it. i’ve anime fan years seem i’ve lost ‘spark’ binge. recommendations genre would awesome!!!!","anime","anime"
"Looking good actually underrated anime recently watched many underrated animes feel like watching them. ones really liked Bakuman Rainbow","anime","anime"
"season jojo watch? finish watching jojos bizzar adventure battle tendency dont know season next.","anime","anime"
"romance anime ended end? recently thinking watch romance anime. aime watched are- Death Note, Fruit basket, Misfit Demon King Academy, Mob Psycho 100.","anime","anime"
"Trying remember smth can’t reason read desc reason remember character, definitely male, whose whole shtick irregular gaurding technique like hands pommel","anime","anime"
"Help finding anime: Strong student council girl mistaken guy joke, always beats protag’s friend Hey everyone, I’m trying remember name romance anime. There’s side character who’s student council, she’s super strong. She’s clearly girl—like 100% obviously female—but protagonist’s friend keeps joking she’s guy strong is. running gag, always ends beating ass whenever makes joke. happens almost every episode side thing. idea anime could be?","anime","anime"
"Looking Anime Recommendations Based Taste! Hey everyone! I’m looking anime recommendations would love suggestions. anime watched really enjoyed: List liked, e.g., Attack Titan, Jujutsu Kaisen, Death Note, Demon Slayer usually enjoy genres like action, mystery, supernatural, psychological, slice life, etc. Things enjoy anime: Great story character development Intense fight scenes deep mind games bit mystery dark elements plus! Things I’m really into: much romance fanservice Overly slow slice-of-life unless strong emotional story hidden gems must-watch classics, please share! I’m open suggestions. Thanks advance!","anime","anime"
