"Thoughts Gundam Build Fighters finally made first Gundam anime ever watched 12 years go. done crying sad realization, yeah, started many years ago. sure started series meant anniversary story Gundam franchise, glad loved it, glad reveal holds years later. masterpiece, still extremely enjoyable entertaining. general plot simple; takes place world, characters build plastic model sets mobile suits, actual thing world, use kind virtual reality simulations. felt similar Yu-Gi-Oh, Bakugan: Battle Brawlers, Beyblade, three anime grew with. think that's reason loved much back even though seen single Gundam installment yet point. confidently say like anime mentioned like even seen Gundam series. fan Gundam, also enjoy this. manages simultaneously successfully appeal hardcore Gundam enthusiasts, model kit builders, from heard, group myself, fans aforementioned ""type"" anime. characters ton fun. famous one Rinko Iori, obvious reasons. seems like popularity transcended anime itself, hard understand why. attractive, cute, likeable, super supportive son's hobby, also pretty funny too. literally perfect waifu surprising everybody fell love her. there's endless stream entertainment nearly every character provides. Sei adorable, also perfectly represents lot super nerdy people really get talking passionate about, Reiji absolute blast. laughs got series him. Although wish learned world originally from, though. felt happy watching it. serious typical Gundam anime, cartoony childish either SD Gundam installments, rests comfortable tonally. Since spent almost month going Gundam beginning, nice seeing bunch mobile suits modeled directly mobile suits see previously Gundam series', something noticed first time watched it. also mention even though main focus series Gundam battles, slice life comedy element Gundam battles virtual simulation constructed around it, actually best action sequences series yet, despite short battles actually are.","anime","anime"
"need old school anime finished watching desert rose, great teacher onizuka, gokusen, patlabor, gunslinger girl, hellsing, big o, nube, gunsmith cats masterpiece want watch animes like recommend somee","anime","anime"
"Recommend Good Romance Anime far seen many popular romance animes want pls help commenting best romance animes u guys watched!n","anime","anime"
"Recommend Good Romance Anime far seen many good romance anime still need more. Comment ur fav good romance anime u watched","anime","anime"
"Anime scene know name Anime scene male MC sitting table piece paper hand female stands next helping glances mentions cup cup shocks inn Hall guild Hall tavern","anime","anime"
"Frieren best Fantasy Anime time? I’m really curious think. heavily prefer Fantasy, Action, Isekai, Shounen, Magic anime. I’ve nearly watched every single one that’s released last 10 years. Ixion Saga DT, Isekai Cheat Magician, more. enjoy & watch seasonal fantasy/isekai “trash” comes by. anime like Grimgar, Overlord, Slime Tensei, Moshoku Tensei, Zero, FMAB, many favorites mine - I’m sure even come close Masterpiece Frieren is. entire 28 episodes. OST, OP, Character Designs, Depth, Animation Techniques, Story…… it. It’s almost good. feel bad people introduced anime one. grew watching Naruto, and since rewatched 3-4x people witness early anime watching journey. watching Frieren, even come close - especially we’re talking Fantasy. I’m absolutely blown away. I’m sure Frieren favorite; still think Zero holds spot me, Frieren definitely best fantasy anime I’ve ever watched. Without question. give perfect 10/10.","anime","anime"
"watch One Piece legally/illegally Episode 1 India? Hey fellow One Piece fans, wanting start One Piece beginning, trouble finding platform India streams episodes legally. Here’s I’ve checked far: Crunchyroll: Starts around Episode 892 streams new episodes weekly, earlier arcs Episode 1 onwards missing. Netflix India: limited set episodes, sadly, earliest ones aren’t there. Cartoon Network India: Recently started airing anime Season 1 Hindi regional languages, it’s fixed broadcast schedule, prefer on-demand. Amazon Prime Video India: Seems episodes, full series—and unclear much accessible. way stream purchase One Piece India Episode 1 onward consistent access?","anime","anime"
"Help find anime like black clover fire force tired romance animes recommend something like black clover fire force. already watched one piece, Sakamoto days, hunter x hunter, kuroko basketball fyi, aot, blue lock, demon slayer. Please help escape boredom! 🙏","anime","anime"
"Best ass focused ecchis Hello. humbly seeking big 25. best booty central animes. Small big. want fan service lmao.","anime","anime"
"I’m Japan two weeks. wondering anime recommendations people me. live United States recommendations air Japan right that’d cool. sure watch I’m here. What’s hard find states look Japan?","anime","anime"
"watch planning list? Here's anilist profile help get sense taste plan watch, ill also try sum up. like little everything, typically alternate romance/slice life/wholesome action/battle/violent keep things interesting different. finished Lie April peak btw typically go something aggressive next, limit suggestions that. suggestions based info would awesome, happy answer additional questions narrow down. Recommendations add list also welcome. Also feel free debate taste, however keep mind list skewed order watched things in.","anime","anime"
"Anime recommendations berserk, nana,erased,peach girl i’m kind beginner anime fan i’ve always watched anime i’ve getting recently. usually watch friends tell wht peaks interest/is popular social media, don’t really much knowledge fr want branch watching what’s trending. Anime love watched include Berserk, erased, nana, death note, peach girl,ergo proxy, cowboy bebop. Anything else good there? plz help!","anime","anime"
"recommend anime :? used watch anime time got caught med school watched anything like 2 years honestly miss it, know new good rn","anime","anime"
"Recommend top animes feel like appreciated enough! like unuiqe, strong character determination, high quality/well done. siiickkkk crappy generic animes feels cheap probably money laundering scheme smtg. example: Tanya evil, fairytail specifically magic games arc, HxH, baby steps, lie April, frieren, kamisama kiss, rimaru slime, yumeiro patisserie, aikatsu stars, Yuri ice, snow white red hair, welcome ballroom, death note, ohshc, one punch, saiki k, noragami, Charlotte, mha, Wiseman's grandchild, Hikaru go, Pokémon, princess jellyfish, rising impact, seraph end, oblivion battery, magic-kyun Renaissance 10/10 series keep close heart there's probably alot forgot pls desperate good show.","anime","anime"
"Anime recommendations similar ""Summer Pockets"" Dude... love summer pocket best anime 2025 fr... That's y'all anime got vibe genre like masterpiece please tell Thank you....","anime","anime"
"need anime suggestions watched One Piece, MHA, JJK, Chainsaw Man, Mob Psyco 100, Black Clover, Solo Leveling, Naruto. need new anime watch","anime","anime"
"Tactics where watch Anyone clue watch anime? remembered blue trying search up, dice. Crunchyroll prime.","anime","anime"
"Can’t find anime scene from. memory may clip edited. looks like something Gundam unsure. scene several pilots floating zero gravity getting stations. suits yellowish. couple briefly kisses float away duties. next scene pilots killed space battle. Either last one remaining pilots charging enemy. recollection may bit fuzzy, know seen scene similar several times scrolling Instagram life cannot find again. Edit: 90s art style helps.","anime","anime"
"getting around watching Moonrise.. Currently episode 16 thinking... show general really really good. Honestly hope Netflix paid huge bag kind quality effort. imagining, series aired weekly season instead episodes quietly dropped Netflix, would heard much it. assuming show still done well, disappointed chose drop episodes once, instead giving treatment Netflix series recently. EDIT : Holy hell ya'll hated LMAO. show nowhere near favorites top whatever. also gripes bits pieces show, script, VAs, etc. watch writing this...I know crazy detailed art & animation see sense time put it. Obv account makes show/story good know ONA, televised. remember animes like Bluebox, Ranma, Orb released week. Maybe difference Netflix licensing aware of. mind binge watching once, thinking releasing slowly could maybe save comes people giving show chance. yeah, mainly speaking hoping Netflix paid properly cuz still imagine shit ton work went show. Like even people consider script shit, reason workers anime get paid efforts lol. specifically Netflix, almost skipped it. again, personally still consider show better lot stuff released right now, maybe giving easy props. ya'll gonna make finish show judgmental eyes..was trying continue innocent LOL.","anime","anime"
"Recommendations romance movies? watched “A Slient Voice”, “Your Name”, “I want eat pancreas”, “Weathering You”. need romance movies destroy me. mean ruin whole day type stuff.","anime","anime"
"top 5 animes would rate 10/10 Basically, title says, anime would rate 10/10, also anime love would 100% recommend. get ball rolling: 1- Hunter x Hunter 2- Black Clover 3- Dr. Stone 4- Apothecary Diaries Really happy 2nd season 5- Frieren Honorable Mention Wind Breaker really happy 2nd season. Thanks advance everyone answers advance!","anime","anime"
"Anime Suggestions Consisting Anthropomorphic Animals/Creature or things talk Humans Alongside? Recently, ive obsessed type animes consisting anthropomorphic animals are/live alongside humans. P.S. animals dont need anthropomorphic least need talk like humans. suggestions? TYSM!","anime","anime"
"Reccomend old anime back watching anime wanted rewatch older anime watched years ago. can't seem remember single title kind list refer back to. someone reccomend good titles 2005 2018 would great. generally used watch rom/com, harem, slice life, fantasy maybe isekai, action, drama mix these, please keep recomendations mostly genres Thank advance","anime","anime"
"need helping remembering anime long ago, remember scene i think bus crashed something stay there, MC got suspicious meat adults giving since didnt say came from, apparently human meat they killing people there, since way survive.","anime","anime"
"Good anime watch public? trying get back watching anime. watched lot high school, college much life got busier busier. recently thought try watching again, best time watch anime cardio gym with headphones, obviously people still see screen, prefer something nudity, fan service, etc. Here's favorites think of: Neon Genesis Evangelion, Kaiju No. 8, Cowboy Bebop, Death Note, Jojo's haven't seen recent 2 seasons yet, Full Metal Alchemist, Variety Ghibli movies Edit: Spelling","anime","anime"
"Seven Deadly Sin Question. SPOILER: never saw Ban background Ban normal human. attempted get potion/elixir life met Elaine fell love King's sister. tried many times attacked would fell death. However, supposedly ""the forest helped"" Elaine stated. Basically fatal blows LUCKILY stopped trees live shrooms. truly luck truly Forest somehow helping him? Curious view.","anime","anime"
"Period/Historical, Romance/Tension recs binge? Recently caught Apothecary Diaries loving it! Waiting hold library read books. meantime I’m hoping watch something I’d like— I’m noticing much like series really like historical/fantasy series romance/tension. time favorite Kamisama Kiss also like Kakuriyo, set/in reference ancient Japan. AD ancient China. recommendations check based themes? : Thank you!!","anime","anime"
"Help question Okay idk right thing oh well. last month half collecting recommendations anime watch mostly all  TikTok videos comments like put enjoyed one get like 6 responses saying would like x z . put list tonight finishing quintessential quintuplets wondering anime’s I’ve recommended actually watch Japanese skills lacking pretty dyslexic find hard watch sub . put full list chatgpt help find majority sure trusted fully cause didn’t tell upcoming dress darling season 2 thought would Reddit one least ones doesn’t think dubs. anyone interested would happy send full list . list ones unsure . Thanks advance 😊 TLDR following list anime know could inform dub watch it? 1. Dangers Heart 2. Dandadan 3. Happy Marriage 4. Crush Work 5. Overflow 6. Frieren: Beyond Journey’s End 7. Ice Guy Cool Female Colleague 8. Hero 9. Blue Box 10. Monogatari 11. Solo Leveling 12. Tada Never Falls Love 13. Real Girl 3D Kanojo 14. Triage X 15. Thought Never Girl Online? 16. Summer Time Rendering 17. Girl Downstairs","anime","anime"
"reccomandations based onwhat watched ?? :3 hellowwww, really big fan anime idk watch next - really liked high rise invasion, romantic killer, nana death note!! tysm replies <3","anime","anime"
"Looking something similar Bastard! Series Hey, I’m looking anime 18+ rating strong perplex romance theme. finished watching Bastard! Netflix pretty scandalous IMO really enjoyed love interests plot. don’t mind there’s fighting action predominantly looking something sexy, scandalous dramatic!","anime","anime"
"Anime FFO Darker Black? really enjoy the, guess call it, ""thriller"" style anime. big horror/thriller/true crime person general. liked pacing storyline DTB. DTB made think. also included snippets fighting cool. Thanks!","anime","anime"
