"Breed Meeko? Repost new Pictures Information Meeko Hi, handsome 11 year old senior dog named Meeko, rescued around 15 years old i’m almost 27 May,20th got age 1 year 3 months old teenager dog rescued him, paperwork says Greyhound/Shepherd Mix…but I’m sure. 🤔 keep thinking he’s Cursinu Corsican dog breed, unfortunately i’m certain…I’m able afford Embark Wisdom panel get DNA tested, I’m hoping someone help actually determine Meeko’s real breed, yes he’s definitely mix think…help? lol. He’s good boy almost Greyhound traits, literal couch potato, lol…but he’s protective loyal like shepherd lot shepherd like traits well. I’m really sure 🤔 he’s handsome that’s know ❤️💕🐾🥹 Edit: added pictures 1 year 3 months old When first got him! added end previous pictures..new old : Meeko’s weight according vet: 33.1 KG 72.9 pounds","IDmydog","animals"
"gutted boi Mochi, posted times last couple months, left us world yesterday. five years old short time brought immeasurable happiness home, me. sister rescued baby 2020, small bottle fed. would never know looking fantastic beast today. big, smart, gentle beast. got older rambunctious, became much sister mom handle catnapped brought house, thrived. loved every single day, end still feel like enough. use picture cuddling old. Instead laid rest tomorrow property, loved outdoors much. honored small ceremony surrounded family found earth. miss every day. Thanks listening, never thought would making one posts 💔💔💔","blackcats","animals"
"Best training program owner stubborn mustang I’m looking train way would work well stubborn mustang well trained, stubborn doesn’t want something. need method work find consistency doing. mostly trail ride, I’m looking arena work ground help establish bond kind way. recs? previously cow horse trained matters","Equestrian","animals"
"Birch bully 2 months Abby Great Dane 3 months I’m looking general advice, either training puppies specifically. main thing I’m nervous playing time cause rough dogs. bully pushes bites lot also chasing end follow everywhere. play would say super rough biting occasionally pulling skin always go back more. playing dogs regularly mess social skills? meet dogs occasionally spend time sometimes don’t take dog parks anything fear actually getting hurt. take walks get time field get energy they’re still always like that. Abby also mild separation anxiety trying stuff like leaving progressively longer continues cry whine. I’m first time dog owner please go easy advice/ tips would greatly appreciated.","puppies","animals"
"First time pomsky parent. Hello, adopted pomsky 2 weeks wondering fur going like. looks fluffy puppy, spiky hair now. trying see going puppy hair changing stage something.","Pomsky","animals"
"snake Enterprise, AL? Saw snake Lower Alabama near Enterprise, AL. little 3 feet long, rattled tail took picture - although couldn’t entirely make tail bush next to.","whatsthissnake","animals"
"cat hates friends. It’s situational too, I’m sure why. earlier, friend sitting couch playing video games, cat chill. even walked let pet her. usually even lay lap we’re room. whatever reason, opened door leave, darted try attack him. reason decides go anywhere own, too, she’ll follow hiss, sometimes try bite him. went use bathroom cornered hallway. happens friends. Whenever we’re room together, she’ll best friend. second alone, wants dead. It’s usually turn back go somewhere. room once, got started walking hallway bathroom, cat sprinted swatted him. stared hissing yowling tail puffed way up. know haven’t abused anything. try nice her, avoid her. previous owner said sweetest cat world, couldn’t hurt fly. wants friends’ heads stake I’m nearby.","CatAdvice","animals"
"Surrounded plushy pillows lays plastic bag reason, one 3 favorite places lay top plastic bag. either that, favorite blanket lap. also like call 'dead cat' pose.","TuxedoCats","animals"
"Urgent! Past deadline! Good boy Rex lovely, friendly pup, urgently looking new best friend foster rescue. risk euthanized space tomorrow 5/15 Downey ACC CA, abandoned owners.","adoptmeplease","animals"
"Dogs disgusting know Especially pitbulls monstrous, drooling beasts. Let’s real, one actually enjoys smelly, drooling, massive dookie taking beast home day. believe people brainwashed “love” them. Oh smell like shit too.","TrueUnpopularOpinion","animals"
"Silly dog trying get last bit cup","Cutedogsreddit","animals"
"Anybody lose dog near Campbell community center? sweet dog came right us collar all. Dm it’s :","Eugene","animals"
"lil girly followed home night! Help name her’!","NameMyCat","animals"
"Cardinal Tetra dying one die one looks like way out. suggestions happening prevent future would helpful","aquarium","animals"
"Red irritation around neck Please help Angel, know yes, take vet. Right cant afford it. Please kind. take care pets X bought flea collars put one said taking front line missed month cheap reason got whatever. wore maybe 3 weeks notice irritation forming asked like idiot dont think take off. 6 7 weeks wothout gotten back Frontline weeks without collar. even bath vet pet wash stuff never problem no bath often really dirty smell picked up itching balding know along way might itching Im looking notice collar. took collar wrapped clean long sock cone laying around. Google says cortizone10 something else. starting raise like dermatitis eczema. mom.use rub wide leaf plant passed cant ask was.","CATHELP","animals"
"Cat losing hair 11 year old cat losing hair behind rear legs, it’s creeping sides. advise would helpful. Old age nerves? medical advise","CatAdvice","animals"
"Missing hobby, don’t know get back used betta fish years ago, absolutely loved tank betta. took really great care frequent water changes, giving nicely aquascaped tank tank mates, generally enjoying close family member diagnosed terminal illness subsequently passed away. husband moved times shortly that, period, severely neglected betta due struggling grief, depression, bad living situation, passed away. distraught continue hobby received respectable burial backyard current home. Fast forward now, work restoring husband’s 40 gallon tank neglecting due struggles mental health, work, finishing degree working on. lost interest hobby, trying get back since used make happy. deep cleaned tank done full water change, added plants shrimp which thoroughly enjoy. trying cheer husband, feel like I’ve found passion aquariums myself, thinking starting another betta tank. issue feel immense guilt sadness utter failure first betta. feel awful suffered, don’t know getting new betta would make feel better worse. I’d like small tank own, sad first betta passed, especially knowing it’s fault. guess looking encouragement maybe someone gone similar experience wants share helped get back keeping betta tank. TIA, pictures current non betta tank restored week attached.","bettafish","animals"
"Vet anxious large dog anyone found vet area works well anxious dogs? dog medium/large freaks vet. never bit, see vet would scared. mainly flails about. strong. rescue clue happened got her. also trainer come try fix root issues vet drama remains. success past vet visits HEB parking lot, recently stuck well. TIA!","thewoodlands","animals"
"idea mixed with? given German shepherd there's gonna something else there, idea?","WhatBreedIsMyDog","animals"
"🐱 Train White Cat – Expert Tips & Tricks! 🎯 **🐱 Train White Cat – Expert Tips & Tricks! 🎯** Struggling train **white cat**? White cats independent sometimes require extra patience, right techniques, teach essential behaviors strengthening bond! ❤️ 📌 **In Video, You’ll Learn:** ✅ early training crucial white cats 🍼 ✅ best **visual aids & clicker training** success 🎾 ✅ Understanding white cat **body language & hearing challenges** 👂 ✅ Preventing **sunburn, tear stains, & skin sensitivity** ☀️ ✅ Training tips **positive reinforcement & engagement** 🎉 🌟 Whether new cat owner seasoned pro, tips help **white cat thrive!** 🐾 🎥 **Watch here:**  🔔 **Don’t forget like & subscribe cat care tips!** 💕 \#WhiteCatTraining #CatLovers #HowToTrainYourCat #CatTrainingTips #PetCare #ClickerTraining #FelineTraining #HappyCats #KittenTraining","gffghghghghghghg","animals"
"Pet Owners Beware Avoid Bedstuy Vet Clinic costs! You’d better taking pet far distant lands proper care. “doctor” isn’t licensed ANYTHING. real guy seems like he’s old function. woman okay, rushes collect money get door. I’ve even heard staff full blown going head head lobby. prices pretty high well subpar professionalism wrong diagnoses. told poor dog elevated white blood cells ultimately cancer. He’s 3 obviously shock. spending thousands Blue Pearl wondered even got information sweet boy totally normal healthy. save stress.","BedStuy","animals"
"Dog Breed restrictions Fort Ord LA Mesa PCSing presidio soon ran problem fort ord housing pet policy. require pet vaccination record DNA test proving dog none banned breeds. Pitbulls, Staffies, Doberman, Rottweiler, etc. normally board dealing certain breeds others misconceptions surrounding them, dog mutt staffy pit mostly shar pei lab. housing allow bit restricted dna. even percentage. question anybody ignored pet policy dl brought pets housing anyway tell leasing office. anybody caught this? so, happened?","dli","animals"
"anyone know dangerous? found small black balls dog's head, near ears. swell, touch dog react, guess hurt her, still worried whatever is.","DogAdvice","animals"
"ID please Congaree NP Posting forgot picture first time 🤦🏻‍♀️ Another snake mom saw today Congaree NP took picture snake obsessed boys. We’re thinking Indigo snake?","whatsthissnake","animals"
"Random Question two yellow Labrador retriever dogs. One 9 years old, newest one 7 months old. dogs’ breeders deliberate making sure offspring puppies jet black noses. 9 year old’s nose turned brown couple months puppy’s nose turning brown also. saw pictures puppy’s siblings jet-black noses. love dogs, think it’s perplexing one, two brown noses. It’s snow-nose - puppies living state mild temperatures. common thing puppy & 9-year old dog food. Anything like happen others? TIA","LabradorRetrievers","animals"
"Turtle Help Hello friends, beautiful snapping turtle hunkered front yard morning staying relatively still throughout day. assumed female looking place lay it’s eggs would move time, closer inspection seems like there’s bit wear shell. I’m sure it’s huge issue I’m concerned might need help initially assumed. I’m sure now. call local animal control overreacting let be? help would much appreciated!","snappingturtles","animals"
"New cats rescued two baby kittens, looking advice raising them! girlfriend found two abandoned kittens behind dumpster live. mother sight, heard meowing taking dog walk. took time getting come us, eventually took looking keeping them. gf cats before, never kittens, new cats entirely. morning vet estimated around 8 weeks old, bit smelly overall good health. expect raising two young kittens, advice give people new kittens? time energy raise them, need help getting started right direction!","CatAdvice","animals"
"tick tick bite? feeling dog ticks felt round ball almost like tick cute hair see. saw red gash. tick deep her? tick bite? nothing? want advice going vet.","DogAdvice","animals"
"Cat angry walk swats us family adopted super old cat  idea age minimum 15. Several years ago sweetest baby girl ever. EXCEPT certain times walk meow frustration swat us. idea why! never ever hurt way she’s queen house don’t think it’s fear perceived threat. also don’t think she’s blind I’m sure. anyone advice?", "CatAdvice", ""
"Missing robins nest watching robins nest yard past week. 4 eggs mama sitting frequently. Today went check nest I touch look afar entire nest missing. entire nest eggs. trace left. Would animal that?? worst part mama still sitting nest", "birding", "animals"
"Kitten possibly escaped hiding car — help! transported 12-week-old kitten **plastic storage tote box** not sealed locked **trunk** 2014 Hyundai Elantra. arrived home, kitten **gone**, even though trunk closed doors locked. I’ve searched trunk, back seat pass-through, seats can’t find it. kitten isn’t meowing, I’m worried it’s hiding silently. anyone experienced kitten escaping hiding car? possible kitten got even trunk closed whole time? advice finding would greatly appreciated!","Animals","animals"
"Dog eating like normal + lumps neck appointment tomorrow morning hopefully I’ll get bottom this. curious anyone similar experiences was…he’s 8 1/2 years old. 3 weeks ago, realized dog wasn’t eating food nearly much was. still begging mine wasn’t like disinterested it. started supplementing wet food, assuming teeth may bothering him. ate wet food problem. stopped eating dry food together week ago, I’ve wet-food diet. He’s 38ish lbs give 2 cans day. dog ALWAYS licks bowl clean looking more. tonight 2nd can, ate 80% refused finish matter much asked. dog Never eating issues. even gave couple bites vanilla yogurt which Loves obvious didn’t want eat anymore 3rd bite. can’t express enough unlike is… Now, I’ve found 3-4 large bumps neck, directly jaw bone. I’m genuinely freaking out.","Animals","animals"
"animal made burrow animal made burrow central OK? pad goes least 5 feet concrete diagonally.","Animals","animals"
"Coastal Brown Bear Vs. American Lion Panthera Leo Atrox posted month ago, people know American lion was, thinking cougar. time, clarify American lion is. also made bear brown bear instead polar bear like last time fairer. American lion big cat, native Americas, 13,000 years ago. could weigh around 550 1,100 pounds Sources vary. matchup, let's assume average 950, leaning higher end, Wikipedia gave lower end, although also said Smilodon could weigh 1,000 pounds, makes sense, American lion always said heavier 2 paleontologists.. coastal grizzly bear, comparison, ranges around 700-1,350 pounds  Again, sources vary. Let's assume average 1,200 pounds, higher end line. American lion roughly 1.2 meters shoulder, 2.5 meters long . coastal grizzly, comparison, stood 1.3 meters shoulder, 2.4 meters long  course, grizzly could get lot bigger standing hind legs, 3 meters tall. American lion roughly 2,800 Newton bite force, bear roughly 1,500 Newton bite force. Also, keep mind lion's teeth better designed combat bear's, meaning lion takes clear edge field. seem information arm strength American lion, given grizzly bear longer claws weight, safe say bear much deadlier paw. Surprisingly, bear reach speed 30-40 mph, lion reach 30mph. Granted, movement speed important fight; attack speed agility matter. Given lion cat, pretty obvious cat takes edge agility arguably combat speed. American lion's diet mostly consisted large animals like bison, deer, even mammoths, bear's diet mostly fish berries. Additionally, American lions coexisted interacted short-faced bear, grizzly bear never seen anything remotely like lion, besides cougar, around 5 times lighter. American lion similar social structure African lion which bit stretch, lion probably lots experience combat. safe say lion better experience/battle experience. Anyway, lion advantage combat speed, agility, bite effectiveness, experience/battle experience. Meanwhile, bear takes size, weight, arm strength, durability, Intelligence Given info, think would win fight, assuming bloodlusted, either equally capable scaring off. Bonus rounds : American lion vs kodaik bear American lion vs polar bear bonus rounds, lion bears advantages other, smaller larger gap","Animals","animals"
"Need advice regarding baby birds long story short, birds make nests random spots front back porches. typically use hanging ferns front porch love getting periodically see process new life window watering said ferns. However, last two springs birds made nests fan blades back porch. would fine since we’re aware keep fan kind, back porch dogs hang day nice weather. kind it, baby birds fall down, become adult birds. question assist safety interfere nature? I’d willing raise inside release there’s option keep mama bird, I’d rather that. ideas? I’d greatly appreciate suggestions advice!! Photos explanation nests made. New nest year currently built back blade can’t see photos!","Animals","animals"
"Bit Petsmart cat vaccinated should anything? petting playing Petsmart cat 2 years age rabies vaccinated December. bit finger drew small drop blood pad right nail meets skin back. last night finger looks normal shows sign ever bit. sanitized rubbing alcohol went afternoon. worried rabies contact doctor?","Animals","animals"
"What's dumbest animal ""fact"" ever heard? Mine ""Snakes bones"" ""Worms can't animals, insects""","Animals","animals"
"sister’s neighbors Labrador. Unfortunately, recently robbed. Luckily, cameras inside outside house, thieves caught quickly. there’s remarkable video: robbers gathering things, dog actually brought toy dinosaur put bag! threw out, ran mouth tried give - like wanted take too! Thanks video, became clear dog knew - thieves familiar people access house.","Animals","animals"
"silverback grizzly?? sure post stupid 'what if' question, im insanely curious... came across post asking something like ""which animal would pick four survive 20 minutes?"" choices were: grizzly, tiger, hippo, gorilla. people chose gorilla, instantly chose grizzly... sooo question is, would easier survive 20 minutes? grizzly silverback?? dont really know much gorillas, maybe goes id pick grizzly, know relatively easy piss gorilla without even realizing it. ive seen quite videos zookeepers make run gorilla randomly turns aggressive, im assuming means theres much calm them. plus, gorillas aggression likely youre seen challenger, meaning true aggression -- whereas grizzlies aggression defensive side. grizzlies really attack hurt/threatened cubs. lay stomach play dead, likely lose interest. dont hunt humans, eat things dead -- threat neutralized, dont really give shit you. know multiple variables would change outcome either situation, think?","Animals","animals"
"need advice take care baby mouse. way back school came across baby mouse looks 14days old. middle large sidewalk shaking limping, nest mother sight took baby me. got home mouse still shaking couldn’t move properly put box one beanies hide warm place gave food. read mice 2-3 weeks eat solids gave sliced apples it’s soft didn’t wanna give water without syringe even it’s tiny bit water lid it’s baby scared would down. 7 hours mouse moving around lot shaking anymore, noticed bugs coming don’t know wise maybe give gentle bath. I’m gonna feed every 4 hours diluted almond milk that’s slightly warmer room temperature. I don’t plan keeping it, I’m gonna nurse back health week two release wild again","Animals","animals"
"Human sized Canadian geese think could work made human sized Canadian geese may get comfortable getting closer us always way fight back going necks. think aggressive us. imagine large birds lawn.","Animals","animals"
"White Rhinoceros vs Hippopotamus White Rhino heavier stronger Physically, also thicker skin defensive weapon its horn Hippopotamus colossal bite, still heavy thick skin although better Rhino aspects, aggressive experience combat usually fights less peaceful it aggressive, great debate","Animals","animals"
"Siberian Tiger vs Oso Grizzly understand it, sometimes read Tiger sometimes seen eating Bears, times read Bear wins greater strength fight would win","Animals","animals"
"Rock wallaby West Australia Last week tourist tour group west coast Western Australia. Tour organisers took us Yardie Creek Cape Range National Park way Exmouth. taken cruise Yardie Creek saw Rock Wallabies, well Ospreys. photo shows well wallabies camouflaged, pointed us could spot them. spend much hot part day tucked rock crevices shade.","Animals","animals"
"breed dog ?? Please give BEST guess breed 8 month old baby girl mocha would 😩 person got idea & stated she’d “small”. asking vet thought hmm let see others might think","Animals","animals"
"looking adopt sulcata tortoise Hey, looking adopt sulcata tortoise. anyone already one willing give someone would love rest life, one. currently dog bird last 12 years. pretty good animals well being. Also, bear shipping ever India. main reason post first look adopt one possible.","Animals","animals"
"ever get severely sad state animals nowadays? Polar bears, fish, whales, seals, etc, animals dying everyday pollution humans makes sad. wish could something help, know probably won’t make difference. get severely sad idk else do.","Animals","animals"
"Slightly controversial topic: would happening put animals completely dark room? title stated. currently watching Jacob Geller’s „fear dark“ video talking humans dark. question popped head, animals nocturnal get completely light derived room? Would behaviour erratic scared? Maybe stupid question, genuinely scared","Animals","animals"
"Squirrels hand tame wild squirrels? daughter wants pet squirrel. state wild caught squirrel legal keep pet. capture one transport cage, eventually tame it? 10ftx8ftx8ft cage setup basement miniature tree sorts fun squirrel things. like take walk leash tamed. already talked local vet, experience working squirrels would squirrel doctor.","Animals","animals"
"Feeling guilty Last night son 2 German shepherds went beautiful sunset Mother’s Day hike. beautiful day. way home fox darted front car hit her. 😔 can’t get image beautiful creature laying bleeding lifeless head. I’ve never killed anything life! love animals there’s special place heart foxes. 😔😔😔 beautiful intelligent creatures. I’m really pissed universe letting happen me, her. 😔 know accident far worse things happen people feel sad can’t stop crying it.","Animals","animals"
"anyone know animal? wasn’t able get picture looks like beaver type mammal front fox back. It’s living stick den behind hockey arena Ottawa clue is, there’s also mats white hair everywhere. colours brown white white end tail","Animals","animals"
"Anyone know animal could left tracks? hiking wife bit trail near yoho pass trail emerald lake. looking moose noticed set tracks. thought might bear it’s size palm. animal expert. Thank you.","Animals","animals"
"animals behave like glitched NPCs? Imagine go Antarctica, Emperor Penguin approaches starts distorted zombie screams, stares dead eyes, starts shaking head like broken helicopter blade, takes dump ground, starts walking aimlessly, trips rock, falls face, glides across ground, stands up, stares void questioning life, falls asleep. behave like that?","Animals","animals"
"Recognizing animals deserve rights good human rights humans, often treat badly. held equal regard. many forms discrimination inequality. Sometimes humans seem like don’t want acknowledge animals’ worth. use excuse many human problems worry supposedly “lesser” beings. However, believe recognizing animals deserve rights makes human rights obvious, undeniable. deserve protection compassion? Simply are. **We sentient beings feel lot.** suffer tremendously needs aren’t met. safe thriving, means everything us. inside. nonhuman being's feelings matter, regardless whether self-reflect intellect. Regardless abilities. Regardless whether look “cute” “ugly” someone else’s standards. Regardless size. Regardless background circumstances birth. Regardless whether anyone else likes cares all, regardless whether relationships solitary. things exactly need realize human selves. Humans need smart enough, able-bodied enough, pretty enough worthy either. appearances don’t make us less deserving. **Whether surrounded loved ones completely alone, whether born privileged marginalized treated badly, infinitely worthy treated much better.** believe dismiss self-worth animals aren’t blessed human technology, intelligence, privilege like us, dismiss part ourselves. make worth conditional. resonate written, would recommend checking book interconnections caring animals caring humans. Truly seeing animals fellow sentient beings mainstream way thinking. that, really feel like actively seek order strengthen already feel inside, empowered advocate. next read, planning get book called *Beasts Burden: Animal Disability Liberation*.","Animals","animals"
"animals typically known freeze response? purely interest crossed mind, discussing friend discussing freeze response, called goat.😭 made curious many animals typically freeze response couldn’t find many direct answers searching","Animals","animals"
"cat doesn’t make sounds Hello , kitten recently month , sick first used sneeze lot energy, treated hes much better. one thing noticed cat barely make sounds? like 4 times whole month, normal cats like this?","Animals","animals"
"Paw print id Need help identifying paw prints son came across hike morning central Illinois . We’re guessing bobcat knows could domestic dog","Animals","animals"
"Breed dog? Anyone ideas breeds dog Zeus would be, told he’s bull Arab cross got 6 weeks, he’s year half old 40kg, someone said don’t see much bull Arab someone else said see staffy really sure, guys think?","Animals","animals"
"type food set various critters backyard squirrels birds would like give treats pair local squirrels, dont know would appropriate set out. specifically relating food like food promotes health","Animals","animals"
