"woke red bump leg May 2nd bat crawled room yesterday. want know chances bat bite. two punctures, eight millimeters apart. Wisconsin. red bump swollen, hot touch, hard pressed on. bat crawled room door. cat waiting outside room think chasing bat. saw got ran stairs. initial shock done opened window flew out. edits going today ER. positive safe. symptoms week. Someone asked bumps bump. Yes, bumps bat came room. red bump healed 2 red dots 8 MM apart ankle. Keep mind bat bitten day came room saw it. would bitten blanket got blanket. Edit 2 final update got vaccine going days 3, 7, 14. Thank giving advice. ER could tell bat bite considering looked like fact bat room could definitively rule possibility room encounter gave vaccine. vaccine hurt there's that. told usually give vaccine people wounds them. reason rule possibility bat entering day intrusion 4 PM. window door leave open one screen. that's why.","Animals","animals"
"found determines lifespan longevity animals? Intelligence? Size? Environment? seems random. example, smaller dogs longer lifespans larger dogs, yet elephants really long life. intelligence, octopus rats incredibly short lives despite pretty smart. could list many examples, sure common knowledge circle. clue determines lifespan overall?","Animals","animals"
"Sweet Doe Yard? Ok, ignorant city girl am, responded months ago flower post picture ""pregnant doe"" yard, educated said ""doe"" actually buck. Oops. 🥴 get right time?","Animals","animals"
"Toledo Zoo visit, Ohio 1. Arapaima 2. Baby Sturgeon 3. Native Turtle Pond 4. Shrimp 5. Sea horse 6. Clownfish 7. Pipefish 8. Giant Stingray","Animals","animals"
"animals could talk, would kind gentle? saw post day animals would rudest could talked, thought would flip question around. curious hear guys come with, honestly really sure.","Animals","animals"
"Deer? I’ve never seen deer face like this. someone identify animal. tripping? 😹","Animal","animals"
"PearlMy nickname Squirrel used visit every days. would occasionally leave peanut shells find away travel. past two weeks now, she’s visiting every single day 1:30pm like clockwork. Today Friday, guess animal kingdom also moves hectic manner, arrived 5:00pm today excited motivated. grabbed food right hand without urinating timeshe first days ate right beside me. left door open accident came back find couch waiting me. grabbed peanuts visual that. Cheers","Animal","animals"
"George goat obsessed us would try climb onto laps shoulders. also didn’t care picked up.","Animal","animals"
"found teeny baby bunny yard online says touch it.. moved hour. move try see alive wait longer? could cause mom leave babies? seems nest close bf accidentally moved fur covering knowing nest. said bunnies jumped away one started stopped spot. photo one them. Also outdoor cats roam neighborhood passing yard daily. photo one siblings whose face much lovely..the one question picture face grass can't get good look.","Animal","animals"
"realistic 1v1 friends arguing hypothetical 1v1 where bloodlusted toward eachother, assume fair habitat, come decision hoping guys help us. personally: ants clear. View Poll","Animal","animals"
"FurryFwendz’s cat house cat deserves cozy kingdom! Treat furry friend ultimate comfort beautifully crafted Cat House — perfect naps, playtime, hiding away. Spoil today make dreams come true!","Animal","animals"
"dog Puppy believe around 7-8 years old got literally bone. can't leave side without wanting pet hours. Loves go outside, listens name Puppy. name work, find fitting funny. way happy little girl 3 years her. Still going strong together even see couple days can't bring somewhere like camping due restrictions family. Also wondering breed is. know. never told definitely kind dominant breed within her. things previous owners told around 6 different breeds within her.","Animal","animals"
"Pygmy Hippo Day Pygmy Hippo Day celebrated April 8 raise awareness endangered species hippos. pygmy hippo smaller cousin hippopotamus. endangered species rapidly moving towards extinction. 2,000 pygmy hippos left world, mainly found Ivory Coast, Guinea, Sierra Leone.","Animal","animals"
"love going National Geographic's site, read animals get funny pictures. Like, images could've taken Tapir, took one looks like this???","Animal","animals"
"animal ? living roof long time, quite small, long tail  maybe adult. Belgium. someone tell ?","Animal","animals"
"train dog stop aggressive around food? dog never bit me, make clear. aggression towards family members, dogs. attacks growls steals food dogs. first almost harmless ignored my bad, got worse got third dog. bites another dog get food doesn't. get food first three, get food last three another dog want give food her. point, every time there's food hyper fixated it. can't walk away. listens commands waits patiently eat food command bite approach eating something even take away I normally unless something dangerous, dogs. way stop it? 2.5 years old.","dogs","animals"
"Dog urine back porch Hey fellow doggie people, I’ve got old man black lab 9 stopped using bathroom grass. fact, refuses leave porch. led peeing porch. used bleach, vinegar, ton cleaners trying get smell it’s still strong. even repainted it, odor still there. anyone tips? I’m loss. back porch unusable. Question 2: anyone experienced dogs? sudden fear grass?","dogs","animals"
"Flying dog Hi everyone first post here. living South Korea moving Turkey. large dog dont want make travel cargo side. searched private charters couldnt find travelling Korea Turkey. know ways? need use pet relocation services, trustworthy?? Thank answers!","dogs","animals"
"DAE think poodle coats absorb smells normal fur? small dog poodle coat swear absorbs odors like sponge. much, any, ""doggy"" scent anytime go outside comes back smelling strongly like anything walked near. Skunk smells, grass flower smells, even perfumes whoever petted him, absorbs it. childhood dog normal coat fur issue. anyone else noticed poodlish dogs?","dogs","animals"
"Anybody else's dog lay bed tell to? mean lays bed prob decides to. scenario lied floor nap switch bed command - always lays long enough make happy wanders lays somewhere else. sure independence thing dog behavior quirk? Maybe bed always feel comfy them? know sometimes laying tile specifically cool bother then. thoughts?","dogs","animals"
"Anyone knows Pomeranians shaky? Pomeranian always hyperactive, really high energy time, met Pomeranians deal, really crazy hyperactive, anyone knows normal breed weird?","dogs","animals"
"Two strange outbursts 4 year old golden… Tonight outdoor concert people dogs around, 4 yo female golden retriever randomly uncharacteristically lunged passing dog happened twice, different dog times. cannot point specific trigger cause, lunges aggressive nature times hackles up. can’t understate sweet loving towards people dogs. likes dog, she’ll play, not, she’ll pay attention. Trying get better understanding happened. answer potential FAQs: fixed, she’s event location multiple times, she’s sick injured, she’s date vax’s, seen plenty dogs without incident, food toys involved, one dog breeds Boxer didn’t know second, dogs question leashed ours anchored chair. Sorry long looking perspective.","dogs","animals"
"dogs prefer We, wife 62F, 61M mostly boxers last 14 yrs. Chihuaha 12yrs, 3 little dog adored me. Wife said like men. Previous husband mean lt boxers 2 females first, one passed 9yrs old. 2yrs got 2nd female company. attached me. 1st boxer passed on, figured get male. Again, guy bonded also. mean extreme! lays feet stop break literally tries lay top night. settles laying head me. female comes pushes female away & correct him. Ive many dogs life, although nothing like guy, something else. add dogs bonded me, degree. wife feeds & pay attention them, gets upset bond degree Anyone ideas?","dogs","animals"
"Small breeds someone likes big breeds **Introduction** 1 first dog? not, experience owning/training dogs? * owned Akita Husky/Aussie mix. newly started dog training job. 2 preference rescuing dog vs. going reputable breeder * preference. 3 Describe ideal dog. * ANSWER question hard i’m flexible. dog strong personality, would enjoy relaxing home also going hikes adventures. enjoy dog enjoys company, won’t need 24/7 i owner hold small breed day 4 breeds types dogs interested why? * ANSWER I’ve always affinity larger/more independent thinkers, i’m wanting see small-medium breeds would good fit since want start traveling bring along 5 sorts things would like train dog do? * ANSWER Lots training! Manners, obedience, tricks. don’t presence easily trainable less-easily trained breeds work regardless find good balance. 6 want compete dog sport e.g. agility, obedience, rally use dog form work e.g. hunting, herding, livestock guarding? so, much experience work/sport? * ANSWER specifically **Care Commitments** 7 long want devote training, playing with, otherwise interacting dog day? * ANSWER spend free time pup! 8 long exercise dog day, average? sorts exercise planning give dog regularly include using dog park? * ANSWER regular day spend hour physical activity dog. Going walks hikes would big source this. I’d also give daily mental exercise form training, puzzles, games, etc. I’m comfortable dog parks, would love find supervised ways dog play dogs. 9 much regular brushing willing do? open trimming hair, cleaning ears, grooming home? not, would willing pay professional regularly? * ANSWER Daily brushing teeth hair. experience grooming salon able home/also willing pay professional needed. **Personal Preferences** 10 size dog looking for? * ANSWER would love mostly suggestions dogs size fly cabin 11 much shedding, barking, slobber handle? * ANSWER None big issue me. biggest fan lots barking, however i’m willing training/making sure i’m meeting needs minimize it. 12 important able let dog off-leash unfenced area? * ANSWER important. There’s always long leads. **Dog Personality Behavior** 13 want snuggly dog one prefers personal space? * ANSWER think good mix would nice, maybe leaning towards personal space. 14 Would prefer dog wants thing one that’s eager-to-please? * ANSWER don’t big preference since know regardless independence create bond training would work well dynamic. 15 would prefer dog respond someone knocking door entering yard? would prefer dog greet strangers visitors? * ANSWER would prefer knock illic little/no reaction, would like greetings manners no jumping/barking 16 willing manage dog aggressive dogs? * ANSWER would prefer dog doesn’t show agression reactivity dogs, it’s mild work that. 17 behaviors can’t deal want avoid? * ANSWER think **Lifestyle** 18 often long dog left alone? * ANSWER Currently work 5 days, option crated left alone would nice. long term though would like persue work home position. 19 dog-related preferences people house involvement caring dog? * ANSWER wife would enjoy company dog would main caretaker. would page terms training structure too. 20 pets planning pets? breed type animal they? * ANSWER pets currently pets would get another dog ducks having dog low prey drive important keep separate 21 dog interacting children regularly? * ANSWER 22 rent plan rent future? applicable, breed weight restrictions current lease? * ANSWER rent hopefully future lol 23 city country live aware laws banning certain breeds? * ANSWER live USA would love relocate EU next 5 years awards laws 24 average temperature typical summer winter day live? * ANSWER PNW currently mild summers/winters **Additional Information Questions** 25 Please provide additional information feel may relevant. * leaning towards breeds big predisposition health problems like dachshunds backs brachycephalic breeds 26 Feel free ask questions below.","dogs","animals"
"Outside thoughts please think turning old, empty gum containers dog treat containers? Obviously I’d clean really well gum xylitol that’s probably what’s got thinking it.","dogs","animals"
"normal? noticed sleeps head twisted sideways half time. He’ll also sleeping upright, can’t see would comfortable im thinking there’s something wrong him? got dont know normally acts. don’t think anything might well mention anyways, he’s missing leg. Maybe kind neurological damage accident had?","cats","animals"
"Goodbye GI Jane Said goodbye girl Jane today. 15, since 4. highest highs lowest lows. sweetest, softest, gentlest cat ever known. Definitely soul cat. told time listened. Sleep well madam.","cats","animals"
"Cat stopped sleeping us. Why? cat tabby born 2021 recently stopped sleeping us bed instead sleeping outside looking bedroom door. I’m puzzled. come?","cats","animals"
"Cat peeing outside litter Hello, cat male, neutered, 3 years old, been, recently sometimes, peeing outside litter box. use one upstairs normally, one downstairs use get middle pee finish next it. go backyard door pee there. **It's medical issue, checked made post!** think there's ""stray"" female, last year chemically neutered sure now, stray ""lives"" gardens next door comes around backyard sometimes, windows open, smell peeing mark territory, think? also peed next backyard vent, first time saw it. said, uses litter box normal the upstairs litter, downstairs sometimes sometimes next it, checked uti health problems none found, gets supplement pills peeing, give water, hydrated. went vet and still today, doesnt complain touch check pain. changes happened, drinks eats plays always. keep checking, advise?","cats","animals"
"Switching Litters Finicky Cat Hey yall! I’ve wanted switch pine pellet litter while, clay become unmanageable I keep vacuum bathroom vacuum every day, unreasonable annoying work lot nights swings cant always vacuum really need. ANYWAY hang sweet beautiful perfect girl cat FLUTD cat, I’m worried changing litter set she’ll start peeing bed/laundry again. She’s really good since started paroxetine c/d stress, but, I’m sure FLUTD cats attest to, I’m nervous change make set I’ll start stripping bed every day wake avoid peeing she pee comforter, would take got bed. plan buy bag throw handfuls box daily gets used idea I’ve fully transitioned clay. tips advice would greatly appreciated. Picture wee beastie tax. *I veteran VA care DVM, well paroxetine/cd combo","cats","animals"
"Help needed - vets live: applied flea treatment still see black dirt/spots cat's chin even can't find fleas eggs black spots anywhere else Hi, noticed black dirt cat's chin noticeable amount quick checking fur resulted black spots visible fleas, took vet prescribed flea spot treatment applied top neck. day black dirt disappeared mostly found reddish spot place. found flea eggs combed fur bit apple cider vinegar next day nothing left brief check. One week later, notice black spots/dirt back chin. sat chimpanzee style checked every bit fur، found nothing except 3 dried flea eggs. tried testing black stuff chin taking putting white paper towel putting water amount black stuff little stuck skin get towel. keep empty room there's water food bowls, litter box, wool towel sleep change every time check fur, empty plastic desk. floor tiled. room cleaned thoroughly night flea treatment, clean thought there's fleas hide i changed wool towel. live rural area àd vets near, closest one the one took last week 7-8 hours round trip away, difficult take again. flea infestation feline acne regular dirt??","cats","animals"
"Cats face change cat hyperthyroidism morning face changed dramatically, mouth slightly open permanently chin really low. old cat never physical symptoms like this. also really moody, hissing growling more usual seems generally down. *first three pictures current face final two less 2 months ago. ideas would greatly appreciated","cats","animals"
"dad said needs lose weight based pictures, say understand cats qualities water and, thus, tendency 'pool'.","cats","animals"
"Cats face change cat hyperthyroidism responding medication simply morning face changed. really hard get picture face us dramatic change. ideas? mouth open slightly chin dropped dramatically, also extremely moody, hissing growling us more usual. *the first three pictures current face second two couple months ago.","cats","animals"
"Todd found Todd stray, adolescent kitten 13 years ago. 🥰 wanted show off.","cats","animals"
"bad squeeze dog’s bladder? adopted 2 year old 15lb rescue dog around Christmas last year she’s amazing far! However, times super stubborn peeing. pee walks often pee within minutes going outside sometimes 1-2 times week take 1+ hours pee even knowing bladder full! times holds pee 8+ hours. I’ve figured giving pressure bladder gently squeezing times make pee. I’m wondering safe do? UTI spine issues. She’s picky peeing.","dogs","animals"
"Question 3 small dogs allow “potty” non-finished cement floors. wipe cloth sometimes. Sometimes use bleach water. y’all think.","dogs","animals"
"Dog wanting pee grooming? Took 10 month old dog get groomed yesterday it first time since mats got shaved lot. acting bit odd learned usually normal dogs since big change them; especially since went long fur shaved. Although keeps hiding sitting lot really peeing take so. wants sit lay concerned holding in. anything help him?","dogs","animals"
"Advice car rental dogs trip need rent car. two small dogs both 20 pounds one long haired quite shedder. major car rental companies near me. would like advice on: 1. car company choose dogs pick drop road trip. 2. dogs seatbelts lot car rental places mention crate. 2 crates, one medium size one XL size. I’m sure kind car renting accommodate crate since don’t usually use that. Also put something inside crate pet hair won’t get it? maybe it’s better use crate use something else? advice car rental companies dogs would great. Trip 3 hours way matters 2 dogs. Dogs long road trips don’t need advice road trips, car rental. Thanks!","dogs","animals"
"Rabies Vax Question indoor female domestic long hair. go outside nor shows interest current setup co-op it’s almost impossible even make building unless go one windows screened. Anyway, seen least annually vet whom love recently moved state. started seeing new vet neighbor uses really like her. However, said age she’s shy 15 - found car engine approx. 6-8 weeks old indoors doesn’t see need rabies vax age it’s possible harm good. She’s coming 3-year shot. chances coming contact feel extremely slim course one guarantee none. Anyone else experience this? push it? Cat tax.","cats","animals"
"beefing much grey cat Mars want play tortie wants left alone? partner tortie 3 4 years now, got Mars little year ago kitten. took long time introduce them, like months maybe, still end multiple times day. We’ve started keeping separate rooms seems like tortie getting worked up. I’m wondering maybe Mars still young she turned 1 month ago! much energy cat?","cats","animals"
