"Gaining knowledge course beginning? incoming first year looking courses considered eligible GEPs. interested courses, MUSC 101 • Fundamentals Music Theory ANCS 210 • Classical Mythology ENG 271 • Intro Creative Writing: Fiction GWST 255/MLL 255 • Intercultural Paris ---- Issue is, can't look catalog get relative idea for, choose given course. looking find past syllabi, courses, even idea structure depends professor semester/year taught, etc. However, believe might closest thing want know. taken courses, please share experience would like to.","UMBC","education"
"NEED actual tips memorize detailed texts Im math student memorization weakness, finals start two days rn Im quite behind duo slow memorizing. first time reading memorizing texts whenever approach feel like forgotten even tho 100% true. Im nervous feel like Im running time","GetStudying","education"
"Day 1: Studying complete Coursera course Today first time used *Kairu* & really enjoying it. working certification Coursera. find as: *The Luminous & Lilac Learner* Course question: Six Sigma Yellow Belt Specialization","GetStudying","education"
"Struggling Procrastination & Fear Licensing Exam I’m 27M doctor currently prepping licensing exam. failed first attempt, I’m sitting months. Honestly, know important exam me, I’ve battling intense procrastination, it’s eating away time peace mind. Even med school, barely scraped couldn’t study wasn’t capable, kept leaving everything last minute. backfired badly last attempt, I’m terrified thing’s happening again. It’s like don’t want study. It’s fear huge syllabus, overwhelming feeling look what’s ahead, guilt wasting time piles up. I’ve wasted almost half preparation period already, I’m stuck cycle fear, procrastination, guilt fear. anyone who’s struggled managed pull it? helped break cycle? cope felt like everything slipping away? Would love hear experiences, advice, even know I’m one boat. Thanks advance.","GetStudying","education"
"cursed study technique you’ve ever tried? recorded reading notes listened sleeping. Didn’t work 10/10 effort. 😂","GetStudying","education"
"Day 3 trying study 12 hours everyday next 70 days Day 3 Studied 7:49 hours today,eyes little itchy due continuous staring screen, tired happy. never studied much day ever, thanks support community, grateful 🙏 try study 9 hours tomorrow. Day 1 - 3 hours Day 2 - 6:20 hours Day 3 - 7:50 hours","GetStudying","education"
"day 15 studying prepare exams. hospital session therapist fell asleep went back home. anyway anything better nothing! listen brain saying ""it's useless work little time, let's watch TikTok""","GetStudying","education"
"Help motivation Im sure aware situation univercities protests Serbia right basically havent lectures almost six months lost motivation study, already problems even worse, tips slowly get back routine?","GetStudying","education"
"Study tips? turned 16 couple months ago exams coming feel really lost, struggle focus likely ADHD. wondering anyone advice! Thank you.","GetStudying","education"
"NEED HELP. PLEASE HELP ME. quick intro. Got 97.8 percent class 10th boards 79 percent class 12. pressure parents whatsoever. want ok. took gap year study dream uni. consistent. takes lot effort willpower get ass sit table study. study 6hrs one day, boom, study next six days. that's months went by. 15 days left exam. hard, pass get uni. thing CAN'T STUDY. Sounds silly right? does. funny. single handedly destroying time. can't bring get study. stuck. stuck loops. study- emotions wash over- spiral- self sabotage- cry- give false hope repeats. please, position before,how correct yourself, fix yourself? stay productive regulate emotional world? need advice. Pease help me.","GetStudying","education"
"Daily Studying Day 4 Proud myself. studied while! Studying more! Let's best hope get great grade coming exams! study 2 hours tmr, tune bit. I school 8am - 4pm school tutor classes 9 \*travel time two hours included\* :D 2 hours plenty","GetStudying","education"
"Waitlists literally situationships #downbad #simp 💔🥀🤧🤧 say “we really like you” won’t commit. Won’t let go either. vibes false hope. absolute worst part? find moved onto huzz instagram stories read “AHHH friend got Harvard waitlist!!” Oh. making decisions. telling me... almost painful seeing ex soft launch instagram. point, I’m even applying college—I’m one-sided emotional entanglement Google Doc titled “Letter Continued Interest Final FINAL Draft.” say you’re let heal peace.","ApplyingToCollege","education"
"Mcgill NYU lib core already committed Mcgill recently got waitlist NYU. american citizen, want go either Big law corporate finance NYC which Im from. know NYU open doors internships opportunities liberal core CAS isn’t appealing. Plus cost tuition much higher would much debt/ harder time affording grad school afterwards. Mcgill offers cheaper tuition would able pursue law school MBA. school pick?","ApplyingToCollege","education"
"Would colleges rather 4.0 student 5 APs Vs. 3.8 Student 15 APs Title, course rigor matter certain point GPA loss?","ApplyingToCollege","education"
"still get music college even w horrible everything 😭😭 live NY state play flute junior HS, Ive band since 4th grade, Wind ensemble since 10th done NYSSMA like 4 years, level 6 year got 100 a guaranteed alternat spot, apart schools Tri apart Tri council, auditioning school orchestra b guarantees, gonna tutor teen students community free summer grades classes 80's 4 aps yr tho ? 😭I feel like enough musical extra stuff b idk else go pls help","ApplyingToCollege","education"
"withhold AP CSA score? hi, senior going lehigh fall, looking summer checklist. submit AP scores july. never sent AP scores institution before, really know works, saw there's $10 fee withold score. got 3 CSA, count credits and cs major bad look lol, got 5 calc BC & 5 AB subscore, took ap stats, physics mech, physics e&m year. think get 5 stats 4 physics tests. physics calc credits count, really want see CSA score. stats score also count college credits. so, still send scores, including CSA, withhold it?","ApplyingToCollege","education"
"stuck. stuck continuous loop unproductivity, struggling commit goals time pass goals feel unachievable day. Like set study right ""vibes"" go study maybe 4 hours straight. finding hard every day. Like always end doom scrolling whole day, ? lack fix ? Ik can't depend vibes what's solution ?","GetStudying","education"
"Georgetown Extended Waitlist got update today saying georgetown finished waitlist put extended waitlist? never heard cant find anything online either. anyone know anything?","ApplyingToCollege","education"
"MIT Waitlist guys think move year. know said something share mid may.","ApplyingToCollege","education"
"GATECH major change help!!! today deadline submit major confirmation form. want switch major, go form, option confirm major?? help panicking","ApplyingToCollege","education"
"Reaching people instagram scary active Class 2029 Instagram page college attending year. really cool people there, I’ve reaching say hi. honestly, ghosting me. don’t even open DMs, even though posts hour ago literally say “feel free reach : EXCITED meet everyone” don’t post anything weird profile pretty normal decent number followers. maybe perspective, account doesn’t give right vibe????? kind hurts people don’t even bother read dms. people actually making friends Instagram like this?","ApplyingToCollege","education"
"USC Spring 2026 appealed successfully got USC Spring 2026 admit! tips things take consideration? current plan go local CC fall fulfill gen ed credits, pros cons USC Spring program? mostly concerned housing opportunities miss on, well able make lot friends. advice?","ApplyingToCollege","education"
"usc appeal received yet? reach USC admissions counselor? submitted appeal day portal opened, haven’t received confirmation email update. I’ve checked spam folder portal, there’s nothing far. anyone else experienced this?","ApplyingToCollege","education"
"Harvard WL got in, major? receive phone call? got rejected, major? didn’t get response, major?","ApplyingToCollege","education"
"Harvard waitlist closed? Harvard seems sent waitlist rejections stating class already full. mean one accepted waitlist?","ApplyingToCollege","education"
"USC UCSD committed UCSD media industries communication, got appeal USC spring term starting January communication. cost factor really want work entertainment companies disney universal future help marketing/advertising super excited UCSD USC dream school, lowkey kind forgot dream school bcs tried making forget rejection","ApplyingToCollege","education"
"Harvard movement? Anyone got off? so, contact you, around time? general, anyone knows waitlist updates Harvard. Thanks!","ApplyingToCollege","education"
"conflicted applied college yet not quite yet stuck. CU boulder RPI two goal schools, really can't choose. go New York hour away best friend, time love Colorado and dislike New York, love too. helped decide go college?","ApplyingToCollege","education"
"Pretty College vs Pretty College Hey guys! currently debating UCLA Vanderbilt getting waitlist. Background Info: * math major likely looking career either tech finance or mixture. * cost nearly state LA. * definitely prefer smaller class size general, know getting LA. * unfortunately time funds visit both, can't really speak much that, know comes searching online forums. * biggest priority finding research internship opportunities college. opinions would greatly appreciated, trying learn schools now.","ApplyingToCollege","education"
"can't focus trying study, reading documents exam, understand anything. always thoughts mind. keep thinking problems troubles. focus","GetStudying","education"
"Want acadamic comeback 5 years... Long story short,i got diagonised cancer,slip disc toxic home shitty friends. Went 3 therapists....last one told dysregulated nervous system.....meaning body lives goes anxiety state time... breathworks anxiet grounding techniques given me...but nothing seems override anxiety moment. 5 years since completed schooling chose carrer path,quit chosen new one. Flunked badly first chosen path since didnt even know going many years. dont want waste time energy anymore unproductivity. want get fight back give strong academic comebackmy self esteem destroyed since self esteem validation came studies topper school. Getting back studies overwhelming makes nervous system involuntarily anxious. makes inconsistent studies. Please please someone gave started study routine scratch...provide insights bounce back. turning 23 really desperate pass exams. dilemma wanting study badly able study makes almost suicidal makes heart weep badly. Please someone help. whole self esteem depends this.","GetStudying","education"
"Caretaker options, need advice caretaker stroke patient parent, sibling spectrum another learning disabilities. Hoping premed. parent works full-time job, stay home turned school offers--I'm left option either go community college state school's nearby satellite campus. tempted go former flexibility lesser academic burden balance caretaking. feel CC may also help transfer reputed school make first two years worth opportunities school attended. worried med school adcoms suspect chose CC sake easier core classes could've attended satellite campus we struggling financially. state school's campus would also obviously provide on-campus opportunities ECs, imagine even hard find research opportunities professors there, opportunities would practically nonexistent CC. really appreciate advice do. Thank advance.","ApplyingToCollege","education"
"Transferring Tandon engineering school spring 2026 Hey guys, currently sophomore want transfer NYU spring 2026. take classes college I’m currently couldn’t transfer fall semester2025. tried go common app start application doesn’t show option pick NYU Tandon school engineering school want transfer to. friend said might application closed right open later spring transfer I’m sure. one know situation?","ApplyingToCollege","education"
"Got conditional admittance international student graduate program, sure Like title says, got admitted condition get gpa 3 first semester gpa 3 course taken, normally problem this, thing actually accelerated master program, supposed take 5 classes first semester alone mixed feelings right now. think doable? paying LOT first semester.","ApplyingToCollege","education"
"Small Rituals, Deep Focus used set simple rule whenever needed get something done: *""I’ve already seen loved movie… I’ll work much ends.""* actually worked. would stay focused throughout film best time. Now, use method — sounds. choose album, usually instrumental doesn’t distract — something enjoy listening start finish. tell myself: *“Just stay focused album ends.”* gives clear time frame mental space settle into. Thanks little habit, manage study deep focus 2 3 hours, least 3 times week. highly recommend finding “time companions.” Whether movie, album, cup tea… sometimes need small reason get started 🍵🎧","GetStudying","education"
"PLEASE help choose usc ucsb college creative studies GOT USC APPEAL cant choose 2. zero fin aid, pay either school feel bad parents pay usc. i get fin aid. want prepharm/pharmacology. usc: pharmacology/drug dev ucsb: ccs chem biochem","ApplyingToCollege","education"
