"Withdrew ED application, know saw it? Hi, recently withdrew application ED school going far state it’s possibility anymore. know they’ve received email know withdrew application? Thank you!","ApplyingToCollege","education"
"US citizen living abroad Hey everyone! I’m rising junior, living abroad. I’m US citizen I’d like go college there. attend online Spanish (don’t live Spain) school. It’s internationally recognized accredited. attend college US? aren’t many options extracurriculars country. play basketball club team volunteer Red Cross. grades high (almost perfect) school, know need take SAT (which I’ve studying for). I’d also need sort financial aid. hear something called FAFSA? don’t know start researching colleges, apply (how apply them), etc. tips advice greatly appreciated!","ApplyingToCollege","education"
"Applying good schools bad year. Help! Making since I’m going junior year time fix it. context, im applying art schools colleges it’s little different. dream school, RISD, really care grades stats however I’m worried. really bad year half freshman softmore GPA went 3.7 2.8- know, it’s pretty bad. failed class, took summer school, didn’t well classes actually liked either. school refusing give accommodations disability frustrating gave up. good test scores extracurriculars. question is: show schools I’m actually improving besides fixing grades? getting year enough show care / show dedication? something specific put application explain situation hopefully really care previous years?","ApplyingToCollege","education"
"much required courseload really matter? Absent question procrastinate real, adult life posting A2C, hopefully helpful somebody else line. Lots schools say require students taken many years subject, like, Columbia (whose CDS looking at) requires 4 years English math, 3 years science, history, foreign language. UCs famously visual/performing arts requirement, etc. But, practice, happens student applies Berkeley without year arts courses -- application immediately binned? Would curious hear admissions officers talk cases.","ApplyingToCollege","education"
"asking advice uni list far!! \+ obvs UCs. want schools good rep (ik subjective like..) & career support. plan law/consulting future applying polisci/gov/public policy major. reason safeties bc thought dont get in, might well go uc uiuc etc. feel free deinfluence uni list (HAHAH) give suggestions recs. esp high/mid tier unis reppy list rn!!! grades ok want schools prioritize strong ECs bc know ECs (esp debate) stand & want maximize chances admission Duke University University Pennsylvania Cornell University University Chicago Brown University Columbia University Rice University University Michigan - Ann Arbor Washington University St. Louis Emory University Georgetown University University Virginia University North Carolina - Chapel Hill University Southern California New York University University Illinois Urbana Champaign University Washington Seattle Barnard College","ApplyingToCollege","education"
"extracurriculars advice? im highschool junior 3.0 gpa unweighted (3.4 weighted) extracurriculars, start make eligible UCs california resident NYU (which know long shot.) looking research programs thousands range dont think afford. now, im taking apush, ap lang, pre calc, spanish 3, child psych regular physics. id like major psychology minor astrophysics college.","ApplyingToCollege","education"
"got 1570 SAT & dad STILL lost shit got 1570 SAT june. gotten 1530 last summer dad happy score, made sign SAT...after SAT...insisting must score 1550+. made drop EVERYTHING study SAT. lot ECs APs dropping stupid test took huge hit. Dad made skip week school grind SAT took April SAT. Got abysmal score. grounded sent backrooms study yet again. took june SAT, felt okay it, got result two weeks later international competition grinding 6+ months 2000+ miles away home. competed, checked score practically fell knees joy. called parents literally could care less. 1st place international competition (hell yeah) went home. dad looked said, ""well, would shame done \*fucking\* work gotten anything."" yeah. that's it. nothing sat score spent last year agonizing about, nothing project, nothing. night, dad physically dragged bed sleeping screamed 2 hours (until 1:30 a.m.). why? shadowing doctor next day shoes going wear ""triggered him."" faded pink Nikes going covered suit going ""embarrass him."" shoved pair skinny jeans (jeans huge shadowing doctors) 10 y/o brother's blazer. Guess learning got 1570 24 hours prior grant immunity anger. mere existence seemed ""trigger"" dad past year. ALWAYS something wrong doing. constant anger, constant fights, screaming matches, killing me. turned 17, time celebrate, shitton exams around corner projects do. mom insisted going family birthday dinner, went. resturaunt, dad started yelling brother refused eat food ordered promptly left resturaunt drove home, leaving everyone else restaurant. never apologized. birthday, asked anything him. referenced particular instance got really mad said ""playing victim"" unforgettable brat ""ungrateful"" everything does. artist, damn good one that. biggest spikes college apps. day junior year ended, went home, happy finally get paint first time weeks, busy 6 AP classes whatnot. thought able peace, since grades really fucking good (lowest grade 97 AP Physics w/ grade inflation) parents obviously knew much studying (was till 3 studying like entire semester), figure problem it. asked mom could take art store (guess license) could buy paints ran of. tells dad, LOST shit. like, resulted worst fight ever had. went room physically dragged easel threatened rip apart paintings. Basically, want art. all. said focus college apps. stupid frivolous paintings. got extremely fed up, especially since planning submit arts supplement top schools. fought him. spent year grinding point hair falling least could spent two hours day painting summer?? somehow, devolved telling could go ahead ""k!ll myself"" could kick house leave. Ever since then, joking kicking 18. H fights continued summer. avoid like plague, takes instances catch tell wrong life. Now, right starting apply colleges, told pay single cent get T20 ivy league. Well, shit. Guess start applying scholarships. got selected finalists couple smaller scholarships. instead happy, told head ""always clouds"" get easily distracted?????? research (that dad insisted drop, actually started winning competitions) poster got accepted medical undergrad/phd conference my/his dream college. fucking moon, guess actually letting travel across country go present work. Though, got poster (that finalized weeks hard work) printed local makerspace, literally even want take look it. mom glanced like, ""cool."" literally done. nothing ever make happy. staying till 3 daily grinding homework, working patent, preparing research conferences/competitions, writing research paper, still working getting college apps done. barely leave room. Yet, every morning, still scream something. genuinely tired this. go school practically sobbing every day, Last night, dad talking uncle ""unfocused"" literally ""focus art"" (haven't painted 5 months) thing pertinent major research get good college (his version good HYPSM). literally said ""unique"" could name ""so many asian girls good art wanted go medicine."" uncle (both daughters graduated valedictorian IB school attended T20s) appalled father's words kept insisting done daughters ever done high school. father argued back. know satisfy man. confusing part used little daddy's girl. used post art time facebook brag friends. know change that. Anyway, there's much could gripe about, 2:07 post already getting long.","ApplyingToCollege","education"
"UCLA, UCSD, UCB, USC realistic stats? senior program based LA known College Match helps high levvel low-income students apply colleges gives professional counselors personalized student. current stats listed schools interested above. Shadowing Pediatrician month (50 hours) Mexican American 1st Generation student 40k annual income. 3 years Key Club (Event Coordinator) 3 years NHS (Secretary) ASB Junior Representative 2 years UCLA Riordan scholars program Founder Medicine Technology Club (Educational videos, aids school blood drives, etc.) 3 Elac Courses 12 APs Class Rank 7/145 UC GPA: UW: 3:85 W: 4.5, Regular GPA: 3.85/4.4 Red Cross Blood Donor Ambassador Member Stanford Neuroscience Club 2 years jaime escalante program SRLA Member","ApplyingToCollege","education"
"College Ideas Hello! Senior High School planning graduate early! however idea colleges apply to? 3.295 unweighted 3.346 weighted. However reasoning that, really toxic environment freshman sophmore year soon switched schools started gaining mostly A's since junior senior year gotten mostly A's. heard many schools favor improvement overall GPA. done SAT ACT. student council, done volunteer work. type school want is: school oregon, california boston, overall good student life, lots opportunities, big college, party school, nice campus environment. thinking majoring either communications business management. Thank guys! please mean 😭 let know college recs? :)","ApplyingToCollege","education"
"get Alumni Interview? applying Yale restrictive early action. heard interview school alumni increases chances accepted. However, sure even possible include alumni interview college applications Common App. can't afford college counseling experts due family status, asking even possible and, so, it?","ApplyingToCollege","education"
"technical colleges like Caltech, make essay technical? essays, talking app made, part use talk personal growth intellectual curiosity learned really talk intricate technical achievements app. advanced CS programs like Caltech whatever, talk things essay?","ApplyingToCollege","education"
"First year transfer application Hi everyone, currently attend university Australia studying double degree Commerce/Science looking transfer US institution (I US citizen). common app transfer application site states must apply transfer completed one full academic year (which would have), however also says must apply first year since coursework professional (commerce/finance). anyone help figure apply first year transfer? Thank much 🙏","ApplyingToCollege","education"
"Need help picking colleges (long post) General: - 3.3 GPA, 1340 SAT (retaking September, gotten 1500+ practice tests recently course may translate), Asian (Indian), low income, VA resident - Majoring Neuroscience - 9 APS ECS: - 200+ hours INOVA hospitals, general volunteer work - 100~ hours shadowing physician Comprehensive Sleep Care Center helped study RDI AHI index prepare patients sleep apnea tests - Superintendent Advisory Council member 2 years - County Center student ambassador 1 year - Tutored 3 years-ongoing Biology, Chemistry, AP Lang, AP Chem, AP Precalc - CNA certification - Worked Coldstone Feb 2025-ongoing Additional Info: - Dealt undiagnosed worsening Juvenile Myoclonic Epilepsy 8th grade-end 10th grade, caused miss lot school terrible classes - Rec letters AP Lang AP Psychology teachers It’s huge reach going med school seeing stats, know. I’m hoping get decent undergrad keep GPA high there. I’m looking suggestions targets reaches reasonable go for. Thanks!","ApplyingToCollege","education"
"wrong gpa scale selected start off, scrolled subreddit found common issue, find consensus right thing is. good friend mine selected weighted 5.0 instead weighted 4.0 submitted applications without realizing. idk exact gpa weighted 4.0 scale 4 sure. do?","ApplyingToCollege","education"
"many schools apply to? (realisitic) breakdown reach, target, safety? Also, many ED vs. EA vs. RD? supplemental essays PIQ really starting add up…","ApplyingToCollege","education"
"2 ap classes enough junior year? Currently going junior year I’m taking APUSH AP research problem school offers total 2 APs junior year","ApplyingToCollege","education"
"APs school transfer — hurt me? I’m international student hoping get good universities abroad. I’m straight-A student extracurriculars, APs transferred schools 11th year IB took upper set classes don’t show report, new school limits students 2 APs per year, options don’t fit all. didn’t take grade 11 adjusting, grade 12 I’m wondering much affect chances.","ApplyingToCollege","education"
"lost case? Hi everyone, really need honest advice. I’m international student dreams applying Williams, I’m feeling like maybe it’s lost case. Here’s situation: don’t SAT/ACT scores (I know they’re test-optional, still). don’t really “traditional” extracurriculars clubs, fancy leadership positions. time gone working content writer taking care family Academically, grades okay (3.6 GPA) know Williams extremely selective especially tough international applicants need financial aid, senior mine got accepted fell love moment saw campus. never wanted anything life. question is: still apply, setting disappointment? anyone (especially internationals) gotten without test scores without classic “perfect” extracurricular profile? advice stories would mean world me.","ApplyingToCollege","education"
"taking courses UC Scout hurt chances UC Admission (or admission lol)? UC Admission Officers look UC Scout? hearing different things this. used UC Scout skip math class, take class conflicted schedule, take class offered high school. also explained additional comments section. heard frowned upon expensive is, demonstrates family money. true? hurt way admission process (I currently process applying, class 2026).","ApplyingToCollege","education"
"Help choose schools Region: DFW (willing move 2 states away) Cost: matter much parents 50k saved first 1-2 years (very grateful) SIze: care Location: City preferable Planned Major(s): Math, engineering, finance (still undecided) Course Load - 3.92 UW, 5.2 W, 1560 SAT APs: Seminar, Research, Calc BC, Physics 1, Bio, physics Cs, human geo, world geo, APUSH, french iv, gov, macro, lang, lit, precalc, psych, CSA, CSP, stats Dual Enrollment: Calc III, Differential Equations ECs: Part time job Best Buy Varsity Football top 15 school Texas (1 years freshman, 1 year jv/var reserve, 2 years var) Key club officer Math Honor Society treasurer NHS VP Volunteer local fire station PC building ""small business"" Private Math tutor mathnasium tutor Varsity Powerlifting Bio-Olympiad club (2 years, quit year) Awards: AMC regional champs (last year, Idk better hope) 3rd team district honorable mention football (possible 2nd team member 1st team honorable mention senior) Bio Olympiad district champs Power lifting state 3rd runner place (hoping better 5th like last year) 1st team district academic team football (3.85+ GPA starts varsity)","ApplyingToCollege","education"
"Coke Scholars phase 1 app question Coke scholars app, inputting like names orgs honors, list name org/honor, input like shows activity/honor list common app? instance, award name itself: Presidential Volunteer Service Award – Gold would input Common App: Presidential Volunteer Service Award – Gold; Volunteered 250+ hours across several nonprofits. put second one Coke Scholars want name?","ApplyingToCollege","education"
"AP Scores actually submit colleges? Aiming T30s: Intended Major: Computer Science Scores: AP Calc AB: 5 (grade class -> B+, A+) (yes improved lot) AP CSA: 5 (grade class -> A+, A) APUSH: 4 (grade class -> B+, A) AP LANG: 4 (grade class -> A, A) AP Precalc: 4 (grade class -> B, B) (yeah ik selling grades) AP Chem: 3 (grade class -> A-, A-) taking 6 APs year, taken test yet obviously listed here. (sorry seems obvious guys really know im doing)","ApplyingToCollege","education"
"best colleges business/finance/econ degrees? Preferably California.","ApplyingToCollege","education"
"College list Hey guys! senior applying colleges trying narrow list, stats needs Academics GPA: 4.721w/4.0uw Testing: 32 ACT (no study, retaking sep 6 i’ve practicing hopefully 34) AP: AP Spanish Lang (4) AP English Lang (5) AP Gov (5) AP Calculus BC (4, 5AB subscore) AP Bio (4) AP chem, stats, psych (currently enrolled) DE: Personal Finance, Spanish 1201, English 1201, Bio 1121 (all completed ones) Activities 4 year varsity XC track athlete NHS member 150+ volunteer hours nearby hospital Shadowed surgeon Part time job Chick-fil-a Language Link secretary, recently formed club school helping foreign students adapt america/with classes Awards AP Scholar w Distinction college board top school award thing? Seal Biliteracy Probably National Merit Semifinalist (219 Index) Demographics White female Born live Ohio (moved around bit ended back MS/HS) Financial Needs Middle class Divorced parents abt 2 years ago Father makes 130k, active duty Mother makes 60k Financial Needs 18 months/half GI Bill (split w brother) active duty father + Yellow Ribbon program 10k saved jobs/babysitting/depop FAFSA father (primary financial supporter) sure much need-based aid would get College Wants Neuroscience major Minor spanish maybe psych philosophy STEM heavy school, medicine particularly Good hospitals nearby intern/research etc. Running club Don’t particularly need party school Don’t really care student body size I’m also kind interested law i’m conflicted, perhaps something like medical malpractice law don’t even know maybe ignore List Ohio State University University Cincinnati Case Western Reserve University University Michigan Ann-Arbor University North Carolina Chapel Hill Indiana University Duke University Johns Hopkins University University Pittsburgh Please help narrow down, brutally honest chances zero lol also give recs schools! :)","ApplyingToCollege","education"
"still good shot IU Kelley without auto admit? title said… little bit context: would really like apply Kelley finance. Currently senior year HS. 1430 SAT (710 EBRW 720 Math) 30 ACT (29 reading, 33 English, 31 Math, 28 Reading) 3.93 / 4.0 (weighted) GPA graduate 9 APs: -AP US History (4) -AP Calc AB (4) -AP Lang (4) -AP Micro (4) -AP Macro (4) -AP Physics 1 -AP Statistics -AP Lit -AP Gov Good extracurriculars, leadership roles multiple clubs, consistently volunteer activities, internships, etc. little edge since admissions office decided drop auto admit starting admissions cycle… help would greatly appreciated :)","ApplyingToCollege","education"
"ED feel like I’m baby trapping college 😔","ApplyingToCollege","education"
"Scholarships Hi good websites show submit essays scholarships?? I’ve looking lot seem kinda sketchy.","ApplyingToCollege","education"
"Supplementals hard write compared personal statement spent week UNC's supplementals. A. WEEK. keep getting angry feeling heart everytime write sentence, realize sounds awful, deleting it. know much longer keep out, fingers fall off. anyone tips get writer's block let know","ApplyingToCollege","education"
"include science ACT score took it? took Act got 26 (Math English 30 Reading Science 21) taking next week. I’m senior year. score good reading time around super score reading, english, math even took science times?","ApplyingToCollege","education"
"colleges apply to? student located CT, stuck colleges applying to. keep looking, overwhelmed options there. Currently, stats 4.2 weighted GPA, 1300 SAT, alright EC. looking school good premed/bio program could attend. already know going apply Fairfield University, UConn, UMass Amherst, Lehigh. schools applying to?","ApplyingToCollege","education"
"Pitt vs. Penn state Electrical engineering Ok feel like comments gonna say many people post lot broad way outdated like years ago literally can’t decide two know Pitt city school live Pittsburgh already close home pros cons. psu college town gut telling Penn state bc fact better national alumni network bc know don’t wanna stay Pennsylvania forever (it matters first job) however school u choose wont matter first job think? cost same, know there’s wrong choice right choice there’s difference I’m also really sure similar co op internships opportunities psu vs Pitt","ApplyingToCollege","education"
"colleges essay apply? colleges allow apply without essay? Preferably ones any, optional not. curious whether colleges like","ApplyingToCollege","education"
"Title 1 school I’m wondering going poor performing high school increases chances t20 schools? background info, high school 70% graduation rate, 25% proficiency math reading, average act score 19, ap participation 19%. said, school offer decent amount ap courses.","ApplyingToCollege","education"
"get mom back? I’m grateful mom. Love her. since school year started, she’s dreadful. ever hound making college lists, writing essays, finding schools. supports suffocating way. drowns care like way Miss Trunchbull forced kid eat cake. Sweet nice beginning sickeningly disgusting rest time. I’m trying please her—also sounds like vent, sorry, genuine questions—but she’s making hard. wants go prestigious school since parents put private school middle high. 1490 SAT obsessed get higher score go T20 (I’m trying get T20, mind you.) doesn’t care finances much me. She, whatever reason, thinks apply 100 scholarships get 100k+ minimum YouTube video. says won’t, really doesn’t want help pay college. wants prestigious school. I’m confused. guys deal stress parents put you? guys stress?","ApplyingToCollege","education"
"“research” freshman? started high school days ago I’m wondering research. want research biology related.","ApplyingToCollege","education"
"toxic hs stories we’re familiar posts complaining toxic college admissions - specific stories happening, please share here! people get desensitized online whining easily, show examples help ppl understand f’ed really get.","ApplyingToCollege","education"
"F&M Hamilton? need help deciding uni better premed track. Planning majoring bio neuroscience minor philosophy literature simply it’s passion mine love reading. love locations love small undergraduate size don’t know better academically. Cost issue.","ApplyingToCollege","education"
"ivies see family responsibilities positive light? make parts app? ive take care family member like 15+ hours week since 9th grade. get d's c's, b's (unweighted gpa still 3.9 many classes ive taken, rank high). ecs typical ivy student who's middle class, hold top positions outside school starting 11th grade nothing like founding nonprofit publishing research papers. also great awards, collegeboard stuff awards nonprofit near","ApplyingToCollege","education"
"important competitions college applications? Hello! first post subreddit. crucial competitions college applications? science competitions since 6th grade (going 10th now) performed well state level, even winning 7th grade onwards. Ive also attending nationals good performances except 9th grade (quarter finals). Would make difference college application process?","ApplyingToCollege","education"
"hope still get good college? Hi everyone \^\^ currently high school student, entering first semester senior year. gpa dropped 3.3 3.7 due getting A's B's dual enrollment ( county unfortunately weigh dual enrollment differently ) , im unsure enough time raise college admission deadlines. participate extracurriculars ( DECA, debate club coordinator, tennis, part-time job ) , changed next semester classes AP, finished dual enrollment pharmacy classes, well summer-time internship. ( also pharmacy technician license ) . hope get gpa first semester, feel though much. Georgia based, stressed admissions good pre-med colleges. psa: really looking ivy/highly selective school haha, one good programs.","ApplyingToCollege","education"
"Prerequisite Course Question loss dont even know begin, came advice. dont come reddit excuse mess dont know much works. senior year high school looking colleges. recently, plan go college money tighter tight clue wanted life. managed decided would really like go medical field looking that. found college want problem. Prerequisite Course- which, understanding, courses need take enrolling- includes 'BIO 2103/2101 Human Anatomy Physiology 1 + Lab' 'BIO 2223/2221 Human Anatomy Physiology 2 + Lab' 'HP 2013 Medical Terminology.' taking Medical Terminology moment, problem. problem first two. guessed, taken two. do? anything could even able go program graduate?","ApplyingToCollege","education"
"wrong choose Amherst Northwestern? Title, Northwestern cost nearly 25k year main decision come here. I’m sort starting regret it… feels small breadth courses programs extremely limiting :/","ApplyingToCollege","education"
"UC Apps Open yet? UC apps open? go fill except still choose campus want attend. that?","ApplyingToCollege","education"
"Virginia Tech wanna apply Virginia tech business school ik it’s super competitive. applied less competitive major? Like Human Resources, hospitality tourism, consulting analytics) Would increase chances? 🙏 advice helps, thanks","ApplyingToCollege","education"
"attended school didn’t like…how now? Hello everyone! hope you’re lovely day finding reasons count blessings. know tough emotionally don’t get college really wanted—especially safety school, though anyone’s experience welcome share. Looking back, feel now? still affected? People often say gets better, high school concerns fade everyone follows path, college attend matters less person are—your resilience, work ethic, drive. think sharing experiences could really comforting helpful students going process year next. feel anxious, remember: care much, you’re already right path! I’d love hear stories main takeaways.","ApplyingToCollege","education"
