"finished, THINK GOT 5!!!!! never worried MCQ, seemed super easy, suspicions affirmed completing test. thing really scared FRQs, turned insanely easy too. bet got like one point MCQ. Like legitimately thing got 69/70 MCQ 6/6 FRQs.","apcsp","education"
"finished test?? anyone taken test today already u think went?? frqs rlly hard? would say say complexity mecws compared cb ap classroom 2021 mcq practice??","apcsp","education"
"I’ve cheated way midterms. stop cheating tests exams? I’m currently taking part time online classes semester full time job morning. know job excuse studying, work feel mentally emotionally exhausted since work customer service deal angry people time. past month, 4 quizzes. cheated three them. probably studied maybe 40% chapter 60% convinced “double check” text book “safe side”. want break awful habit want better midterms. high school wasn’t good academically. getting average average grades, never cheated tests exams, instead accepted grade moved on. stop cheating schedule tips studying bit better? Thanks!","studytips","education"
"Gaining knowledge course beginning? incoming first year looking courses considered eligible GEPs. interested courses, MUSC 101 • Fundamentals Music Theory ANCS 210 • Classical Mythology ENG 271 • Intro Creative Writing: Fiction GWST 255/MLL 255 • Intercultural Paris ---- Issue is, can't look catalog get relative idea for, choose given course. looking find past syllabi, courses, even idea structure depends professor semester or year taught, etc. However, believe might closest thing want know. taken courses, please share experience would like to.","UMBC","education"
"NEED actual tips memorize detailed texts Im math student memorization weakness, finals start two days rn Im quite behind duo slow memorizing. first time reading memorizing texts whenever approach feel like forgotten even tho 100% true. Im nervous feel like Im running time","GetStudying","education"
"Day 1: Studying complete Coursera course Today first time used *Kairu* & really enjoying it. working certification Coursera. find as: *The Luminous & Lilac Learner* Course question: Six Sigma Yellow Belt Specialization","GetStudying","education"
"Struggling Procrastination & Fear Licensing Exam I’m 27M doctor currently prepping licensing exam. failed first attempt, I’m sitting months. Honestly, know important exam me, I’ve battling intense procrastination, it’s eating away time peace mind. Even med school, barely scraped couldn’t study wasn’t capable, kept leaving everything last minute. backfired badly last attempt, I’m terrified thing’s happening again. It’s like don’t want study. It’s fear huge syllabus, overwhelming feeling look what’s ahead, guilt wasting time piles up. I’ve wasted almost half preparation period already, I’m stuck cycle fear, procrastination, guilt fear. anyone who’s struggled managed pull it? helped break cycle? cope felt like everything slipping away? Would love hear experiences, advice, even know I’m one boat. Thanks advance.","GetStudying","education"
"cursed study technique you’ve ever tried? recorded reading notes listened sleeping. Didn’t work 10/10 effort. 😂","GetStudying","education"
"Day 3 trying study 12 hours everyday next 70 days Day 3 Studied 7:49 hours today,eyes little itchy due continuous staring screen, tired happy. never studied much day ever, thanks support community, grateful 🙏 try study 9 hours tomorrow. Day 1 - 3 hours Day 2 - 6:20 hours Day 3 - 7:50 hours","GetStudying","education"
"Need help exams Hey everyone! I’m first-year student IGNOU, exams coming soon. first time appearing IGNOU exams, I’m BA English Honours. anyone please guide find syllabus subjects study from? specific YouTube channels study materials would recommend? subject codes have: BEGC 101, BEGC 102, BEGC 103, BEGC 104, BEVAE 181, BPCG 171, BEGAE 182, BPYG 172","studytips","education"
"Help motivation Im sure aware situation universities protests Serbia right basically havent lectures almost six months lost motivation study, already problems even worse, tips slowly get back routine?","GetStudying","education"
"Studying failed? need tips tricks study subject failed before. Every time sit down( tipical things get mood studying work subjects) start feeling anxious topics fail subject before. try revise learned get even nervous it. Anyone tips whould help stoping continue making even nervous waisting time.","studytips","education"
"NEED HELP. PLEASE HELP ME. quick intro. Got 97.8 percent class 10th boards 79 percent class 12. pressure parents whatsoever. want ok. took gap year study dream uni. consistent. takes lot effort willpower get ass sit table study. study 6hrs one day, boom, study next six days. that's months went by. 15 days left exam. hard, pass get uni. thing CAN'T STUDY. Sounds silly right? does. funny. single handedly destroying time. can't bring get study. stuck. stuck loops. study- emotions wash over- spiral- self sabotage- cry- give false hope repeats. please, position before,how correct yourself, fix yourself? stay productive regulate emotional world? need advice. Pease help me.","GetStudying","education"
"Daily Studying Day 4 Proud myself. studied while! Studying more! Let's best hope get great grade coming exams! study 2 hours tmr, tune bit. I school 8am - 4pm school tutor classes 9. 2 hours plenty","GetStudying","education"
"Waitlists literally situationships say “we really like you” won’t commit. Won’t let go either. vibes false hope. absolute worst part? find moved onto huzz instagram stories read “AHHH friend got Harvard waitlist!!” Oh. making decisions. telling me... almost painful seeing ex soft launch instagram. point, I’m even applying college—I’m one-sided emotional entanglement Google Doc titled “Letter Continued Interest Final FINAL Draft.” say you’re let heal peace.","ApplyingToCollege","education"
"school starts WEEK done advanced reading scared, need HELP! hi! going 3rd year high school, students know tell specific year hardest. already done advanced reading, hard time learning every lesson, really scared give best first months lose motivation following months. procrastination really bad sometimes, get distracted easily, need tips. ***How study effectively? okay study soon get home instead studying late night? okay talkative extroverted maintaining studies? get rid habit procrastinating 7 days?***","studytips","education"
"Would colleges rather 4.0 student 5 APs Vs. 3.8 Student 15 APs Title, course rigor matter certain point GPA loss?","ApplyingToCollege","education"
"study better average student Hello 3rd year student studying BS MLS. average student hard study study brain literally forget next day. tried making flash card writing notes. It’s effective. suggestions improve study technique","studytips","education"
"withhold AP CSA score? hi, senior going lehigh fall, looking summer checklist. submit AP scores july. never sent AP scores institution before, really know works, saw there's $10 fee withold score. got 3 CSA, count credits and cs major bad look lol, got 5 calc BC & 5 AB subscore, took ap stats, physics mech, physics e&m year. think get 5 stats 4 physics tests. physics calc credits count, really want see CSA score. stats score also count college credits. so, still send scores, including CSA, withhold it?","ApplyingToCollege","education"
"interested studying USA Germany looking advice apply university scholarships grants Algerian student. Thanks advance! get university grant abroad student currently living Algeria?","studytips","education"
"Georgetown Extended Waitlist got update today saying georgetown finished waitlist put extended waitlist? never heard cant find anything online either. anyone know anything?","ApplyingToCollege","education"
"MIT Waitlist guys think move year. know said something share mid may.","ApplyingToCollege","education"
"GATECH major change help!!! today deadline submit major confirmation form. want switch major, go form, option confirm major?? help panicking","ApplyingToCollege","education"
"chem teacher brilliant idea giving us practice questions finals Normally like him, opp move. study this? can’t access past exams don’t know past notes gave us. Moreover, specific practice chapter, don’t know specific things exam","studytips","education"
"USC Spring 2026 appealed successfully got USC Spring 2026 admit! tips things take consideration? current plan go local CC fall fulfill gen ed credits, pros cons USC Spring program? mostly concerned housing opportunities miss on, well able make lot friends. advice?","ApplyingToCollege","education"
"usc appeal received yet? reach USC admissions counselor? submitted appeal day portal opened, haven’t received confirmation email update. I’ve checked spam folder portal, there’s nothing far. anyone else experienced this?","ApplyingToCollege","education"
"Harvard WL got in, major? receive phone call? got rejected, major? didn’t get response, major?","ApplyingToCollege","education"
"Harvard waitlist closed? Harvard seems sent waitlist rejections stating class already full. mean one accepted waitlist?","ApplyingToCollege","education"
"USC UCSD committed UCSD media industries communication, got appeal USC spring term starting January communication. super excited UCSD USC dream school, lowkey kind forgot dream school bcs tried making forget rejection","ApplyingToCollege","education"
"Harvard movement? Anyone got off? so, contact you, around time? general, anyone knows waitlist updates Harvard. Thanks!","ApplyingToCollege","education"
"conflicted applied college yet not quite yet stuck. CU boulder RPI two goal schools, really can't choose. go New York hour away best friend, time love Colorado and dislike New York, love too. helped decide go college?","ApplyingToCollege","education"
"Update upcoming exam pass exams truly enjoy every day — there’s one thing struggle with: don’t understand books read. study, stupid feel. anyone got solutions???","studytips","education"
"can't focus trying study, reading documents exam, understand anything. always thoughts mind. keep thinking problems troubles. focus","GetStudying","education"
"many times read textbook? Maybe could discussed posts, many I, you, read textbook study? There's topics Internet like Forgetting Curve, spaced repetition like seems bit vague actually many revisited, like know others approach problem.","studytips","education"
"Burnt I’m currently grade 11 Australia, subjects Chem, Physics, Engineering, Software, Math ext 1, English/Math advanced. struggle study is, yet alone workload. Chemistry backup subject, chosen woodwork line something else couldn’t get it. I’ve failed (bottom class) exams chem, yesterday also physics. I’ll dropping chem grade 12, NEED physics want engineering university. tips/words advice would nice comes studying","studytips","education"
"Transferring Tandon engineering school spring 2026 Hey guys, currently sophomore want transfer NYU spring 2026. take classes college I’m currently couldn’t transfer fall semester 2025. tried go common app start application doesn’t show option pick NYU Tandon school engineering school want transfer to. friend said might application closed right open later spring transfer I’m sure. one know situation?","ApplyingToCollege","education"
"Got conditional admittance international student graduate program, sure Like title says, got admitted condition get gpa 3 first semester gpa 3 course taken, normally problem this, thing actually accelerated master program, supposed take 5 classes first semester alone mixed feelings right now. think doable? paying LOT first semester.","ApplyingToCollege","education"
"ive exams months able study give attention classes bc personal things went really dont want fail modules, please give best tips cover 4 modules within 2 weeks please?","studytips","education"
"PLEASE help choose usc ucsb college creative studies GOT USC APPEAL cant choose 2. zero fin aid, pay either school feel bad parents pay usc. i get fin aid. want prepharm/pharmacology. usc: pharmacology/drug dev ucsb: ccs chem biochem","ApplyingToCollege","education"
"5 days important exam life — Algerian Baccalaureate — need help like I’m last poker chip. I’m coming something real. 5 days, I’ll sitting **Baccalaureate exam Algeria** — aren’t familiar, *the* high-stakes, make-or-break national exam determines entire academic even professional future here. It’s like SAT, A-levels, final boss fight high school rolled one. Failing it? set back entire year, worse, reshape path direction never wanted. Here’s thing: I’m late. “I started yesterday” way, still feel like I’m holding cards close, praying miracle hand. I’ve decided go “predictable” lessons — know, ones always show — honestly, feel like I’m playing poker Florida sunglasses, sweating bullets, hoping bluff works. I’m lost — *want* play smart final 5 days. want survive maybe even win this. here’s I’m asking you, Reddit: * **How would study 5 days prep huge national exam?** * **What’s method memorizing revising works pressure?** * **Have ever turned things around last-minute somehow pulled off?** * **How stay motivated brain tired finish line close?** Motivation. Strategy. Anything. I’m open advice, hacks, encouragement. little brother looks me. parents believe me. I’ve got whole family counting this. you’ve ever something like — whether law school finals, med boards, version “do-or-die week” — I’m begging you: **Drop wisdom here. Inspire stranger. Help someone cross line.** Thank advance. bottom tired, hopeful heart. — student Algeria, all-in last hand 🃏","studytips","education"
"Studying alone awful.. Hey anyway anybody would want study me. know sound desperate, honestly can't concentrate days, need someone's help lmao. Let know know kind app or, help out. Sorry promoting bit that's rules 😬.","studytips","education"
"don’t know what’s wrong me. really study college admissions can’t push actually read book watch lesson. resources like book practice questions lessons can’t help distracted. think effective study habit reading writing fully understanding it. quite while, I’ll get distracted use phone eat using phone. really don’t know do. also suck math whenever watch video lessons, looks easy try answer time video, it’s easy test comes mind blank. What’s wrong me? tips me?","studytips","education"
"stopped cramming burning - actually kept studying order stop cramming burning out, need go fun. Take time take mind studying, socialize, actually enjoy yourself, able focus studying actually use brain full potential. Break studying small chunks, spending much time per day, daily effort, treat unskippable part day, like shower (hopefully) time, grinding mini-lessons, flashcards, practice questions. want spend much time making yourself, made website, [Penseum]( automate it, use basis tweak liking","studytips","education"
"Gamma brainwaves help concentrate better revision? came across tiktok posts said listen gamma waves studying, help deepen focus concentration studying. However, saw people commented radiation could affect listening gamma waves. i’m kinda scared, wanna try really need assurance effectiveness. really wanna ace tests month i’m gonna try methods concentrate better cuz i’m easily distracted 😭","studytips","education"
"keep motivation study parents don’t even believe me? Growing I’ve really bad school, saw use couldn’t look ahead life. parents never really motivated me, let kid. (Also undiagnosed ADD) high school really bad. period really good got favorite subject psychology well sociology well. got depressed didn’t go school anymore. Stayed home. I’m 24 still living home I’m studying online get degree. Right I’m philosophy really love subject mom keeps saying “oh really hope pass exam…” - I’ve studying much get good grades feels belittling. told hope hope really high results love subject asks “huh why? Don’t want pass?” Like… parents want better avarage? supposed get life get avarage? see never well school, never motivated I’m adult finally see got motivation. I’m gonna lie makes feel really mom says this. I’ve already proven well passion it, passion keeps saying belittling tone hopes pass it. - matter hard sees study :( It’s like she’s already made judgement hard work = “E” Edit: sorry bad English. isn’t native language I’m venting caring grammar wanted get","studytips","education"
"Hello guys got history exam 17th begin preparing get atleast 80/100 Please help class 10th.","studytips","education"
"tips pass exam without studying? tips pass exam without studying? got 9 days exam","studytips","education"
"good strategy studying, taking notes, retaining 100+ page chapter material? Currently studying massive volume material chapters 100 pages. I’m trouble managing also finding valuable content take study later.","studytips","education"
"Study hours increase actually increase study hours? Like brain automatically gets burnout specific time slot comes like 12-4 7 9 got sleep lol. genuinely correct this?? Anyone got tips. Also need study partner. Hit ur interested.","studytips","education"
"Life changing hacks complete assignments feel like dont good hacks finish assignments makes mind foggy One thing do, create plan day still always feels hard assignments","studytips","education"
"Help good purpose Good evening everyone, looking ways help child owes 9 difficult courses get diploma. issue courses, fact frustrated failing exams lost motivation (he finished compulsory years school). thinking tutoring, find either good bad, also psychologist. help turn? Personal experiences, opinions help welcome, thank you.","studytips","education"
"stay consistent? hi, im college student, ive trying study 6-8 hours everyday always get distracted social media, say want learn today always get lazy said tommorow (of course didnt next day)","studytips","education"
"Turnitin detectia put dissertation administration already there's 1 week front prepare discussion... truly afraid bcz plagiarism... used paraphrasing concerning quotes dunno correct paraphrasing not?...nd there's common information can't set reference wrote like mine... Turnitin discover plagiarism? Also universities use concerning literature linguistics thesis...is Turnitin detectia?","studytips","education"
"study? study methods yielding good academic results. approach","studytips","education"
"studying tips lazy student? i’m 12th grade, it’s last year school. official exams coming up, honestly, i’m pretty lazy student, haha. please give fun studying techniques help understand, memorize, motivate study? subjects take biology, chemistry, physics, english, arabic, economics, sociology, history, geography, civics, philosophy, math (my worst nightmare). study economics, sociology, history,","studytips","education"
"Need help Give brutalist motivation studying like wasted almost 2 months anything entrance exam end June also starting July university. Getting university dream matter happens get it. due reasons wasted hell lot time want get back track need motivate also help planning study routine 7-8 hours day.... would nice somebody could help me. know going do... getting university means alot family","studytips","education"
"New trying study better Hey everyone, I’m new community getting serious improving study. Lately, I’ve working cutting phone distractions especially reels building better focus. Excited looking forward learning it!","studytips","education"
"study write Chemistry exams English first language struggle concepts? Chemistry student, finding really hard understand concepts. top that, English first language, writing answers properly exams even difficult. can't form clear sentences, end losing marks even try. study improve subject understanding English writing? tips resources would really help","studytips","education"
"unhinged studying tip force to study lazy procrastinating one month (to finish curriculum lol) finals start need extreem, mind blowing, work like charm kind tips ( considering addicted screens need study like pdf files yt etc..)","studytips","education"
"HELP NEEDED!!! freshman competitive public school (average SAT score **1410**.) challenging academics (students **self-delete** often.) Anyways, year, freshman, GOT **C** **Algebra 2 Trigonometry Honors.** high A's classes easily (GPA 3.7), can't keep math course, teacher teach anything. know study cause post study materials. So... three questions: **1. study tips types situations? Please specific.** **2. C affect college admission chances?** **3. competitive public high school affect high school experience college chances (harder/easier?)** Thank help :)","studytips","education"
"I’m struggling hard studying retaining information (EMT training) Im 19yr (f) ADHD anxiety. noticed I’m visual learner, I’m struggling ways study make easier retain information. I’ve tried drawing, highlighter coding, watching videos. remember things I’ve learned, much go over. I’m also behind can’t be, exam 5 days I’m panicking stressed. want pass, I’m lost. tips? I’m stressed.","studytips","education"
"study exam? 15 days exam, guys memorize lessons? Please share methods help remember study. Also, avoid getting distracted phone?""","studytips","education"
"words advice pliz revise effectively? pretty good marks college boards approaching keep feeling like bad. Like forget everything. also lack motivation drive,at rate fear cant even brainstorm exam attend unseriously. dont want depression clouding brain now. cant lose composure","studytips","education"
"Manual Digital Notes?? I’m 16F student going grade 11 couple days. also gonna prep JEE simultaneously. I’m wondering whether could manual notes digital notes. used write manual notes back 9th grade performance quite satisfactory time consuming hand hurt lot. I’ve thinking switching digi notes. Kindly share ur experiences guyss PS - thinking buying IPad 11 launched recently. u suggestions let know. Thanks 😊","studytips","education"
"Best method memorize line line exam Hi everyone, im confused discovered options I’ve 2 month prep exam I’ve write line line exactly text answers points form variations 5 points 12 points. almost 3500 questions well. options follows effective method applied plzz share Option 1. Read 5-10 times points 2. recall verbally without seeing text immediately 3. continue next perfected repeat step 1 4. completing study session recall everything without seeing verbally. 5. wrong go step 1 3. Option B 1. Read 5-10 times points 2. recall verbally without seeing text immediately 3. continue next perfected repeat step 1 4. completing one two study session recall everything without seeing writing. 5. wrong go step 1 3. Option C 1. Read 2-3 times 2. write points without seeing text 3. check write wrong points 2-3 times. 4. recall verbally wrong repeat step 3 5. completing one two study session recall everything verbally without seeing text. Option 1. Read 2-3 times 2. Write points without seeing text 3. Check write wrong points 1-3 times 4. Repeat step 2 5. completing one two study session recall everything without seeing writing.","studytips","education"
"actually study? 10th grade grades far (out 20): Portuguese: 19 Philosophy: 19 English: 19 Maths: 14 Physics Chemistry: 13 Biology Geology: 14 P.E: 15 quite motivated study sometimes really enjoy learning new things, many times overthink whether fail test start panicking.... usually try memorize things, take notes bunch exercises. However, results really match effort put studying. (ex: time studied 1 month test got 14/20) know happens test. mind goes blank can't remember ANYTHING. chose redo 10th grade try make results better. Please tell tips actually study get good results...","studytips","education"
"new study method leaked known Pomodoro [Penseum ]( workflow: step 1: upload lecture slides [Penseum]( step2: spam flashcards, prac questions follow study plan step 3: 25 mins focused studying step 4: 5 min cardio reset flowstate step 5: repeat night exam, tap","studytips","education"
"productive study day actually look like you? ideal version perfect lighting, study playlist distractions, realistic one - still feel like got stuff done. define “good” study day? helps get there? it’s everything according study plan wrote study session","studytips","education"
"macroecon final hello pls help!! macroecon final three days, haven’t done anything, please suggest good study material/yt channels 🙏🏻🙏🏻😓","studytips","education"
"i’m sophomore highschool don’t know study hi! i’m sophomore highschool adhd don’t know study. say that, mean actual studying methods. flash cards don’t work honestly confuse me. method found worked adhd white board method problem takes long. anyone adhd could please give studying tips/methods would appreciated!","studytips","education"
"learned best taking practice test bad? Whenever study find easier find practice test zooming questions like tomorrow screwing this?","studytips","education"
"Lose interest motivation quick studying two subjects. One language, love idea knowledge started bang, look forward studying get home work studying feels like task even full energy. Everything kind even sculpting. end scrolling news autopiloting study absorbing nothing. Anyone gone this? overcome it?","studytips","education"
"unconventional study hacks help crush focus memory marathon sessions? Hey Reddit! I’m tired usual advice like “take breaks” “drink water.” unexpected less-known study hacks actually boost focus help remember stuff you’re grinding long study sessions? Think outside box, weird tricks, mindset shifts, tools changed game. Share secrets!","studytips","education"
