"web development still worth go back get degree? Hello thinking going back finish CS degree. tried going self taught route, small work experience working covid came, unable get another opportunity since. go back finish degree take 2 half 3 years. Would still worth it?","cscareerquestions","education"
"include camp activities list? making college resume keep track accomplishments things do. got accepted 3-day law camp thing state university. would phrase resume / future common app activities list? extended period time put exact dates? better way it? things resume arranged year because activities long-term, last year. help would appreciated!","ApplyingToCollege","education"
"take PSY100 engineering, what’s like? I’m interested taking PSY100 next year fulfil natural science elective requirement. I’ll starting third year next year mechanical engineering which supposedly hardest year I’m trying scope difficult course might be. I’ve heard first year artsci courses aren’t actually easy especially ur used eng classes. Anyone insight?","UofT","education"
"2 weeks till final exams decide life skipped school bunch times didnt shit. lock in? effectively study.","studytips","education"
"everyone pursuing civil Eng discovered wonderful place Reddit, discovered passion public transportation systems infrastructure organically, inspiring pursue civil engineering. However, coming subreddit also interacting people irl seems people want engineer want deal cons engineer work decide civil engineering???? Someone told picked cause easiest Eng crushed lil. reason this? person u lmk want know civil eng","OntarioGrade12s","education"
"Lame PD We’re required get certain number hours PD year, district’s current offerings aren’t appealing. Many tech courses ones could probably teach. There’s nothing directly connected subject area. I’ve always able pick something catalog suffice, don’t even know search outside district find courses. ideas good PD 20+ year high school ELA teacher?","TexasTeachers","education"
"kicked out? first year Tamu. enrolled General Engineering. failed classes last semester withdrew classes semester. advisors talked said transfer General Studies register class fall. already received email approving application General Studies 2 weeks ago, received email today. options go TAMU fall reapplying?","aggies","education"
"4.0ed CSE 232 summer — it? Hey! Got tips helped succeed class? book help all? Also, sample MQs actually helpful? came across Reddit post:  really freaked out. 4.0ed CSE 231 last semester, keep hearing CSE 232 way tougher. Thanks advance!","msu","education"
"Double majoring experiences I’d like hear experiences double majoring experiences. something similar, everything new college like meeting new people, living away home, navigating big city, I’m nervous work load. I’m aware kinds things pretty rigorous, things sacrificed order succeed, I’m worried I’m going life. know seems dramatic I’m seriously stressing this. anyone give two cents I’m curious read","uofmn","education"
"Student beat Hi everyone. I’ve special Ed 24 years. Worked moderate severe needs settings. I’ve seen quite bit even scar two aggressive students. One current students Autism. socially delayed. grade level academics. straight came last week. Yelling shoving me. punching repeatedly. happened crowded place couldn’t run away. threatening student too. need vent people get don’t even want work anymore. changed dynamic much. sync all. year. I’m mad him. seems “unprofessional” again- I’ve seen fair share aggression direct. Don’t even want near . Tell understand!!!","specialed","education"
"well need Pure 3 get star need Uni ? Please help got 43 today’s S1 paper, silliest mistakes. Pure 1 got 70+. mech got 47. many marks think need Pure 3 star esp possibility Pure 1 Mech getting cancelled grade based pure 3 stats.","alevelmaths","education"
"Starting VR&E Fall SoCal used roughly two thirds Chp. 33 Post 9/11 GI Bill 12 months remaining. got approved VR&E going finishing associates degree community college Fall. question is… benefits perks “take advantage” using program aware of? counselor said books / parking pass paid curious else entitled maximize benefits. tips recommendations truly appreciated! Semper Fi 🇺🇸","Veterans","education"
"4 hours left international still haven’t done frqs💀💀💀 look last minute","apcsp","education"
"likely umbc rescind acceptance? I’ve A/B student throughout high school, senioritis hit HARD I’m ending senior year mostly C’s. worried 😶‍🌫️","UMBC","education"
"Anyone going Georgetown SCS Masters Artificial Intelligence Management fall, 25 intake? Excited part Fall 2025 intake Georgetown SCS Master’s Artificial Intelligence Management. Can’t wait kick new chapter! Really looking forward connecting classmates figuring we’re going balance work, life, AI-induced existential crises together. Feel free reach out—would love connect!","georgetown","education"
"fail HESI? Yes, fail HESI exam score meet minimum requirement set nursing program. school sets passing criteria—commonly around 75% higher. Failing may mean need retake test could delay admission. Would like tips avoid failing HESI?","OnlineHESIExam","education"
"Grade 12 English English presentation fits theme ? HI, oral presentation : 9-to-5 system contribute repression emotional well-being personal identity?"" quick illustration use examples -Death salesman Meaning: work system dehumanises people treating disposable. Emotional impact: Willy becomes anxious, depressed. personal life collapses weight professional failure. • Bartleby, Scrivener Represents emotional shutdown mental withdrawal. identity disappears behind refusal participate system. Ends total isolation death emotional consequence life space self-expression. think matches theme axis ? Theme: Self-expression construction Study axis 1: expression emotions","HomeworkHelp","education"
"outside help got written question math assignment wrong teacher asking call tomorrow morning. ISSUE use website anything cheat, asked brother help since understand it, tried answer turns got wrong. know tell teacher like yeah, get question asked brother help, turns lowkey stupid stressing much. whole reason flvs anxiety, HELP 😭😭🙅‍♀️ know fault, probably messaged teacher something, hate calling messaging unless absolutely to. CLUE GOING TELL HER. get trouble admitting went brother help???,,,!?,???","FLVS","education"
"chances appealing academic suspension? So, long story short, title, need honest answer possibly put situation me. finished first year, first semester placed deferred suspension GPA 0.880. lot problems comes studying, paying attention class able work, lot symptoms. part academic success plan, placed class ""Strategies Sucess"" learn study strategies, definetly help. finished semester term GPA 2.43 however, Cumulative GPA 1.74 needed 2.0 higher. Resulting suspended one term. However improve tremendously that's gotta say something right? Since beginning year, trying get tested ADHD Autism even realize load symptoms disorders. spent 6 months trying find place take insurance ADHD Autism testing, unfortunately learned Im 19F legally considered adult, place take insurance testing developmental disorders finally got testing done await diagnosis. point, lot research, talking lot people diagnosed disorders, need testing know anymore, however need accomodations need diagnosis. notes therapy sessions since beginning treatment, stating trying get tested struggles along. well mental health issues also get way Depression Anxiety IEP elementary school LEARNING DISABILITY. caught middle school taken away nobody chose look anything me, thus resulting struggling throughout middle high school college. KNOW reach full potential get accomodations help need. shows progress. need brutally honest answers, advice prep. chances taken suspension? need explain more? need?","rit","education"
"Urgently need participants survey Academic 18+ Hey Guys, urgent need participants survey order get degree! exploring different demographic characteristics change way people see victims crime! take 30 minutes do.  happy everyone else's return!. Thank SM!","takemysurvey","education"
"difficult Calculus IV? Hello everyone, class university program enlisted ""advanced mathematics"" looked course description surprised and distraught see material calculus *AGAIN* last chapters calc, vectors functions, partial derivatives, double integrals triple integrals; passed calc 1 A+ im struggling little calc 2 im definitely failing, definitely wasnt easy fun, dont know expect. looked looks like physics 2 different font new name, like yall?","calculus","education"
"need this? today mock test. I’ve learning 6/7 months thought I’d mock test see I’m ready test date 2 months. Long story short failed mock test. actually confused instructor said. example, never told engage parking break stopping red lights. automatic btw. kept saying wasn’t used told off. anyone know actually required test?","LearnerDriverUK","education"
"Study Partner NAC OSCE Hey guys! Doctor living South Africa ATM. looking serious study partner upcoming NAC OSCE September. open making Time Zone work! need someone hold accountable + practice, practice, practice with! Many thanks, please DM ☺️","MCCQE","education"
"Let’s describe exams one word! 9th: AP World History 10th: AP Chemistry AP Computer Science AP Calculus AB 11th: AP United States History AP Calculus BC AP English Language & Composition AP Spanish Language & Culture AP Physics 1 12th: AP Biology AP United States Government & Politics AP English Literature & Composition AP Statistics AP Physics C: Mechanics AP Physics C: Electricity & Magnetism","APStudents","education"
"I’m OFFICIALLY done BAR almost took out!! Guys feels freakin amazing!!! Failed BAR January 71 sweet victory!!! Passed others first try. Keep pushing guys. It’s totally worth feeling end. I’m happy share study tips. Let’s gooooooo!! second post today bc couldn’t see scores earlier.","CPA","education"
"Quick tips Midterm post, wanted briefly detail general tips remember CS2A midterm final: * & often try trip small details question correct form, check spaces semicolons closely. past, skimmed code catching one error, another line missing semicolon completely missed. * correct answer worded multiple ways. Something like look question come answer checking answers, led astray/convince wrong one. good strategy overall, answer came align premade ones, try reword format rest answers use. * Pacing-wise wise ever close running time, get stressed first questions take while. Oftentimes, make time super-easy questions later on, questions use section code ask different question. * use IDE simulate something, oftentimes faster head/on paper. sometimes write function main statement anything function needs, would need write entire program want put IDE essentially wasting bunch time Hope helps, sure people CS2A class relate tips!","cs2b","education"
"Different topics finals next week starting Tuesday. chemistry final exam Thursday next week. Tomorrow last day remakes need makeup 2 tests. best way/techniques study different lessons/units subject? Thank advance!","studytips","education"
"hate revisions. get started hate revising keep feeling know everything require revisions stay memory. Generally revise friend, like teaching friend sibling everything needs revised, keeps focused. times, one’s available, cannot revise all. Like keep zoning out, yawning distracted anyhow. find super dependent paralysed able keep studies without anyone’s presence. tried teaching imaginary people doesn’t work honestly. actual presence person, feel pressurised keep going get between. Help me.","studytips","education"
"College student - feel like stopped really learning ago Context: college senior. Going college alongside rise ChatGPT made realize stopped truly learning past years. lot assignments became ChatGPT really take time go understand. realized this, talked friends felt similar. So, built app AI tutor socratic method really pushes learn content own. ask example problems + solutions well rephrasings, end day one solving problems. Let know think, thanks!","studytips","education"
"AI detector flagging work AI generated pissed paper matter always detected AI generated even though made everything anyway prevent swear anxious cannot work besides this.","studytips","education"
"want help studying full time job. 40 hours week. two children. also go gym. would guys go studying college math course? eventually want electrical engineer & I’m super bad math I’m letting hold back. would however like advice could organize study & much time allocate taking maybe two math classes time. also would like know people who’s taken multiple math classes time… heck learn two different kind maths math usually builds previous learned maths? Thank you.","studytips","education"
"chat GPT earn degree you? admit, I’ve used chat GPT explain things help understand APA formatting things like that. frustrated seeing many people actually getting higher education essentially illiterate. comprehension they’ve studied can’t hold conversation field. confidently holding degree know nothing about/didn’t earn? It’s point pride use chat GPT past semester stats course couldn’t understand used tutor format checker. Even makes feel type way. I’m tired “I chat write essay edited really heavily basically didn’t cheat” rhetoric. Professionals need competent.","studytips","education"
"need help business cs work? hey, anyone needs help business cs assignments, essays, projects, connect me. i’ve done lot work also help checking removing ai/plagiarism turnitin similar tools professors use. need help studies too, i’m that.","studytips","education"
"FEELING UH DEMOTIVATED facing problem productive procrastinating thought nice study space help didn't. feeling lost wanna work hard can't mean work hr like ah achieved something take break voila lost track. someone help please.","studytips","education"
"89% feels like enough… stop feeling worthless? got 89% boards, yet feel like failure. kind person overthinks feels anxious everything—even smallest tests. worked really hard gave best. still, feel inferior see others used weaker studies scoring me. sad well—in fact, I’m happy them—but makes question myself: *Why couldn’t I?* Even one percent feels suffocating—more ever imagined. cousins got 95%, 97%, can’t help compare. feel better days I’m trying accept reality. haven’t given up. want try even harder 12th grade. Please give suggestions change turn situation around. I’ve always felt like I’m perfect skilled others. I’ve lacked self-confidence self-esteem. now, want something different—something new. want love myself, regardless grades. Everyone talks shouldn’t done, I’m sure start. want responsible, strong, confident. Yes, want well school. also believe focus academics keep discarding parts myself, I’ll end losing truly am. want love myself—not succeed, always.","studytips","education"
"Wanted less stress around studying, helped little Built completely free planner tool keep track need study help others well. Sharing case helps someone else too: quizard.io","studytips","education"
"AI Model Think Best Brainstorming Ideas? I’ve bouncing models need help brainstorming, I’m still sure one consistently gives creative helpful ideas. What’s go-to AI brainstorming?","studytips","education"
"two exams 24 hours two exams 24 hours lot material cover, exams combined atleast 4 hours long. One subject important I even started covering important subject slowly losing mind, AI something make easily understandable flash cards something like that, literally thing would help point guys, HELP ME!!!!","studytips","education"
"AP Psychology Question Exam Hypothetically speaking, given piece scratch paper use multiple-choice section AP psychology exam write vocab words MCQ later use EBQ terms?","APStudents","education"
"physics c e & frq form frq, frq3, would putting voltmeter parallel resistor, subtracting emf valid procedure. said graph subtracted quantity vs time, use fact 1 time constant --> 37 percent voltage gone, find time constant t/R = C?","APStudents","education"
"Learnt nothing AP Physics, teacher failed literally lost since 1st day class able catch even once. exam tomorrow confidently say getting anything 1. Thanks lot physics teacher.","APStudents","education"
"fail AP precalc exam pass AP calculus exam, would effect college credit. worry that. Like failing exam prerequisite matter long pass one it. even know wording right completely sure AP credit thing works whatever want call it. Btw taken classes yet","APStudents","education"
"Question hybrid exams FRQ section on-paper hybrid AP exams like physics tomorrow, Bluebook stay open entire section? completely different. wondering able see timer use Desmos FRQ section","APStudents","education"
"believe you! Good luck remaining AP testers! Manifesting 5s across board everyone, testing tested. proud effort put in! 😁😁","APStudents","education"
"typing issues ap exams took seminar text completely glitching, overwriting stuff random parts essay going parts, everything completely jumbled incoherent. ended getting late exam ordered retake, im wondering anybody else experienced insight whether macbook specific issue? school chromebook could use instead MacBook. go bluebook test preview doesnt issue, seems sporadic suggestions avoid retake?","APStudents","education"
"Welcome. Welcome. haven’t completed check-in yet, pause read. finish checking later. Today you’re taking digital AP Exam. Remember, agreed follow rules preventing students unfair advantage. dismiss anyone tries break rules, scores canceled. may also prevented taking College Board exams future. Bluebook application open device unless you’re approved assistive technology. Close applications now. might need quit Bluebook first reopen finish. anyone need close applications? I’ll come around soon make sure cleared desk instructed Bluebook. still prohibited items, turn put desk collect them. scratch paper, I’ll collect exam. Write full name, today’s date, exam name top right corner. Please give attention again. Bluebook end Section start break automatically. might start break slightly different times neighbor, please quiet times. break over, click button start Section II—don’t wait tell to. take break time, go menu click Unscheduled Break. Raise hand wait dismiss want leave room. lose testing time take unscheduled break. approved accommodation breaks needed, select Pause timer don’t lose testing time. I’ll give start code read final instructions. Keep laptop open tablet uncovered dismiss you. I’ve written reminder here. exam ends, sit quietly make sure answers submitted. Remember others may still testing. Raise hand need help scratch paper time. questions? enter code click Start Test, timer start, begin testing. don’t see start code screen yet, finish checking in. I’ll read start code write board. Good luck!","APStudents","education"
"Girl fainted comically fell ground twice physics mechanics exam working diligently FRQ, heard loud, sudden crash behind me. turned around saw girl comatose floor. could make snarky comment, friend announced ""she fainting disorder"" fainted reason. distracting, managed get back work faint fall AGAIN. turn around time, quite annoyed. escorted room proctor. ruminating, suspicious apparent ""fainting disorder"" two reasons. First, gone school girl several years never seen happen. addition, consider position required fall chair. person's center mass would hanging side chair fainting occurs. sitting chair desk, try relaxing muscles; either slump back chair fall forward onto desk; fall side unless sitting strange position. girl question dubious academic prowess may know projected curve requires mere 55% 5. physics FRQ intimidating, bet fainting done delay taking test. I, personally, think would honorable vomit get it; one ought suffer postpone test, own. used comparable tactic get test before? so, describe it; interested.","APStudents","education"
"experiment frq physics ap physics 1 students, use regression line frq 3? im sure frq 3 otherwise unless points fit line best fit.","APStudents","education"
"APPC E&M calc concepts need know appc e&m? wanna self study e&m next year, i’ll taking Honors calc equiv first semester AP calc bc 1st semester ap calc bc second half bc second semester. fine need learn stuff beforehand? also, need appc mech first? nah","APStudents","education"
"guys really need help studying AP Phys. 1 Exam? reading posts comments really look like lot yall struggling class' tests. really feel confident willing give tips try help. mean, professional physicist physics seems come easy me. Let know topics struggling try best respond give tips exam.","APStudents","education"
"CSP LIGHT asf, physics 1 gonna light Csp free shit need buff exam. Taking APP1 taking physics c gonna funny, imma breeze ts","APStudents","education"
"AP CSP think didn’t good CSP, might’ve done better!! literally nothing class last year Khan Academy course got 5. finished whole exam thought failed !!💔💔I used time free response mcq, yes mean time! even last person done mcq section. also took world day much scared csp world last year. guys probabaly amazing !! :D If you’re taking AP Computer Science next year, pls lock sake.💔CSA downfall.","APStudents","education"
"fail AP Spanish Lang speaking section??? Y’all good got presentation portion. Lowkey kinda eating. like everything clicking, outline fire, rock-solid plan cultures gonna compare. beep went off, way Spanish rolled tongue??? Holy hell. like born speaking spanish, straight outta womb. corner eye though halfway mark chaval next suddenly three legs. didn’t pay much attention cus honestly, cooking started stroking leg ??? glanced realized...............it wasn’t leg. thick veiny DONG??? luckily still locked in, like nothing could break flow, kept speaking without hitch yall. started speaking. first thought bro finally answering prompt like responsible citizen, realized whispering “Bazinga” breath. over. Real devious like. man stands like physically stands chair clearly wasn’t easy stuff hit iPad using record, know hurt fellow BC get it proctor, tired-looking bald man white beard, kept calmly telling sit kid moaned louder every time. point I’m lowkey panicking 'cause knew mic picking up, moaning, Bazinga, hard slamming strokes sweat beginning drip back. proctor enough grabbed kid one free hand escort out, instead kid started SCREAMING “Bazinga” uncontrollably Unfortunately, beep gone proctor said couldn’t re-record. went back listen mine towards end hear bazinga, moaning, hard slapping noises barely voice all. I’m seriously worried- like able isolate voice grade fairly? gonna get stuck background noise around me? please let know","APStudents","education"
"Genuinely don’t care anyone else like rn physics tmrw I’m burned point don’t care like wanna get done never look back","APStudents","education"
"self-study lang? wanted langcomp next year apparently teacher really hard one got still wanna self study cuz genuinely idea wanna good idea right now. Like good books something youtube channels?","APStudents","education"
"Last min AP Psychology Review!! 2025 hey guys, compiled terms school went year share you!  good luck everyone tomorrow !","APStudents","education"
"finished ap csp finished ap csp exam, easy overall im kinda pissed, think got 58/70 mcq somewhere around that, frq im confident got 5/6 6/6 pray think im getting 4","apcsp","education"
"think I’m good? got 66/70 2021 MCQ 57/67 2020, think I’m good MCQ I’m scared FRQ, kind know CPT code, I’m unsure","apcsp","education"
"need 4 bum ass exam, idk im even studying hours trash exam, nobody gaf exam, useless FUCKKKKK im coping","apcsp","education"
"I’m gonna fail exam Im mad teacher really didn’t teach single thing, 3 APs considering class least important haven’t time study. I’ve trying anything Unit 5 isn’t clicking. won’t able frqs bec don’t even understand basic principles coding, app simple possible probably failed meet requirements. I’m frustrated get easy class didn’t know expected learn EVERYTHING myself. want pass atp HIGHLY doubt happen. exam 6ish hrs anyone wants tell study lmk. 😭","apcsp","education"
"frqs free literally spent whole day studying nothing. way easier last year's frqs. Literally way dont get 5 program somehow meet requirements.","apcsp","education"
"finished, THINK GOT 5!!!!! never worried MCQ, seemed super easy, suspicions affirmed completing test. thing really scared FRQs, turned insanely easy too. bet got like one point MCQ. Like legitimately thing got 69/70 MCQ 6/6 FRQs.","apcsp","education"
"finished test?? anyone taken test today already u think went?? frqs rlly hard? would say say complexity mecws compared cb aplassoroom 2021 mcq practice??","apcsp","education"
"I’ve cheated way midterms. stop cheating tests exams? I’m currently taking part time online classes semester full time job morning. know job excuse studying, work feel mentally emotionally exhausted since work customer service deal angry people time. past month, 4 quizzes. cheated three them. probably studied maybe 40% chapter 60% convinced “double check” text book “safe side”. want break awful habit want better midterms. high school wasn’t good academically. getting average average grades, never cheated tests exams, instead accepted grade moved on. stop cheating schedule tips studying bit better? Thanks!","studytips","education"
