"choose : Rog ally X Rog Xbox ally (no X) ? Hello, need advice : play gachas games (Gi, Zzz Wuwa) want use emulation switch games SteamOs. Idk buy Rog ally X bcs storage, windows would good play game heard. 650€ already used. waiting Rog xbox ally release storage buy SSD card","consoles","gaming"
"Playing strategy games console !!! Hello everyone ! Hope good day. kinda new strategy games (at least, consoles) wanted ask opinion whether like play top isometric strategy games building simulators(like Anno, SimCity, age empires etc) controller . play games controller think meant played keyboard mouse?","consoles","gaming"
"What’s best controller ever made? I’ve thinking many different controllers I’ve hands years, NES N64 way PS5, wondering think pinnacle terms comfort functionality. doesn’t console exclusive, even first party controller either. I’ve used fair share third party PC controllers too, though left lot desired haha. personally, terms pure comfort actually think new Switch 2 pro controller best I’ve ever felt. really nailed it. pick favourite nostalgia reasons, it’d duel shock 2 PS2, though always bit cramped hands, controller definitely biggest impact me. Discuss!","consoles","gaming"
"Grand Theft Auto Franchise - Legacy upcoming GTA 6 expected release within year, 5 available PS5 XBSX/S. possible play GTA 4, EFLC PS5? know done XBSX/S digitally via CD PS5? want able play GTA games (VC,SA,3,4,EFLC,5,6) making jump xbox 360.","consoles","gaming"
"That’s actually insane — Sony definitely keep porting PlayStation games now.","consoles","gaming"
"Star Wars Outlaws | Switch 2 - PS5 - Xbox Series | Graphics Comparison","consoles","gaming"
"unable see friends play online? Help please, randomly happened playing","consoles","gaming"
"hear that? Fortnite ruining console gaming. Time switch PC","consoles","gaming"
"PS5 keeps shutting whenever play big games PS5 almost 2 years, recently getting man's sky playing quite lot sea thieves. problem almost 3 weeks now, 15-30 minutes session console turns off. black screen explanation. know much technology first though something power. However turns that's case, light table connected power strip stays fine. always whenever play big complicated games, crash games like Minecraft, balatro, Undertale deltarune. really bothering really obvious reasons. Imagine playing multiplayer game friends need help console turns off. Anyways really grateful anyone could help me.","consoles","gaming"
"exactly PlayStation going compete this? Let’s say next Xbox home console uses OS ROG Ally Xbox edition uses—a simple console that’s also full Windows PC Steam PC launchers. Windows + Steam together literally biggest best games library is. Microsoft huge advantage Windows. Sony, unlike Microsoft, doesn’t desktop OS. exactly Sony going compete this? simple console-PC hybrid like would literally better PlayStation basically every single way. example: * best game library * one PC storefront/launcher, native Xbox app: Steam, Epic Games, GOG, Itch.io, Battle.net * Emulators * Modding * able gaming * Graphics settings * PC exclusives * Able use controller want consoles Controller obviously saying PlayStation going die disappear anytime soon—it still millions loyal players. believe could seriously outcompeted Xbox next Xbox home console ends true console/Windows PC hybrid.","consoles","gaming"
"Marvel Rivals officially coming PS4 September 12, 2025.","consoles","gaming"
"Snagged Retroid Pocket AliExpress less new Switch game","consoles","gaming"
"fan Sony rumored doing. record currently PS5 Xbox Series X Switch 2. Sony rumored 2 consoles next generation one budget model. learn disaster confusion Series X/S. hinder development maximum technology.","consoles","gaming"
"Console exclusives ending heard console exclusives gonna end , wondering chance could see games like left 4 dead ps5 ? newer game ?","consoles","gaming"
"Searching Xbox series X halo edition Hello, wondering anyone seen Xbox Series X Halo Edition Console pre-owned Refurbished local GameStop store recently currently? feedback response greatly appreciated. Thank","consoles","gaming"
"best video game console main menu?","consoles","gaming"
"Rog ally extreme vs steam deck oled","consoles","gaming"
"Tell im wrong friend saying Xbox 360 one best consoles ever. wrong here?","consoles","gaming"
"Recommendations Hello, I’m looking recommendations nephew(6 years old) starting get playing videos games. wondering system better Xbox PlayStation?","consoles","gaming"
"could choose console generation, would be?","consoles","gaming"
"sell Series X? Hear out, always owned consoles past generations play exclusives. However, Xbox releasing games PS5, might well play PS5 Pro. Yeah, Game Pass great, honestly, Xbox games looking forward to. play Space Marine 2 it, every months, play online friends. Tl:Dr., sell around 400 euros keep it, every while, power Xbox releases something interests me?","consoles","gaming"
"Question guys consider last like ""classics"" terms consoles had. me, 360, library, online, local multiplayer name few. PS3 dope 360 yeah. know may say PS4 valid ended 360 me.","consoles","gaming"
"PSP servers still active despite 20 year old game console.","consoles","gaming"
"Ps5 disc drive ps5 slim digital model understood disc games could found much cheaper compared digital games, really worth it?","consoles","gaming"
"Console war PS5 really sold loss, Xbox games selling Sony’s own, make sense Xbox stop producing consoles. They’d need focus making games played rival’s console, losing money producing weakening every day. Im PS5 owner love system,but honest.","consoles","gaming"
"Casual gamer looking console suggestion Hey everyone, I’m pretty casual gamer I’m looking get back consoles (I’ve never owned handheld, I’m leaning console first). playtime would light gaming sessions evenings work. I’m software engineer, don’t ton free time I’m really grinding competitive gaming – want something fun easy pick up. little brother (we live different countries) PS5 gaming PC, I’d love something makes easy occasionally play him. Right I’m considering Switch 2, I’m 100% sure that’s right move. recommendations console might make sense someone like me? go Switch 2, would another console fit situation better? Thanks advance!","consoles","gaming"
"PlayStation controllers won’t get stick drift wondering anyone knew controller compatible PlayStation won’t get stick drift. don’t care super immersive stuff anything. I’m looking controller last long time, decent custom ability, made casual player.","consoles","gaming"
"Blood Dawnwalker director says vampire RPG's story non-linear ""you align human rebellion ﬁnish game without ever meeting them”","gaming","gaming"
"Achievement / Trophies games proud of? working way game steam deck recently, really know getting brutally hard game was, got super addicted worked way hardest difficulty. you, achievements / trophies proud of?","gaming","gaming"
"Buy Mindseye Expedition 33? choice apperenty ""worst game 2025"" ""best game 2025 far?"" know do.. curious mindseye bad enjoyed saints row","gaming","gaming"
"anyone play games parents? feel like generational gap makes hard play enjoy games parents. remember kid playing Mario Kart dad, always fun games casual/family fun design. nowadays, disconnect much. Modern games like play interest him. also much less free times used to. gamers play parents? games play?","gaming","gaming"
"Trolley Solution - Official Gameplay Reveal Trailer","gaming","gaming"
"GOG enables ""One-Click Mods"" GOG released One Click Mods system seamlessly install mods games! without fuss around inside folders! released selection limited terms games mods games mods already scheduled added list. * **Horn Abyss Heroes Might Magic III** * **Phobos DOOM 3** * **Unofficial Patch Vampire: Masquerade – Bloodlines** * **Fallout: London – One-click Edition** [ info.","gaming","gaming"
"Nintendo Announces New Splatoon Spinoff: ""Splatoon Raiders""","gaming","gaming"
"Xbox handheld excite anyone already got steam deck? Maybe come earlier switch 2 'open' steam OS new, Xbox handheld would recieved clearly, feels like another handheld, rather reason Xbox ecosystem, know mean?","gaming","gaming"
"[Chaos Zero Nightmare] CBT invites sent","gachagaming","gaming"
"Invites gone Honkai: Nexus Anima closed beta testing (Sept 17 - 23, 2025)","gachagaming","gaming"
"favorite gacha game non gacha game, would handle gacha exclusive characters/weapons? Genshin would pretty easy. characters weapons unlocked story quests constellations unlocked hangout. character story quest, unlocked hangout well vice versa.","gachagaming","gaming"
"Honestly, guys benched units various gachas? Personally, resigned necessity bench roster gachas best teams go fighting blaze glory, especially true Pokémon Masters EX eventually quit due burnout. It’s somewhat less irritating Hoyo games (Genshin + HSR) WuWa, HSR particular still kinda irks occasionally end using 180 pulls unit isn’t going last longer like, 2 patches (case point, Black Swan HSR) power creep whole lot worse HSR either Genshin WuWa, vertical investment kinda dead end, Seele, DHIL even Firefly testify point. Makes feel like gotta grab OP units last long enough pull often due longevity pull faves. that’s even mentioning lousier units like say Yanqing Arlan, still sitting bench day along many others.","gachagaming","gaming"
"Honkai: Nexus Anima pre-registration open counter rewards far. *Please note this* ***isn't*** *the Nexus Bond rercuitment (started weeks ago)*","gachagaming","gaming"
"data backs removal pity Persona 5: Phantom X Edit: meant say soft pity, hard pity versions. Follow /r/gachagaming/comments/1lnwybo/global_soft_pity_situation_in_persona_5_the/ little bit two months ago made post subreddit saying many people speculating Global (EN/JP/SEA) versions P5X something funky. Finally months later pull tracker game thanks users save pull information upload various websites upload pull info pull rate stats Global (EN servers exact) populated TW servers pull rates. see image 2, rates seem slightly better, 69 pulls beyond, pull rate way higher 80 pity rarely thing. speculation, confirmed terms gathered data, sample sizes lower global version game worse terms pulls, that's top fact faster character rate asia version game, fact wait 6 months standard characters appear. would also like say, main moderator official SEA discord two months ago said game soft pity system, based said **we conclude fact lie.** That's it, longer posting update situation notice change system rates, see data website switch regions.","gachagaming","gaming"
"Western Gacha Drama vs CN Gacha Drama","gachagaming","gaming"
"true gachagaming 😹🙏","gachagaming","gaming"
"Sisterhood Sleepyheads eepy waifus gachas play","gachagaming","gaming"
"Star Savior CBT Results Stream","gachagaming","gaming"
"Honkai: Star Rail's version 3.6 update give free 5 star Dan Heng • Permansor Terrae","gachagaming","gaming"
"Limbus Company X Arknights - Pilgrimage Compassion Teaser Event last starting 25th September 23rd October, whole month. first ever Limbus Company collab true limited event banner today","gachagaming","gaming"
"《 Tower Fantasy 5.4 》Shifting Stars, Veiled Dawn: New Characters, new region, 1.0 Map Rework more! “Red traffic lights, snail-paced convoy ships, involuntary curses sighs, elevators never arrive time… morning rush hour Brighton District, capable draining hope day even begins. Version 5.4 ‘Veiled Dawn’ begins **September 25** (TOF CN). Set Brighton embark new journey.”","gachagaming","gaming"
"Starseed : Asnia Trigger adds ability ""talk"" AI waifus new feature something seen gacha yet, alot ones play pseudo-text message get scripted ""text messages"" characters (ex: Blue Archive, Nikke, Eversoul) way interact tap multiple choice option usually change pre-recorded dialogue all, Starseed still that.... yesterday, JP version gacha launched ton new improvements modes even native Korean version Global version has, (hell characters completely skipped Global version). relevant new addition introduction AI Chat system, everyday conversation characters, reply you. example: Unfortunately available JP version atm, hence grammar bad screenshot, google translated JP, even tho text sent english, JP version reply japanese. **BIG CATCH** currently 10 times per day unless whale stockpile extra chats get stuff like events. found interesting someone makes think possibilities... future waifu/husbando gachas instead usual scripted messages, devs trained AI could actually talk them.. know alot ppl already outside gacha, programming AI sound like character enjoy. Would immersive way talk waifu personally prefer scripted messages?","gachagaming","gaming"
"Azur Lane JP 8th Anniversary Event - Dance Amahara PV","gachagaming","gaming"
"Chasing Kaledorider CBT Pre-Download Server Opens Soon","gachagaming","gaming"
"made peace 50/50. daily time commitment actually struggle with. news HoYoverse's next Honkai: Nexus Anima game, seems like doubling trend. First Zenless Zone Zero (ZZZ), this... feels like even king massive open world pushing 'lightweight', hub-based games. really makes think valuable resource: actual, real-life time. years, meta new gachas ""go big go home."" Genshin Impact Wuthering Waves dropped massive, gorgeous open worlds us. yeah, amazing, basically second job. seen many people elsewhere talking getting ""incredibly burned pressure log onto every day"". ""open-world fatigue"" legit. makes sense devs looking new magic formula: good grind, story slaps, combat actually finish lunch break. look far see works. it’s big worlds versus small menus anymore; even definition ""open world"" seems getting lightweight makeover. seeing new games like Neverness Everness (NTE) Duet Night Abyss (DNA) get ""open world"" tag, hearing, traditional loop running across huge map, solving puzzles, getting pulled random adventures. Instead, worlds seem function like large-scale hubs collection missions. actually proves model incredible, perfect example Honkai: Star Rail. perfectly blends feeling discovery focused experience, giving us big, immersive world without demanding ""second job"" commitment true open-world RPG. top this, can't forget core, gacha mobile-first genre. whole appeal able pull phone anywhere, knock dailies play quick round. Huge, seamless open worlds, amazing PC, often feel clunky draining short, on-the-go sessions. So, brings us real question：If invest time perfect gacha game current lifestyle, What's ideal balance would actually earn time loyalty long run?","gachagaming","gaming"
"Anchor Panic Announced Tomorrow Official Release Game","gachagaming","gaming"
"Ananta officially announced Tokyo Game Show 2025","gachagaming","gaming"
"[PROMO] Ribbit Ranch Froggy-Themed gacha game making 48 Million Combinations Frogs Microtransactions! Let know think 🐸","gachagaming","gaming"
"COM2US announces upcoming 3D turn-based gacha game ""Star Sailors,"" one-week-long closed beta test scheduled start September 22 [Teaser Trailer.]( | [Gameplay earlier beta test (as ""Project Sailor"").]( [Official website.]( | [Facebook.]( | [X/Twitter.]( | [Discord.]( | [YouTube.]( | [Instagram.](","gachagaming","gaming"
"Maou Karin RPG - Koihime spin Gacha announced new Summer Swimsuit Event +daily gems Premium Gacha Tickets free giveaway pull new banner characters Pairen + Shanfu 🏝️🍹🌞 🌊 Dev team give every players daily gems + 20 Premium Gacha Tickets pull new swimsuit skin characters Pairen Shanfu ! need participate event quests ! F2P friendly o/ Also materials farm tickets farm items level characters +nation level like Gold coins/EXP orbs/ Jewel Stat Boost...etc wil increased ! usual feed food items girls, level affection level, read/skip personal stories (and Live2D H scene ( ͡° ͜ʖ ͡°) get free gacha gems. equip new characters previous event formation, also get bonus % rewards pull gacha+ level characters/their equipments/ nation buildings ! **P/s: know gacha game spin-off fandisc based main series** [**Shin Koihime Musou Remake**]( **from JP visual novel dev team BaseSon (different dev gacha). anyone interest main visual novel's story know get/install/play novel game English UI - PM privately guide :P** **There's also** [**the manga adaptation visual novel game series**]( **too, guys also support Koihime series Eng translation projects reading o/**","gachagaming","gaming"
"Seven Deadly Sins: Origin - Pre-Registration Open Google Play & App Store [Google Play]( [App Store](","gachagaming","gaming"
"Genshin Impact × Among Us collaboration starts September 10, 2025","gachagaming","gaming"
"mange play game playing gacha games? playing alot gacha lately like zzz, wuwa, hsr genshin ( know generic selection) really like story game main focus since start playing 4 gets bit overwhelming sometimes feel like enough time games, getting story grinding character completely caught games story expect zzz still played 2.2 story like want play games really feel like playing chore still find fun massive amount content games hard find time play games, like recently silksong metal gear delta came bought can't find time play end yapping guess want know time managing games become easy caught story? Since events something need come back for?","gachagaming","gaming"
"Tired Current Day Gacha mean negative light, enjoy ZZZ, WUWA, etc... kind miss gacha games *phone* games. days, gachas designed played PC console, big flashy graphics mechanics demand full attention. favorite type gacha always portrait-style, “pick play” ones. Stuff like Dokkan Battle, Ninja Blazing Dragalia Lost (RIP). Games built around idea could pull phone break, run event two, put away. style feels like it’s completely faded out. Don’t get wrong, I’m saying gachas shouldn’t depth. Dokkan, Blazing, Dragalia modes lock focus. games like ZZZ Genshin basically full-blown PC/console titles *happen* gacha systems tacked on. success, every new gacha tends follow footsteps. say: miss “classic” mobile gachas used be. anyone recommendations games old-school style, I’d love hear them. Right now, mainly play Dokkan Grand Summoners, occasional bit Uma. **EDIT:** Since people can't read... let clarify. know ""they're still making games durhur teehee uwu"" ...No not. There's barely original gameplay there, portrait orientation RARITY. 90% every new gacha either Mihoyo reskin, random turn-based rpg gacha, gooner slop. Learn think critically realize original game design happen anymore. ""calling out"" favorite gacha. like 90% gachas there. post was, saying tired new repeated formula. Gacha's used much individuality back day.","gachagaming","gaming"
"personal pet peeves regarding gacha games? things certain gachas general annoy monetization stuff? game lot unique races character designs...only game flooded human/humanlike women wearing next nothing OP there's point using anyone else, also makes game embarrassing play public. Thats caused drop ZZZ, whole Manato fiasco complete lack male S-Ranks pretty much S-rank cute/attractive woman, signed for. feels like trying copy games like Browndust 2/Snowbreak/NIKKE can't fully commit Chinese government would heads. problem game female characters playable start, love BanG D4DJ, really like Umamusume. Sorta related something similar Dragon Quest Tact. thought would like Dragon Quest Monsters game, started adding human hero characters game. special additional upgrade system unique them, get enough heroes there's point using Monsters anymore. sad Global EOS found","gachagaming","gaming"
"boss level game made realize actually strategize can't brute force way anymore us likely used characters games top list sort power also huge reality check fuckass whale understand everyone hates fat piece shit","gachagaming","gaming"
"Gacha vs Counter-Strike Skin Gambling: one OK one throughly turns game? thought that's really bugging lately. personally feel repulsed skin gambling scene Counter-Strike, point turns game itself. also OK playing gacha games, albeit spend money them. argued ""optional"" something spend money on. OK engaging gacha games F2P player, refuse touch CS2? monetary gain aspect? culture? Mafia-esque shit going around CS gambling? above? still trying figure myself, hence bringing discussion here.","gachagaming","gaming"
"Free 6 star character, portrait selector (constellation) Reverse:1999 second anniversary September 19th.","gachagaming","gaming"
"Azur Lane showcases upcoming 3D explorable game mode + reveals Commander official design 8 years without design (Doodle form + Human form end)","gachagaming","gaming"
"Destiny Rising perhaps greatest gacha game launch, imo legit worthy mainstream GOTY nomination game seriously shocking lot people quality lot people's First Gacha Game brings mainstream game type genre furst time. kind thing seen since Genshin. Destiny community floored good game Netease produced IP layered many us would take granted mobile MMOs. attest game insane degree polish QOL gate! game launched state games would dream 1-2 years release customer feedback. official PC client, fully playable emulator especially Netease's official one. major reviews key CCs Destiny also Gacha backgrounds: MTashed: Aztecross: Paul Tassi (Forbes):","gachagaming","gaming"
"""Generous"" Gachas myth. cost moves banner gear grind gacha landscape wild recently. seen unprecedented wave generosity, Genshin Impact finally gave limited 5-star constellation anniversary, Neverness Everness (NTE) launching without 50/50 system. feels like developers finally listening. Though, true price ""free"" characters easier pulls simply transferred gacha banner brutal, time-consuming endgame grind? mean Punishing: Gray Raven (PGR), farm S-rank character free time. incredibly generous, character feels incomplete without signature weapon, is, course, separate gacha. primary bottleneck shifts character banner weapon banner intense grind resources resonances. Epic Seven, getting hero price admission real, soul-crushing gacha: gear grind, weeks effort invalidated single bad substat roll. Arknights respects intelligence making material grind strategy, sheer volume resources needed E2 masteries creates long-term time gate real pity counter. philosophy seems future. even seeing games like Duet Night Abyss (DNA) take extreme step removing character gacha entirely, betting everything grind replaces it. think “generous gachas” myth. true measure game’s respect players easy get character. quality, fairness, respect player's time demonstrated entire progression journey follows. celebratory freebie front end easily become smokescreen much frustrating, time-consuming, psychologically draining grind back end. changes nature investment quick, exciting pull slow, potentially endless chore. honest, upfront RNG gacha banner win lose, hidden, time-consuming RNG gear grind never truly ends? game think actually gotten balance right?","gachagaming","gaming"
"Tower Fantasy officially joins Tokyo Game Show 2025 lineup","gachagaming","gaming"
"Arknights Endfield exhibited Tokyo Game Show 2025!","gachagaming","gaming"
"Persona 5 Phantom X global making improvements Guaranteed Banner (110 pulls pity, 50/50, uses currency regular banners) coming october/november Free dupe one character (The standard characters/Joker/Yui/Minami, getting added later. Dupe system include limited characters CN) promises free dupes future Free 5 star weapon selector end month Joker banner available 30 days new players, regardless start rewards dailies/weeklies, plans login events Adding extra plan (Basically tutorial goals rewards). Overall seems like actually attempting course correct","gachagaming","gaming"
"MMO currently one maining/playing most? curious, typical answers WoW FF14 mainly trying see general MMO landscape looking like right now, main game right also say why!","MMORPG","gaming"
"games cross server discrepancies character profiles? Since starting Uma Musume month ago noticed several discussions horse girls' three sizes [supposedly] in-game profiles. However looking global version clearly see information nowhere found. reminds time Blue Archive opened China ommitted students' ages profiles. Also, milder extent, English version Blue Archive lists heights Imperial instead metric like every server. games anything like character profiles?","gachagaming","gaming"
"powercreep make people stop spending money even drop game entirely? Hi everyone. generally gacha gamer, rather consider open world player. gacha games played longer one day / week Genshin Impact, Wuthering Waves HSR. spent money three games, dropped last two games beloved characters put much time sometimes money started falling off. considering either dropping Genshin going f2p continuous powercreep. always defended Genshin even several years release, could still clear content initial main 1.x characters. ever since Fontaine especially Natlan powercreep going rails (in non-gacha-experienced opinion) already made limit monthly spendings battle passes welkins. wondering: powercreep drive away people gets spend money? possibly profitable? experienced gacha gamers accept money spend eventually ""a waste""? FOMO work fallen deep stop now? (For record, get gacha games powercreep keep sales up, especially games played, feel like people would still buy new characters like them. assume would case story-driven games?)","gachagaming","gaming"
"Nexon's full statement Blue Archive hack, happened comes Nexon released statement yesterday's hack [ addition 840 yesterday's update also provide compensation rewards","gachagaming","gaming"
"IP expert says Genshin Impact dev's new Pokemon-style game ""clearly infringes"" hard-to-avoid patent Pocketpair accused infringing","gachagaming","gaming"
