"The Infinite Warfare Campaign is a space nerds wet dream This campaign is very underrated. There are 0 bad missions, great characters and writing, awesome set pieces and scenarios. It really felt like the writers were waiting to make a space game because it oozes with love for the genre. Its sad we won't get another COD like this for a while. ","gaming","gaming"
"Honest question small updates + thank devs! small updates get released, really corrupt saved games? small updates, mean went 1.16.1 1.16.2. Or whatever actual number is. ask constantly deleting run would start new one. Especially warning game gives whenever update. vaguely recall someone saying small ones won't. apologize question answered million times already. also want acknowledge work devs keep updating game! longer constantly listening new nomadic songs loop! + balance confederations lol. Thank work ya'll do!","CrusaderKings","gaming"
"Level 1455 Cheating Guy Thought bring allegations regaring Hypros on reddit/ Know Mercy on game guy random post found. Contains pretty useful info. compilations dropped later. Clowns still support him, stay tuned.","insurgency","gaming"
"Recommend ship mid late game.. Atermis torps Monitor longer works best ship weapon Artemis torp Monitor ship blueprint ... What's mid late game?","TerraInvicta","gaming"
"Squirk…..? know viral thieving method sorc garden run little maze gather lil fruits. world people still die?","2007scape","gaming"
"going laugh lot this. PC RTX ray tracing mandatory want play, impossible play game; let in. bought Game Pass could play start. wish developers would give people without RTX chance enjoy game future, think that's going happen. sad everything :","Doom","gaming"
"Career Progress. much actually Solo? So, looking clothing store found attain several outfits completing Tier 4 challenges Career Progress. upon checking them, realized cooked most. GTA Online, online game, expects play people. problem is, 99% player base GTA online toxic worse COD game. removal Lobby Chat hard ask around people help grind challenges. though, many Career progress Tiers actually finish alone, without beg help Bare mind, comes fact IRL friends take game serious do, Heists, challenges require Hard mode anything involves skill question them started scratch Expanded Enhanced Version grinding Solo stuff build up. Agency, Nightclub, Cayo Perico, extent Gunrunner. Im looking forward getting Niko Bellics outfit. help ideas, much appreciated.","gtaonline","gaming"
"It Takes Two has ruined gaming Not everyone has friends that want to play co-op games. All my friends want to play cod or cs or league. The amount of games announced that are co-op only is disheartening","gaming","gaming"
"pretty new miner 19 hours. Today unknowingly joined modded lobby gave 45 material lots xp. highest class level 21 Scout, level 10 Gunner. Driller Engineer level 1. Well, were. first game playing Engineer, completing mission boosted level 25. Additionally, also raised overall level 15 18. way undo this? really wanted play legit. know even thing joined lobby. noticed mine ores thought bug. expecting completely ruin game save... 19 hours playtime, probably 17 spent Scout. even higher level class one 20 minute game!? Whoever made lobby stolen lot newly gained love game. understand point playing going this? Especially let people join unknowingly? guess ranting point. Rock stone, guess.","DeepRockGalactic","gaming"
"MindsEye launches myriad glitches issues, developer promises performance update","gaming","gaming"
"Playing phantom liberty may dumb question, finish phantom liberty main story, continue playing after? like end keep going main game point return I’m halfway main game rn. Thanks!","cyberpunkgame","gaming"
"rank mean skill? brother play Rhythm games, plays O!m PC play MALODY 4 phone I got PC. debating whether rank = skill. said rank good way gauge skill said rank tells good player is. true?","osumania","gaming"
"Never played Oblivion loving remaster got question item scaling… items scale? want mages guild I’m level 5, don’t know items I’m gonna get don’t know powerful mage items obsolete time I’m higher leveled won’t worth it? guys think?","oblivion","gaming"
"Anyone playing glacier sorc currently how's feel? middle planning next build. Got 2 options one glacier sorc. Basically stacking like 2k+ mana using lost knowledge seed helmet get solid base ward per sec ward cast based total mana stuff. thing sure actually feels play later. done leveling glacier + mana strike really used glacier end game. run around glacier needed pop ice barrage arcane single target ? seen someone uber glacier sorc that's really issue playstyle feel one.","LastEpoch","gaming"
"Never playing Spire never even liked dungeon first place, Ultimatum like pulling teeth, bonus points trying get gold every encounter. Can’t wait another week 2 play second worst dungeon last year again.","destiny2","gaming"
"D:TDA great far, couple things really hope change. Aside Dragon missions knew people didn’t enjoy even game dropped, couple little gameplay things get nerves quite bit. big one put away shield switch weapons. cannot tell many times I’ve middle fight died tried switch situationally optimal weapon completely removed ability block incoming attack 2 seconds. can’t really think way limitation serves gameplay? really fucks combat flow major way leads copious amounts frustration. Second input lag, specifically, cannot cancel actions reactively. go melee Hell Knight, can’t reactively cancel melee attempt block incoming attack. Instead, character follows melee through, gets reduced 5 HP, *then* blocks, know, point entirely moot. also can’t switch weapons one new slo-mo melee glory kills, disappointing gives enough time pick one want follow exit slo-mo without actually giving ability so. Anyway, core combat really good satisfying. Great game. hope becomes common complaint patch things out.","DOOMTheDarkAges","gaming"
"pain rework idea pain interesting perk bc actually pretty strong. grants 20 aim assist x handling d2foundry light.gg don’t specific handling measurements max 10 stacks pretty good, stow weapon lose it. idea would halve stacks gained pain maxes 5, granting 10 aim assist, 20 handling 20 reload speed, keep benefits you’re defeated like new land beyond’s perk. would keep line likes lone wolf grants 10 aim assist you’re alone. handling reload speed could reduced like 10 each, wanted add reload speed perk could used pve rolls well since handling reload nice pve. Thoughts?","DestinyTheGame","gaming"
"getting gifted characters? characters around 30k power playing noticed 30k power sentinel roster leveled red stars, lady death strike gets gifted like sentinel, ive checked online find anything. event this? please tell","MarvelStrikeForce","gaming"
"complete Season 2 Tee Challenge completed objectives except “Complete quest: Wednesday Equip @ Earn”. Thursday says challenge expires five dayswasn’t able complete yesterday. complete challenge?","PGA2K25","gaming"
"lot shooter games seemingly afraid creative arsenals? huge issue, something find slightly... dunno, frustrating might word. whenever see new reveals showcases like, seems extraordinarly rare game includes shooting mechanics go way try anything basic comes weaponry. Pistols, Machineguns, Shotguns, know usual. exceptions course (For example Outer Worlds 2 shown examples ""non standard"" weaponry) almost every shooter, 3rd 1st person seems plaster ""Assault rifle, SMG, Sniper"" little variety bothers me. One reasons post perticular saw Dead Space fans talk Chronos could maybe scratch itch crave first thought ""Maybe, starting pistol satisfying plasma cutter however"" made inspired make post. dunno, wish bit creativity displayed shooter genre all. (Where stake bolt launchers? Remember nailing enemies walls? shit anymore :( )","gaming","gaming"
"miss times you’d pick game based cover alone Showing age bit fond memory picking Metal Gear Solid PS1 local store. idea game was, never read it, heard thought case cool. couple decades later it’s still one time favourites. Nowadays research game watch gameplays etc buying think takes magic experience little bit. Anyone else miss good old days lol","gaming","gaming"
"Dear Groot players Iron Man secondary main Please love everything good world hit Groot ult IMMEDIATELY BLOCK WALL. least pay attention wall is. lost countless multi kill pulse shots Groot either placed wall directly front firing taking people trapped.","marvelrivals","gaming"
"Fallout 4 mod soft lock help Hey need help getting situation in. wanting play game terrible fear phobia flying insects. able get vault first house went wasps closed game played yeard. want play able find mod removes bugs game, first vault can't pick pip boy open vault leave apparently combat. way around maybe another mod could install? advice appreciated thanks help. I'm playing PS5","Fallout","gaming"
"Fun Support climb bronze playing league year started Jungle migrated support thats play style. hard stuck bronze atm want fun support climb bronze with. Played lot fiddle support month ago lot success got bored. Currently playing Nautilus Pyke getting bored again. want support thats fun play high impact game. Also add like meta stuff, played fiddle everyone played went Ornn bronze adc want Ornn.","supportlol","gaming"
"ice fire build good? Rn two bandit curved swords. One cold affinity chilling aoe fire one flaming strike aoe. feel particularly powerful. tips? If work gonna make bleed build","EldenRingBuilds","gaming"
"LIGHT LANTERNS FREEZING HYDRA 500 mastery weopens upgraded dragon talon. died becuase afk levi fight instead helping went hydra get ready freezing freezing changed draco talked wizard said weathers bad take shelter dojo. ingnored coulnt light lanterns flickered died. PLS HELP ME!!","bloxfruits","gaming"
"Platform games question like games like Sonic, Megaman, Mario.. Since games generally much shorter games, make them? finish don’t touch again? redoing levels?…","videogames","gaming"
"would give new Wolverine event MVP scene get skin? MVP screen skin exclusive. cannot use MVP screen without skin, vice versa. would give MVP screen get skin? Unfortunately, cannot play event enough, able get skin. get would give MVP screen skin. Now, MVP screen never able use, seems dumb, IMO.","marvelrivals","gaming"
"Looking game that's combination Fable 1 + LOTR, large scale battles later thought maybe ""Kingdoms Amalur: Re-Reckoning"" would large scale battles, doesn't. Although art close Fable love looks. checked ""Lords Fallen (reboot)"" also small battles ton boss fights, art completely different, liked enough check out. closest found ""DYNASTY WARRIORS: ORIGINS"", art direction completely different Fable. hoping someone point games never heard of, fit criteria. Side note: Even Fable reboot even look like Fable makes sad.","gaming","gaming"
"BMX XXX Records beat? playing BMX XXX, records broken. One is: ""Highest Mark"", NPC Hellkitty scored 20' 0"". anyone know means? trick something? trying get 100% game, things idea are. Boot Fruit, example, found years buying game skaters guy selling fruit.","AskGames","gaming"
"much time dailies take up? Bit fan Persona familiar gachas. mainly play Wuthering Waves HSR dailies finished like 5-10 mins. P5X, outside things like story event quests much time dailies/weeklies take any?","personaphantomx","gaming"
"Lost progress Max Payne 3 played chapter Max shoots police station. stopped playing week two come back find progress lost. uninstall it, lack Steam Cloud issue. cheats commands use get specific chapter finish playing peace?","maxpayne","gaming"
"think Nintendo struggles make next gen console. Think it, Nintendo always behind comes power devices. gaming whole buy console play games it. whole industry messed every device playing pretty much every game companies companies exclusives would found console. Since industry standardized today people shit Nintendo making console could hold competition. That’s Nintendo doesn’t care, since unless you’re spoiled PlayStation Xbox, people agree Nintendo games fun keeps consoles selling, since again, industry spoiled cares power. kinda sad see this, since NINTENDO COMPANIES TAKES PRIDE CONSOLE. Switch 2 good example this. powerful, no, still fun, really matter, absolutely. PlayStation hand made play station thirty years(and PsP). changed anything consoles hardware, power software. Xbox. got New Nintendo 3DS month ago since wanted play games there, holy shit missing out. Even though Nintendo still making pixilated screens 2017, don’t care since games fun. love thing. industry less power, companies didn’t try always next gen every game wasn’t available million consoles. gaming would still feel fresh fun like 1990s 2000s. please agree that.","nintendo","gaming"
"played 30 minutes Doom Dark Ages played game beat first level. image little soft, it’s truly bad all. I’d say it’s par sharpness Doom 2016 system. frame rate rock solid far. I’m happy answer questions!","XboxSeriesS","gaming"
"Mindseye's launch unmitigated disaster players report horrifying glitches poor PC performance","gaming","gaming"
"Modern games vein Champions Norrath, BG Dark Alliance? really fun back day, moderns games inspired ""console arpgs""? know newest ""Dark Alliance"" game","gaming","gaming"
"game made rethink everything knew gaming? favorite game — mean one changed way look games whole. one game made pause think: “Wait… games actually this?” me, Last Us — characters, pacing, emotional weight. didn’t feel like “just game” anymore. you? game completely flipped expectations made feel something new?","gaming","gaming"
"I’ve got Switch 2, there’s reason keep Switch 1, right? Every game backwards compatible, right? account saves copied over, OQ unit basically obsolete. give factory reset sell it? missing something? We’ve got two Switches currently. kids fire minecraft (we’ve got two physical copies game) play multiplayer. still possible Switch 1 Switch 2 combo?","gaming","gaming"
"Game suggestion newbies PC gaming played friends? & friend new PC gaming, suggestions? would really appreciated guy reccomend free games cheap games (on sales)","gaming","gaming"
"Can’t find Game! CG trailer unreleased game came time last two years so. looked extremely similar Thick Thieves. cartoon stylized Victorian theme. genre seemed PvP. trailer CG simulated gameplay, characters specifically Card Based abilities. making up?!","gaming","gaming"
"Rockstar chance funniest thing GTA 6 releases $60. Imagine many companies would slap face making game $60 much detail gameplay elements others put mediocore incomplete $80 games. know NEVER happen. IF. IF. does.","gaming","gaming"
"tried Pokemon Violet years Pokemon. look like this? hardcore pokemon fan. played 3 gens, years apart. Emerald White/White 2 great casual , nothing stood bad looks gameplay. last played sun amazing, gameplay felt fresh, like direction took artstyle. Recently got itch get back gave Violet shot man hype died fast. intro felt rough: choppy transitions, sometime awkward camera angles, walked particularly bushy spot outside house game stuttered evrytime went back forth lol. Everything seemed unpolished. Also know Violet's case, felt weird hear single dialogue, even grunts, chuckles one-liners like usually hear jrpgs. silence jarring. get better? worth continuing gameplay?","gaming","gaming"
"Holy Cow BLUE PRINCE initially little skeptical holy moly Blue Prince one amazing games I’ve ever played. Admittedly missing things I’d like seen haven’t even come close finishing think I’m playing it. wife playing PS5 play Steam we’ve comparing copious notes. game rules please buy play all.","gaming","gaming"
"biggest gaming hot takes? Mine think last us 2 really good game witcher 2 better witcher 3","gaming","gaming"
"videogames enemies actually act ""elite soldiers"" ? Often enemies/guards trained professionists per lore, instead weak dumb generic enemies. get saying, used guards falling hands protagonist, reality, really like that. limited modern elite troops also ancient ones. feel nerfed. game feel like issue? Edit : wanted join mention Assassin's Creed Rogue ""assasin Hunters"" spawned fucked around bit much, stayed true name. Unlike basically every npc game lol","gaming","gaming"
"Stealth archers archers. rapid fire athletic dodge archer Legolas, 3 arrow shotgun burst Robinhood? Games constantly insist archers Snipers, sitting incredible range sleath one shorting enemies. often makes archers best class game (Baulder's Gate Skyrim immediately come mind). creates problems, notibly well known ""every character stealth Archer"" situation Bethesda games suffer from. issue necessary sleath Archer good, even another way play archer available. Games even attempt offer alternative, often making perks/abilities archers tied stealth range. possibilities as: *Increased foreign speed make mid range archer great, giving advantage stealth simply able put damage firing arrows quickly. *Firing multiple arrows spread like shotgun deal burst damage close range. *Adding notching arrow movement, instance, dodging jumping bow automatically notches pulls back arrow dodge counterattack. *Utility like wire traps, sharpenel/explosive arrows, grappling. many ways allow players play archer videogames, popularity Bethesda's Stealth Archer convinced entire industry way create archers videogames offering alternatives waste development time resources. Bows guns. Imo, fantasy medieval game bow bow, sniper rifle. used like sniper rifle (bc yes stealth archer fun), least give uses optional play styles. like see change industry. games think provide better archery: Monster Hunter archers mid/close range acrobatic dodge dancers, Overwatch Hanzo wall climbing stratigist snipe range expectional aim due able zoom like sniper rifle, BioShock crossbow different bolts explode create electric wire traps used utility.","gaming","gaming"
"Strategy web-browser games play friends Hello there! recently joined bunch friends (we 4 - 5) ""nostalgia attack"" decided play Ogame while, laughs. played month eventually dropped game, 30+ y.o. stuff do. main problem another player (him me), actually put several hours friends. felt quite far behind, got bit bored. looking similar games play them, require level commitment. First took look Gameforge games but, well... good dupes others games know. looked games played several years ago (the old reliable ones), let's say aged well, quite complex, simply longer exist (Tribal Wars, Travian, eRepublik, etc.). anyone know free strategy/resource-management browser games play group friends? looking something that's fairly accessible require constant attention. Thanks!","gaming","gaming"
"many games show impeding doom horizon introduction, controls handed player free whatever want, completly disregarding danger, world story wait player. games treat time urgency seriously? best example Pathologic 2, life goes on, events happen independently player, can't save everyone wasting time picking flowers (or maybe picking them? ;) ) means people die turn you.","gaming","gaming"
"Splitgate 1 fan, disappointing see game's release unfold. Die hero, live long enough become villain. I’ve fun Splitgate 2 Beta, get wrong. game watered mass appeal stuffed brim $70 game skins microtransactions. become things claim loudly against. thoughts?","gaming","gaming"
"Mario Kart World Mario Kart absolute best Mario Kart World best Mario Kart yet. (It’s personal favorite though, MK64 wins there) gameplay refined. tight controls feel great natural. graphics bright, fast, beautiful. game also feels lot fair Mario Karts - less lucky wins/losses much skill-based. worth price Switch 2 game? No, it’s not. obviously games released, thinking like doesn’t make much sense. worst part Mario Kart World missed opportunity open world. It’s weak lacks incentive. said, Nintendo created refined game even though open world meh, it’s still fun enough. Switch 2 nice, tight, well-made package Nintendo going destroy generation MKW indication.","gaming","gaming"
"Praise Games Multiple Loadouts Devs yall don’t kno much make things better giving sense dual loadouts RPGs. games bring inventory swap loadouts. Kind sucks time keep switch. Sure don’t switch lot play game I’m running sword shield want initiate fight get upper hand bow range don’t want pause equip bow kill one two pause reequip shield sword continue play. like able hit button swap shoot swap back go swinging.","gaming","gaming"
"played game hooked much since botw im 4th playthrough beaten simon expert twice. goty sure","gaming","gaming"
"best gaming experience life (Journey) don’t remember exactly Journey came out, remember seeing preview thinking looked interesting. never played anything developer before, something stood out. day launched, downloaded jumped in. menu screen, HUD dropped right game. man, absolutely gorgeous right start. took time wandering early levels, soaking everything in. point, came open area started exploring. nowhere, heard little noise. again. realized another character. point even know multiplayer game. way communicate game little chirps character could make, either quick one longer, stronger one held button down. voice chat. Nothing else. somehow, perfect. random person started exploring together, figuring simple puzzles game throws you. didn’t take long totally sync, using little chirps. started figure rhythm system, actually felt like communicating better co op games full voice chat. ended whole game together. Start finish. wandered beautiful environments, helped out, solved everything team. you’ve played Journey, know ending is, hits hard. It’s beautiful, emotional, sad, uplifting once. moment really stuck credits rolled. game shows username person played with, mine someone full Kanji name. Japanese, likely didn’t speak English. that’s hit me, we’d voice chat, probably wouldn’t made past first area. wouldn’t understood other, probably would’ve left. game showed words aren’t always best way communicate. many ways understand connect people you’re open it. little experience decade ago honestly changed see lot things life. made patient, understanding, willing figure people even don’t speak language literally figuratively. Anyway, I’ve told story friends years, figured time share people might really appreciate it. experience always stick me.","gaming","gaming"
"isometric real-time combat RPGs exist similar Baldur's Gate Dark Alliance (2001)? never found comprehensive list genre titles aware of: Ascent Baldur's Gate Dark Alliance & II Champions Norrath Champions Return Arms Diablo I-IV Fallout Brotherhood Steel","gaming","gaming"
"who’ve played it, thoughts Remains Edith Finch? Finished last night pretty crazy game exploration/ walking simulator game! surprised much could fit lines story characters.","gaming","gaming"
"games worst repeating enemies, different colors trope? Recently played Enshrouded enemy variety improved, enemies exact move set, different model. reminded lot Megaman NT Warrior games enemies different color. games worst this?","gaming","gaming"
"What’s one game moment hit right feels stayed forever? flashy boss fight epic victory — quiet, unexpected moment made stop, think, even tear up. kind scene gameplay wasn’t fun, meaningful. me, Red Dead Redemption 2 — heartbreaking scene Arthur watches sunrise, reflecting everything he’s done. wasn’t game moment, felt like real farewell. you? moment game touched way medium ever has?","gaming","gaming"
"Retro controls modern gamer favourite aspect Nintendo Switch Online. Can't wait put Soul Calibur 2 paces Gamecube controller (that finally arrived today trials tribulations Royal Mail!)","gaming","gaming"
"Anti-capitalist RPG Outer Worlds 2 Xbox’s first $80 game, obvious Game Pass marketing push, proof AAA gaming truly cooked","gaming","gaming"
"Assasins Creed Scam Steam hope way shine light , crazy hasent talked really. Assasins creed 1, 2 3 unplayable still sold. require online played isnt supported anymore, u get error... hope least someone sees doesnt buy it, maybe way get unlisted/fix it(yea know wont happen)","gaming","gaming"
"Assume woke year 2125. video game suprised still popular? mean games like chess, poker, go, etc. mean purely video game titles.","gaming","gaming"
"ever game ruined fandom? sure common thing like know game happened. personal experience fallout Fandom honestly ruined fallout NV even tried never really able enjoy game it.","gaming","gaming"
"else add Must Play List? Must Play Games - [ ] Complete Skyrim + DLCs (All achievements) - [ ] Fallout 4 - [ ] Fallout New Vegas - [ ] Red Dead Redemption 2 - [ ] GTA 5 Story - [ ] Minecraft (All achievements bosses) - [ ] Halo Reach - [ ] Halo Combat Evolved - [ ] Halo 2 - [ ] Halo 3: ODST - [ ] Halo 3 - [ ] Halo 4 - [ ] God War Ragnarok - [ ] Cyberpunk 2077 - [x] God War(2018) - [x] Elden Ring - [ ] Warframe (complete story) - [ ] Black Myth Wukong - [ ] God War - [ ] God War 2 retro consoles im open adding old titles list well","gaming","gaming"
"Preferred Input Device curious, playing game supports kb/mouse, controller, touchscreen equally well, preferred way play? Personally raised PC actually tend prefer controller. makes glad console games exist even though console gamer myself, otherwise would many quality controllers choose PC. mostly curious common touchscreen gamers are. Mobile obviously significant market, Switch Steamdeck gaining popularity well wondering common becoming.","gaming","gaming"
"GTA VI comes Xbox play anywhere, Xbox play anywhere PC... Could play GTA VI PC? Look terribly desperate wait game come PC 2027 least.","gaming","gaming"
