"missed lot games younger due playing MMOs want play iconic single player titles...what ""essential"" video games time play? Title really literal, know none essential still...ones defined generations, considered peak whole media gaming. missed lot games due pretty much exclusively playing MMOs friends years ago. exactly 'rut' terms finding games, sometimes overthink end playing nothing. mind really want play Metal Gear Solid series, Dark Souls, Mass Effect, Resident Evil, Street Fighter etc. Really iconic games (and series) pretty much made gaming big is. genre counts. want play many classics learn made great hopefully important line. missed many.","gaming","gaming"
"best mod ever! :) level modding finest, declare Horn Abyss **official** game expansion **Heroes Might Magic 3**!","gaming","gaming"
"Microsoft totally rule SGF? clarify mean console wars way, idgaf shit. mean, presentation-wise switch 2 ps5. absolutely expecting bangers two systems. Instead got shit ton actually major exclusive announcements Microsoft? Good thing ain't exclusives anymore, holy shit imma honest that's expecting SGF turn out... kept disappointed event event Xbox's presentation. Anyone else sharing sentiment? know state play hyped people fighting games FFT remaster, like 0 new Sony Studios game. well anything Nintendo exclusive (unless missed piece news) Obviously ***personal opinion***, nothing get worked","gaming","gaming"
"Call Duty campaigns actually worth playing? I’ve played ton COD multiplayer years never really got campaigns. Lately I’ve thinking going back trying few, see missed. ones would say actually worth playing? I’m anything solid story fun missions general. Doesn’t matter it’s old new. Also, didn’t make zombies campaign one point? good one-off thing?","gaming","gaming"
"Lies P Overture -- Bloodborne inspired game DLC came recently perfect time..","gaming","gaming"
"able play PlayStation games Xbox [ >This aggregated gaming library means you’ll see games Xbox, Game Pass, PC games installed Steam, Epic Games Store, elsewhere single interface, much like GOG launcher offers.","gaming","gaming"
"Persona 4 Revival - Teaser Trailer | Xbox Games Showcase 2025","gaming","gaming"
"one prefer: Bad story good gameplay? Good story bad gameplay? simple examples think of: \-First one: Vampire Survirors \-Second: Alan wake","gaming","gaming"
"games fall afoul ""here's powerful ability, every enemy actually matters immune it"" trope? Classic example: poison damage. Every game poison damage every day weenies die quickly poison effect useful, fatties bosses immune it. Instant kill effects same. enemies works rank file canon fodder need it. examples games fall afoul this?","gaming","gaming"
"Beast Reincarnation - Reveal Trailer | Xbox Games Showcase 2025","gaming","gaming"
"Indiana Jones Great Circle: Order Giants - Official DLC Reveal | Xbox Games Showcase","gaming","gaming"
"popular game started negative trend gaming? say Fortnite live service Edit: Sorry meant popularised","gaming","gaming"
"pre-rendered cinematic trailers please time year start seeing summer game showcases wanted call cinematic trailers. kid thought pretty neat, showed much better graphics real game. adult, really annoy crap me. want see game, trailer reflect game graphics all. trailers get hyped usually annoy me. looking Elder Scrolls 6 trailer.","gaming","gaming"
"first game crossed 1000+ hours gameplay? GTA San Andreas probably","gaming","gaming"
"games benefit Switch 2? cool see many people talking interested original Switch games getting second life sorts Switch 2, like Pokemon S&V, games sort. wondering, based experience heard, games benefit extra power? play many original Switch games outside Odyssey BOTW/TOTK, looking games worth picking up.","gaming","gaming"
"Deathloop. Wow. Borderline hated game. Finally beat game (\~21 hours) sat backlog couple years. heard launch pretty mixed reception, loving Dishonored 1 2 Prey, thought finally check out. game sucks. boring, tedious, uneventful, full backtracking, EASY, worst AI see game, massive slog. Unfortunately condition compels see every game credits, man, game absolute chore. last couple hours borderline disrespectful sequence forcing visit several areas repeatedly unlock new area. give game rating 6/10. high due incredible art design, music, voiceover work. rating based sheer gameplay, would 3-4/10. generally one conspiracy theorist (paid review etc), genuinely cannot understand reviewer giving game 10. unreal. best, game low 7. Like, Dishonored-esque powers, seems like waste time play ""creatively"" walk around headshot every enemy silenced SMG. I, player, need ""find fun"", think devs failed. Anyways, hope save someone's time playing Deathloop. Ughh.","gaming","gaming"
"Modded games good rightful sequels? I’ve really gotten Project Diablo 2 Downfall Slay Spire mod. mods games realms good feel like rightful sequel?","gaming","gaming"
"Single player game recs someone usually plays multiplayer? got gaming 2020 almost played multiplayer games good new old single player games start with? preference nothing open world","gaming","gaming"
"Survival PvE Base Defense recommendations Per title, looking game suggestions feature survival base defense. Something like Forest 1 & 2, Conan Exiles, etc. PC mod suggestions welcome too! Oh multiplayer","gaming","gaming"
"Steam Demo SGF Cool demoes-currently available Steam Summer Game Fest showcase Holstin . - Survival Horror Hell Us .- 3rd Person Open world Formula Legends. - Racer Ferocious.- Survival FPS Escape Duckov. - Top looter shooter Ascend Zero. - Action Roguelike. Prison Husk - souls like. Mio -Metrovania. Phase Zero - Retro Survival Horror Hollow Knight Silk Song getting shadow drop buzz tomm . Apologies formatting , new","gaming","gaming"
"Owlcat announces Expanse: Osiris Reborn seem moving crpgs full 3rd person RPG now. seems interesting hope keep writing depth pathfinder games.","gaming","gaming"
"frustrating part video game you’ve ever played? Asking I’ve playing Nightreign loving it. EXCEPT teammates don’t work together, feel frustrated ever playing video game.","gaming","gaming"
"Former ROM Hackers Reveal Wildbound - New Open-World, Monster Taming, RPG","gaming","gaming"
"Alan Wake 2 Deluxe Edition worth buying 32$ PS store? Could game difficult someone haven’t played many survival horror games before? also play second game without playing first?","gaming","gaming"
"New mobile MMO’s UI… It’s genuinely unplayable 😅😅 (Athena: Blood Twins REALLY want to)","MMORPG","gaming"
"Monsters Memories Stress Test Stress test happening weekend leading first playtest year. lay ground work successful playtest. Come learn game see latest get feel game. # Monsters & Memories Stress Test (June 14th, 2025) holding Stress Test Saturday, June 14th, 2025 1pm Eastern. Technical Stress Test, lots progress work may unpolished, imbalanced, broken. also possibility lag stability issues. running longer, stable polished 3 Day Playtest starting Friday, June 27th, 2025. **Details** - purpose Stress Test see currently server stability - Stress Test last approximately 4 hours (ending around 5pm Eastern) - run stability issues, may patch game or, absolutely necessary, end playtest (with hope running another coming days after) - details Characters Servers available come **RSVP Here:** discord record numbers collect data. ## Register/Download Client - Register account log < - (If already made account previous tests, log in) - Download Patcher - Make sure patched day test - (Optional) Read play Quick Start Guide < look forward seeing there!","MMORPG","gaming"
"Anyone Jumped EvE Frontier Alpha ? got Founders pack ? what’s thoughts? Hi , Looking honest thoughts EvE Frontier game, game recently caught attention outside looking really looks like could good , promising game. newer MMORPG world never really experienced new game launch. interested maybe jumping one , 100% positive wanna seeing many new MMOs failing days. don’t ton finances invest various games would really like experience new game launch lifetime. far game looks like could potential haven’t able find anything bad. wondering anyone jumped ? believe it’s alpha atm founders packs , think it’s worth ? Why? play EvE online Black Desert online personally. love sandbox aspect also enjoy survival games think life skills Professions games give kinda survival game type feel really feels good saw EvE frontier aiming Horror, MMORPG , Survival type game seems like would right alley. bad launches happening, nervous investing without hearing players already played feel. Anyone tried , think it’s worth ? What’s things dislike far ?","MMORPG","gaming"
"Dream MMO # Xbox Game Studios Flight Simulator Map never understood XGS never thought making actual 1:1 earth sized open world game based google maps coordinates, achieved FS2024 enhanced graphics overall quality game compared predecessor FS22, MMO single mega server map size earth? know Star Citizen Light Fire studio cash flow tools need make 1:1 earth sized MMO game millions players shared persistent server today's modern setting players able create cities, towns communities, travel thousands miles vehicles planes, adventuring dozen biomes landscapes","MMORPG","gaming"
"miss 2000s/early 2010s eastern mmos… Grand Chase, Drift City, Rumble Fighter, Mabinogi, Combat Arms, Elsword, GunZ, Maple Story, Habbo Hotel, list goes on. used love games (despite issues) best part EVERY game used widely active time, could hop one game still playing massive population people. also used huge PVP aspect old MMOs kinda doesnt exist anymore, remember really fun pvp matches grand chase, drift city rumble fighter feel like it’s rare get unique mmos like drift city rumble fighter get one doesnt die like year two. know games still around they’re either dead/barely populated ran ground. best part games imo distinct art style aswell (maybe me?) feels like newer MMOs nowadays kinda similar art style presentation, similar settings, similar gameplay etc. Basically im saying used specific era MMORPGS used life little kid miss that’s essentially gone lol, tried bring back (Drift City Remastered, Grand Chase Classic) Dead Arrival :/","MMORPG","gaming"
"NDA - Chrono Odyssey gameplay, UI Hey, Looks like NDA restricts players participated media group beta test, Here’s link video showcasing gameplay, mounts Chrono odyssey","MMORPG","gaming"
"games let play villains/evil faction? One favorite things MMOs able play “Villains”. Class! Warlock, Necromancer, Etc. “good faction” choose too. mean Race. Sith, Villains, Goblins, Orcs, Demons, Undead, Tauren/Minotaur, Trolls, Ogres, Etc.. favorites are, 1. WoW 2. SWTOR 3. Warhammer Online 4. DCUO 5. SWG 6. City Villains. 7. LOTRO “Monster play” fun ones play bad guys? Complete quests, Unique Starter Zones, cause chaos destruction villagers whatever.","MMORPG","gaming"
"[Planetside 2] really like how, using ton clan resources, single player call orbital strike upon big battle send dozens players vehicles flying around. really wish action combat, open world PVP MMOs level interaction players. [This short clip]( recorded low res, low graphics settings playing Steam Deck. imagine fighting one hundred players base, massive laser beam sky turns flaming debris flying battlefield. mean happens quite often kinda upper ground wanted share epic view :V really wish ""fantasyside"" type game, suggested trying GW2 ESO already started getting GW2, sure level awesomeness replicated open world PVP modes. sad kind stuff become pretty much alien tech even talking games released 10 years ago.","MMORPG","gaming"
"Mmo friends like try game try game play healer want play tank mix match. Friends share love mmos look forward new one like Chronos odyssey blue protocol fun playing current ones together like New world, Throne liberty ext. would say tried almost every mmo that's right mind possibly trying convinced, social gamer friends keep loving games","MMORPG","gaming"
"game scams, possible social engineering part game? I’m talking stealing account itself. game scams appear free trading. There’s ways developers deal it. - Make ToS, it’s reportable ban able offense - Reduce completely remove possibility scam mechanically, like removing player player trading everything go optimized marketplace - systems player interaction scams encouraged, part world add game instead detract. opposite would centralized trading, everything must go people directly, naturally services various things form, individual sub groups specific trading form, sub communities trade other, etc. Decreased efficiency increased social interaction, way bad actors trying take advantage system. guys think? preference? scams completely unacceptable don’t want deal that, actually like that? think lot people stories kid playing RuneScape getting completely bamboozled really dumb way, looking back it, sucked, interactions like fun make people social.","MMORPG","gaming"
"opinion, MMO interesting Healer mechanics and/or fun Healing you? mmos lack healers ""support role"" MMO dynamic engaging Healer role you, either Unique non typical norm fun due non-class related things?","MMORPG","gaming"
"MMORPG Fun Engaging Tanking? I’m curious MMORPG think offers best tanking experience, why? I’ve played major titles recent releases, still haven’t found another MMO gives satisfaction tanking Elder Scrolls Online. ESO’s general combat isn’t perfect, control tank kept playing long. Deciding exactly block dodge, managing sustain, handling complex mechanics, maintaining full freedom movement. Plus, ability experiment different builds. steep learning curve, that’s made mastering feel worthwhile. game nails tanking you? anything captures level depth, flexibility, impact?","MMORPG","gaming"
"cursed game design MMOs gather common things people complain mmos paradox. Player: want MMO rewards time gives progression also infinite amount content explore. First sentence hear commonly possible achieve, players want put hours game, get new gear, unlock new content, eventually catch end content. Devs cannot create infinite worlds grind pace players play them. Devs either create daily chores slow progress time-gating make game progression extremely slow takes time grind. Player: want MMO put 12 hours day grinding, hardcore PvP player. Also, want MMO big player base competition game gets excellent care devs. another paradox: every competitive MMO heavily relies gear PvP eventually dies out. reason release, healthiest state, everyone starts clean slate, eventually players hardcore outpace less hardcore casuals, reducing community few. makes devs less profits, take less care game, people quit even snowball effect. Even catch-up mechanics, hardcore players keep outgearing others. Player: want MMO enjoy solo pace force socialize. main problem mentality way work exclusively PvE MMO, alienate pvp competitive players, time, heavily demanding devs constantly create new content, much games like FF WoW done good job side, appeal everyone actually wants socialize mmos. Player: want MMO trading auction house, also want bots, RMT, P2W. another conundrum: long sell things players, real money involved. nature humans pay things cannot have. Player: want MMO army friends fighting masses players like big war. Also, want balanced experience forces almost equal. another big problem ZvZ-type games: rarely feel balanced, time players always band potential winning side. usually ends happening one big group players dominating game gatekeeping everyone else. Player: casual player, Dad, put 2 hours game still would like participate active competitive content. another problem mmos today's landscape. Wow Mmos time released, player base teenagers infinite time throw. many players full-time dads. players feel alienated playing competitive PvP mmos cannot play much hardcore players. Player: want MMO horizontal progression players cannot grind infinitely upwards balanced game. sounds excellent paper, happens generally players' motivation grinding bigger power accumulation involved; remove aspect, less players feel need competitive play, therefore enough motivation play game. Player: want RPG elements open world make players enjoy different types content, like big meteor event changes landscape players interact it. another big problem devs: big events involve lot players. Ideally, want everyone access it, players logged time, alienate players enjoying kind mechanic. much want blame devs making great MMO, one hardest game genres pull off, ROI low amount content need create. companies like NCsoft went full gambling p2w cash grab; make money way. saying impossible make good mmo, many cursed problems dev, question really worth try pull off. MMO, like online game, trouble player base diminishes, game experience diminishes well, compared single-player game enjoy time way.","MMORPG","gaming"
"MMO's MAINTANENCE DAY/TIME??? feel like im messed with. reference im PS5, dont lot options. started playing black desert 2 weeks ago loved much maintenance happened decided download another MMO phantasy star online 2, nights BDO could play that. tonight came, went start character pop told maintenance till 4 a.m. deleted game decided download Tera, another MMO pleasure trying. takes forever stupid spectrum internet experiencing outage area, finally get downloaded. log servers greeted 3RD MAINTENANCE MESSAGE NIGHT. ONE TILL 5 A.M. GO SLEEP NIGHT SHIFT WORKER. thing man? 3 games maintenance time day??? last hope throne liberty point im expecting message get downloaded. universal day MMORPGs decide best games playable 5-6 hours?","MMORPG","gaming"
"Amazon`s Lotr MMO update lately ? quite game. think upcoming Amazon lotr mmo ?","MMORPG","gaming"
"Sorry specific question mmorpgs classes use revolvers main weapon know like gunslinger. know Lost Ark haha Hope help sorry bad english!","MMORPG","gaming"
"PVE mmos luxury extremely p2w... Ultra decked stratosphere p2w char joins random mm dungeon proceeds tear bosses mobs shreds... Pve co-players cheer item loot dopamine rushes bodies.... check pvp scenario p2w player 1 shots naked/f2p/content.... See difference?","MMORPG","gaming"
"Chrono Odyssey Gameplay Revealed interested actual gameplay Chrono Odyssey. cut know today sections (each class) help people see expect three available upcoming beta. [Chrono Odyssey Gameplay: Berserker vs Ranger vs Swordsman - YouTube](","MMORPG","gaming"
"professional MMO tournament Like know FPS games also tournament games Teams like LOL honor kings want know tournament, competition, way play MMO professionally make money real life, work it, know?","MMORPG","gaming"
"begging Chronos Odyssey well. does, change mmorpg genre fun exciting become chore. doesn't, wait another next gen mmo see does.","MMORPG","gaming"
"Chrono Odyssey: 17-Minute Gameplay Walkthrough IGN released 17-minute gameplay video [Gameplay](","MMORPG","gaming"
"guys stick MMORPGs? issue every time find new game get hooked play game fair bit initial weeks. However, one two weeks line suddenly lose motivation play end dropping it. happened FF14, BDO, name it. issue MMOs, pity since enjoy many aspects genre. guys stick games long-term? rely making friends gane? different ways staying interested game? Could also found 'the game' me, guess, weird since enjoy titles mentioned long break (agian, 1-2 weeks)","MMORPG","gaming"
"Yesterday posted talking wanted try Wuxia MMO people recommended World Jade Dynasty (Tw server) far looks amazing! [This Discord link info downloading creating account]( anyone interested try out, thats Discord. game Free Try 10 hours per character need phone number account registration get 6ish euros explained discord. anyone wants ask questions recovering game myself, feel free ask!","MMORPG","gaming"
"Quinfall worth trying? seen MMO, Quinfall Steam noticed 2 euros rn instead 20. worth give try? pros cons game?","MMORPG","gaming"
"Next mmorpg looking forward to? next mmorpg looking forward estimated come out?","MMORPG","gaming"
"Silkroad online Anyone else play free game back day? Super grindy, blast!!","MMORPG","gaming"
"Curious know ""Real Time"" Combat systems MMOs right Hey everyone, Ive looking Dune really interested getting - also wanting know Real Time Combat MMOs, actually require timings parries stuff. Thanks time Cheers!","MMORPG","gaming"
"Give LOTRO try Amazed amount content available (mostly) F2P player! able scale outdoor difficulty preference, epic questline side quest stories, immersive beautiful environments role play, creating outfits, easily accessible player housing helpful community highlights far. Another fun angle chosenest chosen ones ultimate super faction champion, regular character behind scenes major story events. combat UI clunky side personally, enough nuance it’s sufficiently engaging. systems take self-research getting used to. Buying LOTRO points unlock posting AH purchase wardrobe slots cosmetic collections also helpful. Would love see people LOTRO world, really think game deserves larger audience snowball something special!","MMORPG","gaming"
"Let's Talk Exploration: Right Why? previous post mine voiced small grievance FFXIV's love invisible walls, got quite couple comments agreeing sentiment open world exploration is... lacking... say least. MMOs done right, all? did, feel ""secret"" creating world worth exploring? feel still missing talk exploration open world MMO games? me, mostly feel best way incentive exploration sense discovery. put BiS equip top random mountain, *something* there, small token aknowledgement efforts, feel makes exploration worth it.","MMORPG","gaming"
"May unpopular opinion kill Wuxia style MMORPG. know style popular west man, downloaded Naraka Bladepoint since bored accidentally joined lobby completely depressed, game looks good thinking MMO cool cosmetics visuals... style exactly Im looking Im afraid never see it. One dream tho, guys also like style? dying alone hill? lol would drop thousands dollars MMO described P2W.","MMORPG","gaming"
"Newcomer, Slightly Disappointed FFXIV pretty small grievance, things considered, trying FFXIV first time really got many freaking invisible walls game has. wanted try another MMO, decided go FFXIV seeing couple gameplay footage. those, one thing caught attention ""big"" towns looked. sense scale point, massive buildings going high sky, looked like nice game exploration. got it, however, noticed much scenario just... well, scenario. Buildings, matter tall outside, rarelly single store. doors come across closed. cliffs, least town, invisible wall preventing jumping lower area. Even vendor's stalls invisible wall front, never go behind counter. knew start game seemless open world. That's fine, deal zones loading screens (even actual in-game map quite bad navigation lol). even inside zones game feels so... restrictive. Like want explore. wants think massive world, also say may see narrow portion it. Kind bummer. still keeping playing form time time, see making main MMO.","MMORPG","gaming"
"Souls-like progression but... MMO? Honest god question. What's stopping devs following souls like progression... MMO. thought well thought out, gassed work. hear out. Super hard bosses gonna struggle defeat, essentially race guilds groups individuals clear. Loot random maybe mats gear dropped 100% every clear. gear make boss easier gives slight edge adds playstyle i.e. speed, skills etc. piece way power creep never thing skill expression penalizing. PVP also decently balanced get go (kinda). fear alienating casuals wanna die 100 times single clear, see would issue since elden ring bloody blew up. maybe previous content becomes trivial progressed far enough, that's case repurpose previous content making new content require older content mats. sure expressed thoughts properly yeah, game see going route present day maybe soulframe. little faith. Peace!","MMORPG","gaming"
"stressful difficult endgame type WoW OSRS? wanted know think would difficult.","MMORPG","gaming"
"Dragon Ball Online Server best play on? saw, two servers: Ultimate DBO DBO global. ultimate saw YouTube. latest video 10 days ago global latest video year ago im really sure global keep getting updates guy said third dbo universe revelations guy told dbo global universe revelations joined one name dbo global im sure.","MMORPG","gaming"
"OSRS could #1 MMO didn’t look like made MS Paint Let’s real, ton people skip OSRS graphics “Old School” label. yeah, you’re new MMOs looking play, you’re probably clicking game looks like came 2001. that’s makes OSRS wild. Despite looking ancient, still ranks top MMO lists, massive player base, devs actually listen community. Show another MMO looks *this bad* still thriving. can’t. I’m curious, much think graphics matter MMO? Would OSRS completely dominate modern look?","MMORPG","gaming"
"Anyone else excited Chrono Odyssey get launch day? Every MMO I’ve missed launch. seems like one could major MMO. P2W, good graphics, good looking combat. enjoy Korean MMOs except gambling crafting gear p2w sounds like devs won’t systems. day 1 going epic wanted share makes happy, that’s :3","MMORPG","gaming"
"benefit making non P2W MMO ? know people hate p2w, obviously. 99% MMO p2w ? makes wonder : benefit making non-p2w MMO ? Unlike single player games, people = money. P2W games make lot money anyway. make fun : ""p2w trash dying games"", consider company's failure, truth company already made tons money, moving make another cash grab. open business, Would prefer sell products small ammount rich people, make less money, deal people. post trying justify p2w. sad truth is, P2W MMO, especially mobile games, make way money, afaid one point, single non-P2W game left.","MMORPG","gaming"
