"18/F4M hii wanting someone build Minecraft world together love Minecraft hate playing alone hoping find someone 18+ come play me. okay call play. hoping could play several weeks. interested DM me. Can't wait hear you! Also send pictures cat Korra too. bonus","MeetNewPeopleHere","gaming"
"even purpose tree sapling drop rate variation? mostly rant, devs infinite wisdom think good idea create tree like dark oak requires 4 saplings even grow all, lower drop rate saplings first place? three dark oaks week superflat survival world 15 emeralds total saved trading selling trader. wanted dark oak badly too. today, finally sapling stock could grow tree, leaves decayed, got two back tree could grow. Basically getting right back started handful dark oak logs. raced back buy more, despawned. idea whole thing pretty hilarious past frustration, found wondering freaking point certain trees varying sapling drop rate? make tree cannot grow without four saplings make literally go extinct? devs want troll players? Can't trees sapling drop rate?","minecraftbedrock","gaming"
"Top 64 Character Composition R2CS - Hungrybox's Online Qualifier #1 EVO! @WeNeed2BanKragg","RivalsOfAether","gaming"
"Riftbreaker (2021) X-Morph Defense (2017) incredibly stellar yet almost never encounter anyone discussing either title. Riftbreaker base building/resource management RTS X-Morph Defense tower defense games share unique twist makes deeply engaging... character serves cursor utilizes twin-stick shooter control scheme real-time combat. genres almost exclusively controlled point click system added real-time functionality Riftbreaker X-Morph allow gloriously intense addictive gameplay found anywhere else. joy construct layout installations zip around map laying real-time fire quell nearly insurmountable vicious enemy siege. Aside gameplay itself, titles killer music, terrific art design wonderfully charming atmospheres make feel though lovingly crafted 90's; titles developed Exor Studios. Riftbreaker X-Morph Defense two exceptional video games much worth try find genres appealing.","gaming","gaming"
"save space limited? Xbox. broke saves two per character. One pivotal moment, ending. like keeping extra saves current playthrough. tired getting warning many saves. do? could move PC. already deleted playthroughs accidentally abandoned remember goal them. save space limited console?","BaldursGate3","gaming"
"game ruined developers ambitious? video game felt could big developers ambitious trying accomplish.","gaming","gaming"
"games fast travel right way? Meaning isn’t necessity get around map, isn’t totally useless","gaming","gaming"
"Souls fan, real hate games Soulslike recently finished ""The First Berserker Khazan"", absolutely love game. great combination deflect Sekiro combo Nioh 2. said, actually hate game lore perspective. Even though Khazan capable taking giant dragon bro, game, dies two hits. really felt strong Khazan everything takes seven eight big sword slams charged maximum aim straight skulls kill, dies gentle swings. Soulslike make people feel character nobody eventually takes demigods efforts. Insread, get literally war hero ghost warriors providing strength, would verge dying puppy bites once. miss games like Devil May Cry get hit multiple times enemies. still can't recklessly mashing attack never worth trade health since can't heal back HP. still try yo better. game fun, hope soulslike.","gaming","gaming"
"Horror Kaisen another guy playing 20 life jujutsu x bosses x horror modpack. one server hosting essential max 5 players disabling six eyes cause infinity makes easy breaks purpose. fun also includes distant horizons lod preloaded entire world interested dm start 12 hours now❗️❗️❗️ Also proximity voicechat proximity chat extra immersion creatures also track voice","JujutsuCraft","gaming"
"stealth working intended, skill issues? REMASTERED Currently playing level 16 custom character Adept difficulty. Custom class, kinda set fighter/thief hybrid. light armor, 100 sneak. got impatient pickpocket trick Imperial Prison since whatever reason despite Sneak major skill leveling super slowly. Anyway, obviously Im point sneak attacks kill one hit, alerts person/monster Im attacking. Ok, fair, arrow upper thigh definitely wasn’t damn wind. seems kinda puzzle ENTIRE LOADED INSTANCE knows exactly am, regardless behind walls actually witnessed/heard anything. combined fact try break line sight reposition whatever, doesn’t matter. locked me, even leave dungeon Im go open world. chase indefinitely resort open combat. stealth supposed like this? missing something/skill issues? Im considering playing character anymore cant even use half skillset. Tl;dr, despite one enemy lonesome attacked shadows, alert Tameriel AIM-9 Sidewinders unbreakable radar lock Thanks advance advice tips might missing","oblivion","gaming"
"Stuck gaming rut, need “can’t stop playing” kind game 🎮 Hey everyone! 👋 I’ve hopping bunch games lately, none hitting sweet spot, know, kind stay for, even “one mission” kind vibe. context: love good story also enjoy getting lost gameplay loops feel rewarding. attention span’s place right now, want something engaging stressful. Here’s I’ve tried recently, Hades (loved combat loop, beat twice), Celeste (good story, killer mechanics, made rage-cry) Stardew Valley (super calming, bit chill lately) So… what’s game hooked hard? Doesn’t matter genre","gaming","gaming"
"Anyone else frustrated accuracy Storm Troopers? you’re 40, know incredibly poor aim average Storm Trooper. So, type Epic joke us? Storm Troopers season beater aim NPCs I’ve ever seen, I’ve while. would fine one often packs seriously damage you’re careful. Anyone else feel frustrated me?","Fortnite_Over40","gaming"
"Rams open. UPDATED ROSTERS Y1W2. C.E.O. madden franchise C.E.O. MADDEN 25 updated roster post draft. Crossplay Year 1 week 2 RAMS OPEN * Neon integrated * Marketplace incentives * Active commish / trade committee * 48hr sim * Comp settings * Last reboot Madden 26 *LOOKING WAITLIST MEMBERS WELL FUTURE TEAMS*","MaddenFranchise","gaming"
"everyone recommend turning cross play pc cheats things like cronus strike packs exist? Probably stupid question know makes sense banned consoles? want understand ignorant subject see everywhere.","gaming","gaming"
"update 0.8.2c? reading quite bit here. new update? *Typically, slow update game keep resetting objects such*","Voicesofthevoid","gaming"
"Softlocked? went back Jedha Temple right finishing main story talking Cere etc ... realizing teleporter stuff Merin gone drop temple let out. shoot foot?","StarWarsJediSurvivor","gaming"
"need help finding game think lost media remember installing back 2016 almost horizon zero dawn PC low graphics, survival game PC similar red power ranger, map forest base high sky accessed elevator think, could hack defeated robots make allies, searched videos pages games similar one posted can't find it, disappeared without trace","gaming","gaming"
"wanted share images one solo campaigns… Playing sort alternate reality dark Arthurian world. moment using ODND Chainmail switch back ruleset The Grief Engine Kal-Arath plus Killchain Warlord mass combat Infinitely satisfying taking time sketch, watercolor indulge flashbacks like - regular person game table broke apart several months campaign I’m sure I’ll regular group again. problem. live quiet moments walking fog-drenched forests imagination. Happy gaming, everyone.","solorpgplay","gaming"
"perfect dune game copy Death Stranding watching ton Dune Awakening game play looks amazing. one complaint game harsh barren actual Dune. get Dune Awakening multiplayer game make sacrifice. got thinking make dune dune game? think death Stranding answers. single player dune game travel survival dessert would amazing. Death Stranding already button clicking based terrain traversing trip gets easier tools gather. Sandworm riding little ranged weapons would make sense well. guys think?","gaming","gaming"
"play first game? Xbox Thief Simulator games looks interesting, first 2nd game currently price, seem bundle games either... worth playing original first eg. story connecting two games make worth playing order, go straight what assume improved 2nd game, skipping first?","ThiefSimulator","gaming"
"What's fact playing shit decade? time MMOs dropping left right, make beyond 5yrs so, around that. name loved: - Tabula Rasa - Fallen Earth - Auto Assault (actually reported issue allowed play free *months*. reward, permabanned. wonder went under) - Hellgate: London - Ragnarok Online - Star Wars: Old Republic - Requiem (had check, cannot believe still going least available Steam) - fuck, bunch flew flopped everything feels like yet another fantasy whatever fest different features. New World? Feels like old world. one tried Sea Thieves really appealing, especially since came out, what, ten years ago? ESO? Elder gives shit. still play GW2, that's it, Dune new SW:TOR? get New Republic? like New World kept engaged. really really really wanna know is, coming MMComa, ever happened Huxley?","MMORPG","gaming"
"What’s dead game wish people still played? *old*, mean **dead**. Servers empty. Matchmaking impossible. Maybe devs gave it, community moved — *still* think it. boot then, wander around, feel weird mix nostalgia sadness.","gaming","gaming"
"Mario Kart World, local multiplayer On Mario Kart 8 on the switch the game was locked at 60 fps when playing local with 2 or less players. If you played local with 3 or 4 players, it dropped down to 30 fps and looked like absolute trash. Has anyone played MKW locally with 3 or 4 players yet that can comment if this is resolved with the switch 2 hardware?", "gaming", "gaming"
"next rate-up banner go live? Wondering since Idk who to summon for. Thanks!","AFKJourney","gaming"
"tree skip question anybody know gonna miss anything tree skip? walked top fire link shrine heard beginning dialogue there. heard left.","darksouls3","gaming"
"Stellar Blade Playstations Biggest PC Launch Surpassing Every Playstation-Published Single Player Game Steam","gaming","gaming"
"Decorative ""Lava Pumpjack"" built SMP. inspired u/Dabbers_'s concept lava pumpjack decided make spin survival world. uses pigs minecarts the picking mobs mod allows this create pulley prime mover centre look convincing. add functionality yet thats problem tomorrow","CreateMod","gaming"
"emulator, try remapping Circle R2. lets strafe shoot keeping thumb right stick.","RatchetAndClank","gaming"
"RFD FULL QUESTLINE probably worst rfd video you’ll ever watch, tiss point","OSRSContent","gaming"
"Games with fixed camera movement that aren't horror and amuse spectators? We've got a friend who gets motion sickness off camera movement in games, even on the TV in the brightly lit lounge.  We discovered Cats in Paris doesn't trigger this, but it kind of lacks plot.  But searching on Fixed Camera in Steam brings up horror games.   Or Tower Defense. Any suggestions for spectator-friendly fun games on a fixed camera/no background movement on Steam? ","gaming","gaming"
"Howdy y'all, going purchase game soon stumbled upon game looking top shooter type games vein little known rpg/STALKER homage called Tunguska: Visitation game absolutely lovely. Solo dev indie Stalker esque isometric game. list isometric shooters mentioned Foxhole somehow never heard before. looked and... enthralled concept game. truly seems like real evolution online gaming. Anyways dumb long winded post but, anything folks recommend newcomer? major tips? good youtuber follow covers mechanics? looks absolutely insane need another reason leave house free time want play regardless, haha. Much love, see y'all frontline.","foxholegame","gaming"
"City builders, Cities Skylines still go to? know Cities 2 came like 2 years ago buggy mess. improved point replace Cities 1? people moved another city builder point? really loved first one, even issues. recently got itch play city builder again. fire Cities 1 again, replace Cities 2, 3rd better option unaware of>","gaming","gaming"
"Im planning mage build next playthrough, tips? regular vanilla mage build, first time actually going mage build feel like going difficult early game.. find spells? Whats best way level up? particular quests do?","skyrim","gaming"
"tried new update generally negative towards new update hated every change made. decided say screw least try see would give compensation extremely disappointed. first issue fact didn’t even keep old skins hero’s, don’t know thought anyone would okay getting 4k style tickets instead skins literally spent hours real life money obtain. didn’t grind spend 10$ transformer event style tickets robot queen skin. Second issue new hero system general, it’s squad busters hero busters. feels like cheap brawl stars can’t stand game. Third biggest issue progression that’s added, hell unlock hero’s legit maxed removing don’t care troops maxed now. close maxed update took away satisfaction maxing account replaced grind hero characters decided add nobody asking for. feel like whole complaint megas turning either slug fest game would end quick. personal opinion tried indeed uninstalling longer giving time money. Goodbye supercell fun lasted","SquadBusters","gaming"
"feels see HL add new broken characters replace one nerfed","speedbattles","gaming"
"Returning castle dimitrescu part game drop drawbridge river boat castle. aware can't get back main area castle, side door area entrance leads flaming basket bunch loot seems infinite enemy spawner. seeing nothing online I looked hard tbf wondering progress past point? something discover later story?","ResidentEvilVillage","gaming"
"Looking game suggestions yet 15, Australia means can't technically play MA15+ games (idk rated countries sorry). Anyways, completed games looking new ones. must admit, embarrassingly large list games want play, literally either unreleased MA15+ (examples include Death Stranding 2, Ghost Tsushima/Yotei, RDR2, Rest Wicked, etc.). hoping could get suggestions games play would entertain late Nov, turn 15. entirely opposed multiplayer, since play PS5 want pay PS+, access lot multiplayer titles. currently played Jedi: Survivor, Spiderman 2, Black Myth: Wukong Astrobot (plus free playroom thing). hoping could recommendations games suit style (mostly singleplayer, action/adventure, etc.) age appropriate (If unsure, know semi-regular swearing combined heavy violence nudity, probably MA15+). Thanks!","gaming","gaming"
"struggling find new FPS So, quick synopsis, Steam account linked Activision account compromised, despite 2FA Steam guard (don't malware PC, keyloggers, etc. share login info online, took security measures), played cheats account, got perma banned (PS. know many believe ""someone hacked account"", Steam login history prove it, nightmare trying work Activision, Steam, etc.), now....I'm without one favorite franchises. know older games still pretty active, new games consistently active, banned. trying find NEW FPS game play least MP shooter, but....I'm hard time. games kind bounce back forth between, like Splitgate 2, FragPunk, Battlefront 2, Rainbow Six Siege, etc. kind hard time finding one replace hole COD used fill. games hooked. Also, FPS games mentioned great, something COD had, (Splitgate 2 FragPunk) longevity. COD never stop, long running franchise, something many new MP games struggle get getting consistent fanbase, shutting down, fear committing something around long time, like COD. Idk. said, games mentioned GREAT, since know able play BO7, kind switched sights BO7 Battlefield 6, since that's kind side game COD. always loved Battlefield COD, stuck COD more, BF side thing. BF6 look awesome, so....I'm excited. Overall, hard time sticking another game because....I've always put time COD, making large switch commit another game hard. like games LOT, play kind casually, compared COD. Anyone else ever go this? PS. trying work Activision Steam BBB, but....it's looking grim, unique situation parties. PSS. know COD (depending view) rough place, may good thing, but....idk. good letting problem go. COULD technically make new account, want stick rules make situation worse. Edit: also getting single player games. always played sometimes, but, COD, always WAY MP games, but....maybe good opportunity finally beat play single player games backlog. Tons great ones way too, like Dying Light: Beast new Resident Evil game.","gaming","gaming"
"want new game idea game, cheap one, like pay $5, afk type game, rpg elements, build party, send off, rebuild, re-send etc growth party characters levelling, options party classes, difficulty dungeons/bosses etc want game exist. elements already existing mini games larger games, best two examples spring mind star wars companion missions resource gathering crafting, WoW's garrison type missions. looked something like this, could never quite find one matches. closest perhaps Melvor Idle, that's based around single person encountering stuff, vs overlord type sending hirelings.","gaming","gaming"
"Are there any more games like Hellslave? Got this game for free from Steam and I really like it. Finally managed to find an RPG like game like Darkest Dungeon but without party mechanics as I simply hate party management in any game. However admittedly the game feels a bit stiff and doesn't seem to really offer much in the way of dynamic content like DD or any other roguelike. The enemy types, their abilities, the items you get, and a lot else are all unchanging with no variance it seems. I basically want an RPG strategy game, preferably a roguelike and/or like Darkest Dungeon, but with only a single character that I have to manage.","gaming","gaming"
"Help gem drops anybody know don’t get gem drops axe?","allthemods","gaming"
"discovered open_agb_firm whole time, almost finished game gbarunner2 via twilightmenu++. possible use save file? curious, game rhythm heaven silver, stuck polyrhythm 2 third game final stage. really want restart progress play games again...","3dspiracy","gaming"
"Forsakened Stun Question Community. Alright gonna immediately get thinking one while, question Forsaken community: every Sentinel game's main abilities longer stunned, would instead? Chance's gun longer stun, else would Killer Apart put bullet hole them?","FORSAKENROBLOX","gaming"
"Lego Star Wars Online? Roblox remake game Roblox. childhood dream able play three four friends time, play first level even six. Try it, let know think. Link: star wars game - Roblox","legostarwars","gaming"
"Would buy DLC pure parody base game? Think favourite game, except bonus content intentionally parody actual game. Characters talk audience/the player break 4th wall multiple occasions. Mass Effect 3 Party DLC pretty much exactly wished. unfortunate games follow trend. keep thinking ""the great evil defeated. time party fun. lets mock EVERYONE! Including player!"" Maybe judt wish thinking, think much rewarding end game judt rolling end credits call day","gaming","gaming"
"What's next CRPG? rennaisance CRPG past years Divinity 2, XCOM 2, Wasteland 3, Battletech, Pillars Eternity, Pathfinder, Baldur's Gate 3, Rogue Trader much more. else pipeline nowadays year next year? recommendation lookout for? Maybe even indie one? games know coming: \- Solasta 2 \- Warhammer40k: Dark Heretic \- Shadow Road","gaming","gaming"
"Nothing Happens press inject Whenever load gta without battle eye get xenos yimmenuv2 try inject nothing im also legacy dont know conflicts it.","YimMenu","gaming"
"Holy shit mimic ice veins true slayer gods mimic tear. Got last hit 2 play throughs lol💀","Eldenring","gaming"
"First Series, 'Resident Evil Requiem' Playable First Third-Person Launch, Capcom Confirms","gaming","gaming"
"Crash cannot go 5 matches without crashing someone spam autocannons/secondaries, cannot take anymore,","cursedtanksimulator","gaming"
"played Space Marine II, Space Marine Master Crafted feels clunky awful. really enjoyed Space Marine II, played great, controls felt good, fun it. tried Space Marine Master Crafted feels bad. good stuff Space Marine II absent original seems. Combat feels unrewarding like sponging hits. entire combat system seems revolve around stun execute system feels bad fun use. Maybe me, sure desire even play it.","gaming","gaming"
"Looking Sword Can't find anywhere, would appreciate paladin playthrough.","BG3mods","gaming"
"Stuck loading screen download human stuck shaders screen restarted loaded. let load for. hours mf came back it’s stuck “loading game 100%”","OnceHumanOfficial","gaming"
"New Upload - Batman Arkham Asylum Part 4 Hello everyone! uploaded new part Batman Arkham Asylum playthrough YouTube, really enjoying process recording providing commentary also playing game years playing it. appreciate anyone checking content welcome feedback. Thank you!!: Latest Episode:  Playlist Playthrough: ","YouTubeGamers","gaming"
"Beat game! Hi guys first post finally beat last boss got good ending! Beat 3rd phase 1st try happy! amazing game 60 hours well spent : lol master chaos armour looks wicked","TheFirstBerserker","gaming"
"Mega gyarados raid please join Join raid please. Raid group code is; Meowth, bulbasaur, squirtle","PokemonGoFriends","gaming"
"Bring back “Weapon Wheel!” many games childhood used let carry many weapon instead halo/cod themed 2 weapon max. I’m wishing modern games leaned mechanic. Recently DOOM games Ratchet Clank focused feel like modern games shy away. Wishing games brought back mechanic. favorite games multiple weapons available once? I’ll start: Resistance Fall Man Metal Arms Glitch System Ratchet Clank game","gaming","gaming"
"someone duo ranked? Gold 2, played higher rank diamond solo. Main healer fill.","Paladins","gaming"
"Micspamming bots back :/ can't good things. Spotted earlier today EU Harvest servers. kicked 6 them, joining.","tf2","gaming"
"made Tripods, called Omicronpod Omicron-Uber first time made tripods first came okay, since started remastering 2005 Megapod version came really well, creating WotW created dude asked EldeBH version Megapod came really better, decided make better ones remaster **Omicronpod** **Omicron-Uber** tripods really better, fresh look really good terms style, artistic ones made SketchUp.","WarofTheWorlds","gaming"
"“open world paradox” starting primarily era 360/ps3 games like red dead redemption, oblivion, skyrim, like, there’s sharp rise number open world game produced, it’s drastically changed gaming landscape whole. elden ring, horizon, final fantasy 7 rebirth, modern assassin’s creed games, breath wild tears kingdom, etc etc., know games. hell, it’s widespread that, i’m sure know, even new mario kart free roam mechanic drive anywhere map leads want call paradox open world game design. mean idea matter kind content, regardless much little world filled with, there’s way satisfy audiences. audiences determine “too little” content it’s “barren pointless worth exploring”. fill “too much” it’s “another ubisoft slop checklist game wastes time” people say “just fill good content”, that’s whole different topic another post. y’all think? games are, you, examples games GOOD open world, differently games think bad kinda meh open world makes stick out? try descriptive possible","gaming","gaming"
"What's unusual thing makes game 500% attractive you? desert setting/environment. Games like Serious Sam, Mad Max, Conan Exiles, Ruborian Desert Overlord... fond memories games desert segments think would enjoyed nearly much without them. There's something scorching heat, desolate emptiness bright colors find infinitely appealing. Tropical islands things like well. Even game mid best, might put top 10 list desert aspect done well.","gaming","gaming"
"Illuminating little confused illuminate requests work; there's nikki clearly sending request I tell wrists glowing nothing prompts accept it. hover character option illuminate show up. bug multi-player turned something??","InfinityNikki","gaming"
"What's been the best games of the current generation so far? What's been the best games of the current generation so far? ","gaming","gaming"
"Recruiting Clans Masters | #2LG2URYLO | Town Hall 13 | Clan Level 19 | War/CWL Clans Masters looking dedicated players round CWL squad. We’re casual clan, mostly adults stuff going on. hardcore means, take wars CWL seriously. core CWL players pretty good - we’ve Master III couple times, currently Crystal III departures. We’re pretty low maintenance clan don’t ton time play want compete CWL. We’re also looking lower level players want regular war, ask troop donations, grow base. ask don’t join wars, contribute Clan Games Capital Raids. Clan tag - name Clans Masters, changed CoC “inappropriateness”. still prefer known “Red Rockets” 🚀 😤","ClashOfClansRecruit","gaming"
"Running issues climb Im 600k Ekko otp started first climb month ago iron-gold 65% WR MMR increases plat-gold i’m running issues one thing particular seem unable generate lead completely solo reliance piggybacking early lead snowball victory. I’ve nasty chain games felt doomed start, lanes lost, people don’t seem keen make plays push game-state favor, constant deaths block jungle, etc. I’ve never one blame champ teammates pretty major roadblock right now. I’ve trying different ways generate gold leads starting blue/red, recalling, going protecting camps ideally getting whole jungle aswell feels incredibly coinflippy i’ve running issues enemy rotate laners wont even realize something happening. ekko isnt much powerfarmer need early leads snowball accordingly. tips much appreciated.","Jungle_Mains","gaming"
