"Sunflower bugs Hi all, black small bugs clustering stems sunflower. yoh identify them? Sorry bad image harmless? get rid them?","gardening","gardening"
"Blue pink Big Green Egg deck, 15 feet area. Since ash bucket developed rust holes past year...my hydrangea pink. BEAUTIFUL shade pink is!","gardening","gardening"
"Hello! live Gearmany bought baby Musa banjoo, need pot rent dont garden, ""hibernate"" winter indoor? temperature keep him?","IndoorGarden","gardening"
"soil plant basically dead due plague? plant sadly dying I’ve treating plague issues. repurpose soil? so, something recommend it. Just make sure don’t affect new plants I’m still giving hopefully comes back life.","IndoorGarden","gardening"
"Need help ID care tips please! “8” Foliage, Tropical Plant” Hey everyone! Need help ID plant, she’s 3 years always thriving! recent, she’s drooping over. way green thumb. Thank advance!","IndoorGarden","gardening"
"bottom plant this? water growing last weeks bottom one stems turning yellow white stuff coming it. going harm plant?","IndoorGarden","gardening"
"Hello. wondering anyone could tell leaf curling downward much normal needs help? grew bulbs leaf totally healthy. TIA","IndoorGarden","gardening"
"Hope holds… Squirrel, deer, rabbits everything else doomed several years gardens. Here’s latest entry story everlasting battle","gardening","gardening"
"What's grape tomato plant? aphids' eggs fungus? guys think? None plants white sprouts","gardening","gardening"
"wrong lavender? shallower pot, transplanted week ago. doesn’t appear happier. soil still damp didn’t wanna give water.","gardening","gardening"
"this?? rental yard receives literally zero sun grows weeds seem impossible eradicate?? Also cheap?😅","gardening","gardening"
"Tomato help going cherry tomato leaves, fix it? 2 tomato plants bed whose leaves perfectly fine.","gardening","gardening"
"added beauty collection. tips keeping specific varieties happy indoors?","IndoorGarden","gardening"
"Friend foe? waiting arugula go seed soil full bug, arugula fine fear invasion beds.","gardening","gardening"
"Best Indoor Palm Plant Beginners would love palm tree type plants throughout home. suggestions?","IndoorGarden","gardening"
"Root rot? much water? Time repot? complete noob. First plant seed lived long.","IndoorGarden","gardening"
"i’ve keeping leca balls top soil there’s little white balls.","IndoorGarden","gardening"
"Large flower bed. Lots roses. Saw yesterday morning. take photo. many colorful roses.","gardening","gardening"
"break flower let regrow? left alone couple weeks seem better. feel like taking nutrients away new flowers","gardening","gardening"
