"Experiencing migraines Ajovy due. Long post hope someone read Surely normal right? 3 migraines actually required medication ever since taking second dose. Two past seven days. due third shot tonight. getting daily migraines cut meds half make last month. Also comment good experiences Ajovy, would appreciated. search Ajovy see much side effects weight gain hair loss. It’s shallow me, two biggest fears comes medication even helps. I’m working full time depression anxiety gone like 85%. Really 15% thinking time lost discovering Ajovy life could like discovered sooner anxiety developing side effects. Right one know injection site reaction.","migraine","health"
"doctors dismiss symptoms, patients suffer lasting harm. Psychological damage health care avoidance may occur doctors dismiss, minimize ignore patients' symptoms, phenomenon medical scientists call ""symptom invalidation” patients often call “medical gaslighting.”","science","health"
"Researchers found combination heat waves high PM2.5 pollution led nearly 700,000 premature deaths past 30 years—most occurred Global South. United States vulnerable Global North countries, estimated 32,227 deaths.","science","health"
"Sports, Exercise Protects Mental Health Growing Kids. daily amount physical activity age 11 associated 12% lower risk diagnosed mental disorder age 18 additional physically active hour.","science","health"
"doctors dismiss symptoms, patients suffer lasting harm. Psychological damage health care avoidance may occur doctors dismiss, minimize ignore patients' symptoms, phenomenon medical scientists call ""symptom invalidation” patients often call “medical gaslighting.”","science","health"
"Alcohol use particularly negative impact individuals ADHD. adverse effects quality life appear amplified dysfunctional efforts manage intense emotional dysregulation associated ADHD influence alcohol.","science","health"
"Ozempic similar drugs safe effective people mental illness looking lose weight. evidence increased risks mental health problems including suicide, patients without mental illness likely see beneficial impact mental health.","science","health"
"mention psychiatrist? preface I’m M16 realize may normal teenager hormone thing can’t really bring parents. I’m gonna blunt say sadomasochistic tendencies. get cutting watching people same. worse damage better. constantly fantasize school often go bathroom watch cutting videos. started cutting 11 didn’t really connect dots felt good 13. always felt really guilty it. feel empathy people, don’t like see get hurt ways, something cutting/burning can’t. don’t know. I’m also diagnosed bipolar 1 well generalized anxiety disorder. I’ve always quite smart IQ 140 9, obsession mine severely impacted grades prioritize cutting schoolwork. I’d really rather bring shrink don’t want tell parents it.","mentalhealth",""
"cant get feel awful, stressed out, overwhelmed, thoughts loud. music blasting thing keeps calm. cant work today plans weekend want cancel call everything lay bed csnt","mentalhealth",""
"Leukaemia patients 61% lower death risk statins. New research suggests statins—one commonly prescribed cholesterol medications—may help prevent deaths taken blood cancer treatment.","Health",""
"Gene-editing therapy made 6 months helps baby life-threatening disease; Custom CRISPR paves way treating genetic disorders tailormade ways","Health",""
"dangerous E. coli strain emerged; small mutation may explain rise | unclear mutation does, might make E. coli stealthy lettuce.","Health",""
"primary care practices, what's policy deciding established patient new patient? recently called schedule annual physical. last physical last visit 16 months ago. Apparently since then, pcp left. called, told next new pt physical 6 months considered new pt last appt years ago pcp gone. know specialty clinics may need new referral updated every 12 months depending insurance typically say someone new pt followed year, primary care setting that's ridiculous. healthy youngish person would coming every 12 months dot? pcp leave would still wait 6 months? fault organization hold onto doc? fair work FQHC, pt considered established patient 3 years last encounter. can't bill new patient visit pt seen last 3 years. mean send refills 3 years without seeing means considered established 3 years. what's practice's rules?","doctors",""
"tubing replacement old Welch Allyn Harvey Tycos ""original"" stethoscope. Hey everyone, hoping someone might knowledge 'older' stethoscopes... got vintage Welch Allyn Harvey Tycos triple head – old one based Sprague Rappaport design, two separate rubber tubes going chest piece so, two connection points. built like tank, work self defense weapon sounds fantastic, original tubing definitely showing age needs replacing. still, love keep using it. chest piece looks similar modern Harvey DLX triple headed, chest piece identical except two 'connectors' old one I assume new one single connector dual lumen tubing So, questions are: 1. anyone found reliable source original style two-tube replacement tubing specifically Welch Allyn Harvey Tycos model? 2. original WA tubing hard come incredibly expensive,, anyone successfully fitted replacement tubing sets Sprague Rappaport style stethoscopes onto Harvey Tycos chest piece using original binaural? example, would tubing something like MDF Sprague Rappaport work? 3. using non-original tubing like MDF example another brand possible, notice negatively impacted acoustic performance sound quality compared sound? worry different tubing might degrade excellent acoustics model known for. 4. related note, anyone know modern Welch Allyn diaphragms ear tips compatible vintage model? already sent message Welch Allyn/Hillrom customer service, week answered me. Really want keep scope service! tips, leads, personal experiences would hugely appreciated. Thanks!","doctors",""
"Need someone talk Okay im 20F days ago come terms fact can't work due health issues bad mental health desperate leave house raised abused fuck mind point went almost everything tired feel like day losing sanity hard isolated bc health issues also afraid interacting ppl even know isolated times growing always bad get back go school fuck even safe sigh soultions know eventually need someone think came find someone talk would also want hear struggle maybe could make easier go life yk? suicidal ,please interact me. Sorry, can't handle that. im trying survive here, opposite, feel like giving life, ignore post..","mentalhealth",""
"Study finds cancer-causing chemicals several popular beauty products used Black Latina women","Health",""
"Weight loss drugs could slash cancer risks 41% compared surgery","Health",""
"Advice friend friend whose mental health issues caused lots instability friendship, eventually led severing many years trying help them. one last steady friends life, heard spiraled even since. reach back improve mental health maybe save life, falling back toxic relationship? mental health bad place months caused sever ties.", "teenagers", ""

