"pelvic pain necessitate colonoscopy? 30F, 5’2”, ~170-180 lbs, prescribed medications Kyleena IUD, drinking smoking sharp, almost twisting like stabbing inside pain left ovarian area. Often times, feels like someone reaching inside body trying rip ovary out. Occasionally pain extend right side towards right ovary, it’s definitely left side dependent. I’ve gone gynecologist it, 2 ultrasounds, even IUD replaced, told everything normal. primary doctor ordered X-rays, pelvic CT, lower back MRI. Nothing really came except slight/beginning stages degenerative disc disease. pain worsens sex and yearly exam gyno bowel movements. Occasionally pain goes thigh knee, often. GI symptoms, bloating 1-2 days month. primary doctor suspects endometriosis, wanted see gynecologist again. appointment end month. also referred GI specialist, wanted see gyno first. luck would it, GI specialist got first answering yes one question pain with/after bowel movements, wants colonoscopy. family history colon cancer diseases, blood stool rectum, bowel movements normal frequency type. GI specialist heard normal bowel sounds, everything felt normal, even said doesn’t believe it’s GI related. feel apprehensive colonoscopy done, mainly pain lower intestines, move spot lower pelvis. one done pain location really necessary?","AskDocs","health"
"daughter alpha mannosidosis craniosynostosis. rods broke, could cause? Age: 4 sex:female height:3ft? Weight:60? daughter super disorder called alpha mannosidosis ex-wife told also craniosynostosis. surgery metal rods ex supposed twist help expand cracks made form new bone. 2 weeks ago twisting ex-wife broke one rods. went back surgery morning found bones growing faster expected. Causing reason rod break. question really is: Alpha mannosidosis cause this? could something else?","AskDocs","health"
"Coworker friend die 23 due alcoholism… young don’t know full story… 23. SEVERELY impaired liver I don’t know exact diagnosis. showed picture hospital died. entirely discolored. Native American, darker-skin dull yellow almost green?. one year older me. able drink legally 2 years… two years got bad. IWNDWYT","stopdrinking","health"
"harming baby? I’m 20.5 weeks postpartum. told doctor really don’t want take medication PPD/PPA. I’d prefer CBT instead breastfeeding. told it’s fine also added breastmilk bad baby PPD/PPA. I’m left feeling defeated. It’s making sad breastmilk might harm good LO. stop breastfeeding? get medication? I’m really sure would best.","Postpartum_Depression","health"
"First fast Hello everyone, wondering anyone tips advice fasting? first fast pretty anxious, account pretty sure hypoglycemic. anything know going in? Anything specific prepare? starts tomorrow morning know sure starting sweat praying making medicine bags.","IndigenousCanada","health"
"Poor little toes! podiatrists are pediatric podiatrists thing?? here? sweet boy eight months old little life big toes always red puffy areas either side toenail. suffer ingrown toenails, curious that’s what’s going here. don’t seem bother look rough. also quite curved. I’m afraid clip mess them, since know mine flair mess own.","DiagnoseMe","health"
"Grateful Good Times moment, feels like I’ve really struggling sadness, know current emotions distorting experiences. past several months, I’ve putting meaningful efforts towards progress self-growth; ever before. I’ve appreciated much life truly enjoyed it. past week, I’ve struggled low energy caused practice restorative energizing techniques know help. reflect, realize putting off: *tomorrow* *when feel it*. Today, first time while, started fear I’ll always feel way. I’m firstly grateful enough awareness recognize beginning spiral. Tonight, choose recognize forever even done best past week. recognize experienced good times full self-love happiness, continue enjoy even requires mental elbow grease. I’m thankful recent good times, ones born initiative passion, serve reminder make myself.","gratitude","health"
"trust doctor anymore gave unhinged advice 26M went dermatologist due dry scalp dermatologist advised shave head ointment applied directly scalp could work better. think advice reach especially since hair really thick healthy looking. yeah lost trust doctor even though family members trying gaslight saying reasonable advice.","Advice","health"
"Auditive hallucinations amisulpride 50 mg ? doctor prescribed Amisulpride 50 Effexor XR 37.5, surprisingly got auditive hallucinations  surely Amisulpride , thing never before, could happen amisulpride supposed fix hallucinations ? inducing","antidepressants","health"
"Supplement stack healthy hair glowing skin recommendations supplement stacks healthy + thick hair glowing skin?","Biohackers","health"
"Currently dealing large tooth abscess. Looking photos provided, look like swelling reduced past 36 hours? Took first dose azithromycin 2 pills yesterday 5/13 10am. allergic penicillin. took second dose 1 pill morning 10am. abscess started slowly drain morning swelling hasn’t changed much. pain fluctuates dull radiating. managing pain alternating Advil Tylenol although prescribed Norco. dentist extract tooth swelling extreme effectively. really can’t tell swelling changed much. almost seems like less outward sort spread little chin area. understand antibiotics take days see improvement.","askdentists","health"
"infection woes day 6 hey folks, looking support positive stories infection. got wisdom teeth 3 total 5/8, well day 4, started pretty bad pain started feel / taste / smell liquid pooling mouth. Day 5, started spitting pus 🤮 rinsed mouth salt water. Today day 6 went oral surgeon, checked said yup that’s infection right, prescribed clindamycin 300mg one every six hours week. started taking today I’m naive enough think it’ll start working immediately, wanted ask anybody similar experience soon got pain relief antibiotics. jaw / infected extraction sites hurt soooo bad I’ve cried times!! visit, irrigate sites give syringe so.","wisdomteeth","health"
"Internal external hemorrhoids I’ve dealing hemorrhoids now. diagnosed two months ago, since I’ve constant blood toilet paper blood stool. It’s stressing keep telling it’s hemorrhoids r causing bleeding. recently went GI stomach doctor 2nd opinion, looked blood work saw white blood cell count wasn’t low. I’ve told I’ve accompanied stomach pain bloating ever since got hemorrhoids. told thinks bleeding 100% hemorrhoids also thinks could upper GI problem.. Idek. go bathroom it’s painless, still good diet good appetite.. feel relatively normal besides stomach pain bloating. feel like could something else that’s wrong idk.. I’ve stools I’d fart it’s almost blood comes out.","hemorrhoid","health"
"depressed, anxious Depression cause Anxiety Anxiety cause Depression? ""chicken egg"" question?","NoStupidQuestions","health"
"Psychiatrist Anyone know good psychiatrist that's good trauma around Paris, Illinois?","centralillinois","health"
"Eday Success 🎉 !! Immediates much 😕 Hey guys, 26 extractions 24hrs ago….not shabby. minimal pain. Swelling, nothing egregious. immediates horrible. There’s still like 1/2 inch gum exposed top. bottoms painful now. Doc says need wear anyway, didn’t adjustments yet…do guys think I’ll ok without friday ? What’s experience immediates ? Thanks 😊","dentures","health"
"Bite/blister/idk won’t go away 2 months? 24F 6’2 145lbs, smoker, regular drinker, daily meds lamotrigine 100mg sertraline 100mg, surgical history significant medical history large red bump hip 2 months now. really looks like bug bite me, I’ve never heard bug bite lasting long? feels hard, like lump, doesn’t itch hurt. It’s really kind non issue made concerned know lot people say skin tumors painless people ignore them. ideas might be? pictures don’t justice, really bright red, noticeable. Photos:","AskDocs","health"
"Agathisia taking testosterone shots 3 months taking total nine ambiens left disabled Hello everybody came benzos 12 years ago horrific withdrawals lasted 6 months got put drug called Remeron came rehab living life everything great 5 years later took Ambien one month developed Activia 6 months living life fast forward today well two years ago taking testosterone shots 3 months started noticing started getting anxiety rage bladder spasms urinate got hard sleep went doctor told could give Ambien going take much took total nine within 3 weeks 9th one feel like rocking boat remember felt way previous withdrawals two weeks later took another testosterone shot that's world came end four blown aka, pressure body like going explode muscle twitches ringing ears blurred vision electricity running body hurts bad muscle spasms lay ice packs chemical sensitivity food sensitivity histamine issues possibly mass cells admit 2 years symptoms left sometimes feel like mind racing burning skin days better days comes back electricity body lower level morning anxiety better question could Remeron causing can't help think cuz 12 years never problem know Ambien set testosterone shots lost everything construction company sell everything point know multiple doctors multiple psychiatrists want put bunch meds also thought cold turkey Remeron want prolong nothing.. know would horrific know survive chance stabilize talked Nicole lambertson Mark h written book taper drugs tell think Remeron still heal also thought getting propranolol maybe tapering Remeron maybe propranol soften withdrawals heard people much psychiatrist told could also histamine issues know propranol right fit take one day 24-hour kind worked really good actually felt normal wore 21 hours later felt whole lot worse help thank much","Akathisia","health"
"Dr. Kosari Charlotte Seen many derms live nyc saw many derms acne scars. Tried tons difference treatments however found Dr. Kosari Instagram. He’s Charlotte. virtual consult flew see him. AMAZING honestly happy results far. said let know couple weeks it’s holding need touch go see again. would honestly recommend anyone though suffering rolling acne scars pics. really right cheek needed treatment. won’t let anyone else touch face ever again!","AcneScars","health"
"placebo not? noticed taking rapamycin PEM happen. symptoms still exercise feel better best day instead worse. placebo? Seems strong placebo though.","cfs","health"
"Anyone feel like aged exponentially cerveza virus? pandemic started active, somewhat fit, flexible, lot drive socialize. Fast forward 5 yrs I’m totally home body. I’m shape. desire go out. Especially make home work. way I’m leaving again. worst all….I cheaters now. SMH. I’m old man subway pulling janky cheaters order write post. Haha. time go?","Xennials","health"
"kinda new kinda freaking out! hi all! got diagnosis costochondritis past October going emergency room thought something wrong organ right side near lower ribs. Got ultrasound everything fine - treated maybe stomach ulcers. followed primary care first thought slipping rib slippery rib? Asked stretches go back two weeks that, nothing changed, went back that’s mentioned costochondritis possibility. xray came back clear guess supports diagnosis? got weeks worth prednisone ibuprofen. prednisone really helped! pain came back soon stopping, dull. Within last month started getting worse again, especially lower right rib area makes paranoid maybe it’s organ again. saw primary care week prescribed muscle relaxer well tramadol snd gave referral another chest xray schedule. anyone else experience pain area? so, manage anxiety comes it? far don’t think tramadol even helps area. get worried maybe it’s organ ugh!","costochondritis","health"
"Hairclub- Dallas 28 years old, going two hair transplants still experiencing hair thinning, finally decided explore options came across HairClub hair systems. Although it’s expensive, wanted give try—this first time, wasn’t sure could manage maintenance own, thought would best start professional system. I’m mainly balding crown back areas. recommended keeping natural hairline using system cover crown. I’m get hair system hoping hear anyone who’s experience HairClub, especially Dallas location other. systems overall? sweat lot want know system holds well heavy sweating.","HairSystem","health"
"2u2 medically complex baby way Hi all. Hoping inspiration. daughter, whose first birthday tomorrow also 20 weeks pregnant boy. Yesterday anatomy scan discovered baby congenital heart defect called hypoplastic left heart syndrome. outlook great. Multiple open heart surgeries, possible heart transplant, many don’t make it. top much else. scared. appointment specialist next week. already worried 2u2 terrified. everything. daughter still baby baby boy going serious mental emotional roller coaster family scared. live near leading hospital specializes HLHS, I’m grateful for. long journey. hope. I’m praying long journey alternative losing baby. feel guilty nervous baby #2 close age, feel like I’m punished feeling unhappy times. Feeling lot emotions. Sorry rambling can’t wrap head around everything.","2under2","health"
"Turning 9 weeks Hello! I’m turning 9 weeks pregnant prescribed 1 mifepristone 8 misoprostol. However, instructions received say take 1 mifepristone 4 miso. I’m little confused I’ve seen others mention using 8 misoprostol. anyone successful around 9 weeks using 4 misoprostol mifepristone? effective, need take extra 4 later? trying hear others may dosage went them. Thank much!","Abortion_Philippines","health"
"brain won’t stop anxious thoughts took 10mg melatonin fix schedule ended sleeping basically moving around bed vivid scary dreams. it’s like brain quieting down. next day took 5 mg thing. like since friday night. unable sleep, unable quiet brain body keeps moving try sleep close eyes. i’ve tried everything nothing helped. anxious thoughts literally won’t stop want sleep bad even sleep minutes thoughts won’t stop. idk","Anxietyhelp","health"
"fatty liver gone 3 years US liver India . showing mildly increased echotexture. Focal fatty spanning noted adjacent GB fossa . Impression grade 1 fatty liver . last 2 years usa today another us showing Liver size 11.7 cm Liver: Normal contour echogenicity. intrahepatic mass seen means fatty liver reversed ?","FattyLiverNAFLD","health"
"eyebrows? consultation appt tomorrow PMU/microblading. I’ve shaped left one looked good right one bald patch grow despite brow serum etc.","Eyebrows","health"
"5 days 7 days subq Estradiol Valerate injection?? best?? seen people say 5 days estradiol valerate injections ideal 7 days far long. inject 0.5ml 20mg/ml every 7 days, that's 10mg per week. also subq seen anecdotal reports could possibly differing uptake IM? FWIW, last tested trough levels 155.63 pg/ml believe pretty good trough. around 4 months ago December, idk things would drastically changed since then. thing done switch solely monotherapy stopped spiro. estradiol dose changed since all, say get noticeable crashes anything, worried progress good could be. believe 10mg slightly high dose this starting dose injections well hoping might offsetting crashes? endo seems sure 7 days fine generally really good things, hard time trusting medical professionals due past treatment hard feel relieved.","asktransgender","health"
"become NEET mental physical illness decision? case, series mental disorders limited many ways throughout life I diagnosed extreme social anxiety depression. tried many times lead productive life, occasional jobs discomfort social exposure persisted, wanted lead normal life matter hard tried could never adapt, point fell kind resignation came conclusion situation would never change. continue day, good days bad, trying cope situation, without expecting much life, trying make life complicated parents.","NEET","health"
"got wisdom tooth surgery legs hurt mouth got 4 wisdom teeth today. 600mg ibuprofen 400mg acetaminophen. mouth feels pretty much fine. little soreness completely manageable. legs ACHE. even hurting usual me. usual soreness sitting bent walking, goes. think much daily pain general. tend minimize usually function. kinda wild whole ass surgery regular daily pain level noticeably surgical sites. Obviously super major surgery complications anything. definitely putting things perspective.","ChronicIllness","health"
"Stuck dentist dental insurance company - recourse? NM crown dentist said tooth cracked. Dental insurance United Concordia pay said X-ray taken dentist ofc show crack. Appealed claim, denied. Dentist appealed, denied. Dentist billing me. position either: 1 crack dentist shady 2 dentist incompetent x-rays: either led ins. rejecting billed. options? Neither ins. dentist budge. small claims thing? recourse think pay either misled incompetent?","DentalInsurance","health"
"Wrestling club im incoming freshman fall semester, already joined club patriot web heard pretty much dead, anyone got info recommendation? Ive played high school girls wrestling team wanna keep shape.","gmu","health"
"help shaping? growing beard couple months month half growth, shape looks sleeker guess weird mass face ? want let keep growing sure make cleaner looking. cleaning neckline top cheeks","BeardAdvice","health"
"Scarring Electrocautery Treatment went dermatologist get blood vessel removed using electrocautery device. got home, noticed left indent face nervous it’s going scar 😭 anyone advice prevent scarring!?","DermatologyQuestions","health"
"Period underwear recommendations?? wanna get away tampons cause irritate pads gave yeast infection recently. cotton breathable underwear cycle?","PeriodUnderwear","health"
"anyone tips manifesting height? someone give tips manifest height growth 18? want taller, always get picked family friends shorter big insecurity mine. seen many different people say able manifest height keeps hopes up. possible want grow least 10 inches kind lost do. also aware something like probably take time manifestations anyone give advice stay consistent?","lawofattraction","health"
"stay positive ? want start saying haven’t official diagnosis based symptoms I’ve worried months. Recently I’ve developed new symptoms upcoming transvaginal ultrasound. don’t really anyone talk issues. husband knows what’s going he’s positive person keeps telling worry. Things gone wrong health past. reproductive trauma feeling impending doom again especially since symptoms matching scary diagnoses plus several “risk factors.” particular I’m worried endometrial cancer. work, two small toddlers. It’s hard focus stuff back mind. I’ve seen many posts people seem positive inspiring. doctors office gave “ advice” told try remain positive update ultrasound done. alone made feel like indeed something worry although know there’s nothing could possibly said make feel better. Thanks reading.","hysterectomy","health"
"Overwhelmed info! Hiw help waves look stringy? first attempt wavy hair routine know takes time, getting overwhelmed information next. see waves normal used treat hair like straight, soo stringy. believe hair low porosity medium dense. shampooed suave clarifying shampoo, conditioned aussie 3 minute miracle curls deep conditioner combed hair in. rinsed hair soaking wet, bent head pulsed Aussie wave mousse hair. added mousse standing right plopped hair t-shirt 5-10mins. took let air dry. tips help get clump more? stick mousse cream?","Haircare","health"
"please help think im bad side affects one week. Im getting really paranoid, anxiety spiking feel really down. im irritable feel uneasy. really cant eat. doctor put 300mg xl starting dont know that. thats alot. taper off? dont want risk sides going cold shoulder dont want symptoms get worse. please help","Wellbutrin_Bupropion","health"
"Free Mental Health Support – Help, Professional Hey everyone, certified psychiatrist therapist, someone deeply interested human nature psychology. sitting friends recently realized many people—especially students—struggle mental health can’t afford professional sessions feel comfortable seeking one. I’m currently studying human behavior tendencies, honestly, I’m bit bored too. thought, someone wants talk? going something, need vent, want understand thoughts better, feel free message me. judgment, payment, pressure—just fellow human trying help.","therapy","health"
"Sleep mask gave stye purchased sleep mask used handful times. Last week noticed eyelid swelling up. got pretty bad. didn’t think sleep mask caused wore again. bottom part eye also swelling. seems affect left eye. top starting recover thankfully job interview next week don’t think it’ll recover : I’m gonna come looking like lost fight","Vent","health"
"wart? month ago went doctor larger inflamed bump penis shaft thag said pimple popped it. weeks later it’s looking like crater left behind still red seems? scar actually wart?","DiagnoseMe","health"
"Best Workouts Class Hello, started bjj last month wondering kind workouts outside classes really help improve. know bjj lot core also feel like mobility exercises would great too. I’m 26 don’t want end getting hurt! suggestions greatly appreciated!!","bjj","health"
"Improved appetite/weight control biologics? gained ton weight last year illness ramped up, despite barely eating due nausea/lack appetite. anyone else experience getting treatment? meds help?","PsoriaticArthritis","health"
"cut meds happened…… Hi, depressing rant, cut glipzide meds week two heard going squeeze hell pancreas insulin production worsens already damaged pancreas due insulin overproduction counter insulin resistance type 2 like me, week two ran Dexcom g7 cannot see sugar looks like, got new one today reading, even go gym running resistance training, depressing……","diabetes","health"
"smoking weed actually damage nerves, temporarily exacerbate symptoms Ive nerve stuff going past months, off, suspect SFN something along lines that, seen neurologist, doesnt think PN, CIDP, MS, etc. ive burning, shocks sometimes, tingling, etc may SFN. havent decided skin biopsy yet. im wondering really stop weed overall case actually damage safe","ChronicPain","health"
"Patch testing Hi guys! I’m getting patch test done 2 weeks meeting dermatologist moderate/severe dishydrotic eczema hands/fingers last year. I’ve used steroids clobetasol non steroid ointments protopic. would like know anyone’s done patch test eczema? triggers/allergies found helped heal eczema completely avoided them? Also, common ingredient triggers found patch testing? Thanks!","eczema","health"
"30 Day Core Challenge Day 15 | Oblique Focused Core Workout - FUN! Day 15 halfway mark challenge felt fun, oblique focus workout. #obliqueworkout","Lovingthehealthylife","health"
"29F trouble “leaking urine” last two months leaking urine hours day matter little drink putting self bathroom break schedule every 2-3 hours bladder gets full & release urine. went gynecologist said wasn’t nothing took urine sample came back completely normal, she’s referred urologist haven’t gotten call yet. go multiple pads day, leaking urine standing up, walking, bending over, sitting down, laying tired this! happen anyone else? Help please!! want relief, haven’t able intimate husband since started 😩","WomensHealth","health"
"cystic acne come back : 21F.During ny high-school years lot hormonal acne cause cystic acne . hurts badly traumatised lot.I bullied verbally acne.My mom bring dermatologist gave tretinoin along accutane year.Its cleared acne perfectly.For two years thought skin fine recently cystic acne come back.I still appointment doctor due September.While waiting appointment,I really want try treat cystic acne cause scared bullied again.What skincare method try?","acne","health"
"19F getting four wisdom teeth taken tomorrow dental phobia. Like title says, four teeth removed tomorrow. dentist says impacted hard. top two feel like completely erupted bottom left partially erupted. bottom right still stuck gum. taking 10mg Valium bed tonight another procedure tomorrow morning. bought pudding, apple sauce, apple juice, potatoes mashed potatoes, yogurt. terrified. told feel pain. pressure. awake scary me. got 6 fillings done days ago. scheduled surgery last minute doctor comes month it. feeling brave day confirmed appointment panicking. clue do. cleaned room maybe relax. know expect anything. know Valium make react. terrified pain healing. read dry socket everyone keeps telling drink Straw. That's advice gotten besides ice rest. pinch nerve something? know. kind need reassurance here. 😭","wisdomteeth","health"
"Immediately post op revision left labia completely tore apart 8 days post op original surgery. done may 1st. entirely separated lol looked like shark bite. healed fast, still entirely separated wedge. surgeon local anesthesia today repair it. trimmed remaining tissue still lot hanging edges, stitched back using stronger stitches time. also said right lip minor separation part wedge incision minor fix too. Truthfully, think it’s fault stitches didn’t hold didn’t heal well. went back work right away dumb idea. Im kindergarten teacher lots walking outside. didn’t give much time rest bc thought capable didn’t much pain all. revision today done local, traumatic experience, cried whole time. think nerves anxiety whole situation, worried healing properly time. surgeon assured secured well stronger stitches hold especially since made fresh cut, need take resting recovery seriously time! first photo today right revision, separation wedge,","LabiaplastySurgery","health"
