"Judge Trump Murdoch libel case handled lawsuit president dropped Michael Cohen Obama appointed judge assigned Trump Vs Murdoch, WSJ case. Last time judge oversaw Trump case, Trump withdrew.","law","law"
"State: Kentucky Civil Case / Civil Rights / property damages etc. Inquiry wondering anyone throw suggestions me. serious legal battle neighbor curious anyone knows attorneys businesses around legal attorneys would help cases trouble funding front? exhausted resources even police state sheriff's included help me. attorney General town given advice protect meantime along magistrate. much take back court proof couldn't meet appeal deadline know enough prevent defense. also told town corrupt af get attorney live thos town. Hence noticed lost last case, almost sure last attorney bought know mean. Thanks advance anyone help positive way!","legal","law"
"question someone racially discriminate medically discriminates someone 2 years ago south carolina. person get arrested reported within certain time frame?","LawyerAdvice","law"
"allowed? BLM filing rescissions (at least four) without telling anyone. say things “obsolete” definitely affect Alaskan locals especially Native Americans. legal telling anyone?","law","law"
"lawmakers want save program gives health benefits Illinois residents without legal status","WindyCity","law"
"“First Amendment Auditors” convicted lose appeal - recording Federal Courthouse Arrest video attached. criminals convicted, appealed last week court upheld convictions. Regarding 1A challenge, criminals rested First Amendment argument assumption interior courthouse public forum. Citing Local Rule 83.8a, prohibits photographing, recording, broadcasting, transmitting televising inside Warren B. Rudman United States Courthouse also prohibits possession equipment purposes inside courthouse, court held interior courthouse non public forum prohibition reasonable avoid disruption court proceedings. local Rule 83.8a applies ""all persons"" without reference restriction based viewpoint, and, reason, viewpoint neutral. court applies non public forum test. court held “defendants shown convicted violation First Amendment.” link ruling:","Frauditors","law"
"Supreme Court Rule Trump's Executive Order Targeting Birthright Citizenship","CultureAndSocietyNews","law"
"Barrett Tears Trump Official Defend Liberal Justice *Barrett stepped Sauer’s answer asked, “Sir, really going answer Justice Kagan saying there’s way expeditiously?”*","politicsnow","law"
"Judge orders DOJ reinstate legal aid mentally incompetent migrants","law","law"
"Question defamation defamation cases, understand it, defaming statement made third party individual alleging defamation defendant. generally true? statement need made public. Also third party spouse person alleging defamation?","Ask_Lawyers","law"
"Judge gives ex-officer nearly 3 years Breonna Taylor raid, rebuffs DOJ call prison time","law","law"
"I’m sure aware Rodney Hinton case video recorded one hearings. got chaotic. wondering, different angles think of, likely happen result this?","law","law"
"Trump's immigration enforcement record far: High arrests, low deportations Immigration Customs Enforcement agents last month arrested [most people]( least five years, deportations still lagging far behind President Donald Trump promised — even behind Obama administration.","law","law"
"'Stop violating law!': Federal judge blasts Trump admin's 'extravagant unsupported theory' hiding spending decisions public","law","law"
"Supreme Court rules Trump administration Alien Enemies Act case * Supreme Court granted request Venezuelan nationals seeking block removal United States Alien Enemies Act. * President Donald Trump said court “WON’T ALLOW US GET CRIMINALS COUNTRY!” * court barred removal men, Trump administration alleges members Tren de Aragua, pending new decision lower court. * justices rule whether Alien Enemies Act, Trump administration invoked mid-April deport detainees, applied correctly.","law","law"
"Far Right Federal Judge Rules Gay Trans People Discriminated Workplaces Judge Kacsmaryk, far right federal judge Northern District Texas known extreme legal opinions trying revoke FDA approval mifepristone LGBTQ+ protections Affordable Care Act, ruled Title VII protects gay trans people fired simply gay trans harassment disparate treatment gay trans","law","law"
"US judge dismisses charges migrants caught military zone established along border charge immigrants trespassing military zones so-called New Mexico National Defense Area established April along 180 miles border. U.S. Army troops patrol area detain civilians entering it.A second buffer zone set Texas month. Secretary Defense Pete Hegseth said military would continue expand zones gain ""100% operational control"" border. Migrants caught military areas face combined penalties 10 years imprisonment, said. May 15 Reuters - U.S. judge New Mexico Thursday dismissed trespassing charges dozens migrants caught new military zone U.S.-Mexico border, marking setback Trump administration efforts raise penalties illegal crossings.Chief U.S. Magistrate Judge Gregory Wormuth began filing dismissals late Wednesday, ruling migrants know entering New Mexico military zone therefore could charged, according court documents.","law","law"
"Law Game Copyright Hi ! hope well ? ! really know license copyright video games. studio made game publish played Nintendo, studio close. game Nintendo forever ? right studio litteraly create works everything game intellectual property ? Thanks help","law","law"
"Anyone Else Worried Supreme Court Might Actually Limit Nationwide Injunctions Right Now?","law","law"
"Serious question: birthright citizenship overturned US, makes anyone US Citizen without it?","law","law"
"Post Trump/MAGA regime, see criminal charges, trials prison sentences Trump’s Administration? article specific stonewalling Trump Admin Abrego Garcia case, question stands laws currently broken. ever see Pam Bondi, Kristi Noem, Marco Rubio orange jumpsuit? historical precedent?","law","law"
"Director ICE quietly created new delegation order would allow EAD ERO designated customs officer. would create loophole allowing warrantless arrests. would also allow ICE enforce quarantine rules regulations advisement CDC & HHS. 005-2025 Delegation Limited Customs Officer Enforcement Authority Enforcement Removal Operations Apr. 16, 2025 FOIA Link PDF full document included page. seen shared couple subs, seems concerning, especially paired recent ""Homecoming"" EO. well versed law & difficulty understanding full extent delegation trying do. advised share sub, hope okay. seems like could something significant, ultimately wanted get many eyes document possible hopes something could done slow prevent it.","law","law"
"Federal grand jury indicts Milwaukee County Judge Hannah Dugan ICE case post relates law involves sitting judge indicted federal grand jury allegedly helping someone evade arrest, raises serious legal ethical issues judicial conduct, immigration enforcement, obstruction justice.","law","law"
"Judge weighs reality Trump ‘ideological’ deportation policy activists crackdown trial ends","law","law"
"Mexican woman becomes first cartel suspect charged new US terrorism law | Independent","law","law"
"Trump rages Supreme Court ruling blocks Alien Enemies Act deportations: ‘Bad dangerous day’ | Independent","law","law"
"DOJ may drop case Boeing deadly 737 Max crashes, despite families' outrage","law","law"
"California State Bar's Statement Recent Executive Actions Threatening Availability Legal Counsel Rule Law","law","law"
"US federal court blocks DOJ canceling grants national lawyers’ association","law","law"
"Donald Trump’s Legal Framework Mirrors Historical Architectures Genocide | Common Dreams","law","law"
"Trump’s Birthright Citizenship Case Supreme Court Baffled Trump administration’s brief Fourteenth Amendment bad one, naturally led tortured legal reasoning solicitor general.","law","law"
"Ted Cruz: “I think birthright citizenship terrible policy”Oh! Really it’s “policy” it’s constitutional rights guaranteed US constitution","law","law"
"Constitutional confusion Hi, quick question constitutional law. little unsure certain laws go words first amendment permitted. words say congress shall make law prohibiting right freedom speech. Yet certain things, like obscenity fighting words permitted. doubt suppressing speech a fundamental right reaches threshold strict scrutiny given concept ordered liberty undoubtedly makes sense suppress it. First Amendment says Congress shall make law. general argument examples part free speech therefore regulated?","law","law"
"Trump’s Birthright Citizenship order: US Supreme Court weighs lifting nationwide block | Today News","law","law"
"Judge keeps transgender woman Wyoming sorority case, warns lawyers irrelevant allegations","law","law"
"Could End America Know Legal experts warn real chaos could ensue Supreme Court rolls Trump administration request around nationwide injunctions halting birthright citizenship executive order.","law","law"
"Justice Department Publishes Proposed Rule Grant Relief Certain Individuals Precluded Possessing Firearms legal expert, shy masking disdain administration, there's many elements Proposed Rule feel wrong can't necessarily put words why. news release many paragraphs feel problematic: 1. ""The proposed rule provide citizens whose firearm rights currently legal disability avenue restore rights, keeping firearms hands dangerous criminals illegal aliens."" - course need bring illegal aliens breath dangerous criminals. 2. ""Because proposed rule intended create fair thoughtful system evaluate applications restoration firearms right, Justice Department recommends individuals seeking restoration firearm rights review comment proposed process rather submit applications time. "" - admittedly can't put finger portion feels wrong, strikes odd/shifty. wrong feeling? normal way phrased request public comment? 3. Throughout actual Proposed Rule legal document contradiction ""who unable seek relief"" turns says ""buuuut AG give anyone relief based vague loosely defined elements"". basically AG pick choose whoever want receive relief? insights? Misperceptions? Thanks!","law","law"
"US citizen Army veteran detained immigration raid held 3 days. family scrambled find","law","law"
"DHS civil rights office opened investigation Mahmoud Khalil’s arrest days office dissolved It’s example, according whistleblowers, type work paused department’s Office Civil Rights Civil Liberties dissolved late March. elimination office, 150 employees, came around time civil rights offices similarly shuttered severely reduced within departments Defense, Justice Education.","law","law"
"Tennessee inmate's heart device must turned execution avoid shock risk, judge rules US high-income Western state (as far know) death penalty. states, though, either abolished capital punishment keep books execute anyone. understand medical staff could participate turning off, legally morally according Hippocratic oath.","law","law"
"Supreme Court weighs whether let Trump's birthright citizenship restrictions take effect","law","law"
"EXPLAINER: EPA rescinded first-ever ‘forever chemicals’ regulations. get challenged court? story relates law behind pfas rules.","law","law"
"Listening Dean John Sauer mental gymnastics front SCOTUS absolutely wild. made wild arguments last time regarding POTUS immunity, arguments today absolutely bat-shit crazy.","law","law"
"Congress violating oath support defend Constitution allows Trump violate Emoluments Clause accepting $400M plane gifted Qatar?","law","law"
"Appeals Court Limits VRA Discrimination Suits Private individuals multiple states longer bring voting discrimination lawsuits: power goes Trump's DOJ, alrwady pulling back stopping discrimination.","law","law"
"Trump’s Lawsuit Murdoch Journal Sure Loser Yes, base rallied big story broke. lawsuit stupid several levels come back bite him.","law","law"
"Birthright Citizenship Reaches Supreme Court Two huge debates collide Supreme Court Thursday, direction arguments ricochet hard predict. First question: President Trump deny citizenship U.S.-born children illegal aliens? Second: solitary federal judge outpost vast nation halt government action sea shining sea?", "Lawyertalk", "law"
"‘Vermin mould’: Judge calls investigation Lindsay jail drugs, gun sentencing Kevin Nguyen Kevin Nguyen sentenced 8-1/2 years. judge called investigation Lindsay jail hearing called “horrific” conditions sentencing cocaine dealer. following disclosures Kevin Nguyen’s attorney involving “vermin mould” Central East compared much better stay Toronto East, Justice Robert Goldstein said understands jail meant cakewalk, didn’t excuse conditions Central East Correctional Centre. “It preordained jail be something familiar Ivan Denisovich — aware many cases Toronto East still unpleasant, jail would be,” said referring 1950 novel Soviet labour camp prisoner. “The place ripe Ministry investigation conditions there.” issues raised court involve Nguyen spending 543 days jail, triple bunked 112 occasions lockdown 296 occasions, meaning inmates cells day. time, forced sleep floor head near toilet, often without blankets, spent many 10 days without shower. Overcrowding, said, resulted competition space, phone calls even seats. Nguyen’s lawyer called jail highly unsanitary, saying client’s cell infested vermin mould growing showers, cells toilets. also said often urine feces stains walls. court heard inmates access drugs alcohol frequent overdoses, sometimes resulting death. “Mr. Nguyen generally found atmosphere Central East hostile stressful,” Goldstein told court. “He found guards frequently rude disrespectful inmates difficult conditions often led fights.” opposed this, said time Toronto East Detention Centre much positive, participated workshops programs. remains unclear what, anything, done Goldstein’s statement. Ministry Solicitor General told Metroland would comment matter. “The ministry comment specific individual case courts,” Brian Gray, ministry spokesperson, wrote email. Nguyen, 28, found guilty gun drug offences 2023 bust home Toronto’s Spadina Avenue, Durham police discovered one-kilogram brick cocaine, loaded gun, two extended Glock magazines, money counter, cellphones more. Police became aware existence met another man investigating, Dane Goodwin, court heard. fifth firearm offence faced Nguyen. “It seems Mr. Nguyen leading lifestyle professional criminal,” Goldstein said. Prior sentencing Nguyen, Goldstein also paid tribute jail employees difficult jobs running institution like Central East. “This court cannot condemn strongly conditions Central East,” told court. “I understand staff shortages chronic problem Ministry. understand may difficult attract staff incredibly difficult often thankless job.” Goldstein, said sentence, “before taking totality harsh conditions custody” account 10 12 years, but, instead, Nguyen sentenced eight half years. serve five years three months enhanced rate custody credit 40 months he’s already spent custody. Jeremy Grimaldi Metroland’s courts, crime justice reporter.","CrimeInTheGta", "law"
"Judge rules DOJ canceled grants lawyers’ group retaliation criticism","whowatchesthewatchmen","law"
"Dallas County District Attorney John Creuzot, big-county DAs sue Texas AG Ken Paxton new 'rogue' prosecutors rules","law","law"
"Let’s Start Talking Jail Time Trump MAGA Enablers Excerpts: rule law lives dies willingness act—occasionally grim resolve. It’s time people value justice screw courage sticking place. week’s skullduggery is, course, one brief crime spree among many. Nation, Jeb Lund lays lengthy rap sheet Trump written first 100 days. Trump administration heisted private data millions Americans, unlawfully terminated thousands federal employees, extorted law firms businesses broadcasters; they’re gaming markets, raking corrupt money crypto-tokens, kidnapping people exiling foreign prisons without due process, much much more. Lund notes: “The question whether Trump people committed crime read last sentence many.” want suggest certain necessary logic follow corrupt misrule kind: tribunals, trials, punishment, prison, running ground defunding entire Trump syndicate.","law","law"
"Trump Knows Won’t Win Birthright — He’s Got Different Strategy week, Supreme Court hear oral arguments Trump v. Casa. Though case premised Donald Trump’s attempt end birthright citizenship, what’s really stake, right now, administration pushing federal judges end nationwide injunctions — it, judges’ ability put check executive branch.","law","law"
"Ohio man borrowed 100 library books burned charged crime. actions break law?","law","law"
"Judge rules Trump administration broke law takedown public funding tracker","law","law"
"Presidential Library Hi Question legally literate peeps forum, Trump takes possession Qatar jet, valued 400 million, uses president after taxpayers pay money retrofit it transfers library along 25 million settlement Meta 15 million dollar settlement ABC probably lawsuits unaware of...what oversight legally money? use purpose? non profit something else? Obviously, ethically speaking appearance impropriety, makes wrong general, safeguards legally cannot use money family? another Trump University type scam?","law","law"
"Governor J.B. Pritzker Illinois signs executive order block federal access personal data autism legal challenge RFK Jr. Trump administration","law","law"
"Supreme Court justices appear divided birthright citizenship arguments","law","law"
"Supreme Court Hears Birthright Citizenship Case Could Also Sharply Reduce Judicial Power","law","law"
"Judge says DOJ’s explanation state secrets privilege Abrego Garcia case ‘insufficient’","law","law"
"US claim state secrets privilege Kilmar Abrego Garcia case 'inadequate,' judge says","law","law"
"Trump’s Birthright Citizenship Case Supreme Court Baffled Trump administration’s brief Fourteenth Amendment bad one, naturally led tortured legal reasoning solicitor general.","law","law"
"Judge orders release Indian academic held Ice pro-Palestinian views | Georgetown postdoctoral fellow Badar Khan Suri visa revoked arrested immigration officials March `US district judge Patricia Giles Alexandria,` `Virginia` said ruling effective immediately conditions bond.` **She added Khan Suri’s release “in public interest disrupt chilling effect protected speech” hearing.** `The judge explained ruling government submit sufficient evidence several claims.`","law","law"
"Alison Brie Dave Franco Face Copyright Suit $17 Million Sundance Hit Together: A Blatant Rip-Off","law","law"
"EO14270 Requires “Sunset Date” Regulations Enforced Numerous Federal Agencies Past Future, Including Endangered Species Act","law","law"
"Judge backs Trump’s invocation Alien Enemies Act deportations | U.S. District Judge Stephanie Haines, Trump appointee bench Pennsylvania, upheld Trump’s March 14 proclamation declaring Tren de Aragua, violent gang based Venezuela, mounting “incursion” US compared Tren de Aragua “military detachments pirates” pillaged United States law passed.","law","law"
"Plainly unreasonable: Judge halts Trump ‘retaliatory’ order stripping bargaining rights federal unions challenged administration","law","law"
"ABA Grant Withdrawal Trump Administration Halted Judge || || |The American Bar Association depends grants federal government train provide technical assistance lawyers judges work survivors domestic violence sexual assault – President Trump’s Department Justice abruptly canceled grants retaliation ABA’s “support activist causes.”| |That’s right: *The Trump administration retaliated lawyers taking aim survivors sexual domestic violence.*| |Democracy Forward fought back, today court saw Trump-Vance administration's actions are: unlawful retaliation. preliminary injunction – meaning grants must released lawyers get back work supporting survivors.|","law","law"
"Feds push Third Circuit power revoke green cards time:A Justice Department attorney proposed upheaval immigration protocol response New Jersey mosque leader seeking permanent residency","law","law"
"Live updates: Supreme Court debates Trump's efforts limit birthright citizenship Seems like law pretty clear this. constitution.","law","law"
"Border Patrol Agent charged 17 counts child sex trafficking, defrauding government. “A Border Patrol agent facing dozen felony charges related child sex trafficking fraud. U.S. Customs Border Protection (CBP) conducted long internal investigation, revealing disturbing evidence Bart Yager.” people apprehending non-criminal immigrants.","law","law"
"No understanding role courts are: Chief Justice Roberts says rule law endangered warns trashing justices savages young people no real sense","law","law"
"Not hiding governmental blunders: Abrego Garcia’s lawyers say Trump admin falsely claiming state secrets privilege, insist return would imperil national security","law","law"
"former head Chicago’s immigration court, fired Trump, speaking out. new lawsuit accuses administration unlawfully targeting documented immigrants already showing court,","law","law"
"Executive Defies Judiciary: Federal Courts Enforce Orders Without Marshals","law","law"
"Wisconsin Judge Indicted Charges Helped Immigrant Evade Agents Gift Article","law","law"
"Grand jury indicts Wisconsin judge accused helping migrant evade federal arrest","law","law"
"Walmart loses $222 million Little Rock federal court jury trial, one largest Arkansas history","law","law"
"Supreme Court decision thought stated would considered illegal transaction what?","law","law"
"big-money contributions super PACs corrupting? legal case Maine working way courts worth watching","law","law"
"Blindly trust word: Judge scoffs Trump admin demand believe deportation case Venezuelan man perfect compliance ICE supervision","law","law"
"Judge struck improper letter Justin Baldoni's lawyers alleging Blake Lively pressured threatened Taylor Swift Seems like significant rebuke Bryan Freedman rest Baldoni's team","law","law"
"Trump Slams Supreme Court Ruling Blocking Deportations Without Court Hearings: A bad dangerous day America","law","law"
"Supreme Court rejects Trump bid quickly resume deportations Venezuelans 18th century wartime law","law","law"
"Feds DC Circuit: Labor boards Trump’s authority Excerpts U.S. Circuit Judge Florence Pan, Joe Biden appointee, asked Justice Department attorney Harry Graver whether considered potential implications position agency wielding executive powers must answer president. “What you’re asking court do, essentially, take 30 independent agencies Congress created independent move directly control president,” Pan said. “Separation powers two-way street. executive can’t encroach Congress; it’s supposed prevent autocracy.” Justice Department repeatedly argued court president office answerable American people office voted full electorate. Graver repeated Friday, adding way full executive branch answerable president is. “The way works executive agencies wield power answer him,” Graver said. Pan seemed unconvinced, pointing nation’s founding, framers make president accountable voters selected Electoral College, states chose electors via state legislatures. “When tell lines get blurred, that’s abstract, we’re talking real agencies affect real people here,” Pan told Graver. “It seems lot amicus briefs, Fed agencies, would quite harmful make independent agencies subject presidential control.” U.S. Circuit Judge Gregory Katsas, Trump appointee, also seemed unconvinced NLRB MSPB wielded substantial executive power, noting adjudicative bodies, protected Supreme Court’s precedent Humphrey’s Executor v. United States Wiener v. United States. Katsas asked Graver Fed would fall president’s direct control panel ruled favor. replied nation’s central bank primarily engages monetary policy, traditional executive power, “historical status” warranted exception. Katsas Pan found answer troubling, Pan noting Fed fall president’s control, could push chairman lower interest rates boost economy election. Nathaniel Zelinsky, Milbank LLP representing Harris, picked panel’s concerns argued MSPB’s chair could removed will, could Fed chair. Joined Deepak Gupta, Gupta Wessler representing Wilcox, attorneys urged panel find entities wield executive power still protected Humphrey’s Executor Wiener.","law","law"
"ICE Duped Federal Judge Allowing Raid Columbia Student Dorms | Intercept helped unseal affidavit revealing ICE got “judicial fig leaf” search two Columbia students’ dorm rooms. **As part of** Trump administration’s targeting Columbia University students deportation, high-ranking Immigration Customs Enforcement agent submitted wildly inaccurate affidavit federal judge get search warrant, newly unsealed court records show. affidavit misstated basic facts federal law, attorneys told Intercept, judge nonetheless signed authorized ICE search two students’ dorm rooms based assertion Columbia might “harboring” them violation federal law.","law","law"
"‘Metastasized definition sex’: Trump-appointed judge known anti-abortion rulings strikes transgender workplace protections","law","law"
"MAGA wants Court address whether federal trial courts issue national injunctions binding hands incumbent administration.","law","law"
"‘The modern equivalent pirate’: Trump-appointed judge becomes first back president’s use Alien Enemies Act fast-track migrant removals","law","law"
