"XF 16-80mm Lens Front Element Wrecked… Serial Number… Screwed? Please Help Hey everyone, could really use advice shared experiences one. shoot Fujifilm XF 16-80mm lens, recent shoot, champagne accidentally got lens. I’ve cleaned multiple times microfiber cloths, cleaning fluid, lens tissues, matter do, there’s still weird rusty-brownish streak/reflection left front element attached images reference. worried may damaged coating worse. here's kicker — serial number completely worn lens time, can’t find anywhere body anymore. makes things lot trickier repair Fujifilm. also receipts bought used. wondering: * anyone similar issues front element coating damage? able fix replace whole front assembly? * Fujifilm still service/replace front element even serial number isn’t visible anymore? * worth going Fujifilm this, would third-party repair shop better/cheaper option? I’m based Honolulu, shipping wait times factor too. Appreciate insight, suggestions, even cautionary tales. Thanks advance!","photography","photography"
"Allen Key Carabina Clip ago lost one favourite little accessories cannot find sale anywhere I’m hoping someone might know I’m talking about. Caribbean clip Allen key built it. plastic blue the Allen key attachment metal. anyone this? brand it? buy it? can’t see Amazon anywhere. think came one accessories, couldn’t tell one.","photography","photography"
"Best way clean fingerprints Old film negatives? Like title says old film negatives got greasy fingerprints like know best way get without damaging negatives?","photography","photography"
"Noticable Cross-Polarisation effect JCC Variable Lens Hi there, new photography enjoy travel nature photography, recently picked JCC nd2-nd400 52mm Variable Lens nikon D3200 getting dark lines images display, presumably polarizing filters crossing eachother find difficult/impossible get filter work properly cover full photograph without leaving dark cross/line photograph. Anyone know fix this? havent used variable lens unsure special technique needed defective","photography","photography"
"Spicy photo printing? anyone actually found place doesn’t feel awkward? I’ve seen people group mention tricky find place print “intimate” photos. actually good solution people found felt comfortable with? imagine something online female-led would make lot people feel comfortable, curious anyone’s seen something like that?","photography","photography"
"Flash photography wanted know suggestions set camera flash manual trying achieve elevator engagement pictures look flash photography. Ty","photography","photography"
"Fringing quicklook bright RAW photos park. Preview tree trunks people bright fringe around them, Quicklook press space Finder don't. ideas why?","photography","photography"
"Crime scene photo books Hello everyone, anyone know true crime scene photography books? Mainly looking photographs people / blood injuries. supposed inspiration upcoming projects, mainly make sure special effects look real. - education gore effects speak. know difficult topic even sure resources exist all. Honestly even sure stomach photos art supposed revolting pleasing look at. - looking real key. ideas options welcome.","photography","photography"
"Help Canon 650d using canon 650d since Christmas last year recently issues veiwfinder eyepiece, blurry pretty sure dust/water unlikely live 16 miles away water never taken camera 2 miles away houseinside camera anything get professional clean it? help appreciated:","photography","photography"
"Photography Art Movements found resource another user felt lot people might like check well. covers many photography related art movements, concepts, ideas, key people, timeline, etc. source Art Story. link:  favorite art movement why? impact creative work? consider part of, any?","photography","photography"
"free shoot requests ever end... gosh, shooting professionally decade half now, steady amount paid work including several regulars, also remain these... leeches... sure else call them... relentlessly try milk free shoot me, despite clear but polite efforts shut down, entailed giving prices, saying busy, straight ghosting... yes, true, tippy-toed around dropping hard no, done everything ought given necessary indication NO. people relentless send follow-up texts, e-mails, dm's, etc. know everyone hardened businessman know value afraid say no, know need learn that- power no. anyways, vent, reality obviously know do. one girl shot decade ago constantly posts amazing jetset luxury lifestyle, kept borderline harassing shoot her, soon said ""okay, $350"" disappeared, obviously desired result- funny someone truly shame requesting give hours time between shoot editing, expend resources gas, contributing gears wear/shutter count, exchange nothing, yet never work hour free. another girl, crazy... going back probably 2013 string texts every several months, asking shoot, always got it. one day last year sent text basically saying ""i feel like think want use shoot""... uhhh, duh?! haha- scroll up; there's decades worth texts. another guy met twice decade ago keeps asking least times year greatest friends, express fake concern/interest whatever got going on, ultimately circle back photos. there's countless stories. that's mention friends family stuff, ugh. funny many people seem think real work, must sustain via undisclosed means feel entitled draining resources. photography lalaland. again, vent- really seeking anything here, know hard-no what'll fix it.","photography","photography"
"EF RF extender ? Alright cannon r6mii rf end adapter 70-200mm. want get 1.4x Cannon extender. get ef extender put lenses rf ef adapter right ? rf extender. Thanks!","photography","photography"
"Lens recomendations around 2700€ budget 2 lenses cover work do. shoot festivals/concerts. really like Sigma 24-70 dg dn ii 1337€ would around 1300€ left lens. Would love hiegher mm lens something like sony 70-200 f4 sure peformance compared 2.8. recomendations tele lens 1500?","photography","photography"
"Photo Recovery, Pixieset wife maturity photos taken year ago. failed download 30 day window photos available PixieSet. noticed downloaded, photographer backup link expired. anyone experience working PixieSet get photos recovered? anyone able recover without support PixieSet? Desperate husband devistated wife looking help, thank","photography","photography"
"24-70mm prime lens dropped. Zoom lens stiff 60-70mm motor sound turn camera. ideas? walk Canon L-series 24-70mm lens fell backpack swapping lenses, fell onto pavement. seem like super hard fall - around waist height. Zoom stiff 60 70mm turn camera on, get unusual motor noise. Picture quality looks okay fully tested - recommended stop using it. Fully planning servicing it, sound like needs replaced? Thanks","photography","photography"
"immerse art photography, audience? Hi long time see, project culling photos still going, slowly deciding shots publish flickr another app yet undecided, also realising culture photography whatsoever. Sure, grabbed advice starter kits able technically ok shots, never really got interested famous photographers way watched shows played series. sure rabbit holes imagine. question would be, also immerse world, know can't expect receive attention feedback never give mine. Thanks!","photography","photography"
"scan physical images scale whilst retaining clarity? Sorry wrong place post, thought guys would familiar scanning techniques. new musical project, want use friends' artwork album cover. done physically paper, would need scanned digitally. original plan get work right size scanned, need 3000x3000px according online calculators nearly 80x80cm, would make work take forever. way could done physically much smaller, scanned scalled 3000x3000 whilst retaining sharpness dot make detail? Thanks advance help!  example work friend shows art style","photography","photography"
"would handle newborn photographer situation? Hi all! 3.5 weeks ago, newborn photo shoot local photographer great reviews. session went really well—she made us feel comfortable stress-free. issue contract stated 2–3 week turnaround time. Since it’s 3.5 weeks, decided check in—emphasizing rush kindly asking update. didn’t respond. followed days later still haven’t heard anything. want understanding pushy—maybe something personal going on—but normal get zero response like this? would handle it?","photography","photography"
"Whats one thing wish companies/people photography? Im curious, photography market little stagnate moment time, whats one thing wish of?","photography","photography"
"squarespace good easy YouTubers say ? I’ve owned domain years, think I’m ready make site. f watch YouTube photography related content you’ve definitely seen somebody talk square space, good ?","photography","photography"
"Surprise proposal advice / camera use? Hi! beginner photographer even though I’ve cameras years. know basics often live auto mode :/. Still wanting learn! asked take proposal pictures no, hiring someone professional isn’t option. love couple it, they’re rather flexible whole thing. want photos look great. I’ve scouring thread advice, many people recommend telephoto lens. old Canon Rebel T3i 18-55mm lens 55-200mm lens. newer Sony a6100 got since it’s lightweight standard lens. could buy 55-210mm f/4.5-6.3 Telephoto Lens like $300 occasion also better lens. question is, would go ahead shoot canon 55-200mm lens, pictures come better pay Sony lens? like shooting Sony better, it’s lightweight pictures always come nice. I’ve luck canon 12+ years I’ve she’s collecting dust. think? Also read tons advice threads already, always open advice. It’ll daytime outdoor proposal non-crowded area.","photography","photography"
"Tons Rock Photo pass Fellow photographers! anyone photographed Tons Rock Sweden Rock festival? Arena PIT pass. accreditation number entrance festival? lenses recommendations? usually stay? stay camp site used lockers equipment storage? first time photographer : sorry bombarding questions!","photography","photography"
"Sports photographers: deal lots close subjects short moment? eg: athletics Lately shot athletics event local team difficulties following/choosing athlete follow specialities like running. try favor team's athletes even specifically required, even choose one other. regularly shooting athletics sports similar situations, deal that? already shot running events longer, slower competitions issue, also shoot types sports like sailing slower well repeatability Many thanks advance!","photography","photography"
"best way print without losing edges? epson r3880 printer everytime print say 4x6 paper, everything works lose 10% photo edge. use mac computer, experimented 3 settings 4x6, 4x6 borderless retain size, 4x6 borderless auto expand. 3 settings thing. use photoshop software.","photography","photography"
"Building portfolio - couples weddings Toronto - GTA: trying build portfolio market business. besides friends family, best place find real couples willing model. TFP Facebook groups come across tend fashion models looking ""make big"" love meet Real couples. energy want capture?","photography","photography"
"explain photographer need high res photos Hi everyone! recently photoshoot photographer final photos shared low res, file size around 600kb size 1000x666. Photos clearly compressed appear fuzzy grainy even phone screen. asked high res photos print and nicer quality photos look at!. apologised resent photos exact properties. suspect photographer experienced presume something going wrong exporting. don’t think person specifically wanting send high res photos. sure explain go fixing problem. experience digital art space don’t want come across directive.","photography","photography"
"get backdrops? I’m starting get studio work, I’m looking paper backdrop rolls. However, I’m hard time finding colors like. I’m interested pastels mainly, fun bright colors. example, idea getting peach colored backdrop, haven’t found one except one fabric option Amazon. find deep saturated orange, deep marigold type yellows. Anyone recs places wide variety colors backdrops?","photography","photography"
"Looking innovative landscape photographer recommendations Looking landscape photographers take classically pretty pictures. know Todd Hido Richard Misrach, beyond understanding almost nothing. Thanks advance!","photography","photography"
"Weird stuff behind lens. Need help Hi everyone, got camera recently FB marketplace I’m looking help. There’s weird film behind lense I’m unable get rid of. tips would greatly appreciated. I’ve tried leave bag gel silica thinking it’s moisture would go away. unfortunately hasn’t. It’s fixed body lens. think that’s correct. Idk. would love add image show what’s going apparently I’m unable","photography","photography"
"Luminar Neo Mac - Smart Search Function use program mac. anyone able use Smart Search type image? use it, results contingent upon names files folders, type content. ie: search fences beaches, returns results name, content. watched TUTS, none address issues. Thanks","photography","photography"
"Velcro Camera Cube attachments Hey I’ve got backpack inside panel Velcro compatible. would like use camera bag could attach pouches camera cubes Velcro stay flush back elevated rather using standard camera cubes would flop bottom bag. Anyone see camera cubes/ pouches would fit need? Thanks!","photography","photography"
"Point & Shoot shopping realized time upgrade 10 year old point&shoot Lumix. last trip found using phone iphone 13 pro camera want get back camera. Lumix past happy torn Sony RX100 VII  know, pricey that's ok Lumix ZS99. first multiple reviews led Sony checking Lumix see got much greater zoom torn. Also current camera Lumix ZS40 ""through glass"" mode use LOT. can't seem find current cameras mode know shoot auto-focus mode without camera focusing glass instead what's outside, iphone time. background reasonably experienced \~40 years worth, starting OM2, better average, hobby photographer that's good tech. advice, ideas, comments help make mind?","photography","photography"
"Film developing reagents liquid used developing films. dispose it? I’m Netherlands.","photography","photography"
"Airshow photography tips? Hi! going first airshow weekend hopefully take great shots! bringing Nikon D500 200-500mm f5.6 maybe 35 1.8 35-70 2.8D. tips best shutter speed use? bright sunny plan shoot manual, maybe shutter priority. try use f8 f11 use shutter speed 1000th/sec.","photography","photography"
"Bulk auto AI rotating post scanning? process scanning 10K+ old pictures NAS Epson FF-680w. auto rotate function ork well rotated wrong way. sort app/program use scan folder pics rotate ones messed without creating new image. Something AI driven maybe? would rather pre sort pics befor scanning make sure rotated correctly thats probably faster manualy fact.","photography","photography"
"get clean focus bracketing/stacking? trying macro. watched bunch macro bracketing videos, seen two main ways people focus bracketing shots, e.g. insects. continuous shooting, 1 slowing push forward camera subject focus, 2 holding camera is. Clearly want vary distance, 1 seems deliberately trying vary distance, 2 seems letting natural movement hand/environment randomly vary distance? #2 weird, okay. shots, put focus stacking software, invariably get subpar results ghosting, extraneous noise original images, etc. using focus-stack heard people get good results software. GUI, command line, that's fine me. know people clean macro shots, watched live YouTube starting points nowhere bad mine. So, feel like combination technique software. bracket + stack, quality stack out-of-software much cleanup need afterwards?","photography","photography"
"Framing advice museum exhibition showing 5x7 b&w prints museum exhibition, trouble deciding mat & frame size. would like excess matting photo isolated intimate the frames would also larger pack punch. experimented options nothing looks right me. can't decide whether bottom weight mat not--would look strange horizontal photo? thinking maybe 5 inches matting top sides 5.25 inches bottom. 5 around. Standard black gallery wood frames. ideas would greatly appreciated!","photography","photography"
"post processing/advice subs confuse me. see many people posting objectively bad photos, asking opinions post processing. Lots lot replies. People weighing in, dissecting areas tone, contrast, sharpness, etc. photos likely never meaningfully improved, regardless hyper specific discussions. goes equipment shooting tips. People asking $1000 lenses improve underexposed poorly framed photos 1997 Buick Regal. Why? get people like help others can. lot photographs need much basic help fine-tuning luminance channels clarity. think amateur photographers disservice spend much time talking improve flat bad photography advanced techniques. think would better offer basic constructive criticism gets people learning see first foremost. critical eye foundation good picture. RGB curve. It’s like going math professor class asking tips write better shaped figure eights, math completely wrong begin with. asking chef advice imported oregano would make English muffin/ketchup/American cheese mini toaster pizzas taste like margherita Rome. There’s plenty good photography talented people knack editing. people making concerted effort make better pictures. think photo lost cause, ignoring fact diving teach people put lipstick pig waste bandwidth helpful. /rant","photography","photography"
"Ever yelled faced hostility taking public photos? know demonstrations even taking street photos tense. using iPhone Germany women wanted call police. took standard pic street close frame something. people sensitive towards cameras. EU taking public photos completely legal people think law. ever similar incidents happen?","photography","photography"
"Someone uses photos part flattered took photos city posted subreddit city, decided use one subreddits main pic. also sorta peeved ask. previously posted asking goes there, got good answers, great time. Went camera, took tons photos, posted subreddit. week later, see posts subreddit recognize photo new Pic. granted, photography money, hobby if anything, one costs penny two steal anything expected compensated for. posted social media, copyrighted, blah blah blah. reason, feel like asked. feelings valid, accept complement move on? Curious anyone else similar experience. sent friendly message asking ""Hey saw new Pic, curious one posted"" I know 100% certainty is.","photography","photography"
"Editorial shoot rules? work dermatology office photographer come photo shoot newspaper. photographer took photos, practice owner instructed take photos iPhone. I’m sure rules far using photos taken iPhone? photographer isn’t allowed release media rights photos newspaper article released public September. able use photos taken phone prior September?","photography","photography"
"Tips taking decent photos concert using cellphone camera...?? Looking tips/advice getting ""decently passable"" photos concert using Smartphone/cellphone.... anyone? Thanks!","photography","photography"
"best place watch latest gear news? rumours! official things. Like website example instead going every period time brand.","photography","photography"
"Buying photobooks Jiazazhi Books Hello, I’m interested buying photobook little hard find. found bookstore called “Jiazazhi books”, sell photobooks china not Chinese photographers photos. anyone bought photobooks there? It’s legit? I’m Spain. Appreciatte it.","photography","photography"
"Hasselblad V lenses Nikon Z cameras Hi there, load old V mount Hasselblad lenses I’m thinking buying adapter use Nikon Z9. already Leica lenses via adapter, like lot use frequently. Wondering anyone tried Hasselblad lenses results please? Many thanks","photography","photography"
"DIY Beginner/emergency flash diffuser. brand new photography wanted practice setting key/fill lights soft box trying give wallet rest. solution? heavy white shopping bag hundreds bag sink. Wrapped around flash held place small clamp. even access flash opening back. might keep one bag. ","photography","photography"
"Color science versus spectroscopy anyone made comparison accurately nikons, canons, sonys translate actual colors? example object spectroscopy measured tool called spectrometer colors camera reference checked agsinst spectroscopy results. Would interesting see results. expect lot shift japanese manufacturers towards orange tones like kodak gold old analog days.","photography","photography"
"fast primes f1.2 faster worth ? average photographer, investing f/1.2 faster lens truly worthwhile, considering high cost challenges like shallow depth field potential focus issues? affordable options like f/1.4 f/1.8 lenses offer sufficient performance shooting scenarios?","photography","photography"
"Anyone know shooting technique e-commerce acrylic glasses? I’ve working e-commerce project shooting acrylic eyewear website. pretty good understanding studio lighting, struggling making glasses stand also looking good white background also keeping white highlights control? I’m trying shoot something like this. anyone know get glasses even lighting?","photography","photography"
