"think Antichrist's native language be? ""The Antichrist"" prophesized Holy Bible... think native tongue/language be?","religion","religion"
"ever get feeling modern superhero culture today's world give sort pseudo-religious vibe? know seems bit far-fetched concept. many ideas superhero culture think of, sort religious feel it: 1. Heroic figures extraordinary, otherwordly abilities 2. Noble messages virtuous helping others heroic figures always embody preach of course, concept anti-heroes ""morally gray"" heroes, sometimes even stories main character right thing 3. sort good vs evil narrative always coming stories superhero fights supervillain 4. constant message working good society/humanity general thus mean question think it, narratives superhero fiction pushes quite similar religious texts also preach. Sometimes one even finds prominent religious narratives superhero fiction itself, example, Marvel's Daredevil devout Catholic Christian. way, one thus gets feeling superhero fiction see now, is, way, newer modern evolution ancient religious epics also deal moral messages mankind medium superpowered beings chosen individuals powerful abilities constantly struggle ""evil forces"" right thing others. Want know guys think this.","religion","religion"
"think apostolic succession? held Catholic, Eastern Orthodox, Oriental Orthodox, others Protestants, Christian branches.","religion","religion"
"churches opportunistic vultures whenever something bad happens? irritates jump every chance make everything praise god, p ay attention church moment.","aetheism","religion"
"Dealing Mothers mental health. sinful? I’ll keep brief. Cradle Catholic, 28/M, returned faith October away since 16. I’ve grown much faith since October I’m getting stronger. Tuesday week, sister person knew started practicing again. hid mother practicing time Tuesday. mother suffers depression, anxiety whole lot stuff she’s two high doses SSRIs. around mother generally brings mood down. It’s doom gloom point grown quite distant towards her, even now. can’t around 5 minutes otherwise start feel agitated. quite manipulative it’s relationship sister pretty much non existent despite us living one roof. Anyway, told her, made clear reason telling feel like it’s something know. all, it’s something joyful about. However, telling parish go to, going mass generally sharing journey her. want grow feel like around mother causes negative sinful thoughts feel bad around her. sinful here? Ik want share journey her, value growth towards faith anything feel like go route mother, going lead sin. love mother sister dealt issue since born it’s never going improve medications insane dosages never come she’s decades.","Catholicism","religion"
"Wisdom 2 used Reading Mass? not, reading would be? asking Holy Spirit show wants know situation landed Wisdom 2 which talks wicked care righteousness immorality. reading it, part testing God brought back memory reading similar passage lectern Mass many years ago. reason remember priest not knowing actress upon time placed speech competitions jokingly asked read part little bit bite getting ready even commented much got Homily. used daily reading Mass barking wrong tree?","Catholicism","religion"
"Material witnessing Lutherans specifically Blessings all! confirmed Easter Vigil Latin Rite, came apologetics heavy Confessional Lutheran background. discerning going seminary becoming Lutheran Pastor, discerning Permanent Diaconate years. context mind, big struggle OCIA faith forums thet material geared towards Lutherans. felt like lot guided discussions geared towards ""big umbrella protestantism"", protestant positions doctrine simply apply LutheransReally protestant traditions even protestant imo, that's topic different day. really spent last year self-study comparing two seeing points Lutheranism fell short truth. interest using background towards witnessing Lutherans, especially Confessional Lutherans, hoping put together material assist OCIA engagement community. wondering already lot material ""airspace"", perhaps similar stuff Richard John Neuhaus, could reference recommend. especially important alignment ongoing interfaith dialogues RCC ILCInternational Lutheran Council LWFLutheran World Federation. Thanks advance!","Catholicism","religion"
"Question nature Holy Spirit watching stuff explaining fillioque, people say means ""from Son"" ""through Son"" main question this: Holy Spirit receives essence origin Father Son, mean created sorts? know im misunderstanding it, anyone grant clarity really appreciate it.","Catholicism","religion"
"gave life christ Hello. Something strange happened tonight can't really make sense it. driving home, shuffling songs social media yes know bad habit trying overcome lol weird feeling came upon me. Without really thinking said ""i'm willing give life lord"" shocked me, heart still pounding experience, Like prayed even tho ex agnostic still ""researching"" idk waiting right moment guess. said sentences started crying bit nothing messy tears running eyes. strange powerful calming. Sorry long story wanted share somebody. Also idea next baptized, never even around Christians irl mostly muslim country feels terrifying go priest tell i'm afraid putting church risk could give advice would super helpful, thank you.","Catholicism","religion"
"GOD KILL YOUS love god, made everything, there's thing Big Bang Theory, that's shitty TV show. God killed virgins","aetheism","religion"
"question believe science ask this, please go me, asking question. Look creation universe. Religion says god created universe, science says big bang whatever created universe. flaw this. universe simply exist nothing? order something created, something needs put there. Something would needed put god / big bang theory there; something would needed put person too. infinite cycle, one makes absolutely logic al sense. reason, suggest must higher forms understanding pure logic order comprehend creation universe, since creation universe make logical sense. suggest must things 'supernatural', 'out world' typically believe in. go detail that, want realise there's world primitive logic. remember, thoughts - there's reason bash this.","aetheism","religion"
"Something always annoys ""liberal"" christians Around 80% Americans christian... yet 55% Americans believe gay marriage legal. this, ask? Many Christians understand teachings bible wrong, yet hang belief Bible word God. Thus, like cherrypick ok parts bible. ""good christian"", would kill gays sight. tl;dr: Many Christians believe parts bible misguided, yet still believe word God... hmmph EDIT: guess applies most/all religions","aetheism","religion"
"Atheism religion offended atheism? afraid questions can't answer prove? offended atheist asking? atheist post argue back respect belief system?","religion","religion"
"God greatest thing ever everyone subreddit going hell believing almighty lord","aetheism","religion"
"God Finger //Humans inquisitive, always need reason believe. now, Science gives us accurate/right reasons, ball started rolling, knew little. still know little. beliefs hold true today, going get overruled tomorrow. // Religion: So, protocol, cookbook good human, ways support humanity help existence; devised. Obviously shaded biased opinions... Weaved around form Grand Story. passed generation generation....without proof. nonetheless, everyone found ""a Reason"" live with, ""an Answer"" strange phenomenons. ""A Fear"" heart committing crime. ""A Belief"" live good life sake afterlife. much needed fear/reason/belief induced. slowly methodically, like today's idea freedom, idea socialization, idea security, idea belonging, idea unite. Became idea Rule : idea telling people Follow...follow, question. Exactly like thing today refer LAW. Answer everything God will. Given accepted time one knew nothing much. still don't. Hence readily deeply accepted.... Religion is. Summation: showing good human; pointing finger him. start praising finger lord. That's whats wrong ""Religion"".","aetheism","religion"
"Silly Goofy Meat Fasting Question Okay, already know ton Friday fasting new town, understanding various Catholic friends years supposed eat red meat. Depending ask red meat lot different things, generally speaking understand people eating beef pork yeah? correct, please correct wrong, silly goofy question southern woman jar bacon grease afraid use it. use though? Like fry potatoes bacon grease would break fast, yeah? know seems like maybe obvious answer trying dot Ts cross Is. get big dogs theology, quite understand structuring around things like cannot find local redneck Catholic help me. Thank you!","Catholicism","religion"
"anyone debilitating physical mental health conditions? Either temporary, permanent? affect faith? faith help out? currently going tough health issues regarding high blood pressure. triggered anxiety heights never experienced before. fear panic nearly constant which horrible blood pressure already, trying cling faith God. anyone else ever similar season life? prayers devotions helped you?","Catholicism","religion"
"Convinced Protestant Inviting Honest Catholic Discussion Mutual Challenge Spirit Respect Kindness PLEASE! starters, Yes many misunderstandings sides aisle many points get lost disrespectful tone, emotions, passion. touchy subject sure. lives please respectful, gentle, yet mutually challenging discussion one important topics lives? topic Lord! Let’s show people possible. Please say anything boils blood, pray answer. Act you’re trying snatch someone love fire, arguing sake ego. Let’s humble ourselves. out, though tone hard grasp text, mean everything say love respect. holding fellow Protestants accountable also. claim Catholic Church saved, teachings false, etc. Don’t lump Protestants don’t assume something asking. I’ll try best lend respect. many reasons cannot Catholic, addressing authority. Correct get something wrong. 1. CC magisterium Pope sole final interpretative authority scripture. trust interpretation correct w/o external source test interpretation? 2. apostles constantly warned false teachings within church itself, discern false teachings within CC church final authority interpret scripture? 3. Though apostles tell us respect obey church authorities, warnings false teachers never seem point church leaders Holy Spirit-guided institution remedy. always seemed point scripture remedy false doctrine. 4. know Pope spoken ex cathedral couple times, given divinely appointed institution fact made serious errors, contradictions, moral failures throughout history, different church claim infallibility interpretative authority? CC simply claim institutional authority also allowing subject scripture, lest risk reputation operate unchallenged? 5. Obviously Protestant churches making grave mistakes errors, don’t claim infallibility final interpretative authority. Many reformed bc scripture changed ways. reason know correct testing scripture. don’t believe multiple denominations prove needs another infallible source scripture order HS guide church. obviously didn’t even prevent schisms within CC. It’s also inconsistent apostles anticipating expecting divisions/heresies/etc. 6. reason say CC authority scripture, instead using claim equal it, office holds final interpretative authority scripture, effect puts scripture office office holds higher power. Scripture becomes bound interpretations CC instead CC bound scripture. 7. dismissing traditions, creeds, early church fathers, etc. needed beautiful helpful never equal scripture. I’m sure tell camp Sola Scriptura. No, explicitly Bible neither word Trinity. concept biblical. could argue circular reasoning, Jesus held scripture final authority— even tradition. always appealed scriptures giving correction. Paul says scripture sufficient make man God complete — almost complete. Even apostles’ teachings tested scripture Bereans, commended this. SS deny authorities, simply holds bound it. 8. know many verses Catholics use support positions won’t list rebuttals right now. Maybe later replies will. Hope thoughts observations make sense. please help misunderstanding something. try best think replies.","Catholicism","religion"
"Catholic priest tells grieving twin eulogy ""too long,"religion" allow fiance speak.","aetheism","religion"
"Question Christianity man approached gym spoke Christianity beliefs, curious align teachings Bible since largely uneducated it. sum up, said Jesus tried convert jews rejected crucified him, gentiles accepted got prosperity. save holy land Israel, last gentiles today accept Jesus savior repenting faith, mass wave conversion belief Jesus jews happen realize ""oh, wrong, really messiah"". everyone brought even greater prosperity. know far depth Bible Christianity this, curious claims true grounding Bible, painted way.","religion","religion"
"gods/deities seem communicate openly Jesus Christ? Jesus “lord lords” would think presence would powerful religious/spiritual practices. 16 years devout Christian, honestly say saw evil evidence pagan practices god. believe God spoke direct message another person 16 years constant prayer devotion. I’ve seen legit possessed person yes, it’s real. I’ve known people spiritual attachments placed birth African religion. I’ve even family members witchcraft past would talk dead using mirrors crazy stuff. However, never seen directly communicated Jesus Christ. Whenever hear Christian say God spoke gave sign, it’s always generic thing choose interpret sign. It’s always something along lines of, “I driving road saw sign said STOP. knew God answering prayers.” Christians followers divine being, shouldn’t frequent divine encounters? I’m taking prophetic dreams, direct messages people “tongues”, face face encounters, etc. never heard type relationship Christian God modern times.","religion","religion"
"tell religious parents aetheist live Christian parents, used go church, faith gone. feel like god even exist life anymore reason except that. want make parents angry upset learn aetheist, advice","aetheism","religion"
"christian reddit... Christian, believe god Jesus whole shindig. However, reddit specifically r/aetheism shown ridiculous fundamental Christianity is. feel road aetheism thank reddit enlightening several ways, know never true atheist, always believe higher power. Sorry, that's truth. wanted acknowledge r/aetheism done shown fundamental Christianity. accept world views accept science well believing god created this.","aetheism","religion"
"Orthodoxy vs. Catholicism Hey everyone, greetings & God bless! I’ve interesting spiritual journey Christ recently learning Church started. background - baptized RC First Holy Communion Confirmation younger, cultural rite passage though. Neither family practiced. Within last 6 months I’ve fully come understand Christ love full believer. Started Bible progressed non-denominational Church, I’ve growing learning it’s awesome. plethora Orthodox v Catholic v Protestant content online, like many others digesting watching ton content find difficult accept sola scriptura deep feeling understanding Christ founded one visible Church. Pretty much narrows 2 options honest - Orthodoxy Catholicism. Really started favoring Orthodoxy allure Church beautiful theology liturgy, could much reason believe fullness truth. Admittedly, underlying bias Catholicism come way better understanding sides weighed lot evidence historically arguments sides doctrinal preservation vs. organic development, papacy, filioque, etc etc. legitimately standstill right logically don’t even understand one reason way answer either side fully even convincingly. It’s legit like 12 round boxing fight Church 6 rounds each. judges score match… know search truth need pray, ask God guidance, actually experience Church teachings traditions firsthand. seems logically something “fullness truth” found truth, things inherently subjective individual experience. Someone great experience feeling one Church horrible one another doesn’t make either one true. way, sorry rant - I’m sure lot relate. I’d love advice and/or insights pushed edge either side experience was/is like particular battle.","Catholicism","religion"
"anyone else feel like blood Christ honored more? feel like Catholics adore eucharist which great really care blood.","Catholicism","religion"