"Thoughts Mobile Suit Gundam 00 seasons movie Awakening Trailblazer. one pretty good. think anywhere close best installment franchise far, nowhere close worst either, opinion. perfectly middle road compared Gundam installments seen far, that's meant insult. Considering worst series consists near trash like Superior Defender Gundam Force, best original Mobile Suit Gundam debatably first season Mobile Suit Gundam Seed, installments, especially ones go long, straight terrible, series middle road still makes pretty entertaining. series takes place yet another new timeline, called Anno Domini timeline, AD timeline. guessed it, seasons plus movie series anime take place timeline, although light novels manga expand timeline. anyways, like usual, technical stuff improved here, especially animation, art, fight scenes. That's especially case movie. makes sense though movie, mention one came 2010, 15 years ago. getting recent Gundam now, relatively speaking anyways. even two seasons anime somewhat recent comparison older installments, aired 2007-2009. Like best Gundam series, anime themes includes war, also minor themes like love friendship, intertwined anti war themes. times execution themes could get slightly cheesy, enough completely ruin series me. first half show bit slow, although never boring. second half show got super engrossing, towards end show even tragic, lot people would probably expect Gundam anime. think movie unnecessary, still bad.","Gundam","anime"
"guys wondering whatever happened kaiju killing missile blow zetton first kaiju meat want know guys think","Ultraman","anime"
"anyone know anime? anime girls house burning live male coworker maybe guys house burned maybe werent even coworkers end falling love, memory hazy cus long since watched it, ive searching ever since","anime","anime"
"romance anime Bocchi Rock? like type anime romance, even light. Even there's least love interest, fine. one anime?","anime","anime"
"Urgent need help find anime that's lost internet So, kid dad bought dvd film. brother would watch religiously, literally almost daily, really loved it. Even so, around 12 years since watched can't remember crucial details. details remember young boy, small spheres different colors would float around air. Later move faced enemy white hair, thin surface water. reflects sky identically. enemy dies, theres shit ton blood main character crying. Thats literally remember. Im pretty sure french, could dubbed. Regardless remember popular, remember discussing scenes friends school aswell extended family. trying find movie ages, dad threw dvds one day remember movie, brother either. Neither childhood friends extended family. irking years KNOW exists, maybe every month go deep dive trying find havent luck 5 years. information limitied, theres way someone help one would blessing.","anime","anime"
"recommend great anime? Hi like anime can't find anime watch one episode. like FMA brotherhood, code geass, violet evergarden, attack Titan season one three, first half death note. like thing inappropriate content like magi. protagonist behaviour anime. Note: currently watching cowboy bebop frieren. Note: also like anime solo leveling like web comic.","anime","anime"
"action/shounen anime Watch based ones watched ones watched: • ⁠Fire force • ⁠Attack titan • ⁠Solo leveling • ⁠Fate series • ⁠Shangri La frontier • ⁠Wistoria • ⁠Demon slayer • ⁠Jujutsu kaisen • ⁠Kaiju n8 • ⁠Hunter x Hunter • ⁠Sword art online • ⁠Hells paradise • ⁠Chainsaw man • ⁠OPM • ⁠Jojo • ⁠Akame ga kill • ⁠Bleach TYBW know mixed genres basically want anime good animation, fights original powers designs. dont care much plot its ok good, must. Maybe missed i’ll reply say watched one recommendations. Also, dont like action/isekai/ harem type anime like arifureta danmachi, prefer semi modern From 2005 onwards, less.","anime","anime"
"Help find anime's name anime short girl blue hair playing dating sim game? console guy came took tease know name forgot save clip saw","anime","anime"
"Retro-Cast Rewatch Future Boy Conan - Episode 16 Episode Index <- Episode 15 | Episode 17 -> Streaming exclusively RetroCrush Episode 16: HUT Dubbed Subbed Databases: MAL  Anilist  ANN  Databases: MAL | Anilist | ANN | aniDB Today's Questions: 1. Favorite animation sequence episode? 2. Favorite character interaction? See tomorrow Episode 17!","anime","anime"
"Need help finding name older anime Mc uses gears sword made gears fight fight partners pairs 2 alternate plane rember show realistic city backgrounds think 2 seasons","anime","anime"
"go next? Hey everyone, Im somewhat new anime watched classics growing like Akira, Ninja Scroll, Ghost Shell loved them. years ago came across Dorohedoro absolutely loved it. Chainsaw Man came along checking things since. loved far extremely short except AOT like Ninja Scroll series, Jujutsu Kaisen, One Punch man, Berserk, DanDaDan. Looking similar suggestions go next? Im aware Bleach, Full Metal, Samurai Champloo one would suggest first? hidden gems would recommend? tend enjoy darker stuff monsters, curses, demons things straight weird... Appreciate it!!","anime","anime"
"New anime newbie girlfriend Hi! made deal girlfriend: watch favorite Barbie movieswish good luck, she’ll watch one anime me. need help choosing one anime could get hooked make want watch more. She’s Disney princess type — really anything super action-packed war-themed — I’d still like least bit classic anime-style fighting. definitely cute, preferably slice life, since tend bit slow","anime","anime"
"Isekai romance harem Looking isekai romance, without harem. subplot like decent amount. Familiar zero bad cuz end 1 girl kinda felt sleezy? raeliana ended duke's mansion rlly loved.","anime","anime"
"need help finding anime used watch animes like 7-10 years old pretty watched animes like decade except mainstream ones like jjk naruto. can't remember much anime like 2 sisters involved not main characters tho highschool setting. one student council average student. average one blonde remembering correctly. student council sister used look upon think? sad backstory abused children. story also involved children's illustration story book chicken different others. literally details remember","anime","anime"
"Help finding Anime Hi y'all. new anime. started anime Netflix removed could finish it. believe plot disgraced demigod trying get full powers back trying get god status back. begrudgingly teams high school girl powers she turn monkey something. anyone know anime name? started watching Hero Academia. y'all suggestions animes watch. Thank y'all advance.","anime","anime"
"continue hunter hunter? I’m episode 33. first episodes hunter exam actually unique liked them, also really like gon killua. show seems slow. I’m middle fight arc going floors it’s boring. fight hisoka cloning guy interesting, damn drawn out… like holy moly. spend entire next episode hisoka explaining every little detail fight, slog get through. get better? love shounen anime, loved one punch man jutjusu kaisen hope hunter hunter cool fights seems drag lot.","anime","anime"
"anyone recommend horror anime similar Dark Gathering? I’m really liking vibe Dark Gathering fun horror anime, especially like it’s got humour lightness well, it’s constant depressing nightmare. anyone recommend any? dark gorier better, wanted touch humour alongside that. Thanks much!","anime","anime"
"Anybody know watch ""REAL DRIVE"" ? scifi anime made 2008. cant find anywhere watch.","anime","anime"
"Shoushimin Series Season 2 • Shoshimin: become Ordinary Season 2 - Episode 7 discussion *Shoushimin Series Season 2*, episode 7 17 **Reminder:** Please discuss plot points yet seen skipped show. Failing follow rules may result ban. --- **Streams** * Crunchyroll **Show information** * MyAnimeList * AniList * AniDB * Anime-Planet * Official Website * **/r/Shoushimin** --- **All discussions** Episode","anime","anime"
"Recommendations anime haters boyfriend hates anime want put on. He’s really action comedy. Think MCU, Star Wars, sort thing. tried Attack Titan he wasn’t it, Mob Psycho 100 also no. somewhat liked Dororo, never finished it. One biggest turn offs ""weirdness"" anime. Things like fan service, creepy tropes, stuff definitely ... putting newcomers. get it, there's lot stuff veteran anime fans gotten used to. would recommend win over? Anything worked “anime hating” friends partners? I’m open suggestions!","anime","anime"
"anime remember younger watching anime guy lived house hid childhood friend?? people started showinf think emotional scene moves cant remember please help would nostalgic. ideas id love know!","anime","anime"
"Need Help really want get girlfriend 17 anime, seen earlier parts Hero Academia called anime whole cringe, wondering suggestions easy starter anime hopefully get it. understand people anime, simply hoping isnt case her. open genre suggestions.","anime","anime"
"good fantasy assasin anime? Hi, looking good fantasy assasin anime. one mc assasin class fights enemies head rather one actually uses stealth sneak attacks. Going direction thief also fine. Thanks advance","anime","anime"
"comedic / light hearted anime recs? Like title says. rule is, anime cant SA . Looking light hearted stuff puts people good mood :","anime","anime"
"y'all suggest anime based these? want watch something fun, like funny something fun watch. watched anime past 2 weeks found fun: Skip & Loafer Recovery MMO Junkie Monthly Girls Nozaki-kun Summertime Render Ranking Kings Sentai Daishikaku love story Yamada-kun Lv999","anime","anime"
"Looking Mystery Anime Hello, trying get anime, especially anime surrounding detectives something similar. watched Dinner Detective liked someone recommended Bungo Stray Dogs also enjoyed, anime similar vein appreciated. like comedy mainly tolerate drama horror themes, would prefer comedic elements.","anime","anime"
"watch? enjoy action anime, something good animation likable characters. can’t find anything really peaked interest idea watch, like female main characters aswell.. want good anime action great animation","anime","anime"
"someone animes bunnygirls ? someone animes bunnygirls inside exept rascal dream bunnygirl senpai. dont care Ecchi want anime bunnygirls","anime","anime"
"Need help finding anime name saw edit anime caught interest, figure anime is. short, scene young boy, making hands cold ice pack holding young, girl's hands, maybe hands sensitive something? think might flashback romance anime, might check out, anyone could help?","anime","anime"
"Looking anime recommendations like rising impact finished anime rising impact hooked😭 wanna watch sports anime really focuses sports, like haikyuu, prince tennis, rising impact... Please recommend","anime","anime"
"watch movie anime first Rose Versailles? Saw trailer Netflix today, ngl looks hype EXACT cup tea!! absolutely LOVEEE historical romance, might first actual historical romance ANIME gonna watch. unfortunately saw lots reviews saying story rushed movie. place great importance plot romance, hearing kinda bummed out, reason touched anime hard bear old artstyle anime. So, watch movie first despite rushed plot, watch anime first good pacing story?","anime","anime"
"yall anime like seikon qwaser. watch seikon qwaser plot fan service, problem cancelled 2 seasons. shows fan service material decent plot?","anime","anime"
"Short bingeable anime recs 1 Jujutsu Kaisen 2 Beastars only S1 3 Assassination classroom 4 Attack Titan 5 Banana fish 6 Demon slayer 7 lie April 8 Chainsaw man 9 Dandadan 10 Death note 11 Devilman crybaby 12 Tokyo ghoul 13 Tokyo revengers only S1, read manga 14 Sk8 15 Spy x family only S1 16 Kakegurui 17 Classroom elite 18 Moriarty patriot 19 promised neverland 20 happy marriage only S1 21 Hell's paradise 22 Life ordinary guy reincarnated total fantasy knockout watched friend forced me, like it 23 Given 24 Haikyuu only S1 S2 25 Hormiya only S1 26 One punch man 27 Tomodachi game 28 Violet evergarden 29 Kiss him, 30 Windbreaker only S1 list animes watched. really want short ones recover slump era. Help please? Thanks advance!","anime","anime"
"Romance anime mc fmc get married recently watched romance animes watch guy told watch lie april said get married but... yeah looking romance anime mc fmc get married start middle series, maybe also children already watched clannad.","anime","anime"
"Need suggestion next watch. Hi folks! Currently watching - 100 Girlfriends really really really okay lost count! love you! nice fun watch. Looking something similar better. Like Shimoneta watched much genre romcom/harem/ecchi stuff suggestions welcome. Also, trying watch Shimoneta Crunchyroll seems India allow shows here. someone suggest accessed? watched Crunchyroll.","anime","anime"
"Trying find anime watched around 2016 sure anime came time earlier, may also wrong year. remember fantasy/adventure setting. MC harassed 2 characters unidentified while. really villains harassing villain adjacent. MC first encounters enters village/town fountain. kind antagonistic relationship throughout village. 2 harassers revealed turn childhood friends. believe revealed MC forced forget due trauma. also think turns dead returned ghosts MC forgot them. unfortunately recall main story anime, side story arc. believe show movie.","anime","anime"
"Pls help find anime So... anime really old, like art style. remember much plot , main guy crimson red hair liked girl. think dual personality turned phantom night. girl liked , fell phantom sm. phantom like really tall blue hair","anime","anime"
"Anime opening song stuck head can't remember anything besides ""dooba doo doo"" think might say right maybe. girl voice","anime","anime"
"I’m anime slump. help. hi everyone , i’m currently anime slump wondering recommendations get love back it. i’ve anime fan years seem i’ve lost ‘spark’ binge. recommendations genre would awesome!!!!","anime","anime"
"Looking good actually underrated anime recently watched many underrated animes feel like watching them. ones really liked Bakuman Rainbow","anime","anime"
"romance anime ended end? recently thinking watch romance anime. anime watched are- Death Note, Fruit basket, Misfit Demon King Academy, Mob Psycho 100.","anime","anime"
"Help finding anime: Strong student council girl mistaken guy joke, always beats protag’s friend Hey everyone, I’m trying remember name romance anime. There’s side character who’s student council, she’s super strong. She’s clearly girl—like 100% obviously female—but protagonist’s friend keeps joking she’s guy strong is. running gag, always ends beating ass whenever makes joke. happens almost every episode side thing. idea anime could be?","anime","anime"
"Looking Anime Recommendations Based Taste! Hey everyone! I’m looking anime recommendations would love suggestions. anime watched really enjoyed: List liked, e.g., Attack Titan, Jujutsu Kaisen, Death Note, Demon Slayer usually enjoy genres like action, mystery, supernatural, psychological, slice life, etc. Things enjoy anime: Great story character development Intense fight scenes deep mind games bit mystery dark elements plus! Things I’m really into: much romance fanservice Overly slow slice-of-life unless strong emotional story hidden gems must-watch classics, please share! I’m open suggestions. Thanks advance!","anime","anime"
"Thoughts Gundam Build Fighters finally made first Gundam anime ever watched 12 years go. done crying sad realization, yeah, started many years ago. sure started series meant anniversary story Gundam franchise, glad loved it, glad reveal holds years later. masterpiece, still extremely enjoyable entertaining. general plot simple; takes place world, characters build plastic model sets mobile suits, actual thing world, use kind virtual reality simulations. felt similar Yu-Gi-Oh, Bakugan: Battle Brawlers, Beyblade, three anime grew with. think that's reason loved much back even though seen single Gundam installment yet point. confidently say like anime mentioned like even seen Gundam series. fan Gundam, also enjoy this. manages simultaneously successfully appeal hardcore Gundam enthusiasts, model kit builders, from heard, group myself, fans aforementioned ""type"" anime. characters ton fun. famous one Rinko Iori, obvious reasons. seems like popularity transcended anime itself, hard understand why. attractive, cute, likeable, super supportive son's hobby, also pretty funny too. literally perfect waifu surprising everybody fell love her. there's endless stream entertainment nearly every character provides. Sei adorable, also perfectly represents lot super nerdy people really get talking passionate about, Reiji absolute blast. laughs got series him. Although wish learned world originally from, though. felt happy watching it. serious typical Gundam anime, cartoony childish either SD Gundam installments, rests comfortable tonally. Since spent almost month going Gundam beginning, nice seeing bunch mobile suits modeled directly mobile suits see previously Gundam series', something noticed first time watched it. also mention even though main focus series Gundam battles, slice life comedy element Gundam battles virtual simulation constructed around it, actually best action sequences series yet, despite short battles actually are.","anime","anime"
"Recommend Good Romance Anime far seen many popular romance animes want pls help commenting best romance animes u guys watched","anime","anime"
"Anime scene know name Anime scene male MC sitting table piece paper hand female stands next helping glances mentions cup cup shocks inn Hall guild Hall tavern","anime","anime"
"Frieren best Fantasy Anime time? I’m really curious think. heavily prefer Fantasy, Action, Isekai, Shounen, Magic anime. I’ve nearly watched every single one that’s released last 10 years. Ixion Saga DT, Isekai Cheat Magician, more. enjoy & watch seasonal fantasy/isekai “trash” comes by. anime like Grimgar, Overlord, Slime Tensei, Moshoku Tensei, Zero, FMAB, many favorites mine - I’m sure even come close Masterpiece Frieren is. entire 28 episodes. OST, OP, Character Designs, Depth, Animation Techniques, Story…… it. It’s almost good. feel bad people introduced anime one. grew watching Naruto, and since rewatched 3-4x people witness early anime watching journey. watching Frieren, even come close - especially we’re talking Fantasy. I’m absolutely blown away. I’m sure Frieren favorite; still think Zero holds spot me, Frieren definitely best fantasy anime I’ve ever watched. Without question. give perfect 10/10.","anime","anime"
"watch One Piece legally/illegally Episode 1 India? Hey fellow One Piece fans, wanting start One Piece beginning, trouble finding platform India streams episodes legally. Here’s I’ve checked far: Crunchyroll: Starts around Episode 892 streams new episodes weekly, earlier arcs Episode 1 onwards missing. Netflix India: limited set episodes, sadly, earliest ones aren’t there. Cartoon Network India: Recently started airing anime Season 1 Hindi regional languages, it’s fixed broadcast schedule, prefer on-demand. Amazon Prime Video India: Seems episodes, full series—and unclear much accessible. way stream purchase One Piece India Episode 1 onward consistent access?","anime","anime"
"Help find anime like black clover fire force tired romance animes recommend something like black clover fire force. already watched one piece, Sakamoto days, hunter x hunter, kuroko basketball fyi, aot, blue lock, demon slayer. Please help escape boredom! 🙏","anime","anime"
"Best ass focused ecchis Hello. humbly seeking big 25. best booty central animes. Small big. want fan service lmao.","anime","anime"
"I’m Japan two weeks. wondering anime recommendations people me. live United States recommendations air Japan right that’d cool. sure watch I’m here. What’s hard find states look Japan?","anime","anime"
"watch planning list? Here's anilist profile help get sense taste plan watch, ill also try sum up. like little everything, typically alternate romance/slice life/wholesome action/battle/violent keep things interesting different. finished Lie April peak btw typically go something aggressive next, limit suggestions that. suggestions based info would awesome, happy answer additional questions narrow down. Recommendations add list also welcome. Also feel free debate taste, however keep mind list skewed order watched things in.","anime","anime"
"Anime recommendations berserk, nana,erased,peach girl i’m kind beginner anime fan i’ve always watched anime i’ve getting recently. usually watch friends tell wht peaks interest/is popular social media, don’t really much knowledge fr want branch watching what’s trending. Anime love watched include Berserk, erased, nana, death note, peach girl,ergo proxy, cowboy bebop. Anything else good there? plz help!","anime","anime"
"recommend anime :? used watch anime time got caught med school watched anything like 2 years honestly miss it, know new good rn","anime","anime"
"Recommend top animes feel like appreciated enough! like unuiqe, strong character determination, high quality/well done. siiickkkk crappy generic animes feels cheap probably money laundering scheme smtg. example: Tanya evil, fairytail specifically magic games arc, HxH, baby steps, lie April, frieren, kamisama kiss, rimaru slime, yumeiro patisserie, aikatsu stars, Yuri ice, snow white red hair, welcome ballroom, death note, ohshc, one punch, saiki k, noragami, Charlotte, mha, Wiseman's grandchild, Hikaru go, Pokémon, princess jellyfish, rising impact, seraph end, oblivion battery, magic-kyun Renaissance 10/10 series keep close heart there's probably alot forgot pls desperate good show.","anime","anime"
"Anime recommendations similar ""Summer Pockets"" Dude... love summer pocket best anime 2025 fr... That's y'all anime got vibe genre like masterpiece please tell Thank you....","anime","anime"
"need anime suggestions watched One Piece, MHA, JJK, Chainsaw Man, Mob Psyco 100, Black Clover, Solo Leveling, Naruto. need new anime watch","anime","anime"
"Tactics where watch Anyone clue watch anime? remembered blue trying search up, dice. Crunchyroll prime.","anime","anime"
"Can’t find anime scene from. memory may clip edited. looks like something Gundam unsure. scene several pilots floating zero gravity getting stations. suits yellowish. couple briefly kisses float away duties. next scene pilots killed space battle. Either last one remaining pilots charging enemy. recollection may bit fuzzy, know seen scene similar several times scrolling Instagram life cannot find again. Edit: 90s art style helps.","anime","anime"
"getting around watching Moonrise.. Currently episode 16 thinking... show general really really good. Honestly hope Netflix paid huge bag kind quality effort. imagining, series aired weekly season instead episodes quietly dropped Netflix, would heard much it. assuming show still done well, disappointed chose drop episodes once, instead giving treatment Netflix series recently. EDIT : Holy hell ya'll hated LMAO. show nowhere near favorites top whatever. also gripes bits pieces show, script, VAs, etc. watch writing this...I know crazy detailed art & animation see sense time put it. Obv account makes show/story good know ONA, televised. remember animes like Bluebox, Ranma, Orb released week. Maybe difference Netflix licensing aware of. mind binge watching once, thinking releasing slowly could maybe save comes people giving show chance. yeah, mainly speaking hoping Netflix paid properly cuz still imagine shit ton work went show. Like even people consider script shit, reason workers anime get paid efforts lol. specifically Netflix, almost skipped it. again, personally still consider show better lot stuff released right now, maybe giving easy props. ya'll gonna make finish show judgmental eyes..was trying continue innocent LOL.","anime","anime"
"top 5 animes would rate 10/10 Basically, title says, anime would rate 10/10, also anime love would 100% recommend. get ball rolling: 1- Hunter x Hunter 2- Black Clover 3- Dr. Stone 4- Apothecary Diaries Really happy 2nd season 5- Frieren Honorable Mention Wind Breaker really happy 2nd season. Thanks advance everyone answers advance!","anime","anime"
"Reccomend old anime back watching anime wanted rewatch older anime watched years ago. can't seem remember single title kind list refer back to. someone reccomend good titles 2005 2018 would great. generally used watch rom/com, harem, slice life, fantasy maybe isekai, action, drama mix these, please keep recomendations mostly genres Thank advance","anime","anime"
"need helping remembering anime long ago, remember scene i think bus crashed something stay there, MC got suspicious meat adults giving since didnt say came from, apparently human meat they killing people there, since way survive.","anime","anime"
"Good anime watch public? trying get back watching anime. watched lot high school, college much life got busier busier. recently thought try watching again, best time watch anime cardio gym with headphones, obviously people still see screen, prefer something nudity, fan service, etc. Here's favorites think of: Neon Genesis Evangelion, Kaiju No. 8, Cowboy Bebop, Death Note, Jojo's haven't seen recent 2 seasons yet, Full Metal Alchemist, Variety Ghibli movies Edit: Spelling","anime","anime"
